Source,Title,Link,Date,Summary,Text,Like
PTT,Re: [問卦] 蒼藍鴿真的好忙喔 又有人要開戰了,https://www.ptt.cc/bbs/Gossiping/M.1614173522.A.009.html,2021-02-24 21:31:56,,努力的看完了感覺很像小孩子做的影片…他一直強調感冒藥是無效醫療可是也沒提出任何文獻或論文然後截蒼藍鴿的影片說他錯然後又沒提出任何有醫學根據的證據來打臉只是自說自話然後完全跟讀稿機一樣講話像是在唸經？？？？-----SentfromJPTTonmySonyH4493.----,1
PTT,Re: [問卦] 蒼藍鴿真的好忙喔 又有人要開戰了,https://www.ptt.cc/bbs/Gossiping/M.1614161159.A.5AA.html,2021-02-24 18:05:57,,就是有這些大力宣揚西藥是毒的人才會害我每次經痛要吃止痛都被長輩唸說什麼治標不治本小痛忍一下撒小的或是吃西藥會上癮撒小的拜託現在都2021了人體本來就有自然代謝的功能吃個西藥緩解症狀也在靠北幹林老師勒--,1
PTT,[問卦] Dcard 有莎粉跑去檢舉蒼藍鴿？,https://www.ptt.cc/bbs/Gossiping/M.1614390997.A.E89.html,2021-02-27 09:56:35,,乳題剛剛看低卡的熱門有疑似莎粉跑去臺大醫院客服投書檢舉蒼藍哥以臺大醫院的醫院的名義盈利並懷疑以公職身分盈利雖然下面有人留言公費進用的醫生才會有爭議Dcard的莎粉真兇有沒有八卦--好啦好兇,27
PTT,Re: [問卦] Dcard 有莎粉跑去檢舉蒼藍鴿？,https://www.ptt.cc/bbs/Gossiping/M.1614400342.A.344.html,2021-02-27 12:32:19,,如果常去日本自助旅行應該都看過「林氏璧」的部落格事實上他原本是台大醫院感染科醫師台大醫學系畢後來不知道是被衝康還怎樣被教育部以公務員服務法第13條第1項規定，公務員不得經營商業或投機事業。記過一次不過他本人倒是在懲處出爐前就自行離職了所以也很難說他是自己想走還是跟這有關但總之之前確實是有台大醫師被這樣搞過就看教育部怎麼認定不過我倒覺得如果蒼藍鴿真的這樣被弄保證瞬間再漲粉十萬因為變成悲劇英雄愛莉莎莎肯定會被黑更慘掉粉更多有時候都是粉絲在誤事就跟韓粉一樣而且保證有私立醫院向他招手既然公立醫院有條框又不是啥大錯醫師哪會失業?還台大醫科的之前長庚的李石增搞到這麼大人家還不是去敏盛林氏壁是自己想專心部落格這塊不然他要去其他醫院當醫師哪有不能去的?最重要一點蒼藍鴿之前上過館長節目隸屬政府部門的教育部我想應該是不敢怎樣----,1
PTT,Re: [問卦] 蒼藍鴿真的好忙喔 又有人要開戰了,https://www.ptt.cc/bbs/Gossiping/M.1614186910.A.C8C.html,2021-02-25 01:15:08,,過12點了來回一下好了影片其實跟蒼蘭鴿講的東西都一樣阿..只是中文敘述方式不同而已而且有看過蒼蘭鴿講小孩發燒影片講了百幾次了不要因為小發燒就掛急診，吃了退燒藥燒燒退退也是很正常的因為他只是正常進程，活動量還可以就不太需要去管或是整個系列小孩感冒問題，應該就不會發這文章了..如果常看看蒼蘭鴿影片都會強調，吃感冒藥並不會好比較快，減緩症狀而已，病毒感染有特效藥的只有流感。沒錯這些都是醫學系知道東西，非常的淺，蒼蘭鴿只是用簡單有趣方式去敘述而已就跟那個江坤俊一樣，為什麼要一直提到他，他是外科醫師阿，上節目的時候也是綜藝咖，他就是%數更大的蒼蘭鴿而已。不過鏈球菌感染就比較麻煩了，你又不像某個從石化中解除的超級高中生神醫，乖乖的看醫生吃完整個抗生素療程吧。--◤◣◢--是阿，那個理論上是對的，問題是做出來幾乎不可能而且過敏還會出大事囧,
PTT,[新聞] 戰愛莉莎莎慘爆 台大醫蒼藍鴿遭檢舉營利 ,https://www.ptt.cc/bbs/Gossiping/M.1614573460.A.9AD.html,2021-03-01 12:37:38,,1.媒體來源:中時2.記者署名:11:172021/03/01中時新聞網莊楚雯3.完整新聞標題:戰愛莉莎莎慘爆台大醫蒼藍鴿遭檢舉營利院方回應了4.完整新聞內文:愛莉莎莎被醫界砲轟引用資訊不當後，出面道歉並將影片下架，然而粉絲仍為他抱不平，寫信向台大醫院檢舉蒼藍鴿，身為公務員還營利。(翻攝自蒼藍鴿IG)百萬YouTuber愛莉莎莎去年底拍攝「肝膽排石法」影片，被台大醫師蒼藍鴿打臉排出的只是皂化石、不是結石，之後兩人隔空交火，愛莉莎莎並因此遭醫護圍剿，之後不僅公開道歉並將影片下架，但日前Dcard突然出現指控蒼藍鴿身為公務員還藉由YouTube開啟廣告分潤、經營商業頻道，並附上台大醫院接獲檢舉後的回文，台大醫院今證實，全案已進入調查。愛莉莎莎遭醫護圍剿道歉後，有粉絲想幫她反擊，向台大醫院檢舉台大住院醫師蒼藍鴿身為公務員還開設YouTube頻道營利。（圖／取材自愛莉莎莎Instagram）蒼藍鴿吳其穎以台大住院醫生的身分開設YouTube頻道、臉書粉專「蒼藍鴿的醫學天地」，發佈超過260部有關於醫學知識的影片，YouTube訂閱人數更在愛莉莎莎事件後暴衝到49.1萬人，除經營YouTube有分潤外，蒼藍鴿也接業配，推薦健康好物，並為保健品牌打廣告，輸入專屬折扣碼就會有9折優惠。在和愛莉莎莎交火後，蒼藍鴿疑似被愛莉莎莎粉絲盯上，2月26日在Dcard上出現「蒼藍鴿(台大住院醫生吳其穎)恐怕會被撤職」的PO文，指蒼藍鴿違反公務員規定，長期在YouTube經營商業頻道營利，已向台大醫院檢舉。並舉前台大感染科醫師林氏璧為例子，指其就是因為經營日本旅遊部落格營利，依違反《公務員服務法》遭到記過。台大醫院今天表示，確實有收到民眾檢舉吳其穎涉嫌利用YouTube營利，目前已展開調查，但院方強調，台大醫師有些是公務員有些不是，因公務員名額有限，住院醫院都不是公務員，即使升上主治醫師，有些也沒有公務員身分，吳其穎目前還是住院醫師，因此沒有公務員不得兼職或從事商業行為的問題，目前初步認定未違法。但不具名台大醫師表示，不論是否具公務員身分，台大醫師都是廣義的公務員，根據行政院人事行政局96年4月13日所做的第0960008394號書函，即使是約聘僱人員也適用《公務員服務法》，業外不得有商業或營利行為，前台大感染科醫師林氏璧就是因為經營旅遊社群網站接受業配、分潤，遭到懲戒，後來離開台大，蒼藍鴿（吳其穎）其實也是類似情形。《中時新聞網》已透過臉書私訊蒼藍鴿，目前尚未獲得回應。圖為蒼藍鴿的簡介欄中以推薦好物，輸入折扣碼有優惠的方式放置廣告。(翻攝自ApplePodcasts)文章來源：dcard#愛莉莎莎#蒼藍鴿#台大醫院#公務員#營利5.完整新聞連結(或短網址):6.備註:--,80
PTT,Re: [新聞] 戰愛莉莎莎慘爆 台大醫蒼藍鴿遭檢舉營利,https://www.ptt.cc/bbs/Gossiping/M.1614575944.A.953.html,2021-03-01 13:19:02,,之前大鴿上過館長節目相信政府不敢對他怎樣啦況且大鴿也不是做啥傷天害理的事如果醫師出來衛教要被綁手綁腳那民眾被網紅神棍騙根本是剛好而已換言之萬一真的懲處反而會促長莎莎們的孳生光這民怨政府就不敢承擔再者之前就說過萬一大鴿真的被台大醫院搞悲劇英雄形象粉絲至少再漲10萬莎莎只會繼續掉粉那就真的可能小玉化了粉絲害主子的案例又不是沒有去年才一個市長被罷掉一個自帶流量的醫師根本各大私立醫院搶著收畢竟業績很重要(講業績怪怪?)就算大鴿還只是住院醫師無法獨立門診但有人氣總是好的從住院醫師時期就累積粉絲以後升上主治就門庭若市啊這叫超前部屬這兩個人的組合還蠻鮮的兩個都是學生時代父母口中[別人家的小孩]只是一個要效法一個要遠離根本不同世界最後竟然湊一起----法條是一回事執法機關要怎麼解讀法條那是另一回事不然我打這篇幹嘛XD,1
PTT,Re: [新聞] 戰愛莉莎莎慘爆 台大醫蒼藍鴿遭檢舉營利,https://www.ptt.cc/bbs/Gossiping/M.1614577644.A.68F.html,2021-03-01 13:47:19,,銓敘部：公立住院醫師是「公務員」不適用勞基法部落客「林氏璧」證實為台大公職醫師！經營部落格被記過台灣標準情、理、法社會之前林氏璧經營部落格就被被記過所以除非有修法不然蒼藍鴿很明顯知法犯法這種不該等人去檢舉而是台大醫院要主動處理跟那個鬼排石法政府醫界早就該處理不是等到一個文組網紅嗆醫界才出手--別以為素利伯有騎士團蒼藍鴿沒有,6
PTT,[新聞] 愛莉莎莎3分鐘4度鞠躬道歉　蒼藍鴿籲停止,https://www.ptt.cc/bbs/Gossiping/M.1613443924.A.574.html,2021-02-16 10:52:02,,1.媒體來源:ETtoday新聞雲2.記者署名:黃翊婷3.完整新聞標題:愛莉莎莎3分鐘4度鞠躬道歉蒼藍鴿籲停止攻擊：莎莎也辛苦了4.完整新聞內文:YouTuber愛莉莎莎與台大兒科醫師「蒼藍鴿」的事件鬧得沸沸揚揚，雖然她已經在14日拍片4度鞠躬道歉，但網友抨擊仍未平息。對此，蒼藍鴿15日在愛莉莎莎的道歉影片下方留言，表明的確有收到道歉信，內容也很有，希望大家不要繼續攻擊，「莎莎也辛苦了。」愛莉莎莎14日在3分02秒的影片中4度鞠躬道歉，她提到，最近很多醫療人員告訴她，一般來說醫師在做報告時，並不會採用健康雜誌、書籍當作資料來源，自己卻在影片中引用大量的書本與健康節目上的資訊，「對於沒有足夠的醫療背景以及知識的情況下，就去抨擊醫生這件事情道歉。」愛莉莎莎接著解釋，之所以會上傳「喝橄欖油排膽結石」的民俗療法影片，是因為自己以前身體很差，有一陣子常常看醫生、吃藥、掛急診，但是最近幾個月身體明顯改善，所以才會急著把經驗分享給大家，「但是這個方法可能不適用於每個人、也尚未獲得主流醫學的認可，甚至對特定族群有危險性」，後續會下架喝橄欖油排膽結石、回應蒼藍鴿質疑共兩部影片。愛莉莎莎除了向社會大眾道歉，也在影片說明欄中坦言有寄信和蒼藍鴿道歉，「再次跟大家說聲抱歉，也謝謝大家。」不過，網友們對於愛莉莎莎的道歉似乎不太買帳，紛紛在影片下方留言抨擊她根本沒有提到當事人的名字、道歉沒有誠意。事隔一天之後，蒼藍鴿15日親自在愛莉莎莎的道歉影片下方留言，表示的確有收到愛莉莎莎的信，內容很有誠意，所以希望大家不要再攻擊了，去年12月底拍攝那部影片只是想導正視聽，沒想到引起這麼大的風波，「可能真實遇過使用該方法而產生急性問題的患者，所以講的時候也比較激動」，之後他會再出一部小短片當作最終回覆，「莎莎也辛苦了。」5.完整新聞連結(或短網址):6.備註:--,8
PTT,[問卦] 蒼藍哥會踢爆查克拉嗎？,https://www.ptt.cc/bbs/Gossiping/M.1613400316.A.409.html,2021-02-15 22:45:11,,根據起源於印度的瑜伽，人體裡有數以百計的查克拉（chakra)。其中大部分查克拉人都無法控制，但有7個（有的人說有9個或12、14，甚至16或21個）查克拉可以通過修煉開啟。（冥想、瑜伽、心念等等）開啟後可以提升智慧、直覺、創造、愛、感知、穩定等等能力。查克拉強大到一定程度，甚至可以產生神通、接觸靈魂、身體治癒等超能力。有沒有蒼藍哥會不會踢爆查克拉的八卦？-----SentfromJPTTonmyiPhone--,5
PTT,[問卦] 蒼藍鴿IG,https://www.ptt.cc/bbs/Gossiping/M.1613667563.A.2B5.html,2021-02-19 00:59:21,,大家安安小弟剛滑到蒼藍鴿IG幽默地開了自己跟PTT女神莎莎的玩笑看來已經大和解了呢———端湯影片———--,5
PTT,[爆卦] 蒼藍鴿在愛莉莎莎的影片提出回覆了,https://www.ptt.cc/bbs/Gossiping/M.1613400085.A.0E8.html,2021-02-15 22:41:23,,蒼藍鴿的醫學天地1小時前那個...莎莎的信我已經收到了，內容也很有誠意，請大家就不要持續攻擊了。老實說12月底拍了那部影片想導正視聽，也沒想到後續引來的風波那麼大，可能真實遇過使用該方法而產生急性問題的患者，所以講的時候也比較激動。總之過年時刻浪費大家許多時間也不好意思，我之後會再出一支小短片做最終回復，莎莎也辛苦了。補上截圖大家就到此為止吧--,21
PTT,Re: [問卦] 蒼藍鴿IG,https://www.ptt.cc/bbs/Gossiping/M.1613668345.A.4FA.html,2021-02-19 01:12:22,,這樣看起來台男蒼藍鴿vs台女愛莉莎莎之戰winlose台男還是愛台男因為台男壓根超討厭台女在八卦版很少看到台女是被捧的難怪台灣甲甲越來越多這也不是沒原因的畢竟這就是台男的本性--,2
PTT,[問卦] 蒼藍鴿敢diss刀療嗎？,https://www.ptt.cc/bbs/Gossiping/M.1613704464.A.20F.html,2021-02-19 11:14:22,,一個金屬尖銳物在皮膚上面剁來剁去站在科學理性的醫學專業角度應該是沒什麼用甚至會對身體有傷害有沒有蒼藍鴿敢diss刀療的八卦嗎？--,9
PTT,[問卦] 現在蒼藍鴿敢接男生懷孕的戰文嗎？,https://www.ptt.cc/bbs/Gossiping/M.1613725417.A.BA9.html,2021-02-19 17:03:33,,前陣子蒼藍鴿大戰網紅，雖然最後大家一面倒支持蒼藍鴿，但蒼藍鴿也是在值班高峰期看議題延燒無暇加班拍片反擊，現在蒼藍鴿敢碰男生懷孕的議題嗎？還是縮起來了？-----SentfromJPTTonmyiPhone--,6
PTT,Re: [問卦] 蒼藍鴿回應啦 SASA道歉的功勞嗎？,https://www.ptt.cc/bbs/Gossiping/M.1613916910.A.0D3.html,2021-02-21 22:15:08,,好了啦別在說經紀公司不會處理了各位會原諒嗎？倫家也會捐錢啊～--,2
PTT,Re: [問卦] 蒼藍鴿回應啦 SASA道歉的功勞嗎？,https://www.ptt.cc/bbs/Gossiping/M.1613902807.A.AFB.html,2021-02-21 18:20:05,,這篇真的是嘲諷放好放滿先是引用了真正具公信力的研究而且還是研究「有多少人是亂採信偏方治結石」的研究來影射莎莎這種自稱有做功課的人然後再把YT原則搬出來回擊莎莎指控非法二創的謊言順便說莎莎自己不是也二創我的影片但本醫生不像你文組仔要追究喔然後再道歉說不該沒通知莎莎就擅自跳出來糾正大眾吸收錯誤知識所以捐10000元到肝膽結石病症的相關基金會XD）我感覺這是開嘲諷最大的地方明明醫生完全沒做錯事卻自己主動捐錢感覺是在說看你們這些跟XX一樣白癡的人可憐捐錢給你們幫醫藥費反正最後還是要繳回醫院也就是繳給我們醫生--,3
PTT,[新聞] 蒼藍鴿正式回應愛莉莎莎！曬期刊佐證「侮,https://www.ptt.cc/bbs/Gossiping/M.1613903922.A.0CB.html,2021-02-21 18:38:39,,1.媒體來源:ETtoday新聞雲2.記者署名:黃庠棻3.完整新聞標題:蒼藍鴿正式回應愛莉莎莎！曬期刊佐證「侮辱醫學就是不行」4.完整新聞內文:蒼藍鴿正式回應愛莉莎莎！曬期刊佐證「侮辱醫學就是不行」記者黃庠棻／綜合報導▲蒼藍鴿正式回應愛莉莎莎。（圖／翻攝自YouTube／蒼藍鴿的醫學天地）蒼藍鴿21日正式回應愛莉莎莎2度質疑的影片，一開頭他就透露自己才剛值完大夜班，忍不住對著鏡頭直呼「台灣醫生就是可憐阿」，更坦言「為了生活我可以忍，但是侮辱醫學就是不行」，他認為確實不一定醫生講的話都是對的，但為了反擊對方質疑的言論，他會附上自己找到的醫學期刊下去做證明。▲蒼藍鴿正式回應愛莉莎莎。（圖／翻攝自愛莉莎莎IG）5.完整新聞連結(或短網址):6.備註:蒼藍鴿成功打臉愛莉莎莎的做法？還有一些網路上的醫學做法也是錯誤的。----,19
PTT,[問卦] 蒼藍鴿回應啦 SASA道歉的功勞嗎？,https://www.ptt.cc/bbs/Gossiping/M.1613899916.A.625.html,2021-02-21 17:31:54,,"如題蒼藍鴿哥回應了很大器的沒有多說甚麼還捐錢一萬塊是不是SASA道歉成功了呢?==========防雷線==========說真的最後醫生還道歉，真的是很有度量跟一些死不認錯的的YT差太多感覺鴿最後還是對sasa心軟了。最後又丟一個捐錢的球給sasa如果sasa聰明就知道該怎麼接了要復出sasa你自己加油路人家都給了再miss掉真的沒救了真的越想越覺得蒼藍鴿人真好==希望這件事情之後，SASA自己耗子為之吧。--看完厚到底到底喔沒看完怪誰阿>""<我好可憐QQ真的....畢竟醫者善者其實很好奇鴿對SASA有沒有一些建議但最後還是沒有鴿人太好484我可以好好活著惹？最後又丟一個捐錢的球給sasa如果sasa聰明就知道該怎麼接了要付出sasa也知道能跟上了再miss掉真的沒救了真的越想越覺得蒼藍鴿人真好==謝謝正妹我也覺得鴿很有風度QQ真的可以耶！應該是老一輩傳統觀念不想「動刀」想靠自己的身體去排除(但真的想太多了我心裡苦QQ+1sasa道歉影片跟沒有一樣最後還是在那邊暗酸「知道自己是有影響力的網紅」幾十萬訂閱還在那邊假鬼假怪道歉也沒「正式指名」對蒼藍鴿道歉人家鴿還反過來對SASA道歉神奇寶貝自己真的耗子為之啦以前頂多就是不看而已這件事後她業配我個人是絕對拒買我覺得統神真的是最大受益者XD中間影片很明顯就說因為神寶道歉所以就剪掉一大段了最後還跟sasa道歉這樣還不心軟什麼才是心軟QQ你真的有訂閱嗎？是不是沒開啟小鈴鐺？",100
PTT,[問卦] 蒼藍鴿與愛莉莎莎的戀愛三部曲,https://www.ptt.cc/bbs/Gossiping/M.1614111787.A.CA7.html,2021-02-24 04:23:05,,常言道打是情罵是愛小蒼哥哥是不是暗戀莎莎很久了所以才一直找機會噴火花介此讓莎莎注意到他的存在大家覺得小蒼哥哥會成功了嗎出處--愛莉莎莎跟雞排妹不同好嗎,
PTT,Re: [問卦] 蒼藍鴿回應啦 SASA道歉的功勞嗎？,https://www.ptt.cc/bbs/Gossiping/M.1613927456.A.9B3.html,2021-02-22 01:10:54,,提問1.一定期間內刪除影片無發放盈利？就我所知，刪除的影片不會有盈利。不知有沒有熟悉規範的人可以補充愛某的「肝膽排石影片」這樣算是能收到盈利嗎？2.即便有盈利真的有超過一萬收益許多？那「肝膽排石影片」好像也就幾片，即便有收益，那又有多少？我也很好奇「肝膽排石影片」，是指第一片而已？再者，某直樹都說會三倍奉還了，只是繳回不法所得(借用法律術語)，好像說不上是有多大誠意？3.還要等營收出來？影片營收出來的時間大概是多久有人知道？-----SentfromJPTTonmySamsungSM-C900Y.--,5
PTT,Re: [問卦] 蒼藍鴿回應啦 SASA道歉的功勞嗎？,https://www.ptt.cc/bbs/Gossiping/M.1613948054.A.41C.html,2021-02-22 06:54:11,,對!願意道歉我就給鼓勵今天不是說你當醫生就多了不起好好拍片就事論事討論議題就很好不需要為了聲量為了訂閱各種打烏賊戰讓彼此難堪否定別人並不會讓自己看起來更高貴我相信大家都學到了寶貴的一課0.0--仰望著讓人目眩神迷的東西只是錫箔飛鷹的背後只是一片灰可愛妝容只是粉末塗亮的指甲也有黑邊而一條骯髒的手帕仍然骯髒...即使它散發著香水的氣味!--,
PTT,[問卦] 蒼藍鴿真的好忙喔 又有人要開戰了,https://www.ptt.cc/bbs/Gossiping/M.1614141509.A.84E.html,2021-02-24 12:38:27,,網址：雖然這是中醫，但我不是讀醫的所以不發表看法啦，ㄏㄏ各位30cm年薪千萬鍵盤醫師覺得呢？--,100
PTT,Re: [問卦] 蒼藍鴿真的好忙喔 又有人要開戰了,https://www.ptt.cc/bbs/Gossiping/M.1614145595.A.A02.html,2021-02-24 13:46:28,,我先不提這兩個說的內容以及以及一些文盲以為他是中醫，而是小感冒要不要吃感冒藥這件事。其實這世界上會覺得感冒就要吃感冒藥壓制症狀的人其實是少數，那是因為大家活在台灣看病很方便所以感冒就趕快吃藥。事實上在大部分的國家裡面，小感冒馬上看醫生是不可能的，馬上就吃藥的觀念也不是常態，甚至看完醫生醫生也不開藥就叫你回去休息的醫院也很多。一方面，是除了台灣以外看病很不方便，另外一方面，是真的很多人覺得生病不吃藥自然好是一種提高免疫力的做法。我之前在英國室友生病咳了三個星期也不看醫生，也不戴口罩，撐不住的時候就吃一顆布羅芬，我後來被他傳染，也咳了三星期，去預約看醫生的時候，醫生只傳簡訊要我先喝蜂蜜檸檬，三天以後不行再去看醫生。甚至有同學去看病，一樣只拿到布羅芬的，都沒開藥的也是有的，而且這是常態，只有台灣一定趕快開藥壓制症狀之後才可以趕快回去上班，日本則是一樣看醫生不方便所以也是馬上吃成藥壓制症狀回去上班。但也因為都不看醫生不戴口罩不吃藥所以歐美疫情比較嚴重，所以大家就見仁見智了-----SentfromJPTTonmyRealmeRMX2144.--,7
PTT,Re: [問卦] 蒼藍鴿真的好忙喔 又有人要開戰了,https://www.ptt.cc/bbs/Gossiping/M.1614141854.A.077.html,2021-02-24 12:44:11,,林燦城醫師是西醫、中醫兼修吧，說他是中醫可能並不精確，他在西醫方面有家醫、婦產的專科的專業能力以下是其診所網頁的介紹醫師林燦城中西醫雙執照醫師(02)2361-0003高雄醫學院醫學系、醫學研究所畢西醫家庭醫學科、婦產科專科醫師衛生署西學中學分班、中醫師高考及格中西醫雙執照醫師曾任高雄醫學院、國立空大講師廣州中醫藥大學中西醫結合五官科臨床博士班進修中中國「世中聯」醫學會耳鼻喉耳鼻喉專業委員會理事--,8
PTT,Re: [問卦] 蒼藍鴿真的好忙喔 又有人要開戰了,https://www.ptt.cc/bbs/Gossiping/M.1614147493.A.E1A.html,2021-02-24 14:18:11,,所以有藥物是可以「濫用」的嗎？大部分都要適量吧你講了等於沒講一樣再來吃退燒藥會增加病程但發燒很痛苦會影響工作時有人就需要「當下緩解」阿總不能為了縮短病程請假好幾天吧最後人家又沒有要戰你卻用「參戰」兩字形容帶風向也不是這樣的吧你很想看血流成河齁--,6
