Source,Title,Link,Date,Summary,Text,Like
PTT,Re: [問卦] 蒼藍鴿會反擊高端抗體只有1/4抗體嗎？？,https://www.ptt.cc/bbs/Gossiping/M.1631958402.A.884.html,2021-09-18 17:46:40,,算了啦，為什麼要去質疑高端的抗體，又不是打在你身上，我之前上過幾天古文課，如下，湯心地仁厚，一次，他看到獵人在野外東南西北四面張望，口中還唸唸有詞地祈禱“願天上飛下來的，地下跑出來的，從四方來的鳥獸都進入我的網中，多多益善，多多益善…”湯見到後，對他們說：“你們這樣張網會把鳥獸都捕盡的，只有夏桀才想這樣一網打盡呢。”於是命人撤去三面網，留下一面，也跪下祈禱：“要向左的向左，要向右的向右，要向上的向上，要向下的向下，不聽話的才進網中來。”在場的獵人被湯的仁慈所感動，白話很簡單，要打國外疫苗的就去打國外疫苗，要打中國疫苗的，就去打中國疫苗，愛台灣的就打高端疫苗，然後趕快開放不戴口罩吧...我好想看到天擇實驗。--,4
PTT,[問卦] 蒼藍鴿跟簡芝許伯是不是水管清流?,https://www.ptt.cc/bbs/Gossiping/M.1633677094.A.F22.html,2021-10-08 15:11:32,,蒼藍鴿學霸台中一中--「應屆」台大醫學系現任住院總醫師預計年底取得兒科專科長相可愛清秀說話幽默風趣又有專業知識簡芝許伯夫妻檔，一個主持一個剪片以動物知識科普為主充滿愛與溫暖的影片風格看完都很想去認養寵物比起賣兒、蒼藍鴿前搭檔?愛Z沙沙、根本不教英文的阿滴、越來越無聊的那群人類是不是清流呢?--不是所有的公立醫院醫生都是公務員，所以沒問題的熟女控?也可以看藍鴿，想考台大醫學系從小培養,7
PTT,Re: [問卦] 蒼藍鴿最近點閱非常低?,https://www.ptt.cc/bbs/Gossiping/M.1635311797.A.336.html,2021-10-27 13:16:35,,幫蒼藍哥想一個一定高點擊率的計畫就是帶你的家人老婆兒女爸媽去打高端打臉一整票酸民保證點閱率超高不要推高端然後說自己打az是不得已那你家人總還沒打疫苗可以打高端吧用你台大醫科學到的醫學知識去跟自己家人推薦沒過三期的高端阿如果連自己或自己家人都做不到那還是算了吧高點擊率的方法提供給他就怕他不敢做而已----Sentfrom--,
PTT,Re: [問卦] 醫生蒼藍鴿公開支持高端了？,https://www.ptt.cc/bbs/Gossiping/M.1635259889.A.1A8.html,2021-10-26 22:51:27,,高端一定不差的把高端吹上天自己打AZ全台最公正最專業的小兒科總醫師蒼藍鴿看到美國現在不承認高端疫苗，一定會想辦法找出一堆證據來護航！不信就等著看--,7
PTT,[問卦] 原來蒼藍鴿採訪高端這麼容易？,https://www.ptt.cc/bbs/Gossiping/M.1632218674.A.F56.html,2021-09-21 18:04:32,,蒼藍鴿說他採訪高端過程比他以為的更容易他在podcast上說他就聯絡高端說說他想採訪，然後對方就答應了甚至派出廠長跟連加恩受訪，他昨天節目中還說「感染科醫生的都覺得看中和抗體做橋接沒問題」。--,9
PTT,Re: [問卦] 蒼藍鴿最近點閱非常低?,https://www.ptt.cc/bbs/Gossiping/M.1635313874.A.70E.html,2021-10-27 13:51:12,,就一個挺高端的網紅醫生請問你要點來看什麼東西?當初黑愛麗莎莎的時候就已經一堆人看破手腳了本質上就是走網紅炒流量那套真以為別人看不懂?現在要嘛就是去找名人貼貼要嘛就是當好側翼這兩招而已不然一般人看那個幹嘛?----我沒有粉愛麗莎莎阿又不是莎莎每部片都會去看去點讚的喜歡看誰有差嗎?,1
PTT,Re: [問卦] 蒼藍鴿會反擊高端抗體只有1/4抗體嗎？？,https://www.ptt.cc/bbs/Gossiping/M.1633236884.A.799.html,2021-10-03 12:54:42,,他昨天就反擊了啊它有說高端是兩劑型的本來就是打完兩劑之後的數值才是有參考價值然後一堆人看四叉貓打完第一劑之後超興奮說高端沒有用結果打第二劑之前抗體爆衝25倍竟然還有臉出來說你那麼愛驗怎麼不參加臨床實驗蒼藍哥是說信者恆信不信者恆不信但是你不能第一劑跟第二劑用不同的標準在看那叫做雙標我是覺得他講的蠻好的然後下面留言更好笑說他要被八卦版出征了-----SentfromJPTTonmyiPhone--對反正就是很多人雙標突然看到爆從25倍之後就語無倫次！你去看他影片他並沒有這樣說他說這個關聯度信者恆信不信者恆不信但是你不能第一劑和第二劑兩個標準不一樣,1
PTT,[問卦] 蒼藍鴿被詐騙的八卦？,https://www.ptt.cc/bbs/Gossiping/M.1636122678.A.025.html,2021-11-05 22:31:16,,如題知名醫學科普Youtuber蒼藍鴿幾個小時前發了一支影片內容講述了他被詐騙集團騙取了將近五萬，現在詐騙模式越來創新，其高超的騙術居然連高智商的醫生也上當八卦鄉民們是不是也要小心了--,11
PTT,[問卦] 蒼藍鴿最近點閱非常低?,https://www.ptt.cc/bbs/Gossiping/M.1635309268.A.6CD.html,2021-10-27 12:34:26,,除了性病30萬，講Toyz21萬蒼藍鴿最近點閱數是不是很低啊？蒼藍鴿是不是得罪廣大愛麗莎莎粉而被鋼鐵莎粉制裁了==蒼藍鴿點擊數那麼低，有沒有八卦？----,59
PTT,[問卦] 高端面臨銷毀，蒼藍鴿人呢？？？,https://www.ptt.cc/bbs/Gossiping/M.1637310314.A.3A0.html,2021-11-19 16:25:12,,安安打給厚我乘五啦ㄎㄎ當初拍片高端能不能打的蒼藍鴿～用著像似志棋77一副假中壢的方式～在生產線裡做訪談！彷彿是透過這種方式，讓大家能夠安心、沒事兒！打一波打起來的港覺～而如今卻只有77萬人施打！還衰洨不能出國！美國老大的孿生兄弟被射後不理？然後今天又說500萬劑剩下的2/3，可能會依循法規做銷毀～當初還跟486合作過幾次，價值滿滿好似驕傲的蒼藍鴿，現在是什麼感想呢？？會感到押錯邊嗎？甘無八卦某？？--,7
PTT,Re: [問卦] 高端面臨銷毀，蒼藍鴿人呢？？？,https://www.ptt.cc/bbs/Gossiping/M.1637842977.A.447.html,2021-11-25 20:22:55,,我記得8-9月的時候吧身邊的一個覺青朋友有一天貼了蒼藍鴿的影片然後說自己花了一晚苦心研究疫苗不會被新聞謠言帶風向了整個焦糖附身一樣過了一陣子PO黃卡打了莫德納還很不爽說想打AZ當第一次有混打消息出來的時候（政府考慮AZ混其他）他就靠腰說自己很衰被分到莫德納不能混然後又PO了第二劑莫德納的照片明明高端多到不用預約了卻不去打？嘴上說一套做另一套而已啦--,10
PTT,Re: [問卦] 高端面臨銷毀，蒼藍鴿人呢？？？,https://www.ptt.cc/bbs/Gossiping/M.1637838515.A.78A.html,2021-11-25 19:08:33,,海水退了就知道睡沒穿褲子請問蒼藍鴿跑去哪裡？高端現在的狀況都沒發表意見或看法一次疫情看透一堆醫生呵呵--都去高端產線訪問現在總要有個看法吧,36
PTT,[問卦] 蒼藍鴿說醫生一輩子都在考試是真的嗎?,https://www.ptt.cc/bbs/Gossiping/M.1638882908.A.5CE.html,2021-12-07 21:15:04,,"是這樣啦本魯剛下班,想說看的YT讓腦袋放鬆一下就看到YT演算法推蒼藍鴿的最新影片:醫生有多少考試要考看完後,當醫生真的有那麼多考試要考哦這樣很累诶上班要看病人,下班還要念書感覺那些內外科兒科的醫生都超強--",
PTT,[問卦] 蒼藍鴿現在的評價如何?,https://www.ptt.cc/bbs/Gossiping/M.1637393670.A.A7F.html,2021-11-20 15:34:28,,對他有印象就什麼醫學油土伯好像很愛健身還看過啞鈴開箱文聽說疫苗問題也做了影片大家對他的評價如何啊？--,
PTT,Re: [問卦] 蒼藍鴿該改名為蒼綠鴿吧？,https://www.ptt.cc/bbs/Gossiping/M.1631697564.A.AF9.html,2021-09-15 17:19:22,,我是覺得鄉民也太敏感了人家也只是去參訪高端公司（因為最近很夯？）又沒說挺高端內容也幾乎只有訪問連加恩醫師而已也問了許多大家對於高端有疑慮的問題算是很中立公道了這樣就把人抹綠也太奇怪了吧？--,5
PTT,Re: [問卦] 蒼藍鴿是不是以後在八卦板黑掉了？,https://www.ptt.cc/bbs/Gossiping/M.1631699744.A.5B3.html,2021-09-15 17:55:42,,A:問保護力B:抗體很高問A答B這種邏輯沒一致大概只有文組覺青會被呼嚨舉個例子打仗（防疫）問勝率多少（保護力）答士兵很多（抗體）這篇覺青不要看--,
PTT,Re: [問卦] 蒼藍鴿說醫生一輩子都在考試是真的嗎?,https://www.ptt.cc/bbs/Gossiping/M.1638886830.A.4EF.html,2021-12-07 22:20:28,,安安你今天笑過了嗎？講點國際笑話好嗎？舶來品沒進來之前“聽說快過期了”舶來品進來之後“我們買的”“我們買的””我們買的”我們必須把生命交付到這種人手上就像我們必須把生命交付到法律人手上這就是命你沒得選擇但是你可以不要打從心底尊敬這種人順從這種人好嗎？--,1
PTT,[問卦] 視網膜 VS 蒼藍鴿，是不是有點像???,https://www.ptt.cc/bbs/Gossiping/M.1631792420.A.19D.html,2021-09-16 19:40:17,,視網膜蒼藍鴿兩人都戴方框眼鏡，眼睛小小的髮型也很像，五官氣質也是大家覺得呢???--,11
PTT,[問卦] 蒼藍鴿會反擊高端抗體只有1/4抗體嗎？？,https://www.ptt.cc/bbs/Gossiping/M.1631957857.A.4EA.html,2021-09-18 17:37:35,,安安餓死抬頭啦486好夥伴&宛如台大版志棋之蒼藍鴿~看到網紅自費驗抗體，結果高端只有莫德納、AZ的1/4而已！會像之前那樣氣憤地拍片，到處糾正別人嗎？？？--,11
PTT,[問卦] 蒼藍鴿的顏質大概PR多少?,https://www.ptt.cc/bbs/Gossiping/M.1639968686.A.5CF.html,2021-12-20 10:51:24,,其實蒼藍哥的臉還算蠻大眾的，尤其在高中的資優班或清交大很容易看到類似他這型的，我有幾個朋友是清交大的，也是長這型身邊的女生是說他的臉還算順眼，那蒼藍哥的顏質大概PR多少啊?-----SentfromJPTTonmyAsusASUS_Z01KD.--醫生身份能提升顏質?,17
PTT,[問卦] 醫生蒼藍鴿公開支持高端了？,https://www.ptt.cc/bbs/Gossiping/M.1631666679.A.CF3.html,2021-09-15 08:44:37,,醫生是最講究科學證據的，台灣醫生是台灣智商最高的一群人醫生蒼藍鴿都公開表態支持高端了，證明高端效果其實也不差吧？--,1
PTT,Re: [問卦] 蒼藍鴿是不是以後在八卦板黑掉了？,https://www.ptt.cc/bbs/Gossiping/M.1631667241.A.592.html,2021-09-15 08:53:59,,高端沒有保護力的直接證據被攻擊理所當然但是連加恩還有許多網路上的醫師提供間接證據可以用來推估保護力間接證據不能取代直接證據但間接證據就不能被採納?我不這麼認為反而是一堆對免疫學病毒學一竅不通的半瓶水在網路上大放厥詞攻擊醫師的專業意見只因為醫師的立場與自己不同覺得自己很厲害醫師都是為了錢替政府宣傳八卦的水準就是這樣不意外--,
PTT,Re: [問卦] 蒼藍鴿是不是以後在八卦板黑掉了？,https://www.ptt.cc/bbs/Gossiping/M.1631666501.A.762.html,2021-09-15 08:41:39,,"其實蒼藍鴿我是他從介紹工作細胞開始看沒辦法~YT自己演算的.他介紹工作細胞1-2季&工作細胞BLACK還滿好看的~只不過在這次裡面他扮演的有點看不下去免疫橋接?保護力?三期試驗?等....為何不尖銳一點發問!!!!????跟介紹工作細胞一樣直接打斷介紹一下高端到底哪裡可以讓人信服?只拿影片來洗地洗白除非是西台灣大肆宣傳才有用看看那顆星的宣傳XDDDDDDDDD這對台灣人是沒用的!!!那顆星人家保護力還有5""1""%呢!??????????~~~~PS:順便問一下醫院or醫學系學長姐制度很嚴重嗎??遇到自己教授會怕.JPG嗎??--",3
PTT,Re: [問卦] 蒼藍鴿是不是以後在八卦板黑掉了？,https://www.ptt.cc/bbs/Gossiping/M.1631667049.A.DB4.html,2021-09-15 08:50:46,,其實這種類似的影片可以把他當作是業配影片來看業配影片基本上不會去講不好的地方然後還會去強調好的部分除非原本的人設就是要嗆要酸不然基本上業配應該不會講不好的點現在還有那種還沒排到的朋友在揶揄、嘲諷整片都在稱讚、吹捧政府好棒棒之類的最後在補上一句：「這樣我有疫苗可以打了嗎？」只是這個鴿應該是有打到疫苗吧？-----SentfromJPTTonmyAsusASUS_Z01RD.--人非聖賢，ＧＹ難免--,1
PTT,Re: [問卦] 蒼藍鴿是不是以後在八卦板黑掉了？,https://www.ptt.cc/bbs/Gossiping/M.1631667237.A.F80.html,2021-09-15 08:53:55,,混打就是你講的沒二期沒三期就是看抗體數據你以為藥物可隨便混打不出事？藥物交互作用也有一樣的問題要安全性第一期實驗做的就是安全性要有沒有效第二期實驗做的就是有沒有效第三期則是你講的效力分數第二期本來就能推第三期所以反對的人才舉有反例的情形今天高端已經證明安全+有效但效力未知到底在三期哪齣的蒼藍鴿只是很簡單的跟你講現在高端的現狀有跟你講效力幾%嗎？陳院士這最扯他是評審他覺得有狀況就投反對票結果他先自爆後自己中離跟打信長一樣全頻：隊友都垃圾幹xxx已離開遊戲不在評審時大殺四方事後證明疫苗有問題當個先知我是黑人問號啦根本沒人在乎你會不會打政府在乎嗎？第二類可都是打其他疫苗呢鄉民在乎嗎？大家都要等神藥BNT有也是高端股東在乎而已喔對了提醒一下莫德納、AZ也都沒做完第三期--這就很好笑要認證到時候如果過了不就顯得自己推論是錯的高端就沒做完第二期啊但政府就給他EUA現在就剩WHO會不會給認證給了代表政府先知不給就是政府罔顧人命這邏輯應該正確吧就是沒有啊沒有的東西怎麼拿出來所以高端沒做完第二期莫德納沒做完第三期那跟安全性有關係嗎？就沒保護力資料就沒做三期真的可悲我媽愛打什麼是他的事他愛打高端就打高端根本沒人保證成功一分證據說一分話高端安全性+有抗體+抗體濃度高+沒保護力資料所以才叫做EUA緊急使用授權有保護力資料就能申請藥證了我全家每個人都有他們自由意志啦他們打什麼到底關我屁事反高端人士的招數就是問候別人家嗎？怎麼這麼低學歷啦專家他們判斷有效才會給EUA我根本沒有疫苗專業無法打臉他們啊笑死數據自己去看報告啦抗體濃度是不是數據啦？就跟你說沒保護力資料EUA是政府那群專家覺得有效第二期稱為模擬考第三期稱為大考好了因為模擬考考的好所以推測他大考也能考的好但他大考沒分數懂？產品就在那邊現在就是政府給EUA認證了WHO還沒我的問題是等WHO認證後現在的反高端人士會承認政府好棒棒走在前面嗎？還是跟某藝人一樣罵狗官呵呵專家的EUA就是他們認為有效事實上未知呵呵專家就是你高中老師好了你覺得他能不能猜到你考不考的上？老師說這是資優生考得上你說信徒才聽得下去唉…到時候萬一認可是不是臉又腫了一點啥台大考的差只能上學店認證是學歷認證而不是台大認證就好比WHO認證的科興效力6成學店等級不太懂你的問題未知就是未知玩寶可夢會因為未知就不抓嗎第一二三期都是模擬考但考的方向不一樣第一期考安全性第二期考有沒有效(會不會發生血清陽轉、抗體效價)第三期則是防護力正常來說三期都做完就能申請藥證笑死這當場直播直接紅了捧上天吧還在吵安全性的實在沒什麼好談的你就等長生不老藥好了不給政府下台啊你以為你綠共？差不多就是這個意思我怎麼知道高端會不會過事實他現在沒過未來不知道,-2
PTT,Re: [問卦] 蒼藍鴿是不是以後在八卦板黑掉了？,https://www.ptt.cc/bbs/Gossiping/M.1631667360.A.760.html,2021-09-15 08:55:58,,"每次看他影片底下的留言都覺得很好笑，任何對高端的質疑都會被砲轟的很慘。所有跟高端有關的都講得好像超嚴謹，超有科學根據，三期、保護力什麼的數據都根本不需要原本想留點什麼，但覺得反正多一點人去打高端也不是壞事，想幫高端做人體實驗的就儘量去，這也能或多或少增加其他人打到國際認證疫苗的機會，皆大歡喜。覺得高端很好的趕快去打啦,我勾其他三種疫苗到現在還沒能預約第一劑==--我好像重新排隊了QQ好的沒質疑，壞的沒問，某種程度就是支持，只差沒明講吧～之前看到莫和BNT的消息一時把Az取消，後來發現還有得等才把Az再加回去QQ(2x尾端）好的塔綠班，打高端了沒",7
PTT,Re: [問卦] 蒼藍鴿是不是以後在八卦板黑掉了？,https://www.ptt.cc/bbs/Gossiping/M.1631667955.A.F22.html,2021-09-15 09:05:53,,蒼藍鴿以前也說過中和抗體效價不完全等於保護力高低啊，兩者是正相關但不是絕對的因果關係所以他就是講解高端的優點，但沒有說高端的保護力多高，也沒有推薦打高端，也不知道他自己有沒有打高端，就好像陳其邁黃偉哲一樣，高端還是要推銷一下（甚至他們是自稱手臂會優先留給高端的），但身體很誠實打了AZ，加入AZ特戰隊的一員--,16
PTT,Re: [問卦] 蒼藍鴿是不是以後在八卦板黑掉了？,https://www.ptt.cc/bbs/Gossiping/M.1631674218.A.6E7.html,2021-09-15 10:50:16,,我是看蒼藍哥打什麼疫苗就打什麼欸當初AZ被黑成這樣也是看了很多名人打才敢打蒼藍哥柯P誠實中黃副等都是打AZ而且柯和黃副還有到各個重災醫院協調也沒看到他們確診也沒有被隔離我更相信AZ是一款好疫苗了AZ被黑真的沒道理大家都應該打AZ才對啊而且30天後去驗血看看身體有沒有狀況這樣就好了@@結論AZ最高大家都應該打AZ--我全家都打AZ爺爺奶奶爸爸媽媽老弟我都身心舒暢,2
PTT,Re: [問卦] 蒼藍鴿是不是以後在八卦板黑掉了？,https://www.ptt.cc/bbs/Gossiping/M.1631668347.A.D52.html,2021-09-15 09:12:25,,先說我也覺得高端是垃圾智障才打不過我認真去看完這部影片沒看到蒼藍鴿有說挺高端建議大家都去打高端啊他不就是接了個業配介紹高端然後採訪連加恩而已從頭到尾沒說高端很好很不錯吧問的問題確實不夠尖銳不過採訪業配影片一般也都是set好的問題本來就不太能問出三小還是我有看漏他說支持高端？--,15
PTT,Re: [問卦] 蒼藍鴿是不是以後在八卦板黑掉了？,https://www.ptt.cc/bbs/Gossiping/M.1631668892.A.EAD.html,2021-09-15 09:21:30,,"人家台大醫科頭腦比鄉民好多了,真的很聰明當網紅重視的是什麼?錢.聲量.粉絲數嘛看看許多網紅前輩,獲得鐵粉最有效的方式是什麼?要嘛挺政府.反中;要嘛打柯比如焦糖,不用念大學,好好挺政府,靠著10萬粉絲資格直上研究所;館長反中共反紅媒後生意扶搖直上想想有了鐵粉跟聲量之後,廠商就自己上門來找你代言或賣東西了所以介紹高端疫苗可以說是一舉數得啊!更何況目前高端從來沒被突破性感染的紀錄.堪稱世界最頂的疫苗,這麼好的疫苗稍微介紹一下不行嗎?不曉得ptt的鄉民是在不開心什麼?老話一句,支持高端,輪到你,就去打,不要挑!但不好意思,我已經先打國外進口的了...--執政黨民調一直都最高,什麼時候幹民禁洞是主流?反串嗎?八卦不都4%網軍?你怎麼信了?好氣喔哈哈好的塔綠班",2
PTT,Re: [問卦] 蒼藍鴿是不是以後在八卦板黑掉了？,https://www.ptt.cc/bbs/Gossiping/M.1631669392.A.735.html,2021-09-15 09:29:50,,"43~就當作是在看PPLs電視廣告就好了會信的自己要負責畢竟身體是自己的,疫苗打進去有問題沒人能幫你代受苦高端問題大家都已經討論到爛了保護力副作用等數據每次一問到關鍵點就開始以下跳針反應:1.不喜歡,可以不要打2.沒人強迫你打3.一堆人打了還不是沒事4.4%仔閉嘴5.不然你打科興或國藥等各種閃躲問A答B--",7
PTT,Re: [問卦] 蒼藍鴿是不是以後在八卦板黑掉了？,https://www.ptt.cc/bbs/Gossiping/M.1631668543.A.850.html,2021-09-15 09:15:40,,他就趁機賺綠營支持者過來的點閱率而已。觀眾看得爽就好，知識型網紅終究是為了娛樂。看他一些影片，有些題材實在像是沒靈感似的硬是要談，很沒梗。高端疫苗現在就是缺一堆資料，如果就審查觀點或發表面向，資料少太誇張的東西就沒有討論的價值，一般國家就直接不給過，要求較多數據的期刊就直接不給刊。那些挺高端的人要把自己言論寫在期刊上投稿嗎？-----SentfromJPTTonmyiPhone--,
PTT,"[問卦] 蒼藍鴿談高端,為何不去訪問陳培哲？",https://www.ptt.cc/bbs/Gossiping/M.1631674918.A.996.html,2021-09-15 11:01:54,,"關於國產疫苗,最熟悉整件事情來龍去脈,箇中問題的人當屬陳培哲了。親綠中研院院士陳培哲先前聲稱，說以當前國際標準，我國疫苗在7月絕對不可能通過！表示「委員會無法正常行使他的功能，離開更能說真話」因此辭去疫苗審查委員。蒼藍鴿號稱,要用辛辣問題,替一般民眾發問,對於高端疫苗的疑慮。結果,他選擇去參訪高端廠房,像小粉絲似的,聽連加恩講的很高興。蒼藍鴿要談高端的疑慮,為什麼不是去訪問陳培哲？而是去參觀高端廠房,聽高端高層自說自話？--",
PTT,Re: [問卦] 蒼藍鴿是不是以後在八卦板黑掉了？,https://www.ptt.cc/bbs/Gossiping/M.1631672822.A.40B.html,2021-09-15 10:27:00,,其實高端吵那麼久，最大的問題就是一句話而已：推薦高端且有頭有臉的人，幾乎都沒打高端我說幾乎，還是有少數像總統或其他人有示範一次其他包括政客、醫生、藥廠、挺高端網紅們，幾乎都沒打高端你可以說醫生當初就是優先打，那時沒有高端能選但不改變他們沒打高端的事實，在旁人看起來就是沒有說服力今天代言、宣傳一個商品，「說服力」超級重要的不會有人找廚師代言運動用品，也不會有人找運動員代言廚具調味料你不能拿著肯德基，告訴大家麥當勞多好吃，看起來就不對了，再多理由都一樣-----SentfromJPTTonmyAsusASUS_X01BDA.--,6
PTT,Re: [問卦] 蒼藍鴿是不是以後在八卦板黑掉了？,https://www.ptt.cc/bbs/Gossiping/M.1631675106.A.386.html,2021-09-15 11:05:04,,這咖早就看破他手腳一開始不斷吹捧AZ把AZ保護力吹的跟bnt莫德那差不多一直說AZ副作用比較少，血栓就帶過說機率很低還有打疫苗死人說屁話每天都有人死看到這裡只剩白癡塔綠班還覺得他是中壢的吧？現在也不演了反正都被抓包不中壢了直接幫塔綠班推高端我是不懂為什麼有掛醫生，就好像會很懂疫苗啦台灣的很多醫生，也是無腦護航阿，例如之前的沒病不用戴口罩不要信什麼醫生就是對的沾上政治都可以指鹿為馬--那你怎麼要戴口罩？醫生說沒病不用戴口罩阿人家醬料捏我在說醫生會被政治影響中壢性，所以不是醫生講的就是對的ok?別忘了還有笑秉照你邏輯，他比陳院士懂？你怎麼不信陳院士？護航仔都是這麼可憐，那你怎不信陳院士，學經歷屌打蒼綠鴿欸,2
PTT,Re: [問卦] 蒼藍鴿該改名為蒼綠鴿吧？,https://www.ptt.cc/bbs/Gossiping/M.1631697336.A.784.html,2021-09-15 17:15:34,,是不是綠不敢說但從他打AZ並拍影片闢謠那些黑AZ的言論就知道他肯定不是白的～記得當時AZ在八卦版黑到發亮某政黨還製圖叫陳時中背書一個國際認證的疫苗被黑成這樣真的很可怕那時蒼藍鴿的影片在板上就有爭議了現在又拍個高端影片我想他差不多該下去了幫他QQ真柯憐綠--也是啦跟著大家罵AZ罵高端不就好了他影片說血栓機率比被雷打到還低然後說如果你出門不怕被雷打到就不用太擔心血栓唉講這種話根本欠鄉民噓他只說有疑慮，不像某些鄉民黑AZ黑的很大力真的很欠噓耶,12
PTT,Re: [問卦] 蒼藍鴿是不是以後在八卦板黑掉了？,https://www.ptt.cc/bbs/Gossiping/M.1631666354.A.CAD.html,2021-09-15 08:39:12,,真的影片內容很多避重就輕，關於唾酸醣基化…專家委員在審查會議中，維持製程穩定性條件對於唾液酸醣基化的建議：唾液酸醣基化是國際法規所規定在生物製劑上的重要安定性評估指標之一，可影響免疫原性（Immunogenicity），因此高端也須提供證據說明醣基化不影響原料藥免疫原性之證據說明。這可不是驗桃紅色波長這樣避重就輕的看法詳細資訊請參考：--你確定有看我內容？我貼的是影響製程穩定性，而且這是專家在EUA審查會議後，給出的希望高端提供不影響證據的資訊連結都貼給你了，認真看一下好不？,13
PTT,Re: [問卦] 蒼藍鴿該改名為蒼綠鴿吧？,https://www.ptt.cc/bbs/Gossiping/M.1631696228.A.811.html,2021-09-15 16:57:06,,木葉的蒼藍野獸阿凱明明只穿綠色衣服卻叫蒼“藍”野獸阿凱484應該改名木葉的蒼綠野獸才是正解umu卦--,2
PTT,Re: [問卦] 蒼藍鴿該改名為蒼綠鴿吧？,https://www.ptt.cc/bbs/Gossiping/M.1631696874.A.217.html,2021-09-15 17:07:52,,古時候藍色綠色都叫青色青天->藍天青草->綠草所以改成蒼青鴿才是最頂的解釋成藍或綠的說得通--,1
