Source,Title,Link,Date,Summary,Text,Like
PTT,[問卦] 蒼藍鴿打臉影片態度哪裡差？,https://www.ptt.cc/bbs/Gossiping/M.1613271762.A.63F.html,2021-02-14 11:02:40,,如題各位死肥宅蒼藍鴿打臉人體製皂機的影片被說態度很糟不過本肥完全感覺不出來啊他的態度更像是醫生在關懷智障病患吧請問蒼藍鴿態度哪裡差了？有沒有八卦0.0--,49
PTT,Re: [問卦] 蒼藍鴿打臉影片態度哪裡差？,https://www.ptt.cc/bbs/Gossiping/M.1613274098.A.883.html,2021-02-14 11:41:34,,有時候開車突然左轉或跨雙黃線撞到對向機車也是會有記者說啊機車騎太快撞上違規汽車即便你根本無法測速得知機車速度，反正我說你騎太快你就騎太快共同的思維就是好像找個理由扣上去自己就可以不用那麼尷尬所以大家體諒一下巴，不要讓我們的莎莎尷尬嘛好嘛好嘛~-----SentfromJPTTonmyAsusASUS_I01WD.--,
PTT,[問卦] 蒼藍鴿跟愛麗莎莎合作是不是雙贏？,https://www.ptt.cc/bbs/Gossiping/M.1613274607.A.867.html,2021-02-14 11:50:05,,蒼藍鴿如果跟愛麗莎莎合作內容是針對這次的事件畫下句點愛麗莎莎可以用一般民眾的角度像蒼鴿提問接著蒼鴿一一解答最後愛麗莎莎可以用一種「原來是這呀」的方式做影片結尾不僅愛麗莎莎有台階下蒼藍鴿更是獲得廣大粉絲青睞而且顯得有氣度是不是雙贏忘了最後還有志祺七七參戰-----SentfromJPTTonmyiPhone--,11
PTT,Re: [問卦] 蒼藍鴿打臉影片態度哪裡差？,https://www.ptt.cc/bbs/Gossiping/M.1613279391.A.ECE.html,2021-02-14 13:09:47,,也不是嗆她吧只是蒼藍鴿那方式比較像是看蠢人在做蠢事那種輕蔑和傻眼的表現當然是有點嘲諷啦他那影片的形式和態度讓我想到UncleRoger當初炒飯的那個英國人也沒有氣噗噗阿還一起合作做炒飯愛莉莎莎也可以和蒼藍鴿一起合作排石給他看讓他檢查裡面有沒有結石豈不是很棒??--,1
PTT,[問卦] 愛莉莎莎大戰蒼藍鴿用一張圖表示？,https://www.ptt.cc/bbs/Gossiping/M.1613273235.A.023.html,2021-02-14 11:27:13,,吶吶本肥看網路上有人分享j張圖應該三幻鳥之一的冰鳥直接把素利伯虐爆雖然素利伯以前蠻好用的啦都會去11號道路抓一張素利普來養有人在問這件事的話484傳這張圖就好？--,6
PTT,Re: [問卦] 蒼藍鴿打臉影片態度哪裡差？,https://www.ptt.cc/bbs/Gossiping/M.1613279349.A.754.html,2021-02-14 13:09:07,,"台女主觀上感到不舒服就是態度差,根本不需要有什麼確切的證據,愛莉莎莎真的是勇敢的小女孩,勇敢的站出來反抗權威,八卦板肥宅不可能懂,噓我的都沙豬,看不起女權--",
PTT,[問卦] 蒼藍鴿:同志族群和愛滋議題切身相關,https://www.ptt.cc/bbs/Gossiping/M.1613203836.A.41A.html,2021-02-13 16:10:32,,小弟看蒼藍鴿以前的影片有一部內容是醬的蒼藍鴿說自己以前有影片在講愛滋結果就收到不少同志朋友的私訊說想認識這讓蒼藍鴿感到困惑自己到底哪裡像同志後來他整理了幾個重點其中一點說因為愛滋議題和同志議題切身相關，所以同志朋友可能覺得他很親切這樣蒼藍鴿講話這麼直接是不是很讓人尊敬有沒有八卦！-----SentfromJPTTonmyiPhone----,9
PTT,[問卦] 蒼藍鴿 愛莉莎莎 志祺七七,https://www.ptt.cc/bbs/Gossiping/M.1613212246.A.CC2.html,2021-02-13 18:30:44,,朋友傳的圖XDD是說現在有一些文章在叫志祺七七出來這個話題也蠻有熱度了感覺明天他就會發片了xd有沒有八卦？--,6
PTT,Re: [問卦] 蒼藍鴿值班結束了,https://www.ptt.cc/bbs/Gossiping/M.1613211277.A.1D0.html,2021-02-13 18:14:35,,油土伯靠互戰合作拉高雙方的點閱率說不定是他們背後的行銷公司想出來的新企劃！你各位還一直幫他們宣傳、打廣告！鄉民484太容易被操弄了！他們看了統神在市場跟人吵架的影片之後，才發現只要起爭議就可以引起關注，炒一波話題！--,3
PTT,Re: [問卦]笑屎人，蒼藍鴿這個蹭熱度的被台灣IU打臉,https://www.ptt.cc/bbs/Gossiping/M.1613205484.A.D30.html,2021-02-13 16:38:02,,沒差啦等到年後開工當天中央疫情指揮中心記者會就會有記者問這個問題了--,3
PTT,[問卦] 最新獨家影片！蒼藍鴿反擊愛莉莎莎！,https://www.ptt.cc/bbs/Gossiping/M.1613206028.A.D2D.html,2021-02-13 16:47:05,,最新獨家影片！蒼藍鴿反擊愛莉莎莎！竟爆出驚人內幕與真相!!廢話不多說，大家自己看影片吧--,-3
PTT,Re: [問卦] 蒼藍鴿要是輸了 484代表醫生也沒多專業？,https://www.ptt.cc/bbs/Gossiping/M.1613205937.A.973.html,2021-02-13 16:45:35,,這位講的理論都跟宗教一樣也不能說他錯像佛教徒中也有很多醫生認為疾病都是業障引起的有人怎麼抽煙喝酒熬夜就是不會生病有人得到SARS跟武漢肺炎都還能痊癒也有人一個小手術就死了所以這些都歸類於業障我聽某些醫生真的這麼說以前剛畢業時覺得自己很厲害什麼病都能治久了才發覺有的病治好了又復發也不知道原因有的人葉克膜裝上去好了也有人裝上去馬上雙腿黑掉有人得到SARS傳給一百多個人那些人死光了自己被治療好了這種邏輯就是宗教思考沒什麼對或錯如果疾病的發生機轉一定正確為何有人就是不會生病？緩起訴也沒啥過了半年一年不要再賣過了緩起訴時間也就沒事人家也是醫師也不是文組的有醫師資格做直銷才好做我認識好幾個醫師在做安麗跟賀寶芙這有什麼？賣東西才能致富，否則一個藥師一個月賺5-6萬，是要轉幾年才能買房子去年生技發展不錯有賺錢就好綠色小鎮怎麼了？這些推薦人好歹是醫師、藥師、毒理學博士那當然推薦書的目的是要賣東西賺錢您也無法論證推薦人沒有醫學專業他們難道不能一方面賣東西一方面用自己醫療專業推薦嗎？好比醫師去做安麗做到月入百萬後來乾脆不當醫生專心做安麗一樣難道基於賣東西才推薦就代表這種養生方式有問題？也不見得吧！我覺得是要有一個縝密的研究可以反證推翻肝膽排石這個療法有誤否則民俗療法只要不要扯到療效不要違反醫師法大家信者恆信佛教還說每天念藥師咒消業障可以治療百病難道鄉民也要去戰？一樣沒有科學依據一堆信徒念完藥師咒說我頭突然不痛了裡面還一堆醫師在念藥師咒基督教說耶穌基督會治療麻瘋只要每天禱告主會在你耳邊說話本來拿著拐杖的長短腳的人士在教會禱告之後馬上把拐杖丟掉站起來了這種醫治大會不是很常見？也沒有科學依據是否鄉民也要去醫治大會開戰？蒼藍鴿也要去戰？醫治大會會場裡面的醫師沒有1000也有800個戰屁啊人家有自己的信仰！我跟你說啦有時候一直覺得有療效即使吃安慰劑疾病也會好我拿一杯白開水給那些紫衣神教教徒我騙他們這是SeaFood加持過的還有念過108次大悲咒跟49次藥師咒他們每天喝白開水搞不好肝膽排石也會好這就是一種自我催眠催眠後啟發人體的自我抵抗力那些莎粉覺得肝膽排石法有效就算十年後實驗證明沒效但是因為他們安慰作用搞不好許多人真的治療好愛麗莎莎自己使用了不也好了？民俗療法跟自然療法真的見仁見智-----SentfromJPTTonmyiPhone--雞尾酒療法治愛滋病一開始也被當成自然療法許達夫有西醫執照還不是一直推廣自然療法，他也沒什麼事，也沒被以違反醫療法送辦，他被受停業的主因還是他賣電解水暴利，根本一場下來要一百多萬，還有某位骨科名醫賣轉骨方也是百萬起跳，我就不提了！當醫生一個月十幾萬二十幾萬只是小康餓不死，真的要賺大錢還是要當商人一開始真的就歸類自然療法很多醫師信佛教安麗不是醫療產品只是養生保健食品你知道道士畫符喝符水流傳一千多年嗎？,
PTT,[問卦] 蒼藍鴿值班結束了,https://www.ptt.cc/bbs/Gossiping/M.1613209534.A.98C.html,2021-02-13 17:45:32,,咱們這次的莎鴿事件當事人－－蒼藍鴿在新年這段期間，只能在醫院辛苦值班為大家的健康盡一份心力而剛剛本人ig限動表示年節值班結束了，要忙別的了～請問我們勇敢對抗莎莎的蒼藍鴿哥哥這次會有什麼新表示呢？可是莎莎自己都關影片留言、改標題惹鴿鴿是不是贏一半了？--,100
PTT,Re: [問卦] 蒼藍鴿值班結束了,https://www.ptt.cc/bbs/Gossiping/M.1613214829.A.5BF.html,2021-02-13 19:13:47,,認真說莎莎如果要止血就是現在。馬上。立刻。私訊蒼藍鴿道歉說自己年輕人太衝動了然後就說告一段落結論就是這樣等新聞上開始請物理老師毒物科醫師肝膽相關醫師出來真的你往後類似業配我看都沒辦法了何止黑?都黑黑黑了莎莎迷真心為她好就跟她說吧隔行如隔山更何況是醫療聰明人沒人會為這件跳出來為你擔保自己琢磨吧--豪！！莎莎應該拉不下臉除非真阿伯出事了就是老師都上新聞的時候人家又沒同台上尾牙,
PTT,[問卦] 蒼藍鴿上片了,https://www.ptt.cc/bbs/Gossiping/M.1613212439.A.FAA.html,2021-02-13 18:33:55,,風頭上的蒼藍鴿下班後還是有安排上片真的是有良心的優質優吐伯蒼藍鴿加油-----SentfromJPTTonmyiPhone--白虎老公屁股很性感--危險連結不要點危險連結不要點,54
PTT,Re: [問卦] 蒼藍鴿值班結束了,https://www.ptt.cc/bbs/Gossiping/M.1613217566.A.B52.html,2021-02-13 19:59:24,,我小弱弱沒讀書肥宅肝膽排石這麼神奇排出這麼大顆的結石在膽管最寬7mm擴張到11mm內算正常的狀況下隨便google肝膽排石法都跑出超大顆der怎麼排出那麼大的肝膽結石會不會絕頂升天啊--,
PTT,Re: [問卦] 蒼藍鴿值班結束了,https://www.ptt.cc/bbs/Gossiping/M.1613215721.A.6C2.html,2021-02-13 19:28:38,,魯蛇醫生粉可以到此為止了我十年愛莉莎莎粉我可以跟你們說這次錯的絕對不是我們家莎莎愛莉莎莎經營頻道這麼久了如果真的是她的錯早就出錯了不會等到現在才來讓人說她有所謂的錯誤既然她能開頻道到現在就表示她不可能有錯畢竟一個半路殺出來連聽都沒聽過的醫生他講的話會有比我們愛莉莎莎來得可信嗎台大醫科又怎麼樣有比清大人文學院強嗎所以醫生粉麻煩請你們主子不要再來蹭我們家莎莎了現在剛開頻道的youtuber都要用蹭的才會有人看嗎那應該要檢討自己頻道的內容正不正確跟吸不吸引人吧可以跟我們莎莎學習但不要蹭好嗎謝謝-----SentfromJPTTonmyiPhone----,
PTT,Re: [新聞] 請不要亂講話！愛莉莎莎過年開嗆蒼藍鴿,https://www.ptt.cc/bbs/Gossiping/M.1613212633.A.20C.html,2021-02-13 18:37:11,,沒路用欸查某郎～她把讚跟倒讚隱藏起來了，留言區也都關閉啦～這女人我從以前眼光就沒有看錯，真的是很討人厭，現在被專業打臉竟然還有臉硬拗，承認錯誤感覺像要了她命一樣--,6
PTT,[問卦] 看攝影背景 蒼藍鴿是不是輸了?,https://www.ptt.cc/bbs/Gossiping/M.1613222846.A.6D1.html,2021-02-13 21:27:24,,我們愛麗莎沙有千萬豪宅反觀蒼藍鴿背後連裝潢都沒有冷氣還是窗型的在清大面前醫科也只是學店而已蒼藍鴿是不是輸給千萬豪宅了阿?--,7
PTT,[新聞] 愛莉莎莎被醫療人員出征　反擊蒼藍鴿影,https://www.ptt.cc/bbs/Gossiping/M.1613219608.A.F3A.html,2021-02-13 20:33:26,,1.媒體來源:Ettoday新聞雲2.記者署名:李湘文3.完整新聞標題:愛莉莎莎被醫療人員出征反擊蒼藍鴿影片「標題悄悄改了」留言關閉4.完整新聞內文:記者李湘文／綜合報導YouTuber愛莉莎莎先前挑戰「，被台大兒科醫師「蒼藍鴿」批評是誤導觀眾，她。然而，她發表影片後，愛莉莎莎12日上傳標題為「」的影片，無奈表示這段時間不斷被罵，但並不打算因此道歉或移除原影片，因為自己在拍攝肝膽排石法之前，其實也做了不少功課。她強調，。不過，影片上傳後，仍有許多醫學領域網友對愛莉莎莎表示不認同、留言指責她影片內容仍有錯誤，其中一名自稱腎臟科醫師說：「拿Google的資訊來跟七年的醫學系攻讀對抗？我真的是沒看過比妳更可笑的了。」PTT上也出現不少批評聲音「亂宣導偏方真的危害不小」、「嗆專業醫師真的是誇張」網路上討論越來越熱烈，目前愛莉莎莎沒有對此回應，5.完整新聞連結(或短網址):6.備註:支持台灣濱邊美波—愛莉莎莎，對莎黑提告！--,72
PTT,Re: [問卦] 蒼藍鴿要是輸了 484代表醫生也沒多專業？,https://www.ptt.cc/bbs/Gossiping/M.1613218503.A.2FD.html,2021-02-13 20:15:02,,目前合理推斷感覺是一系列的業配操作當然，頭款可能都收完了但沒想到第一波就被蒼藍鴿出手重擊後續要不被解約，甚至要繼續賺這些錢自然而然就必須跟金主討論出套路於是硬著頭皮推出這波影片再搭配網軍洗地但沒想到錯誤百出，反而讓火燒得更大只能客觀地就現況說，要賺錢，還是要有點良心啊...合理推斷是生機食品相關產業的業配只是還沒到產品揭露這步，就GG惹...--,11
PTT,Re: [問卦] 看攝影背景 蒼藍鴿是不是輸了?,https://www.ptt.cc/bbs/Gossiping/M.1613223481.A.E4F.html,2021-02-13 21:37:59,,我蜜蜜子啦你胡說!!!!!從蒼藍鴿的拍片背景可以看到他有很幾個娃娃是個充滿童趣的男孩兒一定很善良而且被子都有摺得很整齊又是一個自律的好孩子!!!!!也難怪可以考上醫學系!!!!!決定了今年交男朋友一定要找一個像蒼藍鴿一樣既有童趣又自律的醫師大帥哥然後我就可以當30路醫生老公甲甲馬上變人生勝利組棒不棒!!!!!!!!!!!祝福我!!!!!!!!--白虎老公屁股很性感--人家本來就紅不要詛咒我,
PTT,Re: [新聞] 愛莉莎莎被醫療人員出征　反擊蒼藍鴿影,https://www.ptt.cc/bbs/Gossiping/M.1613223784.A.6E4.html,2021-02-13 21:43:02,,其實我覺得愛莉莎莎可以告說，想想打從出生的二十幾個年頭過去了，她就可以完成了一項創舉，考試制度有其鑑別力及存在的必要性。-----SentfromJPTTonmyGooglePixel2.--,
PTT,Re: [新聞] 愛莉莎莎被醫療人員出征　反擊蒼藍鴿影,https://www.ptt.cc/bbs/Gossiping/M.1613224141.A.EC3.html,2021-02-13 21:48:58,,有人跟我一樣好奇嗎？這類只信流傳方法的人像是感冒喝符水、燙傷抹牙膏、醬油分的出舍利子跟腎結石差別嗎？會不會對著腎結石，說是舍利子膜拜啊？--,2
PTT,Re: [問卦] 蒼藍鴿vs 愛莉莎莎拍片風格,https://www.ptt.cc/bbs/Gossiping/M.1613190215.A.67C.html,2021-02-13 12:23:32,,"因為這個議題涉及人民身體健康的公益，所以我還是選擇發聲一下。但這兩個人我都沒在追我先聲明一下。其實要說的也不多，就是凡事愛已經有提出一些說法了，也希望蒼可以用相同的標準來回應。畢竟兩邊都是讀書人，應該把戰場的格局拉高。一切都以(當然現在科學能力非常有限連古人斷食的奧秘都無法透徹就是另一回事了)如果最後流於謾罵且無法提出數據證明，是會被笑的。--如果你鑽研佛法、真理多年，卻只是了解文字表指意思的精隨所在，每個名詞跟意思都背的滾瓜爛熟，那麼你一定是一位偉大的，語文專家。by可爾.必思--清大文組跟台大醫學我認為兩邊都有資格稱為讀書人。那個算不算證據，就看個人的理解力囉~那你怎麼證明兩個人""現在""有沒有在讀書，所以囉，現在開始用科學研究說話。恩亨，所以哩?我說了用個人理解力去判斷它們所提出的證據有什麼問題?你在說的是""科學研究方法""，我們在講的是""他人引用這套結論""，我們是否信服。謝謝。不用急著吧自己知道的相關醫學知識拿出來跟大家講，因為根本篇無關。找到什麼等級的很重要沒錯阿，所以我說了阿，她選擇這科學研究的結果來說服我們，那我們信不信是我們的問題。這跟""科學研究方法""有什麼關係?有abcde，有人要a有人要b有人覺得c就可以了。這種問題每一個領域都有阿，尤其學者，都很喜歡用最aaaa級的標準檢視，然後都被實務界取笑活在烏托邦。你取樣標準，怎麼不是研究方法。",
PTT,Re: [問卦] 蒼藍鴿要是輸了 484代表醫生也沒多專業？,https://www.ptt.cc/bbs/Gossiping/M.1613225574.A.A46.html,2021-02-13 22:12:52,,是這樣啦小弟是蒼某的不忠實觀眾雖然或許沒有人注意到但我有一個問題就是蒼某的影片不是年初1/1就上架的嗎？為啥現在才在戰啊？是因為找文獻結果不小心找了一個半月嗎？啊都拖了快一個半月了，要蒼大大馬上拍片回應這是不是...怪怪的？？--大大你484一直狂貼這個連結...我好像看到好幾次了Q.Q國立成功大學資源工程學系博士不用謝了XD,2
PTT,[新聞] 愛莉莎莎不忍了！反擊蒼藍鴿再遭打臉「,https://www.ptt.cc/bbs/Gossiping/M.1613225574.A.6A5.html,2021-02-13 22:12:51,,愛莉莎莎不忍了！反擊蒼藍鴿再遭打臉「可能害死別人」三立新聞2021/02/1321:30娛樂中心陳又瑞報導人氣百萬YouTuber「愛莉莎莎」去年曾實測7日蔬果斷食法，同時又進行了傳說中的「肝膽排石法」，讓同是YouTuber的台大兒科醫師「蒼藍鴿」狠狠打臉「完全沒有科學根據」，不過愛莉莎莎12日再度反擊，強調自己事前有買書來看，書上有許多醫界、養生界大老推薦。但醫護組成的臉書粉專「MedPartner美的好朋友」再度打臉愛莉莎莎，直言該書跟推薦人的說法「在科學上是不堪一擊的」。愛莉莎莎發表影片「正式回應蒼藍鴿對我的各種指責」，澄清自己在進行肝膽排石法以前有做功課，還特地買了《神奇的肝膽排石法》來看，該書獲得許多醫界、養生界大老推薦；愛莉莎莎反批，蒼藍鴿用來反駁她的依據只是醫學期刊《刺胳針》上的一篇「讀者投書」公信力非常低，懷疑蒼藍鴿沒有好好看過自己引用的數據，也沒有好好看過《神奇的肝膽排石法》。不過美的好朋友指出，蒼藍鴿真的沒有亂講話，直言愛莉莎莎引用的書和推薦人的觀點「在科學上是不堪一擊的」，愛莉莎莎認為「讀者投書」沒公信力，但那並非阿貓阿狗就可以去投的，「不然這麼厲害你可以去投看看」；美的好朋友坦言，所謂的「肝膽排石法」絕對沒辦法排出膽結石，「無數的臨床醫師都可以告訴你」，否則醫學上就不用發展相關手術、科技夾石頭，而是喝果汁、喝油就好了。美的好朋友表示，雖然該書有許多大老推薦，但更重要的是「是否能在科學上被檢視」，強調「醫療人員不願民眾被偏方所誤，善意的提醒，希望網紅不要覺得這是被攻擊還是怎樣，修正自己的說法就好。」同時也建議愛莉莎莎可以和真正的專家對談。--,7
PTT,[問卦] 愛莉莎莎收入屌打蒼藍鴿吧,https://www.ptt.cc/bbs/Gossiping/M.1613190275.A.30C.html,2021-02-13 12:24:31,,之前忘了在哪看到，瑀熙的年薪超過500萬，而我們的台灣IU&台灣新垣結衣&台灣坂井泉水&台灣秀智&台灣潤娥&台灣周子瑜&台灣黑嘉嘉&台灣雪炫&台灣艾瑪華森&台灣奧黛麗赫本，頻道訂閱和影片點閱數都有瑀熙兩倍，收入應該是8位數起跳的，至於蒼藍鴿，過年還要值班，就一個駐院醫生，過年還要值班，年薪了不起300萬封頂了，連愛莉莎莎的車尾燈都看不到，蒼藍鴿這次就算專業上贏了，也只是符合大家對醫生的期待而已，而愛莉莎莎又收割了一大波流量，訂閱數應該可以一舉突破120萬，收入又要往上噴了，蒼藍鴿找愛莉莎莎開戰是不是贏了面子輸了裡子？-----SentfromJPTTonmySamsungSM-G9730.--→摘自《女神進化史》--,8
PTT,Re: [問卦]笑屎人，蒼藍鴿這個蹭熱度的被台灣IU打臉,https://www.ptt.cc/bbs/Gossiping/M.1613190880.A.9BE.html,2021-02-13 12:34:38,,主要的原因就是蒼蘭哥自以為自己是醫生艾莉莎莎只是網紅就跑去打人家臉結果沒想到艾莉莎莎是清大高材生直接就翻英文給你看告訴你蒼蘭哥連讀者投書都不知道就大放厥詞難怪就被打臉了所以說不要以為自己當醫生就什麼都懂書都不用看就說那個不對結果書裡面一堆數據實驗都不知道只能說現在像艾莉莎莎這樣的年輕人其實讀的書比以前當醫生的人還多很多因為很多新東西以前沒教然後最新的書不看就不知道了----呵呵事實不能說喔講不過艾莉莎莎被打臉不就自找的自己愛拍還怪別人反擊很無聊,
PTT,Re: [問卦] 針對蒼藍鴿事件我對愛莉莎莎改觀了~,https://www.ptt.cc/bbs/Gossiping/M.1613191084.A.133.html,2021-02-13 12:38:02,,愛力殺殺這次引用的證據如下：1.四個自然療法大咖力挺該書2.有一間診所醫生已經採用此法十餘年累積上千案例3.書中末端有對蒼藍哥們的質疑早就做出反駁了網路神酸的看法:1.那四個自然療法的大咖打得過台大醫科？2.引用的證據英文居然自己看錯，自打臉？3.清大文組就這樣？我們的看法：自然療法對少數人或許有用，不宜全面否定，但使用前宜謹慎，最好先取得主治醫師的專業建議。--,2
PTT,Re: [問卦] 蒼藍鴿要是輸了 484代表醫生也沒多專業？,https://www.ptt.cc/bbs/Gossiping/M.1613191310.A.86A.html,2021-02-13 12:41:47,,是啊你看看莎莎的影片縮圖不是針對蒼藍而是說：「醫生，請不要亂講話」直接把普通的造謠闢謠戰場放大成民間多年來的對立民智未開vs醫學專業這完全是價值觀的對立對莎莎而言就算贏了他也只是爽了一下但對沙粉來說這些人未來就真的不會信醫生了我建議各位醫科大大趕快出來護航拉不然又要再多一票一堆顧吃偏方到最嚴重了才來看醫生的年輕病患Qq----,14
PTT,[問卦] 愛莉莎莎和蒼藍鴿484在演一齣戲？,https://www.ptt.cc/bbs/Gossiping/M.1613191837.A.002.html,2021-02-13 12:50:35,,俗話說不打不相識早在蒼藍鴿拍第一部影片DISS時就已經有先聯絡愛莉莎莎本應該是兩條永不可能相交的平行線因為肝膽排石法而邂逅從那天起他們每晚都會通電話聊的都是LANCET(難怪愛莉莎莎對醫學期刊那麼了解)但可惜遲遲無法公開這段戀情因此他們策劃了一齣戲要愛莉莎莎再拍一部片作球回去我大膽預測蒼藍鴿拍的下部影片開頭是結石結尾收在結婚生子兩邊粉絲都在底下留言祝福請問我這樣的巫力有多少？--,1
PTT,Re: [問卦] 蒼藍鴿要是輸了 484代表醫生也沒多專業？,https://www.ptt.cc/bbs/Gossiping/M.1613196268.A.D18.html,2021-02-13 14:04:26,,原文43我只去清大開過研討會，原來清大有文學相關的區域喔，我很好奇啊，清大二類宅宅們都怎麼看待文組科系啊？覺得妹子很香還是鄙視呢？@@-----SentfromJPTTonmyiPhone--,1
PTT,Re: [問卦] 蒼藍鴿要是輸了 484代表醫生也沒多專業？,https://www.ptt.cc/bbs/Gossiping/M.1613196223.A.134.html,2021-02-13 14:03:41,,就好像那上課沒說過幾句話的同學，畢業後好像多年沒見的朋友，結果聊半天在做直銷，只記得他經典行銷話術說“你什麼會相信醫生”乾！我不信醫生聽你野雞大學的來騙我錢喔--,
PTT,Re: [問卦] 蒼藍鴿要是輸了 484代表醫生也沒多專業？,https://www.ptt.cc/bbs/Gossiping/M.1613192657.A.471.html,2021-02-13 13:04:15,,個人建議兩邊為了和諧，就不要爭對錯了，大家關起門來摸摸自己良心，堅持相信醫生立場的人以後有事就看醫生，堅持相信莎莎立場的人以後有事就看莎莎。對不對？根本沒什麼好吵的，說什麼有人因為學歷不夠，所以自卑的必須讓自身的立場跟學歷相對低的那邊站同一線那種傷人的話就不要說了……大家各自貫徹到底，不好嗎？--,4
