ettoday,運鏡配樂都超強！「YouTuber清流」鄉民一致點名他：最後的淨土,https://www.ettoday.net/news/20211115/2123992.htm,2021-11-15 11:38,台灣YouTuber如雨後春筍般冒出，若有負評或是負面舉動，可能都會失去觀眾。就有網友好奇詢問，YouTuber越來越多，現在的清流是誰呢？貼文一出，立刻引發熱烈討論，就有不少網友紛紛點名這位「台灣阿北」，直呼他是YT界的「最後淨土」。(生活 / 2021-11-15 11:38),,0
ettoday,Toyz販毒羈押「統神先知粉絲」預言瘋傳 一句神回應已備好,https://www.ettoday.net/news/20210930/2090365.htm,2021-09-30 07:23,《英雄聯盟》S2世界冠軍、前電競選手Toyz劉偉健，爆出涉嫌販賣二級毒品大麻被羈押，讓許多人震驚。有網友挖出他的對頭、同事實況主的「亞洲統神」張嘉航7月時跟一位香港粉絲的對話，其中一句「因為Toyz這種低劣的人品，他將來一定會發生事情的嘛！」對照如今的狀況，被許多人奉為神預言。(生活 / 2021-09-30 07:23),,0
ettoday,統神：國動不是故意的！ 普悠瑪事件「是下意識的失言」,https://www.ettoday.net/news/20181027/1291799.htm,2018-10-27 17:25,電玩實況主「亞洲統神」的親哥哥國動日前開台，失控嗆普悠瑪受害者「都死好、都活該」引發眾怒，23日公開道歉，坦承是遊戲中累積太多負面情緒，一時失控才說錯話。統神在記者會後開台談起這件事，認為國動真的該改改個性，但也替對方澄清「他不是故意的」。(影劇 / 2018-10-27 17:25),,0
ettoday,影／怒噴！飆重機上國道「他X的」 亞洲統神：一般機車也要可以上,https://www.ettoday.net/news/20180730/1223443.htm,2018-07-30 13:07,知名實況主「亞洲統神」張嘉航日前談起重機上國道話題，直言台灣太鄉愿了，重機不管從外觀或操作方式來看都只是機車，政府如果要開放就該平等，只要能達到國道最低速限，就該享有相同的權益，「為什麼你重機可以，我一般機車不行？」(生活 / 2018-07-30 13:07),,0
ettoday,國動阿嘿顏曝光新設計產品 「 雪乳X野外解禁感謝祭」粉絲快暴走,https://www.ettoday.net/news/20211217/2148738.htm,2021-12-17 16:41,電競不死鳥統神哥哥國動以極其幽默的實況風格深受粉絲喜愛，尤其他時常雪乳外放、胴體閃爍更創造出「穿衣服就暴動」等等名言。而前陣子瘋狗娛樂應聘全新產品設計，交出來的第一件產品就是「粉絲感謝祭浴巾」，上面的圖案讓國動氣到大喊，「484想被炒掉啊！」 (遊戲 / 2021-12-17 16:41),,0
ettoday,獨／墊底保證統神參戰LOL實況主挑戰賽？官方給回應曝「實際彩蛋」,https://www.ettoday.net/news/20211216/2147703.htm,2021-12-16 14:20,《英雄聯盟》台服年度盛事實況主挑戰賽競爭激烈，從3日開打後戰況激烈，目前由RB、冠緯兩兄弟高居大師甩開其他實況主，而丁特目前居於末位。但就有眼尖觀眾發現，宣稱要照顧小孩、無法參賽的亞洲慈父統神卻悄悄出現在名單上，對此官方則解釋僅列入社群排名增添「可看性」，不會影響實際挑戰賽。(遊戲 / 2021-12-16 14:20),,0
ettoday,史丹利曬「統神合照」隨衰捲實況主挑戰賽爭議 網驚：下個是誰？,https://www.ettoday.net/news/20211215/2146836.htm,2021-12-15 14:48,聖主史丹利除了日前下定決定化身瘦叔叔開設IG後人氣蒸蒸日上，更加入實況主挑戰賽。但近日PTT上卻質疑史丹利抱別人大腿才能上分，引起社群熱議。而就在爭議爆發之前，他才曝光與「電競不死鳥」統神的合照，讓網友驚訝狂喊，「下一個會是誰？」 (遊戲 / 2021-12-15 14:48),,0
ettoday,統神曝光不打挑戰賽原因…第一句話點出關鍵 網狂讚：亞洲慈父,https://www.ettoday.net/news/20211213/2145026.htm,2021-12-13 12:32,《英雄聯盟》實況主積分賽熱烈開打，截至13日由RB宗師霸榜，最末端則為丁特。而在這次因為沒有亞洲統神的加入，讓戰況變得十分膠著、難以預測。對此，就有網友在開台時詢問統神不參加的原因，答案出爐後讓許多統粉直接在聊天室狂刷，「亞洲慈父是你！」(遊戲 / 2021-12-13 12:32),,0
ettoday,緯寶最驕傲一天！冠緯《LOL》三天爬上大師…緯寶狂喊：太水了啦,https://www.ettoday.net/news/20211208/2140976.htm,2021-12-08 10:15,《英雄聯盟》年度盛事「實況主積分賽」火熱開打，為了15萬獎金以及看台人數，大部分參賽者都卯足全力爬分，而今年加入戰爭的冠緯、RB雖然慘遇掛網仔，但比賽僅過三天冠緯就立刻爬上大師，爆肝式打法讓緯寶狂喊，「詹立委太神啦！但記得去休息阿～」 (遊戲 / 2021-12-08 10:15),,0
ettoday,9Q扯進RB版權砲事件…開台被問「暈船沒？」 超高級自臭網友狂讚,https://www.ettoday.net/news/20211207/2140153.htm,2021-12-07 09:07,繼Toyz、統神「賴皮豬」大戰版權砲後，實況主在直播時究竟能否出現別人照片、姓名受到議論，近日凱琪娛樂旗下實況主RB也遭開砲，引起老闆凱琪開台直言「一男一女寄信給我」，而被網友推測出來的男生睪慶「9QOQ」在昨6日開台時就引發網友逼問，再加上一起玩遊戲的夥伴也表示，「這剪精華可以用吧？」(遊戲 / 2021-12-07 09:07),,0
ettoday,兄弟球星加持！ 中信特攻開幕週票房開紅盤進帳425萬,https://www.ettoday.net/news/20211206/2140066.htm,2021-12-06 19:44,T1聯盟新北中信特攻12月4日、5日主場開幕週，2天一共吸引10955人進場，票房開出紅盤，主場門票及官方商品收入分別是350萬以及75萬，雖然PLG聯盟台北富邦勇士主場開幕週票房兩日主場門票及官方商品收入為806萬和143萬，但事實上，雙方票房差距不大，收入差異主要原因在於票價，以及中信特攻球團做出購票優惠。 (體育 / 2021-12-06 19:44),,0
ettoday,做效果！中信特攻開幕統神遇爆胎 做地板看球網笑：拒跟椅子接觸,https://www.ettoday.net/news/20211204/2138757.htm,2021-12-04 18:59,新北中信特攻籃球隊今4日主場開幕戰，邀請「亞洲統神」張嘉航擔任反毒嘉賓，以反毒嘉賓身份簽下第一張連署小卡，雖然他因「汽車爆胎」遲到了，但來到球場後，效果做好做滿，還霸氣開噴洋將，「笑」果十足。 (體育 / 2021-12-04 18:59),,0
ettoday,中信特攻開幕戰門票完售 亞洲統神、熊仔力挺助陣,https://www.ettoday.net/news/20211202/2137399.htm,2021-12-02 19:57,新北中信特攻籃球隊主場開幕周，即將在新莊體育館熱鬧揭開序幕，12月4日隊史首役與台灣啤酒英熊交手，5日繼續迎戰高雄全家海神，在各方球迷熱烈支持下，4日開幕戰門票已全數售罄。球團也公布將邀請「亞洲統神」張嘉航擔任反毒嘉賓，另外嘻哈歌手熊仔也將於開幕戰熱唱。(體育 / 2021-12-02 19:57),,0
ettoday,統神「點名2人」要小心！開直播預告：Toyz出來了，隨時會爆料,https://www.ettoday.net/news/20211201/2136408.htm,2021-12-01 19:45,前世界冠軍、實況主Toyz劉偉建涉嫌販售大麻煙彈被捕，日前被裁定150萬元交保，出來後馬上又進了台中戒治所。對此，實況主統神點名2人「要小心」，等到Toyz出來，隨時可能會爆料。(電競 / 2021-12-01 19:45),,0
ettoday,養眼畫面慎入！男實況主生日開泳裝台 網：蹦蛙員工辛酸畫面流出,https://www.ettoday.net/news/20211129/2134432.htm,2021-11-29 15:31,自Amouranth帶起實況界泳裝台（Hot Tub）後，許多女實況主都會選在特別節日像是生日、聖誕節、萬聖節等等開啟泳裝台，來慶祝這非凡的一天。但你以為只有女實況主才有泳裝台的資格嗎？前蹦蛙員工順家，也是Twitch實況主的順家，在近日就化身蘆洲辣妹，在生日開啟泡澡台。(遊戲 / 2021-11-29 15:31),,0
ettoday,本土最知名兄弟組合？PTT秒點名「這2對」：主宰兩個時代,https://www.ettoday.net/news/20211128/2133682.htm,2021-11-28 12:53,有網友日前在PTT的Gossiping板上發文，文中表示「兄弟、哥哥和弟弟，有可能是雙胞胎，也有可能年紀差異大，但是基本上是一家人，性格和體型也應該差不多」問卦道「台灣最知名的親生『兄弟』組合是誰？」話題引發熱論，其中最多人提到同姓的2對兄弟檔，笑呼「分別主宰兩個時代。」(生活 / 2021-11-28 12:53),,0
ettoday,元宇宙商機大爆發 鴻海旗下工業富聯Wi-Fi 6設備出貨逾3000萬套,https://www.ettoday.net/news/20211123/2129993.htm,2021-11-23 13:50,在元宇宙、5G、AI人工智慧的各種延伸服務帶動下，全球數據總量也呈現幾何式增長，大數據猛爆積累的背後，正隱藏著點燃全球新能源車和元宇宙商機的關鍵 - 算力(Computing Power)商機。為了滿足各國大幅佈建聯網基礎需求，鴻海集團（2317）旗下工業富聯Wi-Fi 6相關設備出貨已超過3000萬套。(財經 / 2021-11-23 13:50),,0
ettoday,運鏡配樂都超強！「YouTuber清流」鄉民一致點名他：最後的淨土,https://www.ettoday.net/news/20211115/2123992.htm,2021-11-15 11:38,台灣YouTuber如雨後春筍般冒出，若有負評或是負面舉動，可能都會失去觀眾。就有網友好奇詢問，YouTuber越來越多，現在的清流是誰呢？貼文一出，立刻引發熱烈討論，就有不少網友紛紛點名這位「台灣阿北」，直呼他是YT界的「最後淨土」。(生活 / 2021-11-15 11:38),,0
ettoday,蕾菈穿深V「胸太垂該隆乳嗎」認困擾3年 酷炫一聽台下反應：喜歡垂,https://www.ettoday.net/news/20211113/2123271.htm,2021-11-13 21:36,百萬YouTuber「WACKYBOYS反骨男孩」今（13日）擔任第3屆走鐘獎頒獎人，孫生登台演唱一段饒舌，不過有幾段沒對到音樂，酷炫笑虧：「孫生啊！你要不要回來頒獎，不愧是YT界的表演王，能把正式當彩排。」(影劇 / 2021-11-13 21:36),,0
ettoday,1年前「親統神」片段被挖出批評！ 蕾菈傻眼嗆：你們慢慢鞭，無聊,https://www.ettoday.net/news/20211113/2122798.htm,2021-11-13 00:20,YouTuber團體「反骨男孩」成員蕾菈（Lyla）近日因為有網友挖出她去年與統神同台直播時，當眾親吻對方臉頰的影片，不過由於統神已婚，而她目前也有男友，此舉因而遭到批評，對此，她在個人Instagram做出回應表示「你們慢慢鞭，我覺得挺無聊的」。 (影劇 / 2021-11-13 00:20),,0
ettoday,被蕾菈親臉頰不為所動！ 統神1年前13秒片被讚爆：真男人啊,https://www.ettoday.net/news/20211111/2122017.htm,2021-11-11 23:49,YouTuber蕾菈（Lyla）是「反骨男孩」成員之一，擁有中東混血基因，已經是一個孩子的媽了，依然擁有火辣身材，加上自然、不做作的個性，使她成為不少人心目中的女神。近日，有網友翻出她先前跟電競實況主「統神」合作時的影片，驚訝統神被她親了卻無動於衷，直呼「一般男生早受不了，引發一陣熱烈討論。 (影劇 / 2021-11-11 23:49),,0
ettoday,接敵隊活動惹怒球團！ 陳芳語「還原真相」：表演前都達成共識,https://www.ettoday.net/news/20211108/2119082.htm,2021-11-08 12:55,歌手陳芳語日前接下職棒樂天桃猿隊「環球阿迷趴」活動的同時，又擔任富邦悍將隊的開球嘉賓，由於她分別現身敵對陣營助陣，讓業界人士認為她此舉「沒sense」，引起熱烈討論，對此，陳芳語經紀人也做出回應。 (影劇 / 2021-11-08 12:55),,0
ettoday,法蘭自爆「雙重人格」 掀金馬上台領獎恐怖內幕！,https://www.ettoday.net/news/20211108/2119065.htm,2021-11-08 12:41,Fran法蘭去年以《親愛的房客》獲得第57屆金馬獎最佳電影原創音樂，近來推出個人EP《另一個法蘭 Another Soul》，其中將《浪人情歌》、《親密愛人》、《我要我們在一起》和《女人花》4首90年代經典歌曲，重新演繹成法蘭式的摩登新復古，同時她也宣布首場新專輯演唱會將於12月4日在台北Legacy登場。 (影劇 / 2021-11-08 12:41),,0
ettoday,ASTRO幕後推手認想出道！ 羨慕炎亞綸「全方位發展」,https://www.ettoday.net/news/20211107/2118643.htm,2021-11-07 18:15,炎亞綸「IconiA」網路節目繼邀請韓國、泰國人氣明星外，這次請來韓國大師級製作人OBROS作客，他開頭就先逗趣公開年紀，又爆料最大夢想是當歌手，想要像炎亞綸一樣以全方位藝人發展，所以又學音樂又學舞蹈，但因韓國音樂市場競爭強，笑說：「因顏值受限所以只好轉由幫高顏值的歌手來製作音樂，也算是圓了半個夢想。」 (影劇 / 2021-11-07 18:15),,0
ettoday,被頒錯獎座飛了！ ØZI沈寂1天鬆口「的確很尬」：大家應該都傻了,https://www.ettoday.net/news/20211107/2118626.htm,2021-11-07 17:48,金音獎昨晚（6日）頒獎時發生嚴重失誤，錯頒最佳創作歌手獎給ØZI，ØZI還開心地上台領獎，甚至講完整段得獎感言，事後主持人才緊急宣布其實得獎者是YELLOW黃宣，場面相當尷尬，也引來大批網友痛批主辦單位相當不尊重人，沉寂一天後，ØZI也曬出合照，發長文回應此風波。 (影劇 / 2021-11-07 17:48),,0
ettoday,韋禮安遠距女友3個月嘆：辛苦！ 羞認街頭擁吻「熱情的表現」,https://www.ettoday.net/news/20211107/2118612.htm,2021-11-07 17:26,韋禮安為奇幻愛情電影《月老》打造的主題曲《如果可以》，今（7日）舉辦MV首映會，談到入圍金馬原創歌曲獎，人在大陸的他開心直呼：「一輩子沒想過會入圍金馬獎，謝謝神隊友幫忙。」但遺憾透露，雖然準備要返台，不過加上隔離時間，無法親自參與頒獎典禮。 (影劇 / 2021-11-07 17:26),,0
ettoday,新生代樂團憂粉絲「不買單新歌」 賭氣放話：下架舊版！,https://www.ettoday.net/news/20211107/2118595.htm,2021-11-07 17:00,新生代樂團綠繡眼日前發行首張創作EP《願溫柔的你》，邀請Crispy脆樂團擔綱製作人、理想混蛋雞丁合作演唱，綠繡眼主唱漢評幾年前在校園創作比賽和雞丁相識，當時他們都處於創作萌芽的時期，並且同樣對音樂生涯感到迷惘，因而造就了合作的契機，一起寫出《說夢人》，不僅用來鼓勵自己，也鼓勵追夢的人們堅持理想。 (影劇 / 2021-11-07 17:00),,0
ettoday,統神大聊老蕭、Toyz！「合體李芷婷」一唱歌網笑噴：阿咪太難了,https://www.ettoday.net/news/20211104/2116315.htm,2021-11-04 12:23,人氣歌手李芷婷經常在直播平台「Twitch」開唱歌台，除了自己唱，也曾邀請許多來賓，3日晚間則是合體「亞洲統神」張嘉航，超奇妙的組合讓網友笑噴。統神除了大秀歌喉，直播中也聊到蕭敬騰和Toyz的事件，更自我調侃、警告李芷婷「欸妳要小心一點耶！他們（粉絲）說，只要跟我同台過的都有危險欸！」(生活 / 2021-11-04 12:23),,0
ettoday,「饒舌界周興哲」遭霸凌關廁所 崩潰大哭「帶刀上學」自保！,https://www.ettoday.net/news/20211103/2115938.htm,2021-11-03 18:27,新人李杰明今（3日）舉辦發片記者會，他因神似周興哲，而被網友封為「饒舌界周興哲」，他坦言小時候因為個性害羞講話其實會結巴，因為聽了阿姆Eminem的音樂開啟他的饒舌路，甚至還因為練饒舌克服原本講話結巴的問題，他表示：「會練成可能是跟情緒有關，情緒越激昂亢奮，才能越念越快，也因為這樣，唸完有一種抒發感，不開心地、不爽的念頭都會消失。」 (影劇 / 2021-11-03 18:27),,0
ettoday,光良被誤解「難搞」 前老闆曝他「私下真面目」！,https://www.ettoday.net/news/20211103/2115887.htm,2021-11-03 17:27,大馬情歌唱作王光良近來趁著排練音樂劇空檔，作客田定豐的podcast節目，田定豐特別擺上馬來西亞味的蔬食餐，讓因疫情2年沒回家鄉的光良一解鄉愁，2人過去因為音樂上的合作，培養出快20年的好交情，彼此在節目上也談起人生要如何才能平衡好自由與自制。 (影劇 / 2021-11-03 17:27),,0
ettoday,金曲歌王蛋堡公園免費開唱！ 同場還有鄉民女神...超強卡司曝光,https://www.ettoday.net/news/20211103/2115818.htm,2021-11-03 16:40,「2021臺北爵士音樂節」自11月27日起連續三個週末，分別在天母忠誠公園、臺北流行音樂中心南基地戶外廣場及大安森林公園音樂台演出，並邀請金曲歌王蛋堡、金曲最佳新人?te壞特、Julia吳卓源、金曲最佳專輯得主門田英司接力演出。 (影劇 / 2021-11-03 16:40),,0
ettoday,蔡依林「高衩一路開到臀」 深夜突辣洩蜜腿根...網全暴動！,https://www.ettoday.net/news/20211103/2115527.htm,2021-11-03 11:57,天后Jolin蔡依林聯手全球百大DJ Steve Aoki及美國流行歌手MAX的新歌《Equal In The Darkness》MV今晨上線，Jolin在MV中換穿2套結合剛與柔元素的造型，其中一套深V西裝外套剪裁的高叉連身衣，點綴浪漫粉紅紗，大洩胯骨腿根，展露她性感修長好身材，讓原本要趕飛機的導演拍到欲罷不能，全力補捉Jolin的姿態，直到最後一刻才甘願喊卡。 (影劇 / 2021-11-03 11:57),,0
ettoday,韋禮安入圍金馬獎藏玄機！ 錄音遇「靈異事件」爆好兆頭,https://www.ettoday.net/news/20211102/2115187.htm,2021-11-02 22:17,韋禮安近來為電影《月老》演唱主題曲《如果可以》，一舉入圍本屆金馬獎最佳原創電影歌曲，只是這首歌連韋禮安都忍不住大嘆：「很難唱。」他笑說：「在寫的時候，我就覺得這首歌出來後，一定很多人會覺得怎麼那麼難唱，連我自己在練的時候都覺得『天啊，也太難唱了吧！』」 (影劇 / 2021-11-02 22:17),,0
ettoday,「星國言承旭」私密閨房曝光！ 起床素顏樣全都露,https://www.ettoday.net/news/20211102/2115160.htm,2021-11-02 21:03,被媒體封為「星國言承旭」的新加坡歌手李俊緯，推出新歌《I Don't Wanna Be This Way》MV，人在新加坡的李俊緯，面臨當地疫情升溫，大家都只能在家工作，所幸直接將MV場景設定在自己家，將WFH的實況變成MV，原汁原味的還原自己的居家工作場景，盼透過這首歌，除了鼓勵聽眾，同時自我省思。 (影劇 / 2021-11-02 21:03),,0
ettoday,施孝榮半年0收入「想跑外送」：就是慘 曝打疫苗痛苦2個多月！,https://www.ettoday.net/news/20211102/2115149.htm,2021-11-02 20:32,「民歌高峰會」明年1月1日將攻蛋開唱，今（2日）記者會上，施孝榮領軍鄭怡、陳艾湄、周子寒、周治平、李明德、王瑞瑜、金智娟、邰肇玫、殷正洋、鄭怡、葉佳修等歌手齊聚一堂，現場彈奏吉他演唱《如果》與《讓我們看雲去》，談到三級警戒時期，施孝榮大嘆：「怎是一個慘字了得，就是慘，大環境就是這樣，半年沒有工作、收入，想送外送人家可能也不要，速度太慢。」 (影劇 / 2021-11-02 20:32),,0
ettoday,孟澔1歲兒已12公斤被虧「巨嬰」 當人肉啞鈴：怕他變哈孝遠！,https://www.ettoday.net/news/20211102/2115139.htm,2021-11-02 20:08,孟澔近來受邀擔任保養大使，談到疫情期間在家當全職奶爸，他直說很有成就感，尤其兒子1歲3個月體重已重達12公斤，「我總喜歡抱著兒子做運動，等於扛著12公斤重的人體啞鈴，讓我的身材不走樣。」孟澔並開玩笑的說：「兒子好壯壯，被好友們暱稱巨嬰，讓我好擔心兒子會變成哈孝遠啦！」 (影劇 / 2021-11-02 20:08),,0
ettoday,爆和大9歲歐弟前妻戀愛ing 陳昊森公司發聲：他已經是大人了,https://www.ettoday.net/news/20211102/2115072.htm,2021-11-02 18:06,42歲藝人「歐弟」歐漢聲2014年和小8歲中國女友鄭雲燦結婚，婚後小倆口育有2女，不過卻在今年8月宣布離婚，結束7年婚姻關係，震驚演藝圈，如今3個月過去，歐弟前妻鄭雲燦被週刊拍到有了新歡，而對象正是《刻在我心底的名字》的25歲鮮肉男星陳昊森，對此，陳昊森的公司也做出回應。 (影劇 / 2021-11-02 18:06),,0
ettoday,女歌手自曝罹乳癌1年！ 「噩耗像原子彈炸開」痛哭：一切沒意義,https://www.ettoday.net/news/20211102/2115051.htm,2021-11-02 17:41,蘇珮卿推出新歌《This Is Trouble》，昨晚（1日）開直播時，意外吐露2019年底確診罹患乳癌，當時還在跑林宥嘉idol巡迴演唱會的她，曾邊工作邊痛哭，時值新冠疫情蔓延停工，讓她正視對抗癌細胞一事，歷經1年的治療，抗癌成功，將剛確診的恐慌心路歷程堆疊成新歌，她也提及：「壞消息像顆原子彈般炸開，那一瞬間，工作、旅行、夢想，一切變得毫無意義，沒有選擇餘地，唯有用盡一切站上戰場，浴火重生後，更懂生命可貴。」 (影劇 / 2021-11-02 17:41),,0
ettoday,蘇慧倫公園免費開唱！ 揪宇宙人、家家、蕭秉治接力演出,https://www.ettoday.net/news/20211102/2115007.htm,2021-11-02 17:00,蘇慧倫、鼓鼓呂思緯、蕭秉治、宇宙人、家家、魏嘉瑩27日將攜手在「謝謝你做好事We Together」演唱會開唱，地點在大安森林公園露天音樂台，蘇慧倫開心說：「之前經過好多次大安森林公園的露天音樂台，都有想像過在那裡演唱會是什麼感覺？這次終於有機會可以在公園裡面唱歌給大家聽。」 (影劇 / 2021-11-02 17:00),,0
ettoday,品冠看《魷魚》以為自己中彈！ 遠端遙控兒女練琴...甜喊話老婆1句話,https://www.ettoday.net/news/20211102/2114810.htm,2021-11-02 14:10,品冠近來飛上海隔離結束，談到最想念的家人，他表示自己定期與一雙兒女視訊聊天，周末更是撥出時間一起在線上玩遊戲，甚至緊盯小孩作業、遠端遙控他們練琴，他也向這陣子得母兼父職的老婆喊話：「辛苦了！」希望能儘快完成工作，趕在農曆年前陪伴心愛的家人。 (影劇 / 2021-11-02 14:10),,0
ettoday,頂級特斯拉求出售！ 「1特色」網友秒認出：是Toyz的,https://www.ettoday.net/news/20211101/2114385.htm,2021-11-01 22:31,電競《英雄聯盟》前世界冠軍Toyz（劉偉健）身陷販毒風波，而有眼尖的網友發現，在二手車社團驚見疑似Toyz的特斯拉求出售，引發網友熱議，「就Toyz那台啊」「超好認 100p車也不多 。」 (ET車雲 / 2021-11-01 22:31),,0
ettoday,吳建豪炸翻《街舞4》總決賽！  宣布「雙喜臨門」：很開心,https://www.ettoday.net/news/20211101/2114363.htm,2021-11-01 21:26,吳建豪曾是《這就是街舞》第二季的明星隊長，他在節目中以強大的舞蹈功底和豐富的舞種駕馭能力，不僅獲得無數觀眾的認可，也影響了很多街舞選手和街舞愛好者，日前《街舞4》總決賽，吳建豪作為第二季隊長回歸，他身穿牛仔外套亮相，與曾經是「吳俠聯盟」的過往隊員，一起上演一場力與美完美結合的舞蹈秀。 (影劇 / 2021-11-01 21:26),,0
ettoday,樂團解散變「內衣大亨」！ 隔15年再出輯：當白紙重新來過,https://www.ettoday.net/news/20211101/2114350.htm,2021-11-01 20:59,成軍21年的搖滾樂團SOWHAT樂團，睽違15年將推出新專輯《回到這裡》，從小鮮肉變成大叔的他們，隨著人生閱歷的增長，不擔心年紀成問題，直言：「年輕時候玩樂團會很擔心未來，現在大家心態都變成熟了，可以好好溝通，融合了五種人生的SOWHAT，說我們想說的故事，做想做的事情與音樂，或許不是最厲害的樂團，但會是最有故事的樂團，不用再擔心未來，會一直走下去！」 (影劇 / 2021-11-01 20:59),,0
ettoday,驚見「蔡依林」現身台下！ 文青歌手秒唱跳《舞孃》全場嗨爆,https://www.ettoday.net/news/20211101/2114202.htm,2021-11-01 17:08,創作歌手「小魏」魏嘉瑩日前在華山Legacy舉辦2場新專輯首唱會，現場有小粉絲因為萬聖節打扮成蔡依林的模樣，閃亮的裝扮讓在台上的小魏一眼認出，直接就來了一段《舞孃》、《倒帶》，超違和演出，也讓現場尖叫聲不斷，大呼賺到。 (影劇 / 2021-11-01 17:08),,0
ettoday,梁靜茹宣佈雄蛋演唱會重啟！ 認了怕被遺忘「冒恐慌症狀」,https://www.ettoday.net/news/20211101/2114042.htm,2021-11-01 14:31,梁靜茹「202020當我們談論愛情」世界巡迴演唱會高雄站，原訂6月12在高雄巨蛋舉行，開賣5分鐘門票迅速秒殺，卻因全台疫情升三級警戒不得已延期，如今疫情趨緩，主辦單位超級圓頂也宣布演唱會確定在2022年2月26日舉行，門票也將於11月21日重新啟售。 (影劇 / 2021-11-01 14:31),,0
