ettoday,嗆警低能「統神」張嘉航FB道歉 網友：你爸代PO的嗎？,https://www.ettoday.net/news/20140301/330000.htm,2014-03-01 17:01,線上遊戲人氣玩家、「亞洲統神」張嘉航日前公然嗆警察「低能」，1日他在臉書PO出道歉聲明，並表示台中警察都是最棒的，治安也是「很好很和善」，「辱罵一事是因為個人行為上的不當，請大眾切勿模仿。」(社會 / 2014-03-01 17:01),,0
ettoday,RRRRR～統神被告請病假 照打電動太神啦,https://www.ettoday.net/news/20140226/329039.htm,2014-02-26 12:32,「亞洲統神」張嘉航靠著網路實況自己打電玩《英雄聯盟》(LOL)的過程，每月賺進大把鈔票，收入是22K的好幾倍。但他有話直說的個性卻也惹來麻煩，統神因罵人被網友控告妨害名譽，台中市警局刑警大隊科偵組25日下午通知他到案說明，但統神本人未現身，僅由統爸出面請假，並請現場守候的粉絲離去。 (地方 / 2014-02-26 12:32),,0
ettoday,英雄聯盟打到一半......正妹自己脫光了：快來撲倒我,https://www.ettoday.net/news/20131120/298351.htm,2013-11-20 13:01,「北鼻，快來撲倒我喔」正妹大魚的性感誘惑，竟然是英雄聯盟玩家最不想遇到的事情，這其中到底有甚麼誤會？還好，這只是「頑GAME」設計的影片橋段，並不是全天下男人都會這樣打電動打到對女友的誘惑不理不睬啦。 (生活 / 2013-11-20 13:01),,0
ettoday,英雄聯盟女玩家「枸杞子」打輸美眉 狂罵X你娘挨告,https://www.ettoday.net/news/20130523/211629.htm,2013-05-23 12:43,女版統神！新北市一名自稱「枸杞子」的女子，14日中午玩網路遊戲《英雄聯盟》打輸，怒嗆敵對陣營一名女性玩家「腦弱是不是啦？」、「妳是那種利用PTT純情鄉民的濫女人！」被罵的女玩家不甘受辱提告，警方看完影片後也十分吃驚，表示從沒見過玩電動玩到這麼激動的女人。(社會 / 2013-05-23 12:43),,0
ettoday,兄弟球星加持！ 中信特攻開幕週票房開紅盤進帳425萬,https://www.ettoday.net/news/20211206/2140066.htm,2021-12-06 19:44,T1聯盟新北中信特攻12月4日、5日主場開幕週，2天一共吸引10955人進場，票房開出紅盤，主場門票及官方商品收入分別是350萬以及75萬，雖然PLG聯盟台北富邦勇士主場開幕週票房兩日主場門票及官方商品收入為806萬和143萬，但事實上，雙方票房差距不大，收入差異主要原因在於票價，以及中信特攻球團做出購票優惠。 (體育 / 2021-12-06 19:44),,0
ettoday,做效果！中信特攻開幕統神遇爆胎 做地板看球網笑：拒跟椅子接觸,https://www.ettoday.net/news/20211204/2138757.htm,2021-12-04 18:59,新北中信特攻籃球隊今4日主場開幕戰，邀請「亞洲統神」張嘉航擔任反毒嘉賓，以反毒嘉賓身份簽下第一張連署小卡，雖然他因「汽車爆胎」遲到了，但來到球場後，效果做好做滿，還霸氣開噴洋將，「笑」果十足。 (體育 / 2021-12-04 18:59),,0
ettoday,中信特攻開幕戰門票完售 亞洲統神、熊仔力挺助陣,https://www.ettoday.net/news/20211202/2137399.htm,2021-12-02 19:57,新北中信特攻籃球隊主場開幕周，即將在新莊體育館熱鬧揭開序幕，12月4日隊史首役與台灣啤酒英熊交手，5日繼續迎戰高雄全家海神，在各方球迷熱烈支持下，4日開幕戰門票已全數售罄。球團也公布將邀請「亞洲統神」張嘉航擔任反毒嘉賓，另外嘻哈歌手熊仔也將於開幕戰熱唱。(體育 / 2021-12-02 19:57),,0
ettoday,統神「點名2人」要小心！開直播預告：Toyz出來了，隨時會爆料,https://www.ettoday.net/news/20211201/2136408.htm,2021-12-01 19:45,前世界冠軍、實況主Toyz劉偉建涉嫌販售大麻煙彈被捕，日前被裁定150萬元交保，出來後馬上又進了台中戒治所。對此，實況主統神點名2人「要小心」，等到Toyz出來，隨時可能會爆料。(電競 / 2021-12-01 19:45),,0
ettoday,本土最知名兄弟組合？PTT秒點名「這2對」：主宰兩個時代,https://www.ettoday.net/news/20211128/2133682.htm,2021-11-28 12:53,有網友日前在PTT的Gossiping板上發文，文中表示「兄弟、哥哥和弟弟，有可能是雙胞胎，也有可能年紀差異大，但是基本上是一家人，性格和體型也應該差不多」問卦道「台灣最知名的親生『兄弟』組合是誰？」話題引發熱論，其中最多人提到同姓的2對兄弟檔，笑呼「分別主宰兩個時代。」(生活 / 2021-11-28 12:53),,0
ettoday,統神大聊老蕭、Toyz！「合體李芷婷」一唱歌網笑噴：阿咪太難了,https://www.ettoday.net/news/20211104/2116315.htm,2021-11-04 12:23,人氣歌手李芷婷經常在直播平台「Twitch」開唱歌台，除了自己唱，也曾邀請許多來賓，3日晚間則是合體「亞洲統神」張嘉航，超奇妙的組合讓網友笑噴。統神除了大秀歌喉，直播中也聊到蕭敬騰和Toyz的事件，更自我調侃、警告李芷婷「欸妳要小心一點耶！他們（粉絲）說，只要跟我同台過的都有危險欸！」(生活 / 2021-11-04 12:23),,0
ettoday,繼端火鍋後又一力作！統神學國動露奶 扮天使彈鋼琴辛酸畫面曝光,https://www.ettoday.net/news/20211101/2113521.htm,2021-11-01 09:20,亞洲統神a.k.a.電競不死鳥張嘉航話題不斷，日前他由兩廳院與行政院科技會報、經濟部、文化部等部會聯手，打造的大型製作《神不在的小鎮》演出，在劇作中扮演「直播天神」，採取線上觀看讓民眾能享受高科技的四維空間。但在劇作結束後，就有網友擷取小部分統神演出畫面直喊，「堂堂天神竟露奶彈鋼琴」 (遊戲 / 2021-11-01 09:20),,0
ettoday,錦囊詛咒又發威！鄧佳華收法院公文 全怪統神「做這事沒好下場」,https://www.ettoday.net/news/20211026/2109994.htm,2021-10-26 19:38,網紅鄧佳華以各種爭議事件走紅，他26日透露自己又收到法院公文。事件發展再度引發關注。他一邊崩潰說不想跟小玉同房，一邊還PO出與統神的合照表示「跟他合照下場都很不好」，被網友問：「你是第幾個錦囊？」(影劇 / 2021-10-26 19:38),,0
ettoday,蕭敬騰嗆Toyz反被統神譙「閉嘴」！ 公司回應：不能接受行為踰矩的人,https://www.ettoday.net/news/20211025/2108907.htm,2021-10-25 13:17,金曲歌王「老蕭」蕭敬騰開設的高級日本料理店，在疫情期間推出便當，不料7月時卻被自稱「美食公道伯」的網紅Toyz狠批口味「無聊」，時隔3個月，老蕭22日和理科太太舉辦線上座談會時，談到網路霸凌一事，老蕭表示：「他不是我的敵人，他是空氣，而且他也被抓去關了。」但卻被Toyz的死對頭「統神」反嗆「關你屁事」，質疑蕭敬騰是在打落水狗，對此，蕭敬騰經紀公司也做出回應。 (影劇 / 2021-10-25 13:17),,0
ettoday,陳柏惟舊貼文被挖出！合影統神「手上比5」 網抖曝：威力太無情了,https://www.ettoday.net/news/20211023/2107941.htm,2021-10-23 18:52,"基進黨立委陳柏惟罷免案23日結果出爐，同意票超過7萬3,744張的門檻，確定罷免成功。事後，陳柏惟2年前的貼文再度被挖出，竟是與「亞洲統神」張嘉航的合照，當時手上還比著「5」，讓人忍不住直呼「威力的第五個錦囊」。(網搜 / 2021-10-23 18:52)",,0
ettoday,Toyz販毒遭爆黑吃黑 藥腳找統神爆內幕,https://www.ettoday.net/news/20211009/2097511.htm,2021-10-09 07:01,電競《英雄聯盟》前世界冠軍Toyz劉偉健，涉嫌販賣超過500顆大麻菸彈遭收押禁見，引起各界譁然。本刊掌握，Toyz被逮後自爆被下線藥腳侵吞上百萬元販毒所得，形同黑吃黑，更慘的是，該名藥腳不但轉為汙點證人供出販毒過程，還找上Toyz的死對頭統神大爆販毒內幕，讓統神樂得隔岸觀火。本刊也訪問藥腳取得多張他與Toyz對話的截圖，還原整個販毒始末。由於Toyz原本打算明年與網紅女友奈奈結婚，但2人身家差距太大，是否為了與女友匹配順利完成終身大事而販毒？雙方是否有資金往來？已成檢警追查重點。(社會 / 2021-10-09 07:01),,0
ettoday,歡慶Toyz販毒被抓！「統神發100份雞排」加碼送好東西：週五晚上見,https://www.ettoday.net/news/20211007/2096138.htm,2021-10-07 12:59,電玩《英雄聯盟》前世界冠軍Toyz劉偉健，因涉嫌販賣超過500顆大麻煙彈遭收押禁見，曾與Toyz是死對頭「亞洲統神」張嘉航昨日發文，情趣用品店為了歡慶Toyz被關，找統神幫忙去送100份雞排，就在明（8）日晚上8點半，雖然原文被刪掉了，但統神之後又發了一篇文，「禮拜五晚上見，發免費雞排和好東西」。(生活 / 2021-10-07 12:59),,0
ettoday,統神宣布「統椅之戰落幕」！看到Toyz「舔嘴唇」被網友點醒,https://www.ettoday.net/news/20211005/2094893.htm,2021-10-05 22:29,統椅大戰落幕？電玩《英雄聯盟》前世界冠軍Toyz劉偉健，因涉嫌販賣超過500顆大麻煙彈遭收押禁見，他的死對頭「亞洲統神」張嘉航表示，Toyz開庭他絕對會到，但遣返時不會去湊熱鬧。 (生活 / 2021-10-05 22:29),,0
ettoday,統神站穩實況界「怎麼紅起來的？」 老粉揭1關鍵：他是第一人,https://www.ettoday.net/news/20211005/2094672.htm,2021-10-05 16:53,實況主張嘉航因擅長使用「英雄聯盟」的角色古拉格斯（俗稱酒桶），而有「亞洲統神」的外號。就有網友好奇，統神在實況界有什麼開創性嗎？他當初是怎麼紅起來的？貼文曝光後，立刻引發熱議，其中就有不少網友點出1關鍵。(生活 / 2021-10-05 16:53),,0
ettoday,統神神預言「內線」曝光 Toyz販毒被抓！直播1動作自曝早知情,https://www.ettoday.net/news/20211005/2094093.htm,2021-10-05 06:42,正當檢警擴大偵辦Toyz販毒案之際，隨著案情發展也爆出Toyz遭藥腳黑吃黑的內幕，不僅毒品貨款被暗槓，還付給藥腳安家費，藥腳卻在檢警找上門後，向Toyz的死對頭、網紅統神張嘉航大爆Toyz販毒的料，本刊日前訪問該名藥腳，取得多張他與Toyz對話的截圖及匯款單，還原整起販毒始末。(社會 / 2021-10-05 06:42),,0
ettoday,Toyz與藥腳對話曝光！ 驚爆「黑吃黑」始末：統神早就知道,https://www.ettoday.net/news/20211005/2094091.htm,2021-10-05 06:23,行政院近年砸了上百億元力推安居緝毒專案，建構全國綿密反毒網絡，誓言將毒品趕出社區及校園，未料，在青少年間擁有高人氣的毒舌網紅、《英雄聯盟》前世界冠軍Toyz劉偉健，涉嫌販賣超過500顆二級毒品大麻煙彈，加上他直通製毒工廠，販毒規模宛如大盤商，台中地檢署9月28日指揮彰化縣警局將他逮捕，訊後依違反《毒品危害防制條例》聲請羈押禁見獲准，刑度從10年起跳，震撼各界。(社會 / 2021-10-05 06:23),,0
ettoday,統神舊貼文2.4萬人朝聖！一張「舊椅子照」網嗨翻：唯一預言家,https://www.ettoday.net/news/20210930/2091108.htm,2021-09-30 19:29,前電競選手、實況主劉偉健（Toyz）驚爆涉毒，消息震驚各界。消息傳出不久，世仇實況主「統神」張嘉航的舊貼文竟然被挖出，一張「跟椅子掰掰啦」的照片，吸引了2.4萬粉絲按讚、留言，引起許多討論。(電競 / 2021-09-30 19:29),,0
ettoday,死敵Toyz被抓也沒補刀！統神「風度反應」鄉民respect：電競公道伯,https://www.ettoday.net/news/20210930/2090628.htm,2021-09-30 12:18,《英雄聯盟》S2冠軍選手劉偉健（Toyz）販賣二級毒品大麻遭羈押，將面臨10年以上有期徒刑或無期徒刑，先前和他發生過爭執的世仇「統神」張嘉航得知消息後，並沒有落井下石或蹭熱度，沒趁人家出事時補刀，網友們看了忍不住佩服「從昨天來看，統神真的是最有品的。」(生活 / 2021-09-30 12:18),,0
ettoday,Toyz深夜裸奔：跟不上我！「89萬越獄片」被翻 統神現身魔性笑,https://www.ettoday.net/news/20210930/2090423.htm,2021-09-30 11:35,《英雄聯盟》S2世界冠軍、前電競選手Toyz劉偉健因涉嫌販毒被羈押，就有網友將Toyz先前拍攝的影片再製，並加入統神（張嘉航）的魔性笑聲，笑稱「Toyz越獄之開心畫面流出，哈們」。Kuso影片曝光後，隨即掀起網友熱議。(生活 / 2021-09-30 11:35),,0
ettoday,Toyz販毒羈押「統神先知粉絲」預言瘋傳 一句神回應已備好,https://www.ettoday.net/news/20210930/2090365.htm,2021-09-30 07:23,《英雄聯盟》S2世界冠軍、前電競選手Toyz劉偉健，爆出涉嫌販賣二級毒品大麻被羈押，讓許多人震驚。有網友挖出他的對頭、同事實況主的「亞洲統神」張嘉航7月時跟一位香港粉絲的對話，其中一句「因為Toyz這種低劣的人品，他將來一定會發生事情的嘛！」對照如今的狀況，被許多人奉為神預言。(生活 / 2021-09-30 07:23),,0
ettoday,Toyz涉販毒7月才嗆謝和弦大麻抽太多 14秒畫面曝網酸：雙倍好笑,https://www.ettoday.net/news/20210930/2090353.htm,2021-09-30 07:02,《英雄聯盟》S2冠軍隊伍台北暗殺星中路選手劉偉健（Toyz），昨（29）日因涉嫌販賣二級毒品大麻被捕，結果網友挖出他7月中還嗆歌手謝和弦「大麻吸太多」，忍不住說「現在看雙倍好笑」。(生活 / 2021-09-30 07:02),,0
ettoday,統神一句話回應「Toyz涉毒」 直播露出久違微笑,https://www.ettoday.net/news/20210930/2090349.htm,2021-09-30 06:37,《英雄聯盟》S2冠軍隊伍台北暗殺星中路選手劉偉健（Toyz），29日因涉嫌販賣二級毒品大麻被捕，後經台中地檢署向台中地院聲請羈押獲准。7月因和Toyz代言同款手遊在直播上起衝突的統神，在Toyz被捕消息傳出當時正在開直播，觀看人數瞬間衝上萬人，統神的表情也面帶微笑，但僅回答自己沒有辦法講什麼，「我跟椅子又沒什麼關係，你問我幹嘛？」(遊戲 / 2021-09-30 06:37),,0
ettoday,Toyz黑歷史揭密！一戰成名「打假賽」被老闆告 獲封最麻煩人物,https://www.ettoday.net/news/20210930/2090281.htm,2021-09-30 01:06,《英雄聯盟》（LOL）S2冠軍隊伍台北暗殺星中路選手劉偉健（Toyz）於29日爆出涉毒被逮，隨後台中地檢署證實他因販賣大麻，被檢方帶回偵訊，訊後向法院聲請羈押，目前正在召開羈押庭。對此，Toyz雖為推動台灣電競一大助力，但從成名後爭議不斷。(遊戲 / 2021-09-30 01:06),,0
ettoday,統神大戰Toyz 10回合懶人包 萬人見證「電競不死鳥」：逆統者亡,https://www.ettoday.net/news/20210930/2090306.htm,2021-09-30 00:17,前電競好手Toyz劉偉健今年7月與知名實況主「亞洲統神」張嘉航合作工商，卻因廠商邀約的線上單挑引發爭執，演變成隔空互嗆，雙方大戰10回合。如今劉偉健29日驚傳涉毒，遭台中地檢署聲押，震撼實況圈。(遊戲 / 2021-09-30 00:17),,0
ettoday,快訊／LOL前世界冠軍Toyz驚傳販毒 遭台中地檢署聲押,https://www.ettoday.net/news/20210929/2090241.htm,2021-09-29 19:51,《英雄聯盟》知名電競好手Toyz劉偉健29日驚傳涉毒被逮。台中地檢署證實，劉偉健涉販賣二級毒品大麻，經檢察官指揮警方搜索，將人帶回偵訊，稍早訊後已向法院聲請羈押(社會 / 2021-09-29 19:51),,0
ettoday,統神3月就預言「今天禁鳳梨，明天禁釋迦」 鄉民一看全跪：真先知,https://www.ettoday.net/news/20210920/2083470.htm,2021-09-20 10:17,繼鳳梨之後，中國大陸海關總署突宣布，因檢出「大洋臀紋粉蚧」，決定20日起暫停台灣釋迦和蓮霧輸入中國，有網友就發現，今年3月鳳梨遭中國禁止輸入時，知名實況主「統神（張嘉航）」在網路節目《鄉民大會》就提到「今天禁鳳梨，假設明天禁你那個釋迦，那後天呢？」驚呼「統神根本是先知」。(生活 / 2021-09-20 10:17),,0
ettoday,統神爸媽都老師「離婚3次結婚4次」 原因極扯！兒看衰：病得不輕,https://www.ettoday.net/news/20210813/2055156.htm,2021-08-13 15:38,統神的哥哥張葦航，今（12）日在YouTube「鼻地大師國動-張葦航」表示，日前滑PTT八卦板時，看到有網友拋問，「37歲沒交過男友，那種老師要不要收？」下秒，張葦航反應超激動回應，「人家說老師在婚友市場超搶手，我跟你講，千萬別娶老師」，他甚至斷言，37歲沒交過男友的老師，「100%都有病！」(生活 / 2021-08-13 15:38),,0
ettoday,統神改名了！5通電話未接「雙關反諷」Toyz 網讚爆：中文的奧妙,https://www.ettoday.net/news/20210726/2039775.htm,2021-07-26 01:46,「亞洲統神」張嘉航與實況主Toyz的改名糾紛不斷延燒，但有網友發現，統神默默將遊戲角色的名稱改為「toyzA告」，用英文、台語來符合Toyz的要求「Toyz的狗」，卻又偷偷諷刺，讓不少看戲的網友笑翻。 (遊戲 / 2021-07-26 01:46),,0
ettoday,桶椅風波越演越烈⋯粉絲心疼003無辜遭罵 親上火線澄清：我也常爆罵他,https://www.ettoday.net/news/20210721/2036080.htm,2021-07-21 11:09,統椅風波越演越烈，20日晚間除了兩人直接實況對罵以外，統神後續也在自己的實況上開放粉絲Call-In，但仍讓兩邊粉絲覺得對方都是各說各話，事情仍沒有趨緩。對此，統神老婆兼經紀人003則罕見發聲，以10大問題整理、並回覆近日發生事件的原因並針對「無辜被罵」事件澄清。(遊戲 / 2021-07-21 11:09),,0
ettoday,統神PK輸賴皮不改「Toyz的狗」 拍桌髒話吼老婆：香港人懂尊重？,https://www.ettoday.net/news/20210719/2033980.htm,2021-07-19 10:09,Garena旗下《天涯明月刀M》邀請到堪稱史上最豪華實況主替遊戲推廣，包含統神、丁特、Toyz、蝴蝶兒、ET、小熊，分別代表不同門派在遊戲實況中宣傳。近日統神所代表的丐幫與Toyz率領的唐門進行聯動實況，兩人在遊戲中相約PK，輸的就要進行遊戲改名。(遊戲 / 2021-07-19 10:09),,0
ettoday,統神認了「罹憂鬱症＋躁鬱症」！ 心酸：哥哥更嚴重…揭受傷黑暗面,https://www.ettoday.net/news/20210718/2033729.htm,2021-07-18 14:58,直播主亞洲統神（張嘉航）因特殊的表演風格，一直在遊戲實況圈深受許多粉絲喜愛，卻也因為人紅，經常遭到酸民諷刺言論攻擊，雖然平常看起來不在意，但他坦言自己罹患憂鬱症以及躁鬱症，無奈說：「大家看開一點！」(影劇 / 2021-07-18 14:58),,0
ettoday,張格斯出生啦！統神曬兒照報平安 網笑：知道爸媽邊生邊吵架嗎？,https://www.ettoday.net/news/20210517/1983691.htm,2021-05-17 11:07,張格斯出生啦！繼2016年與老婆003結婚、生下「小航Z」後，亞洲統神張嘉航於17日早上在臉書上報喜，張格斯（未取好名字）順利出生，還開玩笑強調「父子均安」。對此，網友紛紛笑喊，「格斯你知道你爸媽邊生你邊吵架嗎？」(遊戲 / 2021-05-17 11:07),,0
ettoday,邀請統神加入民眾黨？ 柯文哲大笑：如果他喜歡⋯,https://www.ettoday.net/news/20210331/1950414.htm,2021-03-31 11:55,知名實況主「亞洲統神」張嘉航與「國動」張葦航30日主持節目時，來賓民眾黨立委蔡壁如當場Call out給台北市長柯文哲，而柯文哲本人也邀請張家兄弟一起去北市府吃便當。面對會不會邀請統神入黨？柯文哲31日則笑稱，「如果他喜歡⋯」(政治 / 2021-03-31 11:55),,0
ettoday,統神罵隊友菜雞、垃圾…嘴砲完秒GG！ 慘遭日本官方「永久停權」,https://www.ettoday.net/news/20210323/1944867.htm,2021-03-23 22:47,直播主亞洲統神（張嘉航）因特殊的表演風格，一直在遊戲實況圈深受許多粉絲喜愛，近日轉到《英雄聯盟》的日本伺服器遊玩，沒想到不過才1個多月的時間，就因為在玩遊戲時多次脫口而出不雅字詞，而遭到官方「永久停權」，讓粉絲哭笑不得。 (影劇 / 2021-03-23 22:47),,0
ettoday,統神自爆多益700！「超神英文片」被挖出 網讚：比成大碩士流利,https://www.ettoday.net/news/20210226/1926789.htm,2021-02-26 10:43,近期不斷出現釣魚連結，點進去就會出現「端火鍋滑倒」的影片，而實況主統神（張嘉航）也成為熱門話題人物。就有網友挖出統神與國動訪問企鵝妹的影片，只見統神流利的說著英語，讓不少網友接連驚呼「邏輯更鬼」、「統神強的是數學」，再度引發熱議。(生活 / 2021-02-26 10:43),,0
ettoday,統神真的端火鍋了！自PO「廚房打工」照…有聲音 2萬人朝聖,https://www.ettoday.net/news/20210225/1926615.htm,2021-02-25 22:20,「啊～一代一代一代」這段哀嚎成為近期網路上台灣人最恐懼的聲音，主角「統神」張嘉航近日因「統神端火鍋」的釣魚影片成為熱門話題人物，而他被多次釣魚後，25日晚間直接PO出「真人端火鍋」照，馬上吸引2萬人朝聖。 (網搜 / 2021-02-25 22:20),,0
ettoday,統神低調做善事！私下錄音為車禍粉絲打氣 網讚：電競黑暗騎士,https://www.ettoday.net/news/20210225/1926497.htm,2021-02-25 18:47,實況主「統神」張嘉航近日因「統神端火鍋」的釣魚影片成為熱門話題人物。而今日統神在IG上PO出的一則對話，讓網友發現他私下是位默默做善事的暖男。(遊戲 / 2021-02-25 18:47),,0
ettoday,《統神端火鍋》遊戲化 網友笑稱：這次真的不是釣魚影片,https://www.ettoday.net/news/20210222/1923753.htm,2021-02-22 11:39,「啊～一代一代一代」這段哀嚎成為近期網路上台灣人最恐懼的聲音。而最近有巴哈姆特論壇上的網友 Kento（rogeraabbccd），就自製了一款《統神端火鍋》的網頁小遊戲，將這隻影片的風潮再度推上高峰。(遊戲 / 2021-02-22 11:39),,0
ettoday,吃冰也被釣！他翻開店內「便利貼」見經典背影 萬人朝聖笑翻,https://www.ettoday.net/news/20210220/1923070.htm,2021-02-20 21:12,「啊～一代一代一代」這段聲音網路上人與人之間的信任降到低點，深怕點開任何一個連結都是「統神端火鍋」，那段哀嚎也成為近期網路上最令人恐懼的聲音。沒想到，除了網路上被釣魚之外，有網友在現實生活也被釣到，氣得他PO文大罵「在冰店也被釣，X！」 (網搜 / 2021-02-20 21:12),,0
ettoday,啾啾鞋解析「統神端火鍋」10個冷知識！衝YT發燒第一 影片來源曝,https://www.ettoday.net/news/20210220/1922976.htm,2021-02-20 17:37,近日網紅「愛莉莎莎」與「蒼藍鴿」的事件鬧得沸沸揚揚，網路上因此出現詐騙、釣魚的影片，標題寫著「蒼藍鴿要向愛莉莎莎道歉」，點開卻是火鍋店員工滑倒的影片，讓不少人傻眼，對此，知識型YouTuber啾啾鞋昨日上傳新影片，分享關於「統神端火鍋」10個冷知識，沒想到衝上YouTube發燒排行榜第一名。(生活 / 2021-02-20 17:37),,0
ettoday,統神「真的跌倒了」！倒地高喊：一代一代…粉絲看傻狂洗留言,https://www.ettoday.net/news/20210218/1921707.htm,2021-02-18 18:32,"近期網路上不斷出現釣魚連結，明明外層網址、縮圖看起來十分正常，點進去卻會出現「端火鍋滑倒」的影片，導致該支影片點閱率暴增。對此，實況主「統神」張嘉航也透過自嘲的方式，在臉書上張貼「跌倒」的照片，短短2個小時就吸引了8,000多名粉絲按讚。(網搜 / 2021-02-18 18:32)",,0
ettoday,連假40萬人上當！點開見「端火鍋滑倒」崩潰 網哀號：好可憐,https://www.ettoday.net/news/20210215/1920001.htm,2021-02-15 19:30,近日網紅「愛莉莎莎」與「蒼藍鴿」的事件鬧得沸沸揚揚，引起許多網路討論。不過，也有詐騙、釣魚的影片藉此流傳開來，標題寫著「蒼藍鴿要向愛莉莎莎道歉」，點開卻是火鍋店員工滑倒的影片，導致該影片每日增加約20萬的觀看人次，讓人傻眼。(網搜 / 2021-02-15 19:30),,0
ettoday,星潮之夜重磅來襲！「220位浪LIVE直播主＋重量級藝人」炸翻全場,https://www.ettoday.net/news/20201211/1873541.htm,2020-12-11 12:29,浪LIVE年度盛典「星潮之夜」重磅來襲！超人氣歌手J.Sheon用迷人嗓音炸翻全場，220位直播主走出直播間，打扮成男神女神前來共襄盛舉，包括帥氣又有才的星潮四帥、時尚結合古典的女子團體無雙樂團、魅力無法擋的啦啦隊樂天女孩、知名造型師李明川等等，眾星雲集一同共享浪LIVE的榮耀里程碑。 (消費 / 2020-12-11 12:29),,0
ettoday,臺中電競嘉年華12/18登場 盧秀燕打造「酷城市」邀全民參加,https://www.ettoday.net/news/20201110/1851183.htm,2020-11-10 18:29,臺中市長盧秀燕與在場嘉賓伸出手觸碰魔球，象徵2020臺中電競嘉年華將於12月18日正式開跑，盧秀燕也喊出口號，要將臺中打造成「酷城市」，全力發展酷運動、酷產業，而電競就是其中一項。(生活 / 2020-11-10 18:29),,0
