ettoday,澳媒駐北京記者2年前就被騷擾！家人也遭殃 首度公開內情,https://www.ettoday.net/news/20200922/1814002.htm,2020-09-22 11:17,近期多名澳洲駐中國記者接連遭北京當局拘留、約談，甚至被迫離境；澳洲廣播公司（ABC）前北京分社社長卡尼說，早在2018年他和家人就曾遭中國當局威脅長達3個月。 (國際 / 2020-09-22 11:17),,0
ettoday,人妻開車講電話鏟飛路人肇逃 回家才知公公重傷「秒刪32封簡訊」,https://www.ettoday.net/news/20200922/1814460.htm,2020-09-22 08:35,英國萊斯特29歲女子阿貝丁（Fathetha Begun Abedin）2018年2月5日晚間因為邊開車邊使用手機，結果撞飛一名走在斑馬線上的老翁，但她沒有停下來關心，反而直接加速逃逸，回到家後才知道，剛剛撞上的人其實是公公。(國際 / 2020-09-22 08:35),,0
ettoday,太陽本週進入天秤座！12星座「一週運勢」曝...獅子、摩羯把握工作機會,https://www.ettoday.net/news/20200917/1810951.htm,2020-09-17 10:30,太陽在本週進入天秤座，與火、水、木、土、冥王星產生衝突，制衡的力量開始偏移，貧富差距、世代鴻溝、國際衝突，都會被凸顯出來。強壓弱、大欺小的狀況層出不窮。金融市場相對穩定，干擾因素多可被預測。而醜聞與八卦依舊是討論焦點。(生活 / 2020-09-17 10:30),,0
ettoday,家犬突發狠「撕咬12天大男嬰」！3警急衝上前合力拉狗…反被拖著走,https://www.ettoday.net/news/20200916/1810454.htm,2020-09-16 17:14,英國南約克郡（South Yorkshire）發生一起可怕事件。頓卡司特（Doncaster）一戶人家最近才剛迎接新生命，未料家中愛犬卻突然襲擊出生僅12天的男嬰，將小寶寶撕咬致死。(國際 / 2020-09-16 17:14),,0
ettoday,進行混合戰！中國「振華數據」監控全球240萬人...澳洲朝野超憂心,https://www.ettoday.net/news/20200915/1809712.htm,2020-09-15 20:55,深圳振華數據被揭對全球具影響力人物建立資料庫，以配合中國的「混合戰」。澳洲朝野和專家警告，中國有能力也有意圖利用有關數據作為威脅澳洲的武器。(國際 / 2020-09-15 20:55),,0
ettoday,《鬥陣特攻》職業電競聯賽總決賽四強出爐 2020賽季全明星造型限時登場,https://www.ettoday.net/news/20200915/1808945.htm,2020-09-15 01:18,《鬥陣特攻》職業電競聯賽2020賽季季後賽的最後一輪比賽於14 日凌晨結束，四支隊伍最終晉級總決賽。同時，2020賽季聯賽例行賽MVP的得獎者也在14 日公佈。(電競 / 2020-09-15 01:18),,0
ettoday,突獲5.4億遺產！遠房親戚全家身亡...男子唯一繼承嚇呆：簡直像詐騙,https://www.ettoday.net/news/20200914/1808886.htm,2020-09-14 21:06,加拿大一名男子日前突然接到國際電話，有名律師表示，由於遠房親戚因意外過世，而他的直系親屬也都已經不在人世，男子是唯一的繼承人，將可獲得高達1850萬美元（約5.4億新台幣）的遺產，這份天上掉下來的禮物，簡直就像是詐騙事件，讓男子遲遲無法相信。(國際 / 2020-09-14 21:06),,0
ettoday,孫芸芸10萬香奈兒新貨上身 放送蜜大腿,https://www.ettoday.net/news/20200914/1808702.htm,2020-09-14 17:20,"時序入秋，「台灣第一名媛」孫芸芸時尚行頭也逐一換季了，戴上香奈兒（CHANEL）Logo毛帽、腳踩帥氣的亮面山羊皮與小牛皮繫帶鞋，證明身為精品大戶的她搶貨速度驚人，但畢竟天氣還是有超過30℃的高溫，所以她還是穿背心與香奈兒早春系列約81,700元的短褲上陣，放送蜜大腿。(時尚 / 2020-09-14 17:20)",,0
ettoday,史上第一位！《永恆族》導演趙婷奪金獅獎！  「白寡婦」獲影后殊榮,https://www.ettoday.net/news/20200913/1807711.htm,2020-09-13 02:38,第77屆威尼斯影展於台灣時間13日凌晨1點舉辦閉幕式及頒獎典禮，《永恆族》導演趙婷憑藉著《Nomadland》（暫譯：遊牧之地）奪下了最高榮譽「金獅獎」，也成為威尼斯電影節史上首位獲該獎項的華人女導演！影帝是義大利男星Pierfrancesco Favino憑藉著《Padrenostro》（暫譯：我們的父親）；影后則是飾演「白寡婦」走紅全球的凡妮莎寇比（Vanessa Kirby）拿下。(影劇 / 2020-09-13 02:38),,0
ettoday,金曲獎入圍大贏家阿爆熱鬧開唱 竟放話：想退票的可以退！,https://www.ettoday.net/news/20200912/1807524.htm,2020-09-12 17:06,在今年金曲獎一舉入圍8項的阿爆，昨（11日）在台北Legacy開唱，演唱會名稱為「嘟，會女聲」，是取材自排灣族語「阿嘟Adju」之意（意指姐妹），延伸為不分生理性別的好姊妹，希望演唱會是一場「姊妹們」的音樂聚會，現場氣氛嗨爆。(影劇 / 2020-09-12 17:06),,0
ettoday,約旦「彈藥庫大爆炸」原因曝！煙花式火光噴濺 驚悚影片瘋傳,https://www.ettoday.net/news/20200911/1806330.htm,2020-09-11 08:49,約旦扎爾卡市（ Zarqa）附近發生大爆炸，現場火光衝天，附近房屋玻璃慘被震碎，民眾驚慌失措。當地媒體報導有2人不幸喪命，不過官方堅稱，沒有造成人員傷亡。另外，事故原因也隨之出爐，是一個軍事彈藥庫電氣短路所致。(國際 / 2020-09-11 08:49),,0
ettoday,台積電與 NSO 樂無界教育計畫—陳銳小提琴大師班,https://www.ettoday.net/news/20200910/1805959.htm,2020-09-10 18:12,「我們音樂家做的事情，都是從有限去把它擴展到無限！」NSO藝術顧問呂紹嘉如是說。NSO國家交響樂團攜手台積電文教基金會、公共電視、兩廳院，邀請小提琴家陳銳舉辦全程中英文進行的大師班。(影劇 / 2020-09-10 18:12),,0
ettoday,她擁「42L巨乳」超愛健身！彎腰撿東西竟釀悲劇 慘坐輪椅,https://www.ettoday.net/news/20200910/1805896.htm,2020-09-10 17:27,來自英國沃里克郡（Warks）的26歲女子黛比（Debbie Horton）胸部大小超乎一般女性，已經達到「42L」的尺寸，沉重負擔甚至引發一連串脊椎疾病，導致她現在大部分時間都必須依靠輪椅或拐杖才能行動。(國際 / 2020-09-10 17:27),,0
ettoday,流浪貓躲椅子淚眼委屈！她衝去關切秒傻眼...網笑翻：快撿回家,https://www.ettoday.net/news/20200910/1805966.htm,2020-09-10 17:07,差點就衝去便利商店買罐頭了！日前一名網友Flower Sun到高雄的橋頭地方法院，停好車的時候餘光發現遠處有一隻橘白貓，眼神無助又委屈，垂耳躲在椅子，身影看起來十分孤獨。正當她衝過去關切小貓咪，走近一看才發現自己竟然被騙了，讓她哭笑不得飆出國罵，「X！只是一顆石頭..喵」。 (寵物動物 / 2020-09-10 17:07),,0
ettoday,大眼浪貓躲長凳好無辜 她融化慢慢靠近蹲下心裡罵髒話,https://www.ettoday.net/news/20200910/1805940.htm,2020-09-10 16:37,網友Flower Sun10日下午到高雄市橋頭地方法院辦事情，目光被戶外長凳下超可愛貓咪吸引，她擔心驚動貓咪慢慢地走過去蹲下來，才發現「那只是一顆石頭...喵」。她把奇特的經驗分享在臉書社團「爆怨公社」，讓許多網友爆笑。 (寵物動物 / 2020-09-10 16:37),,0
ettoday,影／台女在新加坡不戴口罩「朝保全打噴嚏」 今被判11周監禁,https://www.ettoday.net/news/20200910/1805745.htm,2020-09-10 13:59,台灣一名46孫姓婦人，4月在新加坡逛街時，因不滿保全要求她戴口罩，竟故意朝對方打噴嚏，甚至要對方閉嘴，最後遭到當地檢方依兩項罪嫌起訴。孫婦已在6月30日認罪，今（10）日被判處11周監禁。(國際 / 2020-09-10 13:59),,0
ettoday,一不小心就破財！12星座「極端周運勢」曝光...處女學著苦中作樂,https://www.ettoday.net/news/20200910/1805601.htm,2020-09-10 13:01,最近是盤整與佈局的時候，不管是國際金融還是政治外交，都有勢力重組的跡象，仔細觀察趨勢流動，才能做出最妥適安排。而市井小民可能要面臨更二極化的財富分配，奢華炫富的笙歌與窮困潦倒的悲歌相對，讓富豪或政要成為輿論攻擊箭靶。(生活 / 2020-09-10 13:01),,0
ettoday,馬桶噴出1公尺蟒蛇「咬中下體」 少年濺血送醫緊急縫合怕爆,https://www.ettoday.net/news/20200909/1805295.htm,2020-09-09 21:51,泰國又發生馬桶有蛇竄出事件，一名18歲少年近日如廁時，突然被一條深色蟒蛇咬中下體，當場血濺廁所，幸好緊急送醫後確認該蛇無毒，下體縫合3針後已經沒有大礙。(國際 / 2020-09-09 21:51),,0
ettoday,被藍鳥單局炸10分 洋基抱怨球場燈太暗、質疑投手動作被抓到,https://www.ettoday.net/news/20200909/1804545.htm,2020-09-09 08:45,洋基8日作客藍鳥單局失掉10分終場以7比12落敗，賽後洋基捕手東岡凱爾（Kyle Higashioka）抱怨這個水牛城臨時球場燈光問題導致失常，也懷疑是自家投手小動作被抓到才會被打爆。(體育 / 2020-09-09 08:45),,0
ettoday,孫大千力挺于北辰「錯殺忠臣自毀長城」 籲江啟臣三思解雇案,https://www.ettoday.net/news/20200908/1804271.htm,2020-09-08 18:30,國民黨8日上午發布人事異動消息，平時愛直播罵黨高層，網紅將軍、黃國園黨部主委于北辰因言行不當遭解職，引發熱議。對此，前國民黨立委孫大千下午表示，于北辰是國民黨優秀人才，可在直播中傳播國民黨理念，絕對是重要戰將，若因為誤會而錯殺忠臣，不但親痛仇快，更是自毁長城，請黨中央三思。(政治 / 2020-09-08 18:30),,0
ettoday,美網／喬帥這一拍代價超大 失格後再損失26.75萬美元,https://www.ettoday.net/news/20200908/1803654.htm,2020-09-08 09:25,喬科維奇（Novak Djokovic）情緒性的往場外擊球，意外打中線審喉部遭判失格，除了喪失參賽資格，後續一連串的獎金、積分拿不到外，還因為各種罰款一共損失26.75萬美元。(體育 / 2020-09-08 09:25),,0
ettoday,買沙發被丟包！門口「完全卡死」根本出不去 她慘困家中2天,https://www.ettoday.net/news/20200907/1803464.htm,2020-09-07 20:33,英國女子莎拉（Sarah Miller）先前跟老公離婚，獨自一人帶著6歲的兒子搬到其他地方住，沒想到她為新家訂的沙發送來之後，兩名貨物人員以新冠疫情為理由，將超大的沙發放在門口後就走了，而莎拉跟兒子則是因為搬不動沙發，導致兩人在房子中被困了整整兩天，一直到其他家人來救援才得以出門。(國際 / 2020-09-07 20:33),,0
ettoday,伸褲縫「抓陰毛」灑菜盤！噁男裝委屈拒付錢…店家看監視器嚇壞,https://www.ettoday.net/news/20200903/1800010.htm,2020-09-03 10:39,英國一名男子與友人8月前往一家印度餐廳用餐，2人點了滿滿一大桌菜，吃得心滿意足準備結帳時，他們告知店家「菜內有毛髮」，因此拒絕付錢，雙方經過一陣爭論後，最後男子僅付了20英鎊（約新台幣782元）就離去；事後店家查看監視器畫面，竟發現一個離譜真相。(國際 / 2020-09-03 10:39),,0
ettoday,火星即將逆行！12星座「7日運勢」公開...僅3星座感到幸福,https://www.ettoday.net/news/20200902/1799130.htm,2020-09-02 12:05,近期金融市場與國際貿易相關新聞多，瞬息萬變，要小心操作，以免淪為韭菜。火星將於下週開始逆行，本週可能會聽到重要人物的不幸消息。本週金星與水星將進入節奏更快的宮位，面對變局，豬羊變色，好壞互換，要盡量把彈性拉到最大。(生活 / 2020-09-02 12:05),,0
ettoday,怪男用刀斬首媽媽「驅魔」 全裸詭異走在街上：她被鬼魂附身！,https://www.ettoday.net/news/20200901/1798580.htm,2020-09-01 16:54,柬埔寨金邊市街頭日前出現一名怪異裸男，警方上前盤查意外發現，他居然用刀斬首了自己母親，因為他覺得對方「被鬼附身」。警方前去現場發現，死者頭部與身體完全分離，頭上還有因為毆打而造成的瘀青，目前已將男子逮捕並進行精神狀態鑑定。(國際 / 2020-09-01 16:54),,0
ettoday,希臘游泳遭快艇撞到！ 度假女下半身被「螺旋槳捲入」當場身亡,https://www.ettoday.net/news/20200901/1798194.htm,2020-09-01 12:42,英國一名60歲女子近來到希臘度假，在科孚島(Corfu)附近的阿夫拉基海灘(Avlaki Beach)游泳時，居然遭快艇的螺旋槳捲入下半身，人送到醫院時被宣布已經身亡。由於快艇肇事後沒有停留在現場，警方目前正在調查駕駛員是否知道自己有撞到人。(國際 / 2020-09-01 12:42),,0
ettoday,幽浮入侵！西伯利亞北極圈炸出深50公尺「天坑」...爆炸原因出爐,https://www.ettoday.net/news/20200901/1798203.htm,2020-09-01 12:38,位處俄羅斯西伯利亞北極圈內的凍原帶（tundra）最近突然發生一起大爆炸，苔原上深達165英尺（約50公尺）的超級大洞便橫空出世，當地民眾懷疑是否為外星人搭乘UFO所炸、也有人懷疑是否為莫斯科當局正在進行不為人知的核武試爆；不過有專家指出，這其實和自然現象有關。(國際 / 2020-09-01 12:38),,0
ettoday,復賽最恐怖受傷！ 魔術提前宣告艾薩克明年報銷,https://www.ettoday.net/news/20200901/1798225.htm,2020-09-01 10:46,魔術超級3年級生艾薩克（Jonathan Isaac）在破繭而出的賽季卻接連遭遇大傷，總管韋特曼（Jeff Weltman）1日證實，艾薩克復賽階段左膝前十字韌帶撕裂傷，將導致2020-21賽季整季報銷。(體育 / 2020-09-01 10:46),,0
ettoday,摔角冠軍迎娶甜美千金！ 500賓客突收「偷情片」驚見新娘是主角,https://www.ettoday.net/news/20200831/1797481.htm,2020-08-31 14:50,俄羅斯摔角世界冠軍佐貝克（Zorbek Sidkov）甜蜜迎娶富家千金麥迪娜（Madina Pliyeva），500名賓客齊聚祝賀，卻突然收到手機簡訊，內容指控麥迪娜是某位60多歲億萬富翁的情婦，也曾從事伴遊女郎的工作，同時附上新娘過去曾經拍攝的鹹濕影片。(國際 / 2020-08-31 14:50),,0
ettoday,小資族愛亂花錢！他曝「3大問題點」 生活品質先丟一邊,https://www.ettoday.net/news/20200829/1796314.htm,2020-08-29 17:04,「300元你吃的是拉麵，但我是在吃300元的房子！」臉書粉絲專業「武敬凱」分享，小資族為何比有錢人更愛亂花錢，他整理出三大重點。小資族認為買車買房很遙遠，加上自己的薪水若比同儕來的高，會覺得多出來的錢是額外的獎勵，亂花也沒有關係，但這可能是你存不了錢的原因。 (財經 / 2020-08-29 17:04),,0
ettoday,「用國人健康還川普人情」 孫大千：蔡英文是赤裸裸的賣台,https://www.ettoday.net/news/20200829/1796435.htm,2020-08-29 14:12,針對總統蔡英文28日拍板開放萊克多巴胺（瘦肉精）美豬肉及30月齡以上的美國牛肉進口，前國民黨立委孫大千29日「七問蔡英文」，不僅質疑民進黨每天都宣稱台美關係深厚，絕無任何對價交換？也批評蔡英文為了還美國總統川普的人情，用國人健康安全作為代價，是赤裸裸的「賣台」。(政治 / 2020-08-29 14:12),,0
ettoday,每晚傳銷魂呻吟聲！賣淫女墳墓接客「1次激戰4男」...居民目睹崩潰,https://www.ettoday.net/news/20200828/1795316.htm,2020-08-28 17:18,教堂原本應該是莊嚴的神聖之地，不料英國一間歷史悠久的教堂竟淪為犯罪溫床！英國德文郡（Devon）托奇鎮的居民抱怨，當地的聖安德魯斯教堂（Church of St Andrew）時常聚集不法分子，吸毒、鬥毆早已屢見不鮮，現在竟有性工作者利用教堂的墓地接客，每到晚上就不斷有奇怪的呻吟聲傳出，令人不堪其擾。(國際 / 2020-08-28 17:18),,0
ettoday,抓住暑假尾巴衝一波！12星座「一周運勢」曝：金牛、處女把握甜蜜約會,https://www.ettoday.net/news/20200827/1794480.htm,2020-08-27 11:00,不同利益的衝撞，把專家們推到浪頭上。學有專精的創作者在本週有機會發光發熱，成為各自領域的耀眼新星。醜聞、劈腿或是外遇的新聞也是本週的八卦焦點，但未必引起公眾關注。金融操作要保守，就怕新頒布的措施又會引發一波市場震動，革命、示威、暴動也可能會造成衝擊。(生活 / 2020-08-27 11:00),,0
ettoday,孫安佐遭以「製槍未遂」起訴…親自拍片回應！ 恐面臨牢獄之災：會欣然接受結果,https://www.ettoday.net/news/20200826/1794168.htm,2020-08-26 18:41,知名藝人孫鵬與狄鶯的兒子孫安佐，因涉嫌在美國製造手槍未遂，24日遭士林地檢署起訴，可處7年以上或最重本刑無期徒刑，引發外界關注。26日他在頻道上傳影片還原事件真相，也透露被起訴的心境，坦言「蠻雖的，但不管怎樣，我還是會做好我該做的事」。(影劇 / 2020-08-26 18:41),,0
ettoday,孫安佐首度回應被起訴！ 公開「美國事件真相」認太白目：講了不該講的幹話,https://www.ettoday.net/news/20200826/1794039.htm,2020-08-26 18:25,藝人孫鵬、狄鶯獨生子孫安佐因涉嫌在美國「製造手槍未遂」，24日遭到士林地檢署起訴，可能被處7年以上或最重本刑無期徒刑，引發社會關注。對此，他在今日（26日）晚間透過YouTube頻道公開「事情真相」影片，對於這起事件親自做出說明。(影劇 / 2020-08-26 18:25),,0
ettoday,活活勒死結婚27年妻...冷血男去酒吧開心喝酒 屍體就丟在他床上,https://www.ettoday.net/news/20200826/1793967.htm,2020-08-26 16:40,英國林肯郡一名商人冷血殺害結婚27年妻子，犯案後竟然還有心情跑到酒吧和朋友一起打鬧，並向家人隱瞞妻子死訊繼續過正常生活，直到岳母懷疑對方已經遇害報案，整起事件才終於曝光，近來被檢方以謀殺罪指控。(國際 / 2020-08-26 16:40),,0
ettoday,夫怒女怨！川普女顧問被迫閃辭 竟因辣妹女兒「反川普」,https://www.ettoday.net/news/20200825/1792594.htm,2020-08-25 16:53,白宮顧問凱利安.康威（Kellyanne Conway）在女兒克勞迪亞．康威（Claudia Conway）發文控訴她替川普工作「毀了她一生」後，與丈夫喬治.康威（George Conway）同時宣布退下工作崗位，回歸家庭。康威一家政治立場各異，在網路上深受大家矚目。(國際 / 2020-08-25 16:53),,0
ettoday,菲利普親王爆有「30位情婦、24位私生子」 女王保聲譽忍73年,https://www.ettoday.net/news/20200825/1792493.htm,2020-08-25 05:56,英國女王伊莉莎白二世，自1953年在位，至今已經67年，94歲的她，每次出席在大眾面前，展現出親切又優雅，深受英國人民喜愛戴，而始終站在她身旁，高大英挺的男子，正是和她結縭73年的希臘王子菲利普親王。雖然女王曾公開表示有這位「背後男人」，她才能堅持下去，不過這幾年卻不斷傳出有關菲利普親王外遇的消息，令人外界感到意外。(國際 / 2020-08-25 05:56),,0
ettoday,她體重暴增到106公斤 進醫院一查...50公斤卵巢腫瘤壓扁腸胃,https://www.ettoday.net/news/20200824/1791763.htm,2020-08-24 12:25,印度德里一名52歲婦女幾個月內體重突然暴增到106公斤，開始呼吸困難、小腹疼痛到無法走路或睡覺，到醫院一查才發現卵巢有一個重達50公斤的巨大腫瘤，血紅素值甚至降到6以下，引起嚴重貧血。所幸18日在Indraprastha Apollo醫院接受3.5小時的手術後，已經完全摘除了腫瘤並開始康復，沒有留下任何後遺症。 (國際 / 2020-08-24 12:25),,0
ettoday,浴缸裡躺「木乃伊女屍」狂飄惡臭！ 金髮妹「伴屍4個月」認了：我殺的,https://www.ettoday.net/news/20200822/1791090.htm,2020-08-22 22:16,西班牙女子泰莉（Teri）與媽媽住在一起，但跟她們住在同一棟公寓的鄰居，卻長期聞到一種「難以忍受」的氣味，警方在19日時破門而入並開始尋找氣味的來源，最後竟然在廁所的浴缸中，發現一具散發著惡臭的「木乃伊女屍」，而屍體的身分竟然就是泰莉的媽媽。(國際 / 2020-08-22 22:16),,0
ettoday,監視器拍到白衣女在工地漂浮 鐵齒保全嚇到失眠：她是鬼新娘！,https://www.ettoday.net/news/20200821/1790013.htm,2020-08-21 12:41,英國一名保全深夜查看監視紀錄器時，竟然看到「白衣女鬼」現身，影片中可清楚看到一名穿著白色禮服的長髮女子，緩緩走過工地現場的詭異畫面，然而立即前往現場卻又沒有找到任何人，讓一向鐵齒的他也不得不相信，自己應該是碰到了靈異現象。(國際 / 2020-08-21 12:41),,0
ettoday,孫芸芸背殺美照藏辛酸 滑一大跤、被海蟑螂嚇死,https://www.ettoday.net/news/20200820/1789407.htm,2020-08-20 16:20,新冠肺炎疫情爆發前，孫芸芸常在澳洲陪一雙兒女讀書，經常曬海邊的穿搭照，而今年無法前往，她依然能發掘台灣之美，戴上自創飾品品牌YUN YUN SUN首飾，到金山神秘海岸拍美照，無論是紅洋裝展現女神氣場，或是黑色連身裝大露美背與玉腿，都讓網友大讚，但美照背後其實藏辛酸，她不僅對海蟑螂心生畏懼，還不小心滑了一大跤。(時尚 / 2020-08-20 16:20),,0
ettoday,土象星群氛圍強！12星座「鬼月首周運勢」公開...白羊、獅子把握偏財運,https://www.ettoday.net/news/20200819/1788245.htm,2020-08-19 16:00,太陽與水星連袂進入處女座，強化了大環境整個土象星群氛圍。專業的職人、學有所長的文青、知識含量豐富的作家，會獲得更多關注的聲量。醫療科技也會有重大突破，很有可能重要的疫苗與解藥即將問世，為目前疫情帶來希望。但金融市場危機四伏，小心突發的波動。(生活 / 2020-08-19 16:00),,0
ettoday,電影院前排座位驚見「男女深情交疊」！ 紅外線監視器全程拍下,https://www.ettoday.net/news/20200819/1788445.htm,2020-08-19 15:35,英國一間電影院發生一起尷尬事件。一對男女來到空蕩蕩的影廳內，趁著四下無人，竟然直接在前排座位上做愛，但是，他們似乎沒有發現前方有一支紅外線攝影機，激情過程全被捕捉下來，在社群媒體上流傳。(國際 / 2020-08-19 15:35),,0
ettoday,辣媽照全家福見「門邊站長髮女童」盯鏡頭 換濾鏡後發現：手裡有拿東西,https://www.ettoday.net/news/20200818/1787273.htm,2020-08-18 18:21,愛爾蘭一名23歲女子愛麗絲（Alice Martin）於4月初時，與湯姆（Tom Brown）、兒子路易（Louie）在家中拍攝全家福照片，但是愛麗絲檢查照片時，卻發現身後的門邊有個奇怪的影子，放大一看發現是，「女童拿著東西直盯鏡頭」，嚇得她馬上搬家(國際 / 2020-08-18 18:21),,0
ettoday,噴霧式防曬超NG！專家曝「產品挑選6要點」…錯誤用法恐吸入體內,https://www.ettoday.net/news/20200818/1786492.htm,2020-08-18 10:22,暑假期間，長期在酷熱天氣下從事戶外活動，除了嚴防中暑、補充水分之外，防曬也不能少！藥師艾琳指出，老一輩的觀念常認為，小朋友外出不用擦防曬，但他們肌膚的防禦力只有成人的1/3，為了保護嬌嫩肌膚免受紫外線傷害，防曬工作務必要做好！(健康 / 2020-08-18 10:22),,0
ettoday,Wecare呼籲「投票護高雄」 孫大千批：證明罷韓真正目的是為了贏回政權,https://www.ettoday.net/news/20200813/1783861.htm,2020-08-13 14:14,高雄市長補選倒數2日，針對國民黨候選人李眉蓁找來前高雄市長韓國瑜站台輔選，臉書「Wecare高雄」發文呼籲「光榮投票護高雄」。對此，前國民黨立委孫大千13日批評，Wecare終於忍不住站出來幫民進黨候選人陳其邁催票了，證明罷韓的真正目的，不是為了贏回榮耀，而是為了贏回政權。(政治 / 2020-08-13 14:14),,0
ettoday,殘爆又激烈的1周！12星座「運勢亮紅燈」…僅這2星座好運不斷,https://www.ettoday.net/news/20200812/1782796.htm,2020-08-12 10:47,要留意週末期間的新聞，引發後續金融市場的波動。重大投資要謹慎操作。八卦與腥羶是本週的熱門點擊，但隨之而來的網路霸凌也讓人擔憂。家庭暴力也可能成為關注焦點。火山、地震可能會對某些地區造成損害。通訊、資訊相關的新產品引發關注與討論。(生活 / 2020-08-12 10:47),,0
ettoday,影／馬里蘭州瓦斯爆炸！至少1死6重傷「兒童受困」 3棟民宅炸成廢墟,https://www.ettoday.net/news/20200811/1781962.htm,2020-08-11 11:34,美國馬里蘭州最大城巴爾的摩西北部10日發生瓦斯爆炸意外，造成至少1人死亡及6人受傷，還有幾名兒童受困。爆炸威力摧毀至少三棟房屋及另一棟房屋的磚牆，磚瓦遍布整個社區，現場殘破不堪。(國際 / 2020-08-11 11:34),,0
ettoday,中職／富邦「將將好生活」主題日 有不老頑童和療癒系女歌手,https://www.ettoday.net/news/20200810/1781133.htm,2020-08-10 11:45,(體育 / 2020-08-10 11:45),,0
