ettoday,《醉後》男星被逼泡「化糞池」 回頭看酬勞都要哭哭了,https://www.ettoday.net/news/20150902/559040.htm,2015-09-02 23:21,好萊塢男星艾德赫姆斯（Edward Helms）曾演出《醉後大丈夫》系列深受影迷喜愛，新片《全家玩到趴》再度以冷面笑匠之姿，受到廣大觀眾的喜愛，但是很少人知道，一開始的時候他還打算把這部電影推掉，差點錯失這麼精彩的電影。 (電影 / 2015-09-02 23:21),,0
ettoday,饒舌歌手搖變《玩命》快遞員 艾德斯克林練搏鬥以1打6,https://www.ettoday.net/news/20150901/558477.htm,2015-09-01 23:19,法國電影《玩命快遞》系列自2002年開始上映，由知名導演盧貝松擔任製片，傑森史塔森（Jason Statham）主演，7年後再度推出第四部《玩命快遞：肆意橫行》，找來艾德斯克林（Edward George Skrein）演出快遞員「法蘭克馬丁」年輕時期的故事。片中車輛競速追逐，劇情節奏明快，更令觀眾大呼過癮。(電影 / 2015-09-01 23:19),,0
ettoday,美國監聽案逆轉？！ 法院改判蒐集電話紀錄「沒違法」,https://www.ettoday.net/news/20150829/557110.htm,2015-08-29 20:08,前中情局高級雇員艾德華史諾登（Edward Snowden）在2013年時踢爆，美國國家安全局（NSA）大肆監控人民電話紀錄，引起各界譁然。然而，日前哥倫比亞的上訴法院卻推翻了原本地方法院對「美國國安局大量蒐集電話紀錄是違法行為」的裁決。(國際 / 2015-08-29 20:08),,0
ettoday,網路監控全世界 威雙紐西蘭館的秘密力量,https://www.ettoday.net/news/20150828/556443.htm,2015-08-28 17:07,當一個國家透過科技與網路監控各國，掌握軍事與外交情報，就等同佔領全世界。紐西蘭藝術家西蒙‧丹尼（Simon Denny）創作一隻禿鷹，展翅高飛時，緊抓著地球儀不放，而禿鷹是美國的國鳥，象徵美國意圖掌握全世界。(名家 / 2015-08-28 17:07),,0
ettoday,壞痞男演出《玩命快遞》 艾德斯克林全身瘀青仍感謝,https://www.ettoday.net/news/20150820/553000.htm,2015-08-20 23:04,演員艾德斯克林（Edward George Skrein）原本是1位英國饒舌歌手，年少輕狂叛逆，甚至在17歲時遭人刺傷，後來改邪歸正，2013年時參與電視劇《冰與火之歌：權力遊戲》的演出，最近接拍《玩命快遞》系列電影，並擔任男主角。(電影 / 2015-08-20 23:04),,0
ettoday,只聞其聲不見其人！嫌犯和警玩躲貓貓 全程被鄰居拍下,https://www.ettoday.net/news/20150807/546293.htm,2015-08-07 00:28,「只聞其聲，不見其人」或許就是這種場面。美國一名男子日前為了躲避警察盤查，巧妙躲在自家屋簷上果真奏效。所幸警察鍥而不捨的精神，最後逮捕該男，而整個「躲貓貓」的過程都被對街的鄰居給捕捉下來。 (新奇 / 2015-08-07 00:28),,0
ettoday,英前首相希斯 疑似性侵男童遭調查,https://www.ettoday.net/news/20150804/544805.htm,2015-08-04 12:39,英國已故前首相及保守黨黨魁希斯（Edward Heath）生前疑似涉嫌兒童性侵案件，英國獨立監察警方處理投訴委員會（IPCC）日前發表聲明，呼籲任何能夠提供證據的人，應主動連絡警方；而目前也有一名男子站出來，表示自己在12歲時曾遭希斯侵犯。(國際 / 2015-08-04 12:39),,0
ettoday,媽媽停止分泌奶水 「泰迪熊化身保母」照顧樹懶寶寶,https://www.ettoday.net/news/20150801/543745.htm,2015-08-01 21:00,英國倫敦動物園（London Zoo）中的樹懶寶寶愛德華（Edward）近日成為焦點，因為樹懶媽媽停止分泌奶水後，飼養員只好想辦法代替餵奶，為了讓樹懶寶寶可以有在母親懷中的感受，決定「雇用」一隻泰迪熊當保母！(寵物動物 / 2015-08-01 21:00),,0
ettoday,《英雄聯盟》各戰隊的國際排名 中韓戰隊整體提升,https://www.ettoday.net/news/20150725/539951.htm,2015-07-25 10:55,除了韓國LCK和中國LPL（還有GPL）地區還有幾週的例行賽外，其他賽區都只剩最後一週的例行賽了，甚至有許多外卡地區早早已經進入季後賽的激戰，LMS也將在本週開始夏季季後賽的決戰時刻。(遊戲 / 2015-07-25 10:55),,0
ettoday,女王童年照做「納粹」手勢 堂妹瑪格莉特：太荒謬了！,https://www.ettoday.net/news/20150720/537838.htm,2015-07-20 17:13,英國體《太陽報》日前公開女王伊麗莎白二世（Queen Elizabeth II)童年照片，並指愛德華八世(Edward VIII)在教女王行納粹敬禮，引起社會一片譁然。伊麗莎白二世的堂妹瑪格莉特 (Margaret Rhodes) 19日與堂姊上教會後表示，「實在是荒謬至極！」白金漢宮也提到，「我們將積極找尋是誰將影像洩漏出去。」(國際 / 2015-07-20 17:13),,0
ettoday,日本企業第一次 等了70年...三菱對受虐美軍戰俘道歉,https://www.ettoday.net/news/20150719/537314.htm,2015-07-19 15:47,2015年正好是二次世界大戰結束70週年，每逢重大事件節日都會有相應的紀念活動。日本三菱綜合材料株式會社首度在15日時表示，他們會在本周末時，對在二戰時期受到不當對待的戰俘道歉，這也是日本第一次有民間企業首度針對二戰議題致歉。(國際 / 2015-07-19 15:47),,0
ettoday,英媒刊登82年前舊照 赫見女王做出納粹敬禮手勢,https://www.ettoday.net/news/20150718/537045.htm,2015-07-18 16:19,英國《太陽報》頭版日前刊出了一張女王伊麗莎白二世（Queen Elizabeth II）年幼時、直挺挺舉著右手的照片，斗大的標題竟寫著，1933年的祕密影片記錄愛德華八世（Edward VIII）教導女王做納粹敬禮。(國際 / 2015-07-18 16:19),,0
ettoday,性奴籲天錄 神秘組織搶救ISIS性奴 過程全都錄！,https://www.ettoday.net/news/20150716/536245.htm,2015-07-16 20:26,極端組織伊斯蘭國(ISIS) 強虜婦女當性奴， 一再傳出許多讓人髮指的暴行。不過，如今終於出現了一個由反抗軍組成的神秘地下組織， 正全力營救這些性奴逃離魔掌。(國際 / 2015-07-16 20:26),,0
ettoday,科學家警告：太陽15年後「休眠」 地球進入小冰河期！,https://www.ettoday.net/news/20150713/534410.htm,2015-07-13 19:48,一項最新研究聲稱預言在2030年至2040年間，太陽活動會減少六成，導致太陽「休眠」，屆時地球可能會出現「蒙德極小期」，亦即俗稱的「小型冰河期」。 (國際 / 2015-07-13 19:48),,0
ettoday,火行者／《魔鬼終結者：創世契機》永遠的阿諾,https://www.ettoday.net/news/20150702/527622.htm,2015-07-02 11:00,我想，最重要的一點，就是Ｔ８００回來了，且是阿諾〔Arnold Schwarzenegger〕演的，光是他走路、說話的樣子，就是無可取代的終結者啊(ETlife(勿用) / 2015-07-02 11:00),,0
ettoday,《刺客教條4：黑旗》免費下！XBOX 公布7月金會員陣容,https://www.ettoday.net/news/20150701/528762.htm,2015-07-01 18:44,台灣微軟今天宣布， Xbox Live 金會員「Game With Gold」兩歲了 !為感謝所有金會員及廣大Xbox玩家的支持，微軟七月份推出多款經典遊戲組合供玩家下載，包含在Xbox One 平臺上推出的作品《刺客教條4：黑旗》及跳躍闖關遊戲《So Many Me》； Xbox 360 為玩家帶來《植物大戰殭屍》及《戰爭機器3》。(遊戲 / 2015-07-01 18:44),,0
ettoday,VOGUE／全球最受歡迎Top 20婚禮歌曲你聽了嗎！,https://www.ettoday.net/news/20150629/526118.htm,2015-06-29 21:00,婚禮是一生中最美麗的時刻之一，音樂除了能完整呈現新人的戀愛故事外，更重要的，是讓婚禮的賓客能起身至舞池中，隨著美麗的歌曲盡情擺動。那麼在這些婚禮當中，哪些歌曲能獲得步入禮堂的新人青睞呢? (ETlife(勿用) / 2015-06-29 21:00),,0
ettoday,妻子太寵愛2歲公西施犬 美國男子吃醋竟性侵「牠」,https://www.ettoday.net/news/20150617/521886.htm,2015-06-17 13:40,美國阿拉巴馬州日內瓦市39歲男子梅德利(Jonathan Edward Medley)忌妒妻子太寵愛家中的西施犬，竟然性侵狗兒。妻子在針孔攝影機中看到這一幕氣得報警，但由於阿拉巴馬沒有關於性侵動物的法條，目前梅德利僅依虐待動物被拘留，裁定保釋金535美元（約1萬7千元新台幣）。(國際 / 2015-06-17 13:40),,0
ettoday,《英雄聯盟》LPL地表最強賽事開打 12支強隊介紹(上),https://www.ettoday.net/news/20150605/516218.htm,2015-06-05 14:00,《英雄聯盟》MSI季中邀請賽EDG力剋SKT拿下冠軍後，地表賽事強度最強的LPL賽區已揭開序幕，將由EDG、OMG、LGD、WE、IG、King、Snake、M3、VG、RNG、QG、UP，12支頂尖隊伍將攜手踏上新賽季的征程。(遊戲 / 2015-06-05 14:00),,0
ettoday,《英雄聯盟》2015全球戰隊排名 ahq、閃電狼Top 10,https://www.ettoday.net/news/20150605/516213.htm,2015-06-05 10:00,《英雄聯盟》的五大聯賽陸續開打中，亞洲聯賽較歐美LCS聯賽早開始，但說實在的中國賽區的局勢目前來說還是十分撲朔迷離，各隊在經過人員的交易替換過後，每一隊的實力、戰術以及整體的操作性想必需要在重新的分析一番。(遊戲 / 2015-06-05 10:00),,0
ettoday,國際火線／有陰謀！美查國際足總貪腐是為打擊俄羅斯？,https://www.ettoday.net/news/20150605/516485.htm,2015-06-05 03:00,國際足總貪腐本來是跟美國政府八竿子打不著的事。美國為何一心一德的要查國際足總的貪賂？ 矢志拉布萊特下馬？很自然的陸陸續續出現了許多陰謀論。(國際 / 2015-06-05 03:00),,0
ettoday,小剛的日本音樂風暴區／天皇的御廚 實力咖襯古典樂,https://www.ettoday.net/news/20150601/514541.htm,2015-06-01 15:12,2015春季TBS大戲”天皇的御廚”，除了佐藤健優異的演技，有直追影帝岡田准一之勢，在收視攀升之下，不只劇情，連片頭配樂蔚然成為話題。(名家 / 2015-06-01 15:12),,0
ettoday,狗鍊勒頸強暴成植物人 印度女護士臥床42年後病逝,https://www.ettoday.net/news/20150518/508382.htm,2015-05-18 20:19,印度孟買（Mumbai）67歲女護士尚邦格（Aruna Shanbaug），42年前在醫院被病房清潔工以狗鍊勒頸，並強姦得逞，造成她腦部受傷變成植物人。此後一直臥病在床，期間曾有不少人為她爭取安樂死，但卻被最高法院駁回。上週診斷她染上肺炎，受苦多年最後在18日病逝，令人不勝唏噓。(國際 / 2015-05-18 20:19),,0
ettoday,路易威登詮釋旅行的藝術 行李箱變海灘椅,https://www.ettoday.net/news/20150518/508144.htm,2015-05-18 14:54,法國精品路易威登重新詮釋旅行的藝術，由9位知名設計師結合工藝與想像力，推出Objets Nomades全新系列共16件家具家飾單品，包括以路易威登行李箱內固定物品的織棉布帶為靈感的海灘椅、Keepall提袋把手延伸而來的鞦韆椅，以及外形與Noé水桶包呼應的鐘形吊燈等，每個單品都代表著品牌獨特的創意風格。(消費 / 2015-05-18 14:54),,0
ettoday,英男利用iPhone換機漏洞大賺129萬 涉詐欺罪坐牢6個月,https://www.ettoday.net/news/20150516/507452.htm,2015-05-16 12:43,英國一名男子自作聰明，鑽科技大廠蘋果的換機計劃(replace or repair scheme)漏洞，收購51台二手iPhone後假藉要換機寄回蘋果公司，藉此換來51台新手機並賣出，獲利高達2萬7千英鎊，後來被警方發現後，該名男子被依竊盜及詐騙罪判處6個月有期徒刑。(國際 / 2015-05-16 12:43),,0
ettoday,美國眾議院通過自由法案 國安局不能再收集通訊記錄,https://www.ettoday.net/news/20150515/506916.htm,2015-05-15 17:27,美國聯邦眾議院於當地時間13日以338票對88票，壓倒性通過《美國自由法案》（USA Freedom Act），禁止國家安全局（NSA）大規模收集境內國民的電話通訊記錄，包括電話號碼、通話時間、電子郵件以及瀏覽網址，但仍保有按個別情況向電話公司獲取電話通訊數據的權力。(國際 / 2015-05-15 17:27),,0
ettoday,MSI 15／ 哪國最強？《英雄聯盟》季中邀請賽開戰在即,https://www.ettoday.net/news/20150507/503317.htm,2015-05-07 12:01,即將於明（5/8）日於美國佛羅里達州－塔拉哈西舉辦的《英雄聯盟》季中邀請賽，邀請到了全球五大區聯賽的冠軍以及一名外卡隊伍，爭奪 S5 開季以來的第二場全球性賽事。(遊戲 / 2015-05-07 12:01),,0
ettoday,《英雄聯盟》季中邀請賽正式開打Garena Live全程直播,https://www.ettoday.net/news/20150505/502182.htm,2015-05-05 20:00,全球超過 2700 萬玩家的策略模擬遊戲《英雄聯盟》，即將在台灣時間 2015/05/08 （五） 清晨4:00 舉行2015 季中邀請賽 （MSI，Mid-Season Invitational） 首場賽事，冠軍賽則於台灣時間 2015/05/11 （一） 清晨6:00 進行，一連 4 日為全球所有《英雄聯盟》玩家呈現最精彩刺激的賽事。(遊戲 / 2015-05-05 20:00),,0
ettoday,《英雄聯盟》Riot公開台灣ahq選手西門夜說介紹影片,https://www.ettoday.net/news/20150505/501733.htm,2015-05-05 12:00,《英雄聯盟》季中邀請賽（The Mid-Season Invitational）美國時間 5/7 正式開打，遊戲研發商 Riot 特別在比賽前夕釋出來自台灣隊伍 ahq 選手西門夜說影片，向全球玩家介紹這名選手，並且邀請大家 5/7-5/10觀賞季中邀請賽中西門夜說與 ahq 的表現。(遊戲 / 2015-05-05 12:00),,0
ettoday,波克夏Q1獲利增10% 巴菲特掌舵50年還是不退休,https://www.ettoday.net/news/20150503/501345.htm,2015-05-03 17:44,由股神巴菲特領軍的波克夏公司2日舉辦年會，高齡84歲的巴菲特與他的副手孟格花了數小時回答來自股東、分析師與記者的提問，不過對於接班人這個問題，不管怎麼問他就是不說，反而表示自己明年2月會再寫一封致股東報告書，意味著他不會那麼快就交棒。 (國際 / 2015-05-03 17:44),,0
ettoday,為AHQ加油！《英雄聯盟》MSI季中賽四日賽程出爐,https://www.ettoday.net/news/20150430/500044.htm,2015-04-30 04:10,由《英雄聯盟》開發商 Riot 舉辦的年度兩大賽事之一的 2015 季中邀請賽（2015 Mid-Season Invitational）即將於台灣時間 5 月 8 日至 11 日於美國佛羅里達塔拉哈西開打。今（4/30）公布了對戰賽程與名單。(遊戲 / 2015-04-30 04:10),,0
ettoday,史諾登爆料：紐西蘭監控中國使館網路，情報供美加英澳,https://www.ettoday.net/news/20150419/494919.htm,2015-04-19 18:35,紐西蘭媒體《先驅報》日前報導，「棱鏡門」爆料人史諾登（Edward J. Snowden）提供的絕密文件指出，紐西蘭的情報機構有配合美國國家安全局，監控中國大陸駐紐西蘭第奧克蘭市的外交機構數據連接線路。使館發言人19日對此表示關切。(大陸 / 2015-04-19 18:35),,0
ettoday,瘋電影／第四公民 用命維護自由應有的權益,https://www.ettoday.net/news/20150417/493931.htm,2015-04-17 08:52,攝影師蘿拉正在拍攝一部有關911事件後、美國情報監控的影片，為此她還莫名遭到美國海關刁難，多次將她在機場攔了下來，但她始終不肯屈服放棄…。有天，蘿拉突然收到許多署名「第四公民」的匿名郵件提醒她：這些事件背後的真正原因，其實遠超乎她的想像。更誇張的是，她的名字早被列在美國國家安全局的監測黑名單上…。(名家 / 2015-04-17 08:52),,0
ettoday,《英雄聯盟》官方釋出新戰力排行榜 ahq首次入世界榜,https://www.ettoday.net/news/20150416/493198.htm,2015-04-16 10:00,英雄聯盟官方於（4/15）釋出最新的戰力排行榜。官方表示根據目前戰況，本次季中邀請賽將能造福許多喜愛中路選手的觀眾，因為這次將有機會看到 Faker、西門夜說、Bjergsen、Febiven 與 Pawn 等知名中路選手的對決。(遊戲 / 2015-04-16 10:00),,0
ettoday,MLB／紅襪當家終結者歸位 上原浩治傷癒復出,https://www.ettoday.net/news/20150413/492253.htm,2015-04-13 18:46,有「完全守護神」之稱的上原浩治即將傷癒歸隊，接下紅襪終結者一職。12日在1A格林威爾驅動對登板一局，投球狀況顯示左腿後側肌肉無礙，預計14日芬威主場開幕戰就會回到牛棚報到，為紅襪後防線加深強度。(體育 / 2015-04-13 18:46),,0
ettoday,秒拆史諾登雕像 創作者：通常捍衛理念的人都是罪犯,https://www.ettoday.net/news/20150407/489587.htm,2015-04-07 18:39,3位美國藝術家7日在布魯克林格林堡公園（Fort Greene Park）戰爭紀念碑上，豎立揭密者史諾登(Edward Snowden)的半身雕像，希望人們可以重視史諾登對抗美國箝制人民言論自由的貢獻。然而，雕像不久便被公園管理單位移走。(國際 / 2015-04-07 18:39),,0
ettoday,全民英雄拿了奧斯卡不改揭密砲火 沒想到他的罩門是…,https://www.ettoday.net/news/20150404/488664.htm,2015-04-04 23:58,勇奪今年奧斯卡的《第四公民》主角艾德華史諾登(Edward Snowden)，3日突然對英國開砲，爆料「英國監聽阿根廷政府長達五年」，將監聽風暴燒向南美洲，引發阿根廷全國震驚。讓人好奇的是，這位被全球民眾視為英雄、揭密勇氣驚人的史諾登，罩門究竟在哪裡？ (影劇 / 2015-04-04 23:58),,0
ettoday,一世代贊恩爆偷腥 甜親未婚妻PO照恩愛回擊,https://www.ettoday.net/news/20150402/487769.htm,2015-04-02 16:06,英國合唱男團「一世代」贊恩（Zayin Malik）3月25日凌晨在官網宣布退團，接著爆出偷腥事件，接著又發表新個人單曲《I Won’t Mind》，讓昔日團員很傻眼。僅管外界支持、反對兩派聲浪沒停過，他現在放上和老婆接吻照，用恩愛照擊破外界流言。(影劇 / 2015-04-02 16:06),,0
ettoday,MLB／洛老師季前分析紅襪 投資策略大分,https://www.ettoday.net/news/20150401/487167.htm,2015-04-01 18:54,墊底、冠軍、又墊底，紅襪球迷這三年的心情就像坐雲霄飛車一樣忽高忽低，任誰也沒想到陣容完整戰力強大的衛冕軍會有如此荒腔走板的表現，季末還上演瘋狂清倉大特賣，把眾多紅襪迷最愛的巨星成了別隊的招牌，簡直讓人崩潰到家。(體育 / 2015-04-01 18:54),,0
ettoday,MLB／上原浩治恐趕不上開季 紅襪找好替代人選,https://www.ettoday.net/news/20150330/485992.htm,2015-03-30 16:14,波士頓紅襪隊日籍投手上原浩治先前大腿拉傷，可能趕不上開季，總教練法瑞爾（John Farrell）對此已有解決方案，他透露可能將終結者任務交給穆西卡（Edward Mujica）。(體育 / 2015-03-30 16:14),,0
ettoday,影／一世代贊恩無預警退團 演唱會5缺1哈利掩面淚崩,https://www.ettoday.net/news/20150326/484087.htm,2015-03-26 07:30,英國偶像男團「一世代」贊恩（Zayn Malik）近來被爆出在泰國摟妹照，讓未婚妻佩芮愛德華（Perrie Edward）大為光火，婚姻告急，25日凌晨官網發布他將退團通知，讓所有粉絲相當震驚。消息公開後，該團體依照原訂計畫開唱，哈利（Harry Styles）卻因不捨團員離開，在台上淚崩。(影劇 / 2015-03-26 07:30),,0
ettoday,我眼中最美的台灣！台南鹽田倒影美如金字塔,https://www.ettoday.net/news/20150321/481809.htm,2015-03-21 12:04,台灣這片寶島真的很美！《ETtoday新聞雲》17日在粉絲團辦徵求美照活動，讓更多網友看見不一樣的「台灣」，因參賽的人數眾多，採隨機抽選方式選出5名幸運兒，一起來看看這些美得令人屏息的照片吧！(生活 / 2015-03-21 12:04),,0
ettoday,史諾登「現身」德國電腦展：你們正受到攻擊,https://www.ettoday.net/news/20150320/481427.htm,2015-03-20 14:08,「來無影去無蹤」的美國頭痛人物愛德華．史諾登（Edward Snowden）竟「現身」德國漢諾威CeBIT電腦展，警告與會者「你們正受到攻擊。」強調資訊安全的重要性。前美國中情局雇員史諾登因公開政府監聽民眾的「稜鏡計畫」遭通緝潛逃在外，目前仍向各國尋求政治庇護。(國際 / 2015-03-20 14:08),,0
ettoday,「一世代」贊恩背著未婚妻 泰國摟妹PO文道歉,https://www.ettoday.net/news/20150319/480922.htm,2015-03-19 16:00,「一世代」贊恩（Zayn Malik）最近風波不斷，先是被有同性疑雲的團員連恩（Liam Payne）爆料2人曾嘴對嘴接吻，現在又被爆出在泰國背著未婚妻摟妹，還有照片為證，他也趕緊PO文道歉並澄清消息。(影劇 / 2015-03-19 16:00),,0
ettoday,《英雄聯盟》最新官方戰力排行yoe閃電狼排名世界第13,https://www.ettoday.net/news/20150319/480550.htm,2015-03-19 13:31,每周都會更新的北美《英雄聯盟》官方戰力排行榜，yoe 閃電狼這次表現出色，本次排行榜在 IEM 世界冠軍賽過後有了不少變化。我們也完整的翻譯了這篇官方原文，希望可以讓讀者們參考國外對於 yoe 閃電狼的評價、目前《英雄聯盟》各區域聯賽的趨勢、以及 IEM 賽事所帶來的改變。(遊戲 / 2015-03-19 13:31),,0
ettoday,接獲贖金後...IS釋放19名亞述基督徒 還有200人待營救,https://www.ettoday.net/news/20150302/472383.htm,2015-03-02 07:54,極端組織伊斯蘭國（IS）曾於2月24日、25日突襲敘利亞北部村莊，綁架220名亞述族基督徒，敘利亞人權組觀察組織（Syrian Observatory for Human Rights）最新消息指出，伊斯蘭國在收到贖金後，已於今日（2日）釋放19名亞述族基督徒，但仍有200名人質尚待營救。(國際 / 2015-03-02 07:54),,0
ettoday,奧斯卡／紅毯4酷哥！班奈狄克白馬王子裝 搭妻帥登場,https://www.ettoday.net/news/20150223/469987.htm,2015-02-23 09:08,班奈狄克（Benedict Cumberbatch）以「福爾摩斯」一角爆紅，憑電影《模仿遊戲》入圍最佳男主角，他在情人節前夕，也是正值奧斯卡獎投票期間宣布結婚消息，震撼影壇，接著又和妻子宣布懷有小baby，期待帶著這股氣勢一舉拿下影帝。(影劇 / 2015-02-23 09:08),,0
ettoday,奧斯卡／44歲伊森霍克越老越帥 甜吻老婆頭放閃,https://www.ettoday.net/news/20150223/469992.htm,2015-02-23 07:49,伊森霍克（Ethan Hawk）憑著電影《年少時代》入圍本屆奧斯卡最佳男配角，得獎呼聲高，但勁敵艾德華諾頓（Edward Norton）、JK西蒙斯（J.K. Simmons）也來頭不小。他在紅毯上梳著帥氣油頭，同樣展現迷人風采，放閃親吻老婆 萊恩霍克（Ryan Hawke），期待今晚能拿下好成績。(影劇 / 2015-02-23 07:49),,0
ettoday,過年檔12部電影懶人包！賀歲大囍、感官格雷還有...,https://www.ettoday.net/news/20150218/465639.htm,2015-02-18 15:00,過年的強檔電影有哪些？《ETtoday東森新聞雲》特別將過年大家想看的電影，用4種方式「闔家觀賞的國片」、「大朋友小朋友都愛的動畫片」、「看門道不看熱鬧的奧斯卡熱門片」、「情人節首選」區分開來，讓雲友們一目了然地可以去觀賞自己想看的電影！(影劇 / 2015-02-18 15:00),,0
ettoday,網友預言成真！ 原唱Sia分享郭郁承模仿影片：太滑稽,https://www.ettoday.net/news/20150216/468228.htm,2015-02-16 10:56,網友預言成真！樹德科技大學學生郭郁承日前驚唱《寂寞水晶燈》，當時就有網友預言「這一定紅到國外去」。果不其然，原唱澳洲知名金曲天后希雅真的看到了，在臉書PO上影片連結，直呼「太滑稽」。(新奇 / 2015-02-16 10:56),,0
ettoday,轉頭受驚大唱《Chandelier》 網友：這一定紅到國外去,https://www.ettoday.net/news/20150210/465650.htm,2015-02-10 12:39,網友「Edward Jarvis」8日在臉書PO出一支短片，一名男子突然被後方的人嚇到，瞬間用驚恐地表情高歌一曲。有網友看了大笑，「這一定紅到國外去」。(網搜 / 2015-02-10 12:39),,0
ettoday,華華咖啡廳／魔鬼終結者的難處,https://www.ettoday.net/news/20150209/465134.htm,2015-02-09 11:51,2015年電影魔鬼終結者即將推出第五集！來看看過去魔鬼終結者電影裡不為人知的化妝技術，到底阿諾半人半機械的臉是怎麼做到的呢？(名家 / 2015-02-09 11:51),,0
ettoday,102歲老太太收養成貓 互相依偎超感人,https://www.ettoday.net/news/20150121/456239.htm,2015-01-21 09:36,美國德州一間蒙哥馬利縣收容所在1月中的時候發生一件令人感動的事情，一名高齡近102歲的女主人愛奧那(Iona)收養了成貓愛德華(Edward)，並且緊緊把牠抱在懷間呵護，而愛德華也非常乖巧地待著，人貓依偎的畫面相當溫馨，也感動很多網友。(寵物動物 / 2015-01-21 09:36),,0
ettoday,瘋電影／鳥人 獨一無二的電影藝術語言,https://www.ettoday.net/news/20150116/447753.htm,2015-01-16 08:45,他曾經是大銀幕上威風的超級英雄；但歲月不饒人，如今年華老去、頂上稀疏。受限於昔日紅極一時的銀幕形象，人人只視他為被時代淘汰的過氣演員，不再認真看待他的任何嶄新嘗試。(名家 / 2015-01-16 08:45),,0
ettoday,奧斯卡／同入圍9項！《鳥人》強拚《布達佩斯大飯店》,https://www.ettoday.net/news/20150115/452151.htm,2015-01-15 22:59,第87屆奧斯卡金像獎15日晚上公布入圍名單，即將於16日上映的電影《鳥人》以及曾在2014年引起好評、上映許久遲遲不下片的《歡迎來到布達佩斯大飯店》雙雙入圍9個獎項，堪稱本屆奧斯卡的最大贏家，典禮將定於2月22日（大年初四）進行。(影劇 / 2015-01-15 22:59),,0
