ettoday,狄鶯傳訊息：我好想哭！ 「假老公」楊懷民曝她管教孫安佐辛酸,https://www.ettoday.net/news/20180403/1143974.htm,2018-04-03 18:06,狄鶯的18歲兒子孫安佐再度被搜出槍枝和1600多發子彈，涉嫌恐攻的案件層級升高，她和老公孫鵬停工趕往美國營救，出發前收到好友楊懷民傳來關心簡訊，直說：「我好想哭。」(影劇 / 2018-04-03 18:06),,0
ettoday,哈林曝小哈利特殊興趣！ 每天強迫互動「教養2關鍵」,https://www.ettoday.net/news/20180403/1143897.htm,2018-04-03 17:21,「哈林」庾澄慶育有16歲兒子小哈利及9個多月的愛女，提到此事他表示不便多說，體諒狄鶯夫妻倆心急如焚，不過哈林也分享自己教育的2個關鍵重點，一是要給正確價值觀，二是希望孩子找到喜歡的是輕，也笑說：「現在每天都會跟兒子『強迫互動』，會問今天功課、做了什麼事。」(影劇 / 2018-04-03 17:21),,0
ettoday,1608子彈要花多少錢？網曝「超低價」！ 專家：孫安佐試過槍,https://www.ettoday.net/news/20180403/1143904.htm,2018-04-03 17:09,孫安佐（An Tso Sun）在住處被搜出1608發子彈，以及一支自行組裝的9厘米手槍。據國外軍用品網站價格推估，用台幣1萬4388元即可買到1600發子彈，而就孫安佐被發現的子彈數量來看，美國步槍協會教練曹瀛生研判，「散數不合理，可能已經試槍過。」(影劇 / 2018-04-03 17:09),,0
ettoday,14歲貝克宇被狄鶯姊狂轟！崔佩儀冷靜回應了,https://www.ettoday.net/news/20180403/1143884.htm,2018-04-03 16:10,孫安佐在美被逮捕，牽扯出星二代教育，14歲貝克宇是崔佩儀獨子，曾在臉書發言：「我不會成為第二個他（孫安佐）。」事後崔佩儀出面道歉，狄鶯姐狄玫對此大怒，重話更說出口。崔佩儀得知遭到砲轟，低調不想再多說。(影劇 / 2018-04-03 16:10),,0
ettoday,求政府「救救孫安佐」 張菲愧疚害張少懷住警局,https://www.ettoday.net/news/20180403/1143863.htm,2018-04-03 15:30,孫安佐的事件持續受到關注，綜藝大哥大張菲今（3日）談到此事也面有難色，「老實講，會害怕，很擔心他們（孫鵬與狄鶯）的小孩子。」他也感嘆自己曾將兩名兒子送出國，40多年來沒有盡力做到教育的責任，但他回想起那段日子突然大笑起來，原來他曾害張少懷被抓緊警局兩天，就因為兩條香菸。(影劇 / 2018-04-03 15:30),,0
ettoday,孫安佐用狄鶯附卡 吳宗憲兒住波士頓每月「僅花4萬」,https://www.ettoday.net/news/20180403/1143844.htm,2018-04-03 14:58,孫安佐的事件持續受到關注，賓州警方周一（2日）找到孫安佐的槍，以及超過1600發的子彈。據悉，孫安佐買東西都是用爸媽的信用卡附卡，吳宗憲認為這不妥，還透露自己的兒子在波士頓生活，每個月的花費只有1千多美金（約4萬元台幣），而且還要求附上款項明細，避免小孩走鐘。(影劇 / 2018-04-03 14:58),,0
ettoday,孫安佐寄宿社區老舊街景曝光！ 「常發生搶劫襲擊」犯罪率超高,https://www.ettoday.net/news/20180403/1143815.htm,2018-04-03 14:32,狄鶯和孫鵬的18歲獨子孫安佐（An Tso Sun）在美國揚言到就讀學校開槍被捕，被控屬輕罪的恐怖威脅罪，他居住的寄宿家庭位於上達比（Upper Darby）社區，以中低收入戶為主，多是非裔居民，據美國網站調查，該地區1000名居民裡平均就發生25.54件罪案，尤其又以襲擊和搶劫案最常發生。(影劇 / 2018-04-03 14:32),,0
ettoday,薇閣擔心「孫安佐事件」精神喊話 家長：怕小孩子心情受影響,https://www.ettoday.net/news/20180403/1143690.htm,2018-04-03 14:15,孫安佐涉嫌恐攻在美被逮捕，國中時就讀私立薇閣雙語高級中學，連日來風波，讓學校師生受到不少討論，據一名薇閣中學的家長透露，「現在全校班導師都要對學生精神講話，讓學生明白有些行為是不應該做的，同時也積極協助學生，怕小孩子心情受影響。」(影劇 / 2018-04-03 14:15),,0
ettoday,狄鶯赴美4天煎熬睡不好 堅強向姊報平安「我會處理好」,https://www.ettoday.net/news/20180403/1143688.htm,2018-04-03 13:32,狄鶯、孫鵬飛美國救子，連日來風波延燒，被警方搜出1600發子彈跟手槍，案件變得複雜，他們到賓州監獄探視，一看到穿囚衣的兒子都激動哭了，狄鶯姊狄玫表示，她探視之後還沒有給我訊息，但應該這幾天都不好睡，當初到美國時有傳訊，「姐，妳放心，我會處理好。」(影劇 / 2018-04-03 13:32),,0
ettoday,李昌鈺警告成真！ 孫安佐藏軍火證據上交國安部「問題嚴重了」,https://www.ettoday.net/news/20180403/1143766.htm,2018-04-03 13:03,孫安佐（An Tso Sun）因在美國揚言恐攻遭逮捕，又被發現持有一把真槍及1600多發子彈，整起案情犯罪層級升高，著名鑑定專家李昌鈺博士警告，美國司法單位若將此定義為「囤積軍火」，嚴重性也會加重。(影劇 / 2018-04-03 13:03),,0
ettoday,孫安佐如果在台被捕 律師林智群解析這5點：結局可能不一樣,https://www.ettoday.net/news/20180403/1143741.htm,2018-04-03 13:02,狄鶯和孫鵬的18歲獨子孫安佐在美國揚言到就讀學校開槍被捕，被控屬輕罪的恐怖威脅罪，至今仍在德拉瓦郡監獄。常對時事發表看法的律師林智群就說，如果這件事情發生在台灣，那麼結局可能不一樣，因為「台灣就是這麼一個溫馨的地方⋯」。(社會 / 2018-04-03 13:02),,0
ettoday,孫安佐若在台被捕結局會不一樣！ 律師：台灣就是這麼溫馨,https://www.ettoday.net/news/20180403/1143705.htm,2018-04-03 12:27,狄鶯與孫鵬18歲的兒子孫安佐（An Tso Sun）在美國涉嫌持有非法武器、揚言5月1日在就讀的高中發動槍擊，如今又被警方在住處搜出一把9厘米手槍和1608發子彈。孫安佐目前羈押於賓州德拉瓦郡監獄，保釋金為10萬美元（約新台幣291萬元），將於11日開庭審理。台灣律師林智群1日在個人臉書發文（本文已獲授權）指出，若孫安佐事件發生在台灣，過程和結局可能不太一樣。(國際 / 2018-04-03 12:27),,0
ettoday,孫安佐涉案層級升高「州法→聯邦法」 最重判刑10年！,https://www.ettoday.net/news/20180403/1143742.htm,2018-04-03 12:23,孫安佐（An Tso Sun）在寄宿家庭的房間內又被搜出超過1600發子彈和手槍，整個案件恐怕層級將升高，他最重恐被判10年。而日前在美國中央佛羅里達大學（University of Central Florida）就讀的大陸留學生孫文亮也因類似的事情接受調查，現在已經被遣返並且10年內不得入境美國。(影劇 / 2018-04-03 12:23),,0
ettoday,孫安佐買1600顆子彈正常？ 他PO「2點專業分析」…PTT認證推爆,https://www.ettoday.net/news/20180403/1143738.htm,2018-04-03 12:18,孫安佐（An Tso Sun）在網路上購入1608發子彈、再買零件組裝9厘米手槍，「Home媽」早一步拿走孫房間內放有槍枝、彈藥的行李袋藏匿，動機引人懷疑；對於他只有18歲，就擁有如此龐大的槍械，PTT網友分析「到底1600顆子彈算不算多？」有人指出，美國基本就是 1000發一盒，對軍事迷來說1600顆子彈很正常。(影劇 / 2018-04-03 12:18),,0
ettoday,孫安佐擁槍械「home媽幫忙藏」 美網友質疑：2人還發生什麼事？,https://www.ettoday.net/news/20180403/1143660.htm,2018-04-03 12:15,台灣藝人狄鶯與孫鵬之子孫安佐（An Tso Sun）的案情越來越複雜，因為寄宿家庭媽媽（Home媽）希伯特（Valerie Hibbert）身為律師，竟在警方展開搜索之前，將裝有1608發子彈及組裝槍枝的手提袋藏起來。消息一出，讓許多網友質疑，寄宿家庭被蒙在鼓裡的可能性似乎極低，「這個女人和那個年輕人之間，到底還發生了什麼事？」(國際 / 2018-04-03 12:15),,0
ettoday,FBI調查孫安佐！全因295發校園槍擊常用的「AR-15」子彈,https://www.ettoday.net/news/20180403/1143649.htm,2018-04-03 12:10,孫鵬和狄鶯的18歲讀子孫安佐在美國被逮捕，只因為一句「開玩笑」。當地警方以相當嚴肅的態度看待這個案子，現在美國聯邦調查局（FBI）已經介入調查，證據也上交國土安全局。美國當局會如此謹慎看待此案，其中一個原因是因為孫安佐所藏的軍火之中，有時常被用在校園槍擊案的「AR-15」子彈。(國際 / 2018-04-03 12:10),,0
ettoday,孫安佐1608發子彈來源曝光！ 阿姨「買東西都是刷狄鶯的卡」,https://www.ettoday.net/news/20180403/1143722.htm,2018-04-03 12:00,台灣藝人狄鶯與孫鵬之子孫安佐（An Tso Sun）因為在美揚言恐攻遭到逮捕，賓州警方稍早指出，在寄宿家庭找到一把真槍及1608發子彈，狄鶯雖然一直表示兒子只是開玩笑，但子彈數量之多仍讓警方不敢輕易下定論。而狄鶯的姐姐狄玫則在台灣持續為外甥喊冤：「我不相信我外甥會買這麼多東西！」 (影劇 / 2018-04-03 12:00),,0
ettoday,孫安佐住處搜出槍枝！ 邱彰：對美國警察說謊吃不完兜著走,https://www.ettoday.net/news/20180403/1143550.htm,2018-04-03 11:53,狄鶯、孫鵬18歲的兒子孫安佐（An Tso Sun）被美國賓州警方找到住處藏有一把9厘米手槍和1608發子彈，讓案情更加嚴重。警方原本在他的臥室搜出大量軍事用品，但沒有最關鍵的槍枝，如今孫安佐的「Home媽」卻被發現預先幫忙藏匿槍枝和彈藥。美國執業律師邱彰接受《ETtoday新聞雲》訪問時表示，對美國聯邦警察說謊是一項重大罪名，孫安佐恐怕「吃不完兜著走」，警方一定會「把罪名一條一條加上去」。(國際 / 2018-04-03 11:53),,0
ettoday,狄鶯姊怒轟崔佩儀「落井下石」：你們才虛偽,https://www.ettoday.net/news/20180403/1143677.htm,2018-04-03 11:22,狄鶯、孫鵬赴美救子孫安佐，親姊狄玫這幾天代為出面，她對崔佩儀14歲兒子貝克宇在臉書發文「我不會成為第二個他（孫安佐）」以及崔佩儀道歉一事大怒，狄玫直接怒嗆：「妳寵小孩在網路批評任何人，再來講父母親責任，有嘴巴說別人，沒嘴巴說自己。」(影劇 / 2018-04-03 11:22),,0
ettoday,1600發子彈+自製手槍 朱學恒：孫安佐玩笑「有計畫又專業」,https://www.ettoday.net/news/20180403/1143551.htm,2018-04-03 10:28,台灣藝人狄鶯與孫鵬之子孫安佐（An Tso Sun）日前在因為揚言要在校園發動攻擊，遭到逮捕，美國賓州警方稍早宣布，在孫安佐所住的寄宿家庭中搜出一把手槍以及大量的子彈。宅神朱學恒在臉書上表示驚嘆認為，孫安佐所說的「開玩笑」真的是相當有計畫性。(國際 / 2018-04-03 10:28),,0
ettoday,孫安佐寄宿家庭有「詭異疑點」！ 連美警都搖頭：是個鳥地方,https://www.ettoday.net/news/20180403/1143522.htm,2018-04-03 10:05,孫安佐（An Tso Sun）案情有了新進展，警方表示，寄宿家庭媽媽（Home媽）接到校方通知後，立即把裝有1608發子彈及組裝槍枝的手提袋藏起來，動機令人懷疑；據悉，他的Home媽是律師，且寄宿家庭的地區是低收入戶區，連警長都不解以他的家庭背景，怎麼會住在這種地方，更質疑他的Home媽可能是「職業性」的營利組織。(影劇 / 2018-04-03 10:05),,0
ettoday,孫安佐被爆國中曾談滅屍計畫！ 「分屍後和廚餘一起丟」,https://www.ettoday.net/news/20180403/1143586.htm,2018-04-03 10:03,孫安佐（An Tso Sun）在美國涉嫌威脅攻擊事件鬧得沸沸揚揚，過去教導過他的導師、家教老師和鄰居也接受了訪問，而3日時PTT流傳著一張INSTAGRAM的限時動態，其中一名疑似他的國中同學者寫下過去他所提出的駭人提問。(影劇 / 2018-04-03 10:03),,0
ettoday,美警錯愕！孫安佐「自己組裝9厘米手槍」 8個月收集到1600子彈,https://www.ettoday.net/news/20180403/1143520.htm,2018-04-03 08:47,孫安佐（An Tso Sun）在住處被搜出1608發子彈及一支9厘米手槍，據外媒報導，他的手槍是自行組裝，子彈也是上網購入，打臉之前辯護律師所說「是為了萬聖節比賽的道具」，警方認為他在美國念書僅短短8個月，卻能擁有這麼大量的槍械，有足夠理由懷疑他在計畫些什麼。(影劇 / 2018-04-03 08:47),,0
ettoday,孫安佐律師Home媽「槍彈裝黑袋交另一人」 狄鶯改聘大牌律師,https://www.ettoday.net/news/20180403/1143488.htm,2018-04-03 08:31,孫安佐（An Tso Sun）案重大進展！美國警方最新公布找到孫擁有1把9厘米手槍和1608發子彈，並表示將和掌管恐怖攻擊的聯邦政府官員會面，了解此案是否需要轉給聯邦政府；另外，「Home媽」則把槍彈帶走交給另外一人。而狄鶯、孫鵬也更換掉原本的律師安立奎，改找「大牌律師」羅伯特。據了解，羅伯特在地方上非常有人脈，他表示「我們會盡可能保護他」，此案將於11日首度開庭。(國際 / 2018-04-03 08:31),,0
ettoday,孫安佐私藏「屠殺級軍火」！警：阻止了一場災難 聯邦政府介入調查,https://www.ettoday.net/news/20180403/1143497.htm,2018-04-03 07:20,孫安佐（An Tso Sun）在被逮捕時聲稱沒有槍枝，但警方2日在住處內新發現1600多發子彈，及一把9厘米手槍，軍火強大連警方都忍不住驚呼：「我們認為阻止了一場悲劇。」全案目前由聯邦政府介入調查，證據也將呈報給國土安全局，而他的新律師來頭不小，曾幫助上千名青少年脫罪。(影劇 / 2018-04-03 07:20),,0
ettoday,0403今日頭條／孫安佐Home媽藏「1608發子彈槍枝行李袋」,https://www.ettoday.net/news/20180403/1143492.htm,2018-04-03 07:13,美國賓州上達比（Upper Darby Police）警方公布孫安佐（An Tso Sun）案最新偵辦進度，除了找到孫擁有一把9厘米和1608發子彈外，還發現「Home媽」在員警入屋搜查前，早一步拿走孫房間內放有槍枝、彈藥的行李袋。警方直呼，他們及時避免一場大災難，美國國土安全部門將加入調查有無其他人涉案。孫鵬、狄鶯已入監探視兒子，據律師轉述，兩人情緒都非常激動，雙雙掉下淚水。(生活 / 2018-04-03 07:13),,0
ettoday,快訊／孫安佐律師Home媽趕在警前 急藏「1608發子彈槍枝行李袋」,https://www.ettoday.net/news/20180403/1143482.htm,2018-04-03 05:45,美國賓州上達比警方（Upper Darby Police）公布孫安佐（An Tso Sun）案最新偵辦進度，除了找到孫擁有一把9厘米手槍和1608發子彈外，還發現律師「Home媽」在員警入屋搜查前，早一步拿走孫房間內放有槍枝、彈藥的行李袋。警方直呼，他們及時避免一場大災難，美國國土安全部將加入調查有無其他人涉案。孫鵬、狄鶯已入監探視兒子，據律師轉述，兩人情緒都非常激動，雙雙掉下淚水。(國際 / 2018-04-03 05:45),,0
ettoday,快訊／孫安佐住處搜出1600發子彈！警見9厘米手槍 物證匯報國安部,https://www.ettoday.net/news/20180403/1143471.htm,2018-04-03 02:35,台灣藝人狄鶯與孫鵬兒子、18歲賓州留學生孫安佐涉嫌持非法武器與在美國以言語恐嚇校園用槍，揚言5月1日「射擊」就讀的高中，遭警方逮捕。美國賓州上達比（Upper Darby）警方2日表示，在孫安佐住處內新發現1600多發子彈，包括425發AK-47子彈、295發AR-15子彈、225發散彈槍子彈，以及一把9厘米手槍與663發手槍子彈。(國際 / 2018-04-03 02:35),,0
ettoday,快訊／狄鶯、孫鵬都哭了！ 「見孫安佐穿囚衣」情緒激動,https://www.ettoday.net/news/20180403/1143453.htm,2018-04-03 00:56,狄鶯、孫鵬都哭了！夫妻倆18歲獨子孫安佐因涉恐攻威脅被捕，孩子目前被拘禁在德拉瓦郡監獄，2人急飛美國賓州救兒，在新律師羅伯特的陪同下，在當地時間2日早上進入監獄探望兒子，據律師轉述，夫妻二人一看見兒子，情緒都非常激動，雙雙掉下淚水。(影劇 / 2018-04-03 00:56),,0
ettoday,快訊／狄鶯進賓州監獄看孫安佐！ 苦等5天「新律師陪同」,https://www.ettoday.net/news/20180402/1143379.htm,2018-04-02 23:39,狄鶯18歲獨子孫安佐因涉恐攻威脅被捕，孩子目前被拘禁在德拉瓦郡監獄，她和老公孫鵬急飛美國賓州救兒，除了登記5日的公定探監日，並獲得紐約經文處（駐紐約臺北經濟文化辦事處）協助，2日晚間在新律師羅伯特陪同下，進監獄見兒子！(影劇 / 2018-04-02 23:39),,0
ettoday,45歲吳玟萱「渾圓美乳」噴鼻血！辣開衩到大腿根部,https://www.ettoday.net/news/20180402/1143348.htm,2018-04-02 20:33,45歲吳玟萱美魔女凍齡，之前還被海關誤認20歲少女，她出席環亞美神大賽，一襲黑禮服開衩到大腿根部，胸前更是挖空，只用一顆鈕扣支撐，藏不住渾圓美乳，一登場讓人眼睛大吃冰淇淋。(影劇 / 2018-04-02 20:33),,0
ettoday,貝克宇vs孫安佐 崔佩儀道歉：我會好好教,https://www.ettoday.net/news/20180402/1143189.htm,2018-04-02 17:11,狄鶯兒子孫安佐因涉恐攻威脅被捕，寵兒有名的崔佩儀14歲獨子貝克宇事後也在臉書直言：「希望大家不要把我跟他混為一談，我不會成為第二個他。」被網友讚爆，卻也有人認為貝克宇不該落井下石。(影劇 / 2018-04-02 17:11),,0
ettoday,王大師／什麼才是假新聞？孫安佐持槍事件算嗎？,https://www.ettoday.net/news/20180402/1142042.htm,2018-04-02 12:00,能讓政府沒收人民財富、限縮網路與言論自由的，都是真新聞；只要阻礙實施前述惡行，且對政府正當性有害的，就是假新聞。孫安佐持槍事件是為了協助美國形塑恐攻與槍枝氾濫氛圍，讓像台灣等盟友，要求網友將各類社群媒體內容及電話等個資交給公部門運用。(論壇 / 2018-04-02 12:00),,0
ettoday,孫安佐最快4／5見爸媽、「繼母」 律師不夠力？探視驚見另一人,https://www.ettoday.net/news/20180402/1142739.htm,2018-04-02 08:43,藝人孫鵬、狄鶯赴美國賓州救18歲獨子孫安佐，據了解，兩人已登記5日的監獄公定探監日，且同行的還有「繼母」寄宿家庭女主人，但是否能提早探監，還得看典獄長的裁示。至於原本的委任辯護律師安立奎去探視孫時，發現還有另一名律師，因此傳出他可能被撤換。(國際 / 2018-04-02 08:43),,0
ettoday,獨／花心分手狄鶯親姊 喜翔：說我劈腿60女也可以,https://www.ettoday.net/news/20180401/1142665.htm,2018-04-01 22:38,狄鶯親姊狄玫代為出面，替外甥孫安佐求情，意外曝光她未婚生子，孩子的爸就是喜翔，至於分開原因，外傳他太花心分手，他受訪時坦言：「我當年就是花，現在怎麼說我不在乎，男人要有承擔，說我花心還是柳下惠都可以，現在就是想要好好生活。」(影劇 / 2018-04-01 22:38),,0
ettoday,【ET晚報】天宮一號墜落延後 「預計4月2日再入大氣層」,https://www.ettoday.net/news/20180401/1142552.htm,2018-04-01 18:23,(ET來了 / 2018-04-01 18:23),,0
ettoday,余祥銓未來志向寫「專業殺手」 李亞萍飛加拿大救援,https://www.ettoday.net/news/20180401/1142445.htm,2018-04-01 13:41,余天當初因為白曉燕事件，把三個小孩都送到國外，現在想起來，他覺得相當後悔，「要的話，應該要爸爸媽媽其中一個待在他們身邊。」余祥銓提到，12歲剛過去沒多久，老師要他們寫未來想當什麼，他跟同學討論後寫下「專業殺手」，一開始覺得很酷並沒有想太多，沒想到就被叫去輔導。(影劇 / 2018-04-01 13:41),,0
ettoday,喜翔是孫安佐「親姨丈」 狄鶯親姊認未婚生子：他是爸爸,https://www.ettoday.net/news/20180401/1142382.htm,2018-04-01 12:07,狄鶯親姊狄玫代為出面，解釋外甥孫安佐狀況，透露自己有個26歲醫生兒子也在美國，問到爸爸是誰？她一愣回答：「忘記了。」之後爆出生父就是喜翔，她接到求證電話承認，但僅說：「過去的事情不用再說。」(影劇 / 2018-04-01 12:07),,0
ettoday,打贏美國官司有「關鍵4眉角」！ 陳美鳳救孫安佐…曝4年血淚經歷,https://www.ettoday.net/news/20180401/1142338.htm,2018-04-01 10:34,狄鶯、孫鵬18歲獨子孫安佐揚言恐攻，在美遭到被捕，緊急赴美救兒子，許多法界人士也出面分析案情給予支援，曾在美國打過官司的陳美鳳也分享個人經歷，直言美國人沒有模糊地帶，的確需要遇到好律師才能有機會脫罪，但最重要的還是要孩子自己勇敢面對。(影劇 / 2018-04-01 10:34),,0
ettoday,熬一年...使壞耍心機求生！ 高凌風正妹女兒當櫃姐,https://www.ettoday.net/news/20180401/1142282.htm,2018-04-01 07:28,狄鶯與孫鵬之子孫安佐在美國出事後，「星二代」再度成為網友議論的焦點，但其實不是所有的星二代都是在星爸、星媽的保護傘下，高凌風的女兒葛子楊2017年大學畢業後，想往演藝圈發展卻星途不順，一度改當櫃姐，最近終於有了轉機。(影劇 / 2018-04-01 07:28),,0
ettoday,狄鶯驚爆85歲媽跌傷、小弟神智不清！ 憔悴飛美救兒兩頭燒,https://www.ettoday.net/news/20180401/1142231.htm,2018-04-01 01:02,狄鶯飛奔美國救兒，驚爆家中禍不單行，除85歲媽媽跌傷手臂，小弟也因多年前腦部開刀，目前神智不清，但她反應異常冷靜，讓身邊友人直呼不可思議，然而，其實她在人前堅強，唯獨在姊姊面前脆弱。狄玫31日出面受訪時更哽咽表示，妹妹心急想救子的模樣，她全看在眼裡：「她只會跟我撒嬌，只會哭給我看。」(影劇 / 2018-04-01 01:02),,0
ettoday,寵壞18歲獨子孫安佐？ 狄鶯親姊：她是疼愛，不是溺愛,https://www.ettoday.net/news/20180331/1142049.htm,2018-03-31 21:15,狄鶯、孫鵬18歲獨子孫安佐揚言恐攻，在美遭到被捕，由於狄鶯只有一個獨子，外界討論是否太寵溺兒子，狄鶯親姊狄玫語氣激動澄清：「她是疼愛，不是溺愛。」她也說妹妹的管教方式，就是「武則天模式」，絕不讓兒子當敗類，如果這樣，先把他打死。(影劇 / 2018-03-31 21:15),,0
ettoday,孫安佐未來命運曝光！ 命理師鐵口斷「狀況不樂觀」,https://www.ettoday.net/news/20180331/1142117.htm,2018-03-31 19:39,星二代孫安佐（原名孫華，An Tso Sun），日前因一句「玩笑話」，被警方以涉嫌恐嚇逮捕。他的父母孫鵬、狄鶯已抵達美國救援，他的未來命運備受關注，有命理師受訪透露，他接下來的3年半，狀況都不樂觀。(影劇 / 2018-03-31 19:39),,0
ettoday,星二代出包就找余祥銓 余天嘆：真後悔把兒子送出國,https://www.ettoday.net/news/20180331/1142088.htm,2018-03-31 18:52,資深藝人余天出道多年，現仍在螢光幕前活躍，是娛樂圈的大哥大。他近日看到孫鵬夫妻，為了愛子孫安佐奔波，一想到自己當年，也把么兒余祥銓送出國，回台後闖禍不斷，讓他忍不住感慨：「真的後悔把兒子送出國。」(影劇 / 2018-03-31 18:52),,0
ettoday,狄玫曝光狄鶯「鐵血育兒」教育：她是武則天！,https://www.ettoday.net/news/20180331/1142016.htm,2018-03-31 17:48,狄鶯、孫鵬18歲獨子孫安佐揚言恐攻，隨即表示是玩笑，但在美已經被捕，夫妻倆心急飛美救子，狄鶯姊姊狄玫也十分心急外甥，由於近日來外界質疑狄鶯教育方式，她氣反駁，「她（狄鶯）教小孩好像武則天一樣。」(影劇 / 2018-03-31 17:48),,0
ettoday,若孫安佐被關監獄 狄鶯親姊：我妹絕對活不了,https://www.ettoday.net/news/20180331/1142006.htm,2018-03-31 17:05,狄鶯、孫鵬飛美救子孫安佐，連日來風波未平，親姐狄玫代為出面，她心疼表示，姪子才18歲無法想像他待在那邊有多無助，她不捨說：「如果被判刑，我妹妹一定崩潰。」狄鶯人前堅強，但唯獨在姊姊面前脆弱，她也說：「她（狄鶯）只會跟我撒嬌，只會哭給我看。」(影劇 / 2018-03-31 17:05),,0
ettoday,狄鶯親姊淚崩：她可以為兒子死！雙手合十祈求全家平安,https://www.ettoday.net/news/20180331/1141921.htm,2018-03-31 15:15,狄鶯孫鵬赴美救獨子孫安佐，目前已經抵達機場，全程戴口罩不發一語，狄鶯親姊姊狄玫在台出面，她談到外甥孫安佐是個懂禮貌又貼心孩子，一度講到激動處哭紅眼，「這次事情給我妹妹很大打擊，她心裡一定千刀萬剮，她真的可以為她兒子死的人。」(影劇 / 2018-03-31 15:15),,0
ettoday,17歲貝克宇：我不是第2個孫安佐 崔佩儀「4教育法」網讚爆！,https://www.ettoday.net/news/20180331/1141909.htm,2018-03-31 14:56,星二代孫安佐在美國因涉嫌恐攻被捕，事件至今衍生出過份寵兒、青少年教育等問題。藝人崔佩儀寵兒事蹟在演藝圈也是出了名，因此受到外界議論，她的兒子貝克宇發文回應，表示自己知道事情的嚴重性，也明白什麼玩笑可以開，強調：「我不會成為第二個他。」其實，他從小思想成熟，13歲就捐了上萬塊零用錢給慈善機構，讓崔佩儀相當引以為傲。(影劇 / 2018-03-31 14:56),,0
