ettoday,孫安佐製槍案最後一次開庭 檢察官當庭秀製槍影片明年1／26宣判,https://www.ettoday.net/news/20211215/2147143.htm,2021-12-15 20:52,藝人孫鵬、狄鶯獨子孫安佐在美留學上網購買槍枝零件進行組裝，並嗆要在學校掃射，構製槍未遂罪在美服刑238天，返台後被依違反《槍砲彈藥刀械管制條例》7年以上製槍重罪起訴。15日士林地院9度開庭，公訴檢察官當庭秀《80% Lowers》YouTube頻道槍枝加工教學，想證明孫安佐已將槍枝加工因此觸犯製槍未遂罪。全案辯論終結明年1月26日宣判。(社會 / 2021-12-15 20:52),,0
ettoday,劉嘉玲揭巨星「42億豪宅秘密」！ 走進專屬麻將間一抬頭：嚇死了,https://www.ettoday.net/news/20211028/2111547.htm,2021-10-28 16:48,香港女星劉嘉玲擁有出色演技、美豔外型，實力更是受到許多獎項肯定，知名度享各地。她近日當起脫口秀主持人，專屬節目《嘉玲秀》預告也在28日曝光，她在節目中不但透露了張國榮打麻將的習慣，還爆料林青霞的「豪宅秘密」，引發網友熱烈關注。(影劇 / 2021-10-28 16:48),,0
ettoday,孫安佐超正表姐趴床「炸出雪白UU球」！下半身沒穿 大尺度辣照外洩,https://www.ettoday.net/news/20211028/2111523.htm,2021-10-28 15:55,孫安佐回台後認真經營YouTube頻道，藉著健身、動漫題材受到許多粉絲歡迎，還曾找表姐「艾莉兒」合體拍片，表姐不只長相甜美，身體也是相當火辣，曝光後隨即引起網友暴動，近日艾莉兒重開IG，一連曬出多張只穿內衣的性感床照，渾圓飽滿的胸型全都露，讓人大噴鼻血。(影劇 / 2021-10-28 15:55),,0
ettoday,狄鶯同框孫安佐「乞丐論」談格局 高EQ回敬酸民,https://www.ettoday.net/news/20211025/2108668.htm,2021-10-25 09:17,藝人狄鶯今（25日）一早在臉書曬出與兒子孫安佐同框的合照，位於健身房的兩人都擁有相當令人驚豔的好身材，狄鶯也按照往例分享一些人生觀點，以「乞丐」談起教養的格局。沒想到，卻有網友反用「大麻」照樣造句，不過狄鶯卻僅是淡淡地留下一句：「你怎麼那麼負面。」(影劇 / 2021-10-25 09:17),,0
ettoday,別在廁所滑手機！醫警告「一滑秒沾糞便細菌」：比馬桶髒10倍,https://www.ettoday.net/news/20211020/2105225.htm,2021-10-20 14:57,隨著科技的發達，每個人幾乎手機不離身，走到哪滑到哪，甚至上廁所時也要用手機，不過這樣的行為可能導致手機沾滿糞便細菌，骯髒程度比馬桶還要髒，提醒大家上廁所不要滑手機，也要固定清潔手機。(生活 / 2021-10-20 14:57),,0
ettoday,孫安佐製槍案8度開庭！ 女權名教授美國法鑑定報告出爐,https://www.ettoday.net/news/20211020/2105437.htm,2021-10-20 13:57,藝人孫鵬、狄鶯獨子孫安佐在美就學上網購買槍枝零件進行組裝，更嗆要在學校掃射，構製槍未遂罪在美服刑238天，返台後被起訴《槍砲彈藥刀械管制條例》7年以上製槍重罪。20日士林地院八度開庭，由擅長科技法律的交通大學教授林志潔進行美國法鑑定，報告鑑定認定孫安佐並無犯美國的製槍罪，因並無銷售、散佈及有工具進行加工，故不構成組裝完成。(社會 / 2021-10-20 13:57),,0
ettoday,女孩搭公車姨媽突報到！司機見「白褲被染紅」秒遞外套超暖心,https://www.ettoday.net/news/20211020/2105226.htm,2021-10-20 11:54,大陸河南一名女孩日前搭乘公車時突然月經來，白色褲子都被染紅了，公車司機見狀後，立刻起身，拿起自己的外套給這名女孩，讓她用外套遮蓋一下。隔天女孩將外套洗乾淨後還給公車司機，並附上一塊小蛋糕及便條紙，上面寫著「謝謝公交師傅的呵護」，互動相當暖心。(大陸 / 2021-10-20 11:54),,0
ettoday,小玉出來不用混了！鄉民猜測「比Toyz還慘」：他搞到各個領域的人,https://www.ettoday.net/news/20211019/2104702.htm,2021-10-19 15:00,YouTuber小玉（朱玉宸）涉嫌透過變臉軟體製作A片，受害者不計其數，甚至連網紅館長、總統蔡英文也在名單內，PTT網友討論，小玉歷經這次事件恐怕很難東山再起，光是受害者的求償就賠不完，出獄後也難以挽回形象，「小玉是不是會比Toyz還慘？」(生活 / 2021-10-19 15:00),,0
ettoday,小玉「換臉A片」被罵垃圾！ 孫安佐被Cue爆氣：請問他被判刑了嗎,https://www.ettoday.net/news/20211019/2104342.htm,2021-10-19 09:01,YouTuber小玉（朱玉宸）涉嫌利用AI換臉技術，將各界男女名人變成A片主角，藉此獲利粗估超過千萬，18日被警方上銬逮捕，當日晚間被移送新北地檢，因為財產被凍結，檢方最後准予降至30萬交保候傳。從百萬網紅變成嫌疑犯，對此星二代孫安佐也發聲。(影劇 / 2021-10-19 09:01),,0
ettoday,狄鶯「水滴型胸器」封印！宣布不再做早安圖…揭初衷：只為一個承諾,https://www.ettoday.net/news/20211004/2093648.htm,2021-10-04 13:08,藝人狄鶯4日發文宣布，不會再做長輩圖了！她最近投入製作火辣長輩圖，引發兩極化反應，為此曾強調「照片只是點綴」，但是傲人身材依然成為外界關注焦點。(影劇 / 2021-10-04 13:08),,0
ettoday,狄鶯解放「59年水滴型兇器」！ 限定年輕人心靈雞湯圖：別只看照片,https://www.ettoday.net/news/20210923/2085347.htm,2021-09-23 10:49,女星狄鶯最近在社群網站PO出一系列長輩圖，並稱「這不是長輩圖，這是給年輕人心靈雞湯」，掀起網友的高度討論。她今（23日）一早再度PO照，雖然強調「照片只是點綴」，但傲人胸圍及火辣身材，依舊成為眾人目光亮點，在網路上掀起熱烈討論。(影劇 / 2021-09-23 10:49),,0
ettoday,阿嫂逆襲！暴肥上封面 狄鶯三周狠甩8公斤雪恥,https://www.ettoday.net/news/20210921/2082101.htm,2021-09-21 12:00,女星狄鶯過去和老公飛到美國搶救兒子孫安佐，在美國待了8個月，因壓力太、飲食不正常，體重從四字頭飆58公斤。回台後，靠著一天吃3顆蛋、水果、青菜，好不容易回復以往；沒想到上月21日，狄鶯被周刊拍到她的身材像吹氣球、全身圓滾滾，暴肥到60公斤的照片，嚇壞一票讀者！(消費 / 2021-09-21 12:00),,0
ettoday,狄鶯不忍了！「下衣失蹤」悼龍劭華挨譙 PO照反擊：人有嘴不一定有腦,https://www.ettoday.net/news/20210917/2081546.htm,2021-09-17 08:59,狄鶯最近在社群網站PO出的一系列長輩圖，引起網友的高度討論，但龍劭華離世隔天，她上傳一張身穿黑衣、下身失蹤的辣照當底圖，儘管哀悼文寫著「抱歉，今天為前輩龍劭華哀悼1日，一路好走」，部分網友仍認為很不得體，即使沒有正面回應，但她17日似乎藉由「早安圖」反擊了！(影劇 / 2021-09-17 08:59),,0
ettoday,龍劭華沙發上驟逝 網不捨《含笑食堂》3演員「都已成天使」,https://www.ettoday.net/news/20210916/2080573.htm,2021-09-16 01:31,金鐘視帝龍劭華，昨天（14日）晚間驚傳在高雄拍戲的住處昏倒，送醫搶救無效，享壽68歲。人還在南部拍戲的龍劭華，死訊來得太突然，各界都萬分震驚、無法接受，許多演藝圈的好友與戲迷，都悲痛欲絕。但有資深台劇粉發現，2013年播出，由龍劭華等一線演員所演出的台劇《含笑食堂》，包括龍劭華在內，劇中有3位實力派演員，都在這幾年相繼離開，成為天使，在龍劭華的死訊一出，立刻引起討論，戲迷們滿滿的惋惜。 (生活 / 2021-09-16 01:31),,0
ettoday,狄鶯自製超辣長輩圖「29字悼念龍劭華」！一雙美腿全露 網全看傻,https://www.ettoday.net/news/20210915/2079858.htm,2021-09-15 10:16,資深藝人龍劭華14日在高雄猝逝，享壽68歲，突如其來的消息震驚各界，狄鶯也發文悼念，但她又親手製作了「長輩圖」，放上自己下衣失蹤的性感造型當作主圖，為龍劭華哀悼「一路好走」。(影劇 / 2021-09-15 10:16),,0
ettoday,59歲狄鶯自製「火辣長輩圖」傳家族群組 孫安佐Line被洗版崩潰！,https://www.ettoday.net/news/20210909/2075223.htm,2021-09-09 00:11,資深女星狄鶯出道演藝圈約40年，儘管已經59歲，但仍保持凍齡美貌以及火辣身材，與老公孫鵬情牽20年，婚姻生活仍舊相當甜蜜，夫妻倆育有一子孫安佐，兒子先前雖鬧上社會新聞版面，但近期低調發展個人事業與YouTube頻道，吸引超過6萬人追蹤，沒想到近日兒子卻在社群媒體上無奈爆料她的糗事，引起許多網友熱議。(影劇 / 2021-09-09 00:11),,0
ettoday,米砂爆新歡是《陣頭》男演員！ IG低調曬愛…男友視角露餡,https://www.ettoday.net/news/20210621/2011647.htm,2021-06-21 07:35,2019年網紅「米砂」自曝為孫安佐墮胎，雙方各說各話，占據不少新聞版面，事後她身邊陸續出現與素人男友及排球選手李興國，但2段感情都僅維持3個月就分手收場，她也將重心轉往事業，當起AV影片監製，更自豪月收入多達67萬元。但本刊發現，米砂身邊早有新對象，她為了保護男方選擇「地下戀」，但在親友間早已不是祕密。(影劇 / 2021-06-21 07:35),,0
ettoday,孫安佐女友爆「深夜擅闖遊樂設施」！ 附近全是三角錐…樂PO文,https://www.ettoday.net/news/20210514/1982012.htm,2021-05-14 18:18,網紅阿乃（現改名為：維恩）擁有亮眼外型及火辣身材，是星二代孫安佐的女友，2人曾因網紅米砂的墮胎事件短暫分開，在男方苦心追求下復合，小倆口目前感情穩定。時常透過社群媒體分享日常的她，日前在Instagram限時動態曬出多則深夜出遊的畫面，被發現竟然在非開放時間闖入遊樂設施內。(影劇 / 2021-05-14 18:18),,0
ettoday,媽急尋14歲女兒發現可疑車！上前驚見車內吞吐 氣瘋怒告男網友,https://www.ettoday.net/news/20210509/1977563.htm,2021-05-09 10:54,男子阿宏（化名）與14歲少女小花（化名）交往，但卻2度搞車震，其中一次還將車停在某國小前，剛好小花媽媽正在找小花，看到阿宏車輛可疑，於是抄下車牌後報警，才發現此事，氣得一狀告上法院。嘉義地院審理後，依2個對14歲以上未滿16歲女子性交罪判阿宏6個月徒刑，緩刑2年。(社會 / 2021-05-09 10:54),,0
ettoday,孫安佐製槍開庭喊：想出國散心！法官不買帳「延長限制出境8個月」,https://www.ettoday.net/news/20210508/1977314.htm,2021-05-08 16:46,藝人孫鵬、狄鶯獨子孫安佐遭控在美國製槍未遂罪且在美已服刑238天，但仍觸我國《槍砲彈藥刀械管制條例》7年以上製槍重罪。士林地院日前開庭時，孫還當庭喊著，「想出國散心」，不過法官認為，他仍有逃亡可能，5日裁定他自26日起，延長限制出境、出海8個月。(社會 / 2021-05-08 16:46),,0
ettoday,孫安佐製槍7度開庭 「美國法槍砲彈藥意涵」鑑定人選卡住原因曝,https://www.ettoday.net/news/20210421/1964980.htm,2021-04-21 12:46,藝人孫鵬、狄鶯獨子孫安佐遭控在美國製槍未遂罪且在美已服刑238天，但仍觸我國《槍砲彈藥刀械管制條例》7年以上製槍重罪。21日士林地院開庭，孫委任律師提出3位有法學博士鑑定人。由於鑑定人費用不斐，孫傾向編號3鑑定人，但檢方則認為既然3位都是孫找的，選誰應該都行，故選編號1，最後檢辯雙方未達共識，將由法院決定，全案候核辦。(社會 / 2021-04-21 12:46),,0
ettoday,Janet產後復出「小腹不見了」 放閃老公：你很需要我！,https://www.ettoday.net/news/20210409/1956451.htm,2021-04-09 08:09,Janet（謝怡芬）產後第一個通告獻給衛視中文台《鴻門家宴》但她因為還在坐月子，只能改派老公George與媽媽上場秀廚藝。George精心準備一道家鄉特調的「花生醬味噌魚」參賽，不過他太過緊張，過程中手忙腳亂，漏了許多步驟，Janet在觀賽區忍不住出聲喊話，最後還深情地對George說「你很需要我」，被主持人Ella吐槽：「OK！Stop！」搞笑阻止兩人放閃。(影劇 / 2021-04-09 08:09),,0
ettoday,狄鶯同台兒子孫安佐做料理 一舉動逼哭鍾欣凌,https://www.ettoday.net/news/20210403/1952441.htm,2021-04-03 08:30,狄鶯日前與兒子孫安佐、二姊狄玫上衛視中文台料理節目錄影，比賽過程中評審長鍾欣凌觀察狄鶯母子檔齊心協力做菜感動不已：「一路那麼多風風雨雨，你們沒有對這世界失望，帶著愛與對彼此的信任，那樣就足以讓你們的菜很好吃！」讓狄鶯聽完也感動的鼻酸不已。(影劇 / 2021-04-03 08:30),,0
ettoday,孫安佐製槍案六度開庭 限制出境5月到期...他低調五字回應！,https://www.ettoday.net/news/20210317/1940059.htm,2021-03-17 12:48,藝人孫鵬、狄鶯獨子孫安佐遭控在美國製槍未遂罪且在美已服刑238天，但仍觸犯我國《槍砲彈藥刀械管制條例》7年以上製槍重罪。本案17日六度開庭，孫鵬陪愛子到士林地院出庭。由於檢方起訴書引用的是美國法典，孫的辯護人提出聲請調查證據狀，將找熟稔英美法鑑定人，鑑定上回開庭雙方整理出「不爭執」事項。對於限制出境將屆滿，孫安佐以五字回應。(社會 / 2021-03-17 12:48),,0
ettoday,狄鶯過年曬辣照！零P圖曝「58歲真實身材」 短褲狂露神級美腿,https://www.ettoday.net/news/20210216/1920055.htm,2021-02-16 08:24,狄鶯雖然已經58歲，依舊維持苗條身材與甜美外型，近年更減肥成功，整個人明顯瘦了一大圈，起色也變得更好。近日逢遇農曆新年，她不忘透過社群網站向粉絲拜年，同時曬出一系列美照，大方展現火辣身材，並強調照片完全沒有經過修圖，全是真實呈現。(影劇 / 2021-02-16 08:24),,0
ettoday,孫安佐製槍案五度開庭...神情痛苦跑廁所 孫鵬關心愛兒跟著去,https://www.ettoday.net/news/20210120/1903029.htm,2021-01-20 13:13,藝人孫鵬、狄鶯獨子孫安佐遭控在美國製槍未遂罪且在美已服刑238天，但仍觸犯我國《槍砲彈藥刀械管制條例》7年以上製槍重罪。20日士林地方法院開庭孫安佐由父親孫鵬陪同出庭，孫安佐開庭中途向辯護律師表示身體不適便摸著肚子往廁所奔去，回庭後點頭表示OK，繼續開庭準備程序終結。本案預計農曆年後續開庭。(社會 / 2021-01-20 13:13),,0
ettoday,女友低胸裝「幫孫安佐慶生」穿超辣！他PO合照閃炸：有人陪真欣慰,https://www.ettoday.net/news/20210105/1891785.htm,2021-01-05 12:44,孫安佐原本有在經營YouTube頻道，但近期已鮮少更新，2020年的最後一則貼文則停留在12月11日，事隔多天，他終於在4日PO出新動態，原來是他和女友阿乃（現改名為：恩維）一起低調慶生的合照，「慶祝一下自己21歲了。」(影劇 / 2021-01-05 12:44),,0
ettoday,國片超好看！《孤味》封2020票房王 前10名合計破7億,https://www.ettoday.net/news/20201230/1887280.htm,2020-12-30 16:00,2020年因新冠肺炎疫情影響，許多好萊塢大片紛紛退檔，加上台灣電影今年品質整齊，終於有機會被看見，《孤味》全台票房突破1.8億，毫無懸念奪下冠軍，而同志題材電影《刻在你心底的名字》罕見開出破億佳績，名列亞軍。除了2部破億以外，前10名電影全部突破3000萬，整體表現不錯。(影劇 / 2020-12-30 16:00),,0
ettoday,孫安佐國小為八八水災捐出5萬 狄鶯曝他4歲就做公益,https://www.ettoday.net/news/20201215/1876941.htm,2020-12-15 19:25,藝人孫鵬、狄鶯與兒子孫安佐為「白永恩神父社會福利基金會」拍攝《你在我在因為愛》公益短片，一家人今（15日）同框出席慈善影片發布會。分享暖心善舉的過程中，孫鵬與狄鶯透露，在11年前的「八八水災」時，僅就讀小學的孫安佐就大方捐出家人為他存的積蓄，甚至在學齡前就懂得做公益。(影劇 / 2020-12-15 19:25),,0
ettoday,孫鵬一家同框淚曝心聲「面對未知數」：還有路要走,https://www.ettoday.net/news/20201215/1876904.htm,2020-12-15 16:00,藝人孫鵬、狄鶯與兒子孫安佐為「白永恩神父社會福利基金會」拍攝《你在我在因為愛》公益短片，一家人今（15日）同框出席慈善短片發布會。在分享做公益的同時，感性的孫鵬與狄鶯都忍不住哽咽落下淚來，因狄鶯在拍攝短片過程中，當時重病的母親正在醫院；孫鵬則是想起這兩年來一家人所遭遇的種種。(影劇 / 2020-12-15 16:00),,0
ettoday,老濕姬米砂進軍AV圈！和孫安佐約砲墮胎被罵爆想隱退 整型後重生,https://www.ettoday.net/news/20201212/1874675.htm,2020-12-12 06:14,Youtuber「老濕姬」米砂一直以來影片風格都以兩性、成人話題為主，也常在社群網站上分享她的大尺度辣照，現在她又跨足AV產業，當起影片監製，成功引起話題，首支影片就創下熱銷8000支的好成績。(生活 / 2020-12-12 06:14),,0
ettoday,獨／淡出演藝圈2年！李沛旭當「私人教練」近況曝光,https://www.ettoday.net/news/20201206/1870168.htm,2020-12-06 07:00,李沛旭近2年鮮少出現在螢光幕前，日前宣布換新東家，本來是想專心當選手，卻因為疫情打亂了腳步，以往給人滿滿正能量的他也無奈喊，「覺得自己好廢哦！」乾脆利用閒暇時間當起健身教練，這幾年收入自然不比過去多，甚至賣掉名車，但他說，「不後悔，人生有價值的事情不一定跟錢有關。」(影劇 / 2020-12-06 07:00),,0
ettoday,伯大尼家園前院長涉侵占公款 「A錢全都認」低姿態表示歉意,https://www.ettoday.net/news/20201111/1852357.htm,2020-11-11 21:18,財團法人基督教台北市私立伯大尼兒少家園前任執行長兼院長林鮑基慧，遭指控擔任院長期間，涉嫌侵占伯大尼公款及院友存款約500萬元，檢調今（11）日依公益侵占罪嫌搜索林鮑桃園住處並約談她到案，檢方訊後諭令20萬元交保。據了解，她先前已向伯大尼坦承，因有債務問題才會一時情急動歪念，並已賣房賠償伯大尼部分損失。(社會 / 2020-11-11 21:18),,0
ettoday,孫安佐變低調！出庭No comment...律師：製槍未遂不罰 檢駁謬誤,https://www.ettoday.net/news/20201111/1851985.htm,2020-11-11 15:13,孫安佐今（11日）因製造槍枝未遂案第三度出庭，他黑衣黑帽現身，且一改過往受訪大方談話，格外低調，在律師陪同下和父親孫鵬分開進入法院。開庭時，律師仍強調製槍未遂美國不罰，我國司法應判決公訴不受理；孫鵬則於旁聽席盯著投影大螢幕、手邊翻閱律師的辯護書狀。整場開庭不到一小時結束，孫安佐離去時僅強調不便受訪、No comment。(社會 / 2020-11-11 15:13),,0
ettoday,孫安佐三度開庭「一身黑」消瘦許多 孫鵬提前到法院狄鶯未現身,https://www.ettoday.net/news/20201111/1851727.htm,2020-11-11 10:49,藝人孫鵬與狄鶯愛子孫安佐因前年在美非法持有彈藥，並涉恐怖威脅，在美服刑238日後被遣返，且終生不得入境美，返台被士林地檢署依製造手槍未遂罪起訴。法院11日第3度開庭，他一身黑裝看起來消瘦許多，至於孫鵬則是提前在法庭外等待，狄鶯未出現。(社會 / 2020-11-11 10:49),,0
ettoday,狄鶯媽媽病逝！得知孫安佐被起訴「狀況突然變差」 孫鵬淚崩：我們對不起她,https://www.ettoday.net/news/20201020/1835966.htm,2020-10-20 22:36,藝人狄鶯的媽媽在19日病逝，享壽87歲。孫鵬20日受訪時難過表示，岳母原本身體還不錯，但就是一直掛念孫安佐的風波，前陣子得知外孫在台灣被起訴，健康狀況突然變得很不好，19日醫院發出病危通知，不久後便離世。(影劇 / 2020-10-20 22:36),,0
ettoday,國人7成有經驗！輕視過敏恐釀鼻塞、結膜炎 醫授3穴位迅速緩解,https://www.ettoday.net/news/20201018/1834326.htm,2020-10-18 16:32,天氣越來越冷，很多民眾早上起床時會有流鼻涕的問題，嚴重者還可能會出現鼻塞、吸不到空氣的感覺，多數人會忽視這樣的症狀，但若長期不理會，造成身體處於缺氧的狀態，很可能導致百病纏身，且嚴重影響生活品質！如網紅孫安佐就因「鼻中膈彎曲」過敏，產生鼻塞、長期缺氧、血液循環差和黑眼圈，但在改善手術後，整個人神清氣爽。(健康 / 2020-10-18 16:32),,0
ettoday,孫鵬同台孫安佐「他是我領養的」 《飢餓》互嗆來賓看傻,https://www.ettoday.net/news/20201015/1831999.htm,2020-10-15 11:19,今年上半年孫鵬、狄鶯陸續上中視外景節目《飢餓遊戲》，主持群當時曾頻頻敲碗邀請他們再來上。果然等到孫鵬、孫安佐父子合體，這是2人第一次一起上外景遊戲節目，孫鵬一開始就先給兒子下馬威：「今天想回家的話就乖一點！」深怕兒子戰力太強，還先喊話：「該讓的時候就要讓出來！」(影劇 / 2020-10-15 11:19),,0
ettoday,孫鵬陪兒出庭「分頭離開」 律師：安佐在美寄宿家庭沒爸才買槍,https://www.ettoday.net/news/20201014/1831244.htm,2020-10-14 13:13,孫安佐14日因製造槍枝未遂案出庭，律師仍強調孫安佐在美犯案，美國不罰的罪台灣無審判權，並提到孫安佐案發時年僅17歲，是個剛到美國的小留學生，再加上寄宿家庭裡只有媽媽「沒有爸爸」，與孫安佐的期待有落差，才會上網買槍枝零件，孫鵬、狄鶯相當後悔「所託非人」，而孫安佐的父親孫鵬今日也出席旁聽，離去時未多作表示，與兒子分頭離開。(社會 / 2020-10-14 13:13),,0
ettoday,製槍案孫安佐出庭！未獲解境管：不會特別不爽 預告飲料店復出,https://www.ettoday.net/news/20201014/1831110.htm,2020-10-14 11:10,孫安佐回台遭起訴製造槍枝未遂罪後，士林法院於14日再度開庭，他向學校請假一早就先來法院等候，受訪時笑稱自己「腦子還沒開機」，很喜歡目前的大學生活，對日前聲請解除限制出境被法院駁回，他無奈表示，「這就是命啊，他（法院）想要限制就限制阿，也不會特別不爽」。(社會 / 2020-10-14 11:10),,0
ettoday,直擊吳怡農「神祕結印手勢」逗嗨女友！ 深夜約會行程全被拍,https://www.ettoday.net/news/20201013/1830068.htm,2020-10-13 06:48,吳怡農被本刊曝光另一半後，有人預測他可能閃婚，更有命理師獻計，他趕在2022年前結婚，有助參選台北市長選情。本刊日前捕捉吳怡農與「小農女」的約會行程，而且一行人不停擺出「權力三角形」手勢，隱隱流洩「統治底部大眾」的霸氣。(影劇 / 2020-10-13 06:48),,0
ettoday,孫安佐跪地幫父親洗腳！ 孫鵬泛淚吐真心話：從沒停止愛過他,https://www.ettoday.net/news/20201012/1829467.htm,2020-10-12 11:01,藝人孫鵬與狄鶯的兒子孫安佐日前在美國就讀高中時，因持有槍械及大量子彈，被關押長達238天，之後返台又被士林地檢署起訴，未來恐面臨7年以上或最重無期徒刑。近日他與父親孫鵬上節目，跪地洗腳讓孫鵬忍不住感動泛淚。(影劇 / 2020-10-12 11:01),,0
ettoday,孫安佐半跪「幫爸爸洗腳」吐內心話！雙手猛搓…孫鵬淚：我第一次,https://www.ettoday.net/news/20201011/1829219.htm,2020-10-11 22:34,星二代孫安佐和老爸孫鵬一起參加《超級夜總會》，更在節目中為爸爸洗腳。他第一次幫爸爸奉茶洗腳，並罕見在鏡頭前說出內心話，令孫鵬聽得全程含淚。(影劇 / 2020-10-11 22:34),,0
ettoday,南半球女王遭逼婚…開超狂1條件「生一打孫子」 爸秒嚇退：不行,https://www.ettoday.net/news/20201003/1823221.htm,2020-10-03 07:00,有「南半球女王」之稱的F胸直播主周荀昨（1日）被爸催婚，因為過節只有爸媽兩老在家、覺得無聊。對此周荀笑著跟爸爸討價還價，「誰叫你不接受未婚生子，接受的話就生一打給你。」趣味的對話讓粉絲全笑翻。(影劇 / 2020-10-03 07:00),,0
ettoday,孫安佐開刀…阿乃全程陪伴照顧！ 曬與狄鶯親密合照曝：對我超好,https://www.ettoday.net/news/20200928/1820111.htm,2020-09-28 18:53,狄鶯、孫鵬獨子孫安佐日前被士林地檢署依製造手槍未遂罪嫌起訴，神隱近一個月，27日他在YouTuber頻道上傳一支女友阿乃（現改名恩維）掌鏡拍下的手術影片，說明他為20年隱疾開刀的原因。(影劇 / 2020-09-28 18:53),,0
ettoday,孫安佐為20年隱疾開刀！ 「全身麻醉」術後憔悴樣曝光…女友陪在身旁,https://www.ettoday.net/news/20200927/1819372.htm,2020-09-27 23:08,藝人孫鵬、狄鶯的兒子孫安佐經營YouTube頻道、飲料店，近期卻低調鮮少現身，消失約1個月，27日終於透過影片揭露原因。原來，他不久前去動了鼻中膈彎曲手術，以解決困擾多年的呼吸問題，影片記錄術前、術後的狀態，讓怕痛的他著實吃了不少苦頭。(影劇 / 2020-09-27 23:08),,0
