Source,Title,Link,Date,Summary,Text,Like
PTT,Re: [新聞] 理科太太賣維他命一天超標1850%！網不買,https://www.ptt.cc/bbs/Gossiping/M.1614267889.A.BD6.html,2021-02-25 23:44:47,,奇怪!?484繼潘X宗之後又一個醫療保健領域非醫師賺的比正統醫師多的人物?之前辛普森家庭一年多前Cue到蒼藍鴿時有個台詞:『理科太太隨便唬爛就有百萬訂閱我認真做節目才十幾萬不如去給車撞吧!!』結果本尊還出來回應笑死之前蒼藍鴿就說過台大住院醫師的薪水其實不高大概8萬多(要考慮到醫師養成時間跟工作時數還要值班)應該可以又多一句台詞『理科太太隨便募資就有1700多萬我認真值班月薪才八萬多不如去給車撞吧!!』----,3
PTT,Re: [問卦] 理科太太嘖嘖募資一天就破千萬？,https://www.ptt.cc/bbs/Gossiping/M.1614398882.A.B83.html,2021-02-27 12:07:59,,剛隨手拿起老婆在家樂福買的綜合維他命看一下成份一瓶好像七百多吧看了這成份差異不知道該怎麼說臺灣盤子真的很多？↑這是集資賣的(截自集資網站他們自己貼的圖)↑這是家樂福買的集資賣的有列出的幾乎每項都狂敗大概只贏了生物素，然後多了葉黃素、DHA、Q10、香瓜萃取粉其他每樣劑量都是被碾壓，還少了維他命A、C及其他一堆元素還有各位30cm最愛的鋅更是6mgvs15mg被狂屌打當然綜合維他命這種東西的各種成份不是一定越多越好啦只是隨便逛家樂福就能買到的且價格一半不到一堆盤子去買過氣網紅自己做的，真的是無言剛剛去看網站已經破3000萬了zzz--,20
PTT,[問卦] 理科太太:矽谷創業家!,https://www.ptt.cc/bbs/Gossiping/M.1614243037.A.643.html,2021-02-25 16:50:34,,成功人士通常都有共通的特質理科太太身上也不例外有沒有發現不管美貌姿勢產品願景都驚人的相似!!!下一隻獨角獸找到了而就在台灣!!----,10
PTT,[新聞] 理科太太賣維他命一天超標1850%！網不買,https://www.ptt.cc/bbs/Gossiping/M.1614239323.A.FB9.html,2021-02-25 15:48:38,,備註請放最後面違者新聞文章刪除1.媒體來源:新頭殼newtalk2.記者署名:林若水3.完整新聞標題:理科太太賣維他命一天超標1850%！網不買單：除了傻眼還是傻眼4.完整新聞內文:知名Youtuber理科太太昨日（24）發文宣傳自己的品牌「好好生醫」，並在網路平台「嘖嘖」上發起維他命商品的集資。僅時隔一天，就有網友發現已經募資超過1700多萬，讓不少粉絲相當傻眼，表示「理科太太神話不滅？還是台灣人的錢真的太好賺？」引發不少討論。理科太太在2019年底因自己與老公John的健康因素，宣布暫停YouTube頻道經營。日前她在粉專發文，表示「直到短暫失去了健康的身體、清醒的頭腦，我才明白，沒有了健康，其他重要的事情抓到了多少、順序如何，都不重要了」、「生活可以過得很難、也可以過得很簡單，當你不斷變得更強大，世界會變得更柔軟，，希望讓所有人在高速生活中的你，好好吃飯，好好睡覺，好好生活，籌備許久的這一天終於到了」，於是開啟了網路平台「嘖嘖」募資活動。而平台募資活動才剛過一天，截至今日（25）為止就已經募資到1700多萬元，，已經突破600人贊助，距離理科太太設定的一百萬元，已經超標1850%。消息曝光後，正反評論相當不一，許多網友並不買單，表示「這種市面上都有的基本保健食品也能賣成這樣？」、「除了傻眼還是傻眼」。5.完整新聞連結(或短網址):6.備註:太佛!有理科太太肖像加持...加1000才買--,36
PTT,[問卦]理科太太＝台灣的新垣結衣？,https://www.ptt.cc/bbs/Gossiping/M.1614226343.A.0C2.html,2021-02-25 12:12:21,,剛好想到昨天剛好看到理科太太的新聞他的學識專業外表猶如跟日本的新垣結衣莫名相似且如出一轍我剛好眼科出來看完就這麼覺得如何？-----SentfromJPTTonmySamsungSM-N960F.--,-2
PTT,Re: [新聞] 理科太太賣維他命一天超標1850%！網不買,https://www.ptt.cc/bbs/Gossiping/M.1614435939.A.A58.html,2021-02-27 22:25:37,,原文恕刪小妹剛好是對保健食品做過一點功課的藥師最近有很多朋友也對這款保健品很有興趣，紛紛跑來問我以下的淺見供版友參考重點：這種固定的配方並不適合所有人先來看看B群的劑量（一天吃兩顆）吃兩顆結果還只有B12超過的DRIs??????我還以為我看錯，以為是不是只有一顆的量...OK沒關係，我們飲食一下就補足了老實說B群成本很便宜，各位可以拿自己手邊有的B群看一下含量，沒意外應該都會超過太空人膠囊很多我拿我藥局的B群來說，在含有的成分差不多狀況下，劑量卻多很多，也是一天兩顆一個月換算下來成本不到250撇開價格不談，畢竟研發製程都是成本來聊聊考生、燒腦的上班族需要的是什麼樣的B群吧）通常會是高劑量B1、B2（因為它們參與我們飲食產能代謝的輔酶）且B1型式會是不易被水解的Fursultiamine或Bisbenthiamine，才能有效提供續航力那如果是焦躁易怒、睡不好、經前症候群呢？基本上就是B3、B6、B12劑量高一點的配方來穩定神經那年長者呢？主要會希望有多一點的B6、B9、B12來增加homocysteine的代謝，來預防其堆積造成的大腦衰退講這麼多，是希望我身邊的考生們不要覺得這個可以拿來提神每個族群所需要的配方根本就不同這充其量就是微量補充來看看其他成分：Q10Q10本身是一種很強的抗氧化劑因為是脂溶性所以建議飯後服用，Max：30mg/dBUT！！！Q10不是所有人都能吃因為結構長得很像vit.K，所以warfarin（某種抗凝血藥）使用者不能吃雖然有服用statin（某類降血脂藥）會使體內Q10減少，但要注意患者肝臟功能是否正常再來就是孕婦不建議服用Q10來看看藻油DHA藻油和魚油不太一樣，比魚油少了EPA，適合素食者服用阿115mg...有點加心酸...這個劑量不要說護惱了，連改善眼睛乾澀都做不到一般我會建議改善眼睛乾澀，omega-3至少補充至1000mg（不過life'sDHA的確是很好的原料來源，推推~）硒硒其實有點被過度神化了（抗癌、超級食物...之類的）但其實人日常飲食已經可以補充足夠的硒而且目前很多研究都證實無法降低癌症發生率網路上已經有很多專業的藥師打臉最後來講葉黃素葉黃素對各位過度使用3C的睫狀肌疲勞或假性近視幫助「非常小」葉黃素是累積在黃斑部且一般人劑量6-10mg/d即可若非嚴重case真的沒有必要補充到極量但如果是覺得眼睛疲勞，那基本上這款不會有太大效果基於上述原因，我個人不會被這款保健品吸引本人知道的很有限，僅分享已知的知識供各位版友參考若有筆誤還請指正，感謝大家版?嘖不討她，過』天便經都--版友您好，每個人對保健食品的需求與劑量不同喔！我個人有補充含花青素劑量多一點的葉黃素、魚油、鈣片、維生素D等可以向您信賴的專業人員諮詢~版友您好，每個人適合的配方不同，我也不想在這邊有任何業配嫌疑，純粹是分享自己對太空人膠囊的想法，沒有推薦任何人保健品組合。至於葉黃素屬於累積在黃斑部，針對我有糖尿病家族史會比較建議補充來預防黃斑部病變；而我特別強調「花青素」是因為可以明顯緩解我過度用眼的睫狀肌疲勞我從來沒有說過葉黃素沒用啊...有錯開啊啊啊啊大家問太多了啦我只是想分享我對這款保健品的看法QQQQQQ,92
PTT,[問卦] 理科太太484過氣了？,https://www.ptt.cc/bbs/Gossiping/M.1610713451.A.5B3.html,2021-01-15 20:24:08,,嗨大家今天過的好嗎~好像是前年突然爆紅然後還可以請到劉德華蔡依林這種大牌明星一起拍片但是破百萬訂閱之後現在一直卡在一百零幾萬沒在動了請問她現在是不是不紅了？--話說埋料犬犬也很久沒有出片了...,8
PTT,[問卦] 理科太太怎麼只剩十幾萬觀看？,https://www.ptt.cc/bbs/Gossiping/M.1609833511.A.033.html,2021-01-05 15:58:29,,身為台灣的百萬訂閱youtuber怎麼現在影片的觀看平均都只有十幾萬？這觀看數跟訂閱也差太多了吧幾乎只有接近兩成的人欸到底說為什麼阿？？--,29
PTT,Re: [新聞] 理科太太賣維他命一天超標1850%！網不買,https://www.ptt.cc/bbs/Gossiping/M.1614439976.A.BB0.html,2021-02-27 23:32:54,,"理科太太她鐵粉的特質大概就是:不喜歡用腦,不喜歡看書,覺得看youtube就可以學習到很多知識,youtuber說這個有用所以我覺得應該是真的,反正都無腦去看她的影片了,無腦花大錢買保健食品也不奇怪了。--",7
PTT,Re: [新聞] 快訊／理科太太離婚首發聲！　「我正用,https://www.ptt.cc/bbs/Gossiping/M.1635924922.A.189.html,2021-11-03 15:35:20,,原文恕刪，我無意中YT看過她跟她老公的一集說要停播一陣子，那老公的臉色黑到像要打人一樣根本不想上鏡被硬拉上去解釋，所以老公根本就不想出鏡被這女的想紅逼上去露臉的--,8
PTT,Re: [新聞] 理科太太賣維他命一天超標1850%！網不買,https://www.ptt.cc/bbs/Gossiping/M.1614443538.A.17F.html,2021-02-28 00:32:15,,"這是在蝦皮買的三多綜合維他命這是理科太太的一、理科太太一份要吃兩顆，三多一份一顆二、以價格來看三多300錠420元，平均一份1.4元理科太太以最大方案計，一瓶60顆(30份)1500元，平均一份50元三、理科太太劑量僅贏過:生物素、葉黃素、硒、DHA，還有那什麼酵素Q10、香瓜萃取粉其他都輸四、三多綜合維他命還多一堆營養成分，理科太太都沒有--【結論】「生物素、葉黃素、硒、DHA，還有那什麼酵素Q10、香瓜萃取粉」的價值原來這麼高呀--☆☆認識台灣地理篇選擇題☆☆(多選題)沒正確答案喔^.<(全)1.請問北部是指:(A)大安區(B)台北市(C)台北縣市,基隆(D)新竹以北(全)2.請問台北是一個:(A)國家(B)皇城(C)統一協會(D)蛆蛆的家(全)3.請問基隆相對於台北為:(A)南部地區(B)鄉下地區(C)蠻荒地區(D)未開化地區(全)4.請問台北到南部需要:(A)上語言學校(B)台語托福(C)辦理綠卡(D)考牛車駕照(全)5.請問南部到台北需要:(A)偷渡(B)到大使館面談(C)薪資證明(D)門都沒有--真是個低劑量的好理由啊",41
PTT,Re: [新聞] 理科太太賣維他命一天超標1850%！網不買,https://www.ptt.cc/bbs/Gossiping/M.1614439537.A.3A5.html,2021-02-27 23:25:35,,看到這個新聞就會讓我想到讓子彈飛的劇情三大家族一人需拿一百兩出來看到他們拿了百姓也會跟著拿出來接著這三百兩必須如數奉還百姓的錢再拆帳一直強調募款超標真的很有趣--,1
