Source,Title,Link,Date,Summary,Text,Like
ettoday,玖壹壹洋蔥年後PO照「整個人瘦一圈」！　粉絲驚：快認不出來,https://www.ettoday.net/news/20190210/1375040.htm?from=pctaglist,2019-02-10 23:56,本土饒舌團體「玖壹壹」舉辦粉絲見面會，10日來到台中廣三SOGO百貨廣場，在粉絲到場熱情支持下，圓滿結束演出。洋蔥PO出活動側拍照片，開心表示「比我想像多人」，卻被網友發現似乎瘦了一圈，甚至讓部分人大呼「快認不出來！」,,0
ettoday,考試造句！國小生填「玖壹壹神曲」老師高分給過　萬人笑噴：考卷有聲音,https://www.ettoday.net/news/20190208/1332710.htm?from=pctaglist,2019-02-08 20:15,小孩有在跟潮流聽歌！一名小學生在寫國語作業中的照樣造句時，二話不說就把腦中「玖壹壹」的《9453》裡的歌詞填上，還獲得老師的畫紅筆稱讚。作業照在網路曝光後，引來網友笑說，「這作業竟然有聲音！」,,0
ettoday,用洋蔥擦窗戶超乾淨！客廳、臥房大掃除清潔秘訣曝光,https://www.ettoday.net/news/20190127/1366817.htm?from=pctaglist,2019-01-27 13:28,掃客廳看到滿滿雜物，該從哪裡開始清？生活圖文作家《我是阿明》分享，打掃前要先清掉雜物外，是遵守從房間的「上到下」、「裡到外」、「乾處到濕處」的原則，就能夠更有效率的完成清潔工作。,,0
ettoday,玖壹壹洋蔥因「一顆過期貢丸」交到現在女友,https://www.ettoday.net/news/20190124/1364786.htm?from=pctaglist,2019-01-24 15:43,本土天團「玖壹壹」日前上公視台語節目《台灣金頌》，分享新專輯的過程，洋蔥也聊到成名以前曾在便利商店打工，現在的女友是當時店裡的常客，有次對方拿了咬過的貢丸，要他也吃吃看是否過期，因此變熟識最後才在一起。,,0
ettoday,洋蔥與紅蔥頭差別在哪？｜克里斯丁聊料理,https://www.ettoday.net/news/20190113/1351496.htm?from=pctaglist,2019-01-13 20:30,西式料理當中不論是製作醬汁、熱炒或者是熬湯都會使用到長得像是洋蔥，但卻又不太一樣，長的稍微細長的Shallot紅蔥。它到底是怎樣的食材？,,0
ettoday,洋蔥循環經濟　發揮洋蔥到極致到「蔥滿」希望,https://www.ettoday.net/news/20190104/1348256.htm?from=pctaglist,2019-01-04 19:41,國立屏東科技大學農業推廣委員會輔導恆春鎮農會，在屏科大薄鹽醬油之父─謝寶全教授的指導下，利用恆春半島洋蔥的辣香甜搭配恆春生產的黑豆，釀製出風味獨特口感甘醇代表恆春的新產品「洋蔥醬油」，並充份利用洋蔥，開發出洋蔥系列產品，把洋蔥的價值發揮到淋漓盡致，品嘗過的人都說讚。,,0
ettoday,【廣編】有洋蔥！玉泉徵件創意影片　評審大讚獲獎作品傳遞細膩情感,https://www.ettoday.net/news/20190103/1347331.htm?from=pctaglist,2019-01-03 17:41,由台灣菸酒股份有限公司主辦的第一屆「這支短片有洋蔥」線上影片徵件比賽，由多位影視專家及業界代表組成的評審團隊，經過專業判斷，評選出得獎者，頒發獎金與獎品，藉此鼓勵青年學子發揮原創精神，並同時宣導正確飲酒的價值觀。,,0
ettoday,南部人吃鹹酥雞配「解膩神物」　台中居民崩潰：到底哪來的吃法...,https://www.ettoday.net/news/20190101/1345201.htm?from=pctaglist,2019-01-01 18:08,台灣南北的飲食口味常常有些差異，例如南部人吃「草莓」大多會沾糖粉，其他地區則是沾蜂蜜或是巧克力醬。南北差異也在「國民小吃」鹹酥雞上看得到，有網友日前就驚訝表示，自己買的鹹酥雞裡面竟然加了「生洋蔥」當配料；透過網友留言才知道，原來把「洋蔥」當炸物配料，在台南、高雄都很常見。,,0
ettoday,玖壹壹洋蔥撇「預謀求婚」喜訊　澄清：只是私下玩笑話！,https://www.ettoday.net/news/20181218/1334423.htm?from=pctaglist,2018-12-18 23:17,平民天團玖壹壹剛結束小巨蛋演唱會，投入新專輯宣傳，而瘦身有成的洋蔥被爆出將和女友黃怡萱結婚，《ETtoday星光雲》記者求證混血兒娛樂，公司表示，「只是我們在公司閒聊的玩笑。」,,0
ettoday,專家教戰！最強洋蔥式穿法「只要3層」這樣做　保暖又不悶熱,https://www.ettoday.net/news/20181217/1332804.htm?from=pctaglist,2018-12-17 20:01,近日首波冷氣團報到，許多民眾都陸續拿出冬衣保暖，雖然大多數人都聽過「洋蔥式穿法」，但僅少部分人真正了解「怎麼做」，專家表示洋蔥式穿法不是穿得像「洋蔥」，有時保暖過度反而引發不適，其實基本的洋蔥式穿法只要3層，保暖兼顧透氣才是關鍵。,,0
ettoday,特寫玖壹壹「小巨蛋包廂」　女星站一排「扭臀辣舞」High炸！,https://www.ettoday.net/news/20181209/1326446.htm?from=pctaglist,2018-12-09 11:08,本土饒舌團體「玖壹壹」以獨特的台氏曲風大受歡迎，8日在台北小巨蛋開演唱會，吸引不少藝人好友到場支持，丫頭、小優、茵茵等人在樓上的包High到站起來熱舞，興奮到tag玖壹壹3位團員的IG：「應該發我們去台上跳舞的呀！」,,0
ettoday,就是要監視著...切洋蔥吃貨貓堅持不走　一抬頭爸媽驚呼：哭了！,https://www.ettoday.net/news/20181117/1308952.htm?from=pctaglist,2018-11-17 18:11,洋蔥...原來是因為洋蔥。網路上最近瘋傳一則影片，內容是這晚有隻吃貨貓咪看到2位奴才準備煮好料的，趕緊跑到廚房來監視，沒想到當牠低頭低了一會兒，再次把頭抬起來時，居然淚流滿面，但其實真相是被洋蔥薰的。影片不到一週就突破500萬次觀看次數，但網友們的回覆也相當兩極。,,0
ettoday,超神奇止咳溫補聖品　「電鍋洋蔥滴雞精」,https://www.ettoday.net/news/20181116/1307836.htm?from=pctaglist,2018-11-16 19:00,這道滴雞精可說是結合了傳統智慧的補品，洋蔥有驅風、活血、補腎氣的效果，熬煮後會引出特有的甜味，甚至有「西方柴魚」的美譽；雞精則富含人體必須的氨基酸和蛋白質，能增強抵抗力並恢復體力，可說是美味又實用的最佳拍檔！更棒的是，這道滴雞精只要用坐月子的新手媽媽來說更是超棒的補品唷！,,0
ettoday,影／抹過世嬤口紅出嫁！急找「20年前色號」　穿婚紗緊握遺物：我想妳了,https://www.ettoday.net/news/20181108/1300875.htm?from=pctaglist,2018-11-08 14:22,林姓女子即將要結婚了，但她還有一個心願想達成。她在外婆過世後，一直留著一支外婆生前的口紅，但口紅現在已經氧化到看不出顏色了，她很希望婚禮那天能夠畫上外婆最愛的口紅顏色，帶著和外婆相處的回憶完成婚禮，希望能有專業的美妝高手幫忙她，找到這個記憶中的色號。,,0
ettoday,小病人「400天的等待」　施景中曝「萬聖節鼻酸小故事」,https://www.ettoday.net/news/20181031/1294890.htm?from=pctaglist,2018-10-31 18:44,近日全台各地不分年齡都在過萬聖節，被網友封稱「仁醫」的台大醫生施景中也在臉書分享一個故事。他說，去年有個病童私訊萬聖節活動主辦人，內容是「每天都在等萬聖節，因為已經400多天無法走到戶外」，如果這位小朋友已經開心回家，請再到醫院和大家團聚。,,0
ettoday,阿嬤回收誤撿僅值百元電扇　失主開口：拿3000元來和解,https://www.ettoday.net/news/20181027/1291586.htm?from=pctaglist,2018-10-27 11:32,67歲蘇姓拾荒阿嬤，誤檢他人循環扇等物品，警方據報循線將她查獲而吃上竊盜官司，蘇姓拾荒阿嬤向失主鞠躬道歉，詢問是否願意和解，失主提岀2千元和解金，偵查員葉水皓得知蘇婦生活並不富裕，於是便私下塞了2千元給蘇婦，讓蘇婦有錢與失主和解，以期司法輕判，葉員愛心令阿嬤當場感動到眼框泛紅，感激之情、溢於言表。,,0
ettoday,春風：發生很多不好的事　玖壹壹半夜「做了決定」PO文嚇傻網,https://www.ettoday.net/news/20181026/1290901.htm?from=pctaglist,2018-10-26 13:04,玖壹壹團長春風日前辦慶生趴，怎料大根（黃亮鈞）隨後在KTV爆發鬥毆衝突，當下並不在現場的他，名字卻被提及，讓他很是無奈，距離事件浮上檯面至今已過了9天，他26日凌晨突然和成員洋蔥、健志上傳一段影片，「最近發生了很多事情……有件事情想跟大家說……。」頓時嚇壞不少粉絲。,,0
ettoday,抗流感！必吃「超強免疫3料理」　鮭魚炒飯+OO牛奶上榜,https://www.ettoday.net/news/20181018/1284217.htm?from=pctaglist,2018-10-18 13:30,面對流感來襲，您的防禦措施準備好了嗎？除了施打流感疫苗保護自己之外，大千綜合醫院也提醒民眾，可以多攝取增加抵抗力的食物，並搭配充足睡眠及適度運動，幫助抵抗各種細菌與病毒的入侵，就能遠離流感侵襲。,,0
ettoday,蔥、薑、蒜挑掉不吃？「地獄級後果」嚇哭網友...罹癌＋老更快,https://www.ettoday.net/news/20180923/1262767.htm?from=pctaglist,2018-09-23 08:31,別再挑掉蔥了！許多人看到料理當中有蔥、薑、蒜會習慣挑掉，但其實這樣的行為反而讓自己深陷「老化地獄」和「癌症地獄」中，因為這些調味料除了能替食物增添特殊香氣，還富含第七大營養素－植化素，尤其洋蔥所含之酮類化合物是所有蔬果之最，抗氧化效果良好，想要永保青春、遠離癌症的人還敢挑掉嗎？,,0
ettoday,認識Soffritto義大利三大元素　克里斯丁一分鐘料理,https://www.ettoday.net/news/20180918/1260532.htm?from=pctaglist,2018-09-18 09:50,”Soffritto”在義大利文當中就是「慢炒」的意思，同時也代表將洋蔥、紅蘿蔔、西洋芹3種食材透過慢炒出汁，把風味完全調和的基底食材。Soffritto被廣泛運用在義大利各色料理，如義大利麵、燉飯、燉蔬菜湯....等料理當中。,,0
ettoday,羅志祥、玖壹壹都出席！　他辦生日趴「全場都是A咖」,https://www.ettoday.net/news/20180910/1255143.htm?from=pctaglist,2018-09-10 01:52,諧星大根（黃亮鈞）和圈內好友大飛，8日在公館舉行生日演唱派對，兩人脫去搞笑形象，化身唱將在舞台上大聲飆歌。他的派對上，被捕捉到嘉賓幾乎全是大咖，「小豬」羅志祥、玖壹壹都是到場，小禎庹宗康、邰智源、納豆和KID也現身，全是比壽星大咖好幾等的A咖，好人緣可見一斑。,,0
ettoday,爸爸變身半裸隧道人！逗貓遭忽視...　網笑歪：怎有洋蔥啦,https://www.ettoday.net/news/20180904/1250950.htm?from=pctaglist,2018-09-04 16:37,奴才犧牲很大，可惜主子不領情。花蓮一位爸爸為了逗11個月大的曼赤肯「Polly」開心，不惜犧牲色相，半裸頭套「貓咪隧道」要讓牠開心，沒想到Polly完全不理爸爸，當場捲起尾巴調頭就走，爸爸則崩潰吶喊「X～」，讓一旁媽媽快笑瘋。,,0
ettoday,超狂爺爺種出4.5kg「巨無霸洋蔥」　可供30人吃：想越種越大,https://www.ettoday.net/news/20180826/1244145.htm?from=pctaglist,2018-08-26 00:58,英國唐卡斯特的74歲退休鍋爐工人斯托瑟(David Stothard)與52歲兒子花費了數月時間，種出了一顆巨大洋蔥，這顆洋蔥重達10磅（約4.5公斤），圓周長達27英吋（約69公分），供30個人食用也不成問題。斯托瑟強調，要種植出巨型蔬果的方法就是尋找最好的種子，還要有懂得如何照顧與栽種的人。,,0
ettoday,限定只有6萬組！「屏東落山風洋蔥涼拌組合」全聯獨家開賣,https://www.ettoday.net/news/20180823/1242459.htm?from=pctaglist,2018-08-23 18:23,為讓民眾更了解國產洋蔥的好味道，全聯與屏東縣政府合作，推出限定6萬組的「屏東落山風洋蔥涼拌組合」，以及洋蔥陳列販售。,,0
ettoday,偷早餐店兩顆高麗菜竊盜　結果竟有洋蔥！,https://www.ettoday.net/news/20180821/1240552.htm?from=pctaglist,2018-08-21 16:20,鹽埕所員警於107年08月19日0時許接獲民眾報案，其表示放置於金華路某早餐店內的2顆高麗菜遭竊，警方不因小案而不辦，仍積極調閱監視器鎖定犯嫌後於當日下午立即逮獲竊嫌，然竊嫌因家境困苦，才會一時起了貪念，最後警方還自掏腰包買米送給竊嫌，並叮囑其不得再犯。,,0
ettoday,洋蔥復合前女友！　七夕放閃「穩定向前」樂當攝影師,https://www.ettoday.net/news/20180817/1237631.htm?from=pctaglist,2018-08-17 15:12,七夕情人節到來，玖壹壹17日推出搖滾爆裂情歌《恐怖情人》，有一種愛情類型名為血腥，那種愛執著而強烈，這個關係是危險平衡，不輕言結束你我，甚至不擇手段只要在你身邊，最新單曲《恐怖情人》在這樣的靈感下醞釀而成，玖壹壹歌曲唱著大眾心聲，歌詞間可窺見對現代社會的觀察與思考。,,0
ettoday,影／《玖壹壹》洋蔥百萬車遭破窗偷包　竊嫌得手400元早花光,https://www.ettoday.net/news/20180808/1230674.htm?from=pctaglist,2018-08-08 16:37,知名樂團玖壹壹成員洋蔥（本名陳浩宇）日前百萬名車停在台中市區紅線，遭人砸破車窗竊取車內財物，警方迅速蒐證比對確認竊嫌身分後，7日順利逮人。李姓竊嫌供稱，他擔心行車紀錄器有錄到他作案才拿走，除了現金400元，其他物品全丟大排了。警方除將他依竊盜罪嫌送辦外，也將持續追查贓物下落。,,0
ettoday,獨家／玖壹壹洋蔥「百萬車遭竊」　車窗破、卡全被偷！,https://www.ettoday.net/news/20180805/1228442.htm?from=pctaglist,2018-08-05 17:48,玖壹壹洋蔥5日下午在台中逛街，百萬愛車意外被敲破玻璃，甚至行車記錄器被拔起、相關身分證件也被偷走，懷疑被有心人士鎖定，洋蔥已經在第一時間報案，交由警方處理。,,0
ettoday,小豬、玖壹壹合體！站一排演唱《我跟你卡好》嗨翻了,https://www.ettoday.net/news/20180802/1226360.htm?from=pctaglist,2018-08-02 20:38,玖壹壹新單曲《我跟你卡好》邀來羅志祥（小豬）跨刀獻聲並擔任MV編劇，還友情演出最帥保全，首度在《娛樂百分百》合體，搭配逗趣舞蹈笑翻全場。愷樂羨幕不已，當場向玖壹壹邀歌：「一直好想唱台語歌唷。」團員之一的洋蔥立刻答應，還爽快表示：「明天開始做！」,,0
ettoday,洋蔥帶霸氣喊：我花錢　一掏口袋⋯傻眼了,https://www.ettoday.net/news/20180727/1222290.htm?from=pctaglist,2018-07-27 19:19,玖壹壹中的洋蔥近日帶著旗下團體「草屯囝仔」上《綜藝3國智》宣傳，三人自組一隊，認真看待每項關卡，還依照每人的強項分配挑戰項目。張立東透露：「他們三個都是搶先所有人先到錄影地點討論遊戲戰術，看來真的很想下班。」,,0
ettoday,饒舌團體躺粉絲上被狂摸！　單身團員收女粉私訊求愛超羞,https://www.ettoday.net/news/20180714/1212782.htm?from=pctaglist,2018-07-14 15:25,草屯囝仔將於8月12日在台北華山Legacy舉辦「為此時而唱」生涯首場演唱會，兩人成軍來征戰上千場廟會、中南部商演，自封是「廟會文青」的他們，不僅會扛轎入場、更有「攢轎腳」、過火儀式，他們也公布當天嘉賓人選，邀請玖壹壹的洋蔥同台，更首先公布歌單，將演唱突破400萬點閱的《愛我你會死》，讓粉絲期待。,,0
ettoday,醫生大推喝「洋蔥汁」甩肥肚　平坦小腹不是夢,https://www.ettoday.net/news/20180701/1193714.htm?from=pctaglist,2018-07-01 17:03,小腹是許多女性的困擾，很多人甚至四肢纖細，但就是無法甩開小腹陰霾，對此南韓中醫師柳勝善有解，他推薦能喝「洋蔥分解果汁」試試看，改善小腹問題。,,0
ettoday,洋蔥曬親妹合照！「五官100％神複製」　網抱頭崩潰：我認不出來,https://www.ettoday.net/news/20180623/1197496.htm?from=pctaglist,2018-06-23 20:00,洋蔥是「本土天團」玖壹壹的成員之一，平時常在社群網站上發文，分享生活、工作點滴。23日他在IG分享和妹妹的童年合照，但兄妹倆的長相竟然一模一樣，就像是雙胞胎一般，相似度高達100％，嚇壞一票網友，驚呼：「你們確定不是雙胞胎？」,,0
ettoday,玖壹壹升格當老闆！健志16歲當店長...8千薪水全買這個,https://www.ettoday.net/news/20180615/1191901.htm?from=pctaglist,2018-06-15 19:07,玖壹壹推出今年首支單曲《Working Holiday》，以自身經驗分享：「每一位在外地打拼的人，要能學習著吃苦，縱使有多累也是豐富的經驗，才能成為自己的Rich man。」有趣的是，歌詞寫「太陽曬的我攝護腺都腫大」，被問是否有這個症狀？春風回應：「單純聽起來好笑，所以才加進歌詞裡面，沒有特別理由。」,,0
ettoday,新壽辦捐發票換鳳梨　助偏鄉孩童課輔、閱讀教育基金,https://www.ettoday.net/news/20180614/1190509.htm?from=pctaglist,2018-06-14 07:14,新光人壽得知屏東慈惠善導書院栽種鳳梨過盛難銷，恐將缺少收入難籌措偏鄉孩子課輔等基金，6月19起連續三天邀請民眾到新光人壽摩天大樓廣場參與「捐發票換鳳梨、送報到山嶺」二個公益活動。,,0
ettoday,影／有洋蔥　女孩沉默不語症　為陪伴口腔癌難說話父親,https://www.ettoday.net/news/20180601/1182187.htm?from=pctaglist,2018-06-01 17:52,有個小女孩選擇不語症，令學校老師擔憂，原來她為了陪伴罹患口腔癌不能言語的父親，而以沉默、寡言回應。這是臺灣夢兒少社區陪伴扎根計畫的真實案例，並由台灣人壽出資拍攝為《第三個願望》廣告，用愛關懷你我周遭。,,0
ettoday,玖壹壹洋蔥跨刀師弟團！　一唱就進榜「拿下5大冠軍」,https://www.ettoday.net/news/20180527/1178315.htm?from=pctaglist,2018-05-27 15:28,混血兒娛樂嘻哈團體「草屯囝仔」音樂能量大爆發！樞育與阿倉兩個年輕音樂人以台語為基底，正港本土文化為靈感，近來推出《媽祖》、《愛我你會死2018》兩首新歌轟炸樂迷耳朵，在好歌加上團員賣力宣傳下，《愛我你會死2018》這首歌席捲台語樂壇，一舉奪下KKBOX五大榜單冠軍！,,0
ettoday,「饒舌男團」卡司Hen強！　洋蔥、鄭人碩、林辰唏全來了,https://www.ettoday.net/news/20180518/1172440.htm?from=pctaglist,2018-05-18 14:39,混血兒娛樂旗下嘻哈男團「草屯囝仔」銳不可擋，團員阿倉與樞育2018年音樂能量大爆發，推出最新單曲《愛我你會死2018》，新歌除了有洋蔥獻聲加持，MV更是邀來金馬獎最佳男配角鄭人碩與林辰唏兩位實力派演員同台飆戲！,,0
ettoday,4顆洋蔥50！她挑好結帳　老闆娘霸道換「1／3大小」吼：誰標的價,https://www.ettoday.net/news/20180509/1165959.htm?from=pctaglist,2018-05-09 13:28,一名女網友習慣到某間果菜行買菜，那裡的價錢公道，還有帥哥店員，但老闆娘和兒子卻讓她不敢領教。某回，她和表哥看到洋蔥4顆50元，於是挑了4個大的去結帳，沒想到老闆娘硬是拿原本3分之1大小的洋蔥替換，還在他們面前高分貝大吼，「誰標的價？這樣有賺嗎？」,,0
ettoday,可成挺蔥農　採購7噸洋蔥送2500位同仁,https://www.ettoday.net/news/20180509/1166000.htm?from=pctaglist,2018-05-09 11:14,"可成（2474）挺蔥農！繼去年認購高麗菜後，今年則向恆春農會採購七噸多洋蔥分送公司近2,500位同仁，紓解洋蔥產地供過於求導致價格崩跌的壓力。",,0
ettoday,助蔥農　水公司第十區處員工認購洋蔥100包,https://www.ettoday.net/news/20180505/1163836.htm?from=pctaglist,2018-05-05 23:16,今年因南部洋蔥生產過剩，不但造成市面上洋蔥供需失衡而滯銷，亦嚴重影響蔥農生計。自來水公司第十區管理處處長李慶興暨全體員工，為協助蔥農解決滯銷問題，以及關懷弱勢族群，積極響應自來水公司董事長郭俊銘呼籲，踴躍認購100包洋蔥。,,0
ettoday,【廣編】17公噸洋蔥到新竹　三陽買洋蔥助蔥農,https://www.ettoday.net/news/20180503/1162367.htm?from=pctaglist,2018-05-03 18:23,三陽工業(2206)響應企業助蔥農活動，5/2宣佈總計認購17公噸，三陽工業集團董事長吳清源也號召員工多吃洋蔥，協助屏東農產品去化庫存，紓解產量過剩壓力，讓農民生計獲得保障，盼能拋磚引玉，邀請大眾共同加入「買洋蔥助蔥農」行列。,,0
ettoday,洋蔥文　5張發票換4顆　新光黃昏市集搶救小農大作戰,https://www.ettoday.net/news/20180430/1160626.htm?from=pctaglist,2018-04-30 22:19,搶救洋蔥大作戰！5月4、11及18日連續三周的星期五下午3~7點，在新光站前摩天大樓廣場前有新光小農黃昏市集洋蔥促銷推廣活動，民眾選擇以下兌換方案之一，像是用5張發票就可以交換4顆洋蔥。,,0
ettoday,今年洋蔥汁多味甜又飽滿！國產當季直送超方便,https://www.ettoday.net/news/20180417/1152118.htm?from=pctaglist,2018-04-17 18:23,行政院農業委員會農糧署表示，由於今年冬季氣候穩定，日夜溫差大，且少雨乾燥，適合洋蔥生長，粒粒鮮甜飽滿，品質極佳。該署專案輔導產地農民團體辦理多項措施，增加行銷通路，便利消費者選購，也透過貿易商辦理外銷，讓國內外的消費者都能即時品嚐當季的臺灣好滋味。,,0
ettoday,洋蔥1顆6元10年新低！墾丁「涼拌洋蔥」250元挨批　業者：醬汁用心,https://www.ettoday.net/news/20180417/1151645.htm?from=pctaglist,2018-04-17 10:54,墾丁亂開價事件頻傳，天價滷味、漢堡和乾麵更被戲網友稱為「墾丁三寶」。恆春洋蔥價格今年創10年來最低，一顆約6元，但有消費者不滿到餐廳點大份的「涼拌洋蔥」，要價250元，直呼「難怪墾丁會倒」。對此，業者強調，是先收費才下單，消費者事前已知價格，且洋蔥價貴時，「我們也是這樣賣，只是最近比較便宜。」業者也強調，醬料是師傅問了同業後用心調配。,,0
ettoday,屏東落山風洋蔥滯銷！企業認購6000袋合共90公噸,https://www.ettoday.net/news/20180416/1151531.htm?from=pctaglist,2018-04-16 21:52,目前正值恆春半島洋蔥盛產期，由於今年產量爆增，屏東縣政府為協助農民銷售，結合4家在地企業購買6000袋、總計90公噸洋蔥直送台北，捐贈給弱勢團體，縣府強調，屏東洋蔥品質優良且有屏東好物標章認證，「採購好吃、便宜的落山風洋蔥，現在正當時」。,,0
ettoday,討厭吃洋蔥？「蔬菜界皇后」9大好處...不想感冒就要吃,https://www.ettoday.net/news/20180416/1150278.htm?from=pctaglist,2018-04-16 09:02,有些網友們討厭洋蔥的辛辣刺鼻味，但事實上一層層的洋蔥也代表著它對健康的好處。洋蔥不僅常被添加於料理中，提升食物風味，甚至有「蔬菜界的皇后」的封號，你絕不能忽略它對健康的益處。《ETtoday健康雲》根據國外健康網站《Health Fitness Revolution》整理報導，讓人想流淚的洋蔥對人體的10大優點，看完你還想排擠它嗎？,,0
ettoday,蔬菜界抗病聖品！秒懂洋蔥營養　植化素在外層別傻傻剝掉,https://www.ettoday.net/news/20180415/1150633.htm?from=pctaglist,2018-04-15 12:29,洋蔥是家常菜中最常出現的料理，無論是生切夾入漢堡或三明治中，還是剁碎跟濃湯和醬料一起炒煮，洋蔥散發出來的清香和甘甜都內含許多有益身體的營養素。國外網站《FoodFacts》更列表舉出了洋蔥的營養成份，更是醫生最推薦的蔬菜之一！,,0
ettoday,吳音寧「洋蔥文」遭專業批耍文青無知　 網酸：年薪250萬小編,https://www.ettoday.net/news/20180414/1150256.htm?from=pctaglist,2018-04-14 16:29,北農休市事件之後，台北農產公司總經理吳音寧成立粉絲專頁，3日的一篇「洋蔥文」卻遭到狠酸，內容提到，「進口洋蔥通常顆顆渾圓，表皮厚、顏色深、有光澤，但本土產的表皮通常比較薄。」此文一出也遭農業粉專 「Lin bay 好 油」打臉，服務的是農業生產者跟農產品分銷販售的承銷端，不是讓你耍文青，透漏自己的無知。,,0
ettoday,洋蔥滯銷　王品集團採購70公噸台灣省產洋蔥,https://www.ettoday.net/news/20180413/1149941.htm?from=pctaglist,2018-04-13 21:09,台灣省產洋蔥豐收，市場價格暴跌，引起各界關注，王品集團13日宣布，即日起採購70公噸台灣省產洋蔥，希望盡棉薄之力，避免賤價傷農的情況。,,0
ettoday,吃完蔥蒜嘴巴超臭？　「10實用方法」能去味...約會必備！,https://www.ettoday.net/news/20180411/1147318.htm?from=pctaglist,2018-04-11 11:14,大蒜和洋蔥都能提升膳食的風味，並且提供健康益處，有多項研究證實，兩者都具備抗癌改善心血管健康等好處。但不幸的是，它們都會引起口臭，特別是生吃的時候。獨特的味道由大蒜和洋蔥中的含硫化學物質所引起，氣味可隨著人的呼吸持續數小時甚至一夜間，讓旁人聞了逃之夭夭。,,0
