Source,Title,Link,Date,Summary,Text,Like
ettoday,1200頓洋蔥免費拿！彰化盤商「佛心」放送百萬顆　台中人都跑來撿,https://www.ettoday.net/news/20180409/1146935.htm?from=pctaglist,2018-04-09 20:36,彰化縣伸港鄉大同國小後門的空地上，堆滿了上百噸的洋蔥「免費」任人拾取。現場出現大批彰化、台中的民眾到場撿洋蔥，預估洋蔥的總重超過1000公噸，預計到明日都還有洋蔥可撿取。,,0
ettoday,亂吃發洩也不怕肥！6大「超瘦減壓食物」公開，巧克力狂吃也OK,https://www.ettoday.net/news/20180407/1143446.htm?from=pctaglist,2018-04-07 19:29,有人說，壓力使人成長；但，過度的壓力，卻會心理影響生理，默默侵蝕著你的健康。食物的確能幫助減輕壓力，但吃錯食物，不只可能發胖暴肥，還會引發腸胃炎！,,0
ettoday,小狗狗睡翻天！被惡整當「三明治」　躺吐司蓋綠菜＋洋蔥被被,https://www.ettoday.net/news/20180406/1145318.htm?from=pctaglist,2018-04-06 17:46,這個三明治長得特別可愛呢！抖音ID用戶「Vx13811433777」在網路上分享一則寵萌短片，內容是一隻小小汪星人，居然被小主人當成玩具，只見牠舒服得躺在吐司上，還蓋青菜＋洋蔥的小被被，模樣還真得有點呆萌。,,0
ettoday,三立員工99%超像洋蔥！　上班一半突上台模仿..網笑到黑姑,https://www.ettoday.net/news/20180405/1144909.htm?from=pctaglist,2018-04-05 14:52,玖壹壹常在社群網站分享生活點滴，春風在IG不時PO出和助理的互動，讓大批網友笑翻，洋蔥也因在《綜藝玩很大》裡的反差萌，看到不同於舞台上的那一面。近日《綜藝大熱門》中有一集廣告歌曲洗腦歌單元，阿虎、大根扮成玖壹壹唱歌，其中飾演洋蔥的工作人員，與洋蔥長相相似度超高，讓網友笑翻。,,0
ettoday,摘洋蔥碎屑飄進眼角膜　用手亂揉「黴菌感染」恐失明,https://www.ettoday.net/news/20180330/1141155.htm?from=pctaglist,2018-03-30 14:45,屏東洋蔥採收缺工，農委會號召農業公費生下田幫忙，海軍陸戰隊也投入200名兵力協助，但許多學生在採收過程中未做好防護措施，也讓眼科醫師直搖頭，因為洋蔥皮屑細碎，容易被風吹進眼睛，刮傷角膜，若再用手去揉，可能會讓表皮吸附的黴菌滲入眼球，引發黴菌感染，嚴重還有可能會失明。,,0
ettoday,嘻哈歌手見阿達哭慘了！　穩交5年女友「窮有窮的過法」,https://www.ettoday.net/news/20180328/1138891.htm?from=pctaglist,2018-03-28 07:04,「文青說唱歌手」賴慈泓苦埋做音樂，終於帶著新專輯《別來無恙》回歸樂壇，27日發片記者會上，同門玖壹壹成員洋蔥、BCW驚喜現身，見到主持人阿達他忍不住淚崩，表示若不是阿達不斷支持鼓勵，早已放棄音樂這條路；除了好友支持，他身邊也有一個交往3年的女友，就算經濟不充裕，小倆口也很知足。,,0
ettoday,看街友路邊縮一排…健志寒夜奔北車　快遞送棉被暖炸！,https://www.ettoday.net/news/20180323/1135993.htm?from=pctaglist,2018-03-23 00:36,玖壹壹出道以來，螢幕形象看似玩世不恭，最近卻被民眾爆料，其實私下人超暖！團員健志近日和同門BCW一起逛街，被民眾目擊，似乎是有感近日氣溫驟降，寒風刺骨，深夜在北車看到不少街友，當場就和身邊師兄弟，湊了現金2萬元，直接買了棉被、外套發送。,,0
ettoday,洋蔥媽煮飯加水「免用量杯」　撇步掀網共鳴：我媽也是！,https://www.ettoday.net/news/20180317/1132559.htm?from=pctaglist,2018-03-17 22:08,洋蔥是「本土天團」玖壹壹的成員之一，平時常在社群網站上發文，分享生活、工作點滴，16日曬出媽媽煮米時，不需使用量杯，就能測量水與米比例的方法，畫面曝光後，立刻勾起大票網友心中共鳴，同時也有不少人紛紛留言喊：「我媽也是這樣！」意外引發熱議。,,0
ettoday,洋蔥狂流淚、惹口臭？內含強效抗氧化物　預防5大疾病！,https://www.ettoday.net/news/20180313/1129621.htm?from=pctaglist,2018-03-13 19:19,洋蔥是四季都能吃得到的蔬菜，也是許多家常菜的愛用食材，不僅能夠帶出鮮美的甜味，還帶來清爽的口感，另外它含有大量的硫化物，強烈的氣味讓眼淚直流，根據國外網站Medical Daily指出，洋蔥含有超過100種的含硫化合物，具有殺菌、抗發炎等療效，有助於預防多種疾病。,,0
ettoday,味噌洋蔥豆腐湯　暖胃增強抵抗力,https://www.ettoday.net/news/20180221/1113456.htm?from=pctaglist,2018-02-21 06:30,你喜歡洋蔥嗎？許多人害怕它那種辛辣、嗆鼻的口感，其實洋蔥具有優良的抗氧化劑，對血壓、血脂的調節，也有相對的幫助。萬芳醫院營養室營養師徐慧英表示，洋蔥分為白色與紫色兩種，前者較柔嫩、水分、甜度較高，後者辛辣味較重，常用來拌炒或做生菜沙拉，而國產的白洋蔥，有著進口洋蔥沒有的鮮甜與軟嫩。,,0
ettoday,玖壹壹洋蔥夜戰CLUB　「前女友」開車打包回家！,https://www.ettoday.net/news/20180219/1116055.htm?from=pctaglist,2018-02-19 22:21,平民天團玖壹壹過年活動滿滿，從初一到初三、從北到南連著舉辦簽名會，或許是年味濃厚，團員洋蔥行程匆忙，但體力和心情似乎都在最高點，結束高雄工作回到台中後，接著直衝知名夜店，最後還由「前女友」黃怡萱打包回家。,,0
ettoday,扮成玩偶才能靠近女兒！催淚不輸《與神同行》的3部韓國親情電影,https://www.ettoday.net/news/20180217/1102406.htm?from=pctaglist,2018-02-17 10:00,隨著近年來越來越多韓片在台灣上映，國內民眾多次見識到南韓電影堅強的說故事實力，尤其對人與人之間的情感刻劃，總是能讓觀眾笑著進戲院、哭著走出來。如果你看了《與神同行》淚流不止，對片中一家人的親情感到十分感動，以下還要推薦3部有大洋蔥的親情電影給大家。,,0
ettoday,曾莞婷彎腰「洶湧雪乳全露」！吳宗憲犒賞幕後：帶了一百萬,https://www.ettoday.net/news/20180209/1111613.htm?from=pctaglist,2018-02-09 20:39,三立電視9日辦尾牙，本土劇女神曾莞婷穿著平口現裝現身，親切發送發熱衣、紅包，一個心急，傾倒上半身，事業線全都露，讓台下都快噴鼻血了！本土天王吳宗憲也是大送紅包，他豪氣說：「我今天帶了一百萬來！」,,0
ettoday,阿嬤餓到偷2碗泡麵　高雄暖警一個動作藏滿滿洋葱！,https://www.ettoday.net/news/20180131/1104497.htm?from=pctaglist,2018-01-31 15:19,三民區大昌二路一家賣場日前遭人偷竊商品，員警趕抵現場時，發現嫌犯是一名72歲的洪姓阿嬤，她並無前科紀錄，追問下發現原來她是想買泡麵回家當晚餐，加上丈夫剛車禍住院，家中經濟較不穩定，一時貪小便宜起了竊心！員警聽聞後感到相當不捨，當場先買晚餐給阿嬤果腹，隔天更準備一些民生物資，包含油、米、麵條等，親自送到住處，讓阿嬤當場感動到哭了。,,0
ettoday,「胖子也有溫暖的心」！肥宅男傳訊完動手術　她淚：消失4天了,https://www.ettoday.net/news/20180126/1100853.htm?from=pctaglist,2018-01-26 13:16,新竹一名女網友表示，她認識了一名住在台北的肥宅小黎（化名），在聊天的途中得知對方患有心血管疾病，且開刀後可能「醒不來」，便後悔沒有多陪伴對方。在小黎傳完「不要再討厭胖子，胖子也有溫暖的心」後消失，讓原PO崩潰地一直等訊息。,,0
ettoday,阿公住院想吃「美國菜包」　她騎半路「神解謎團」惹淚鄉民！,https://www.ettoday.net/news/20171225/1079248.htm?from=pctaglist,2017-12-25 19:00,「我阿公想吃美國的菜包！」一名女網友回憶道，當時年邁阿公住在醫院裡，某天她接到老人家電話，說想吃「美國菜包」，起初她滿頭問號，結果在騎去醫院的路上靈光一閃，成功解開謎團。鄉民們看完被戳中淚點，紛紛直呼「笑著笑著就哭了」、「害我想到阿公」。,,0
ettoday,撞倒百萬重機逃逸！16歲男被逮賠「一封信」逼哭網：以後也買1台,https://www.ettoday.net/news/20171224/1078752.htm?from=pctaglist,2017-12-24 12:02,人的一言一行，都能用溫暖感化他人，台中一名陳姓網友騎著BMW S1000RR重機時，被一名16歲少年撞到，最後發現他原來是一名運毒通緝犯。但這名少年在被逮捕的期間，卻把修車的錢和一封信轉交給他，讓他感動不已。,,0
ettoday,網拍「玖壹壹建志簽名照片9453元」　網一看...就畢冊啊！,https://www.ettoday.net/news/20171204/1065534.htm?from=pctaglist,2017-12-04 12:39,來自台中的饒舌團體「玖壹壹」由春風、建志（KEN-G）及洋蔥組成，他們獨特的台式曲風受到粉絲熱烈歡迎，沒想到有網友相中他們的超人氣，竟把過去有建志簽名、照片的畢業紀念冊拿出來賣，一本要價9453元，連本尊都注意到了。,,0
ettoday,哭了！世界最大產出國印度洋蔥價格漲7倍　台灣難逃漲價命運,https://www.ettoday.net/news/20171203/1065061.htm?from=pctaglist,2017-12-03 16:59,近來不只一般的葉菜類價格高居不下，連洋蔥價格都可能面臨暴漲態勢。根據路透社報導，全球前幾大的洋蔥出口國如印度、巴基斯坦紛紛宣布限縮外銷洋蔥，主因是去年洋蔥供應量創新高，促使印、巴國的農夫削減栽種面積，加上今年各地的氣候異常，部分地區雨季打亂洋蔥的插秧時節，導致採收延後或是產量減少。據了解，印度洋蔥零售價格已在短短5個月內飆升7倍，台灣恐怕也得面臨同一問題。,,0
ettoday,春風被爆曖昧E奶雪碧　火速打臉「絕對不可能」,https://www.ettoday.net/news/20171025/1038537.htm?from=pctaglist,2017-10-25 13:19,夯團玖壹壹備受台灣時下年輕人喜愛，當中團長春風特別受女性粉絲青睞，不過單身的他近日卻被爆與「E奶辣模」雪碧有曖昧情，2人曾穿過同款T恤，一名女方閨蜜透露「是一種情侶裝的概念」，不過他卻透過經紀人表示跟雪碧絕對不可能。,,0
ettoday,「暖心壽喜燒」5星灌爆！搭高鐵親送癌末弟湯頭…網揪團朝聖,https://www.ettoday.net/news/20171017/1032651.htm?from=pctaglist,2017-10-17 00:59,網友楊小玫為了完成癌末弟弟的心願，聯絡高雄花葵壽喜燒，希望店家能賣宅配湯頭，讓弟弟吃到想念的味道。結果游姓老闆得知後，二話不說直接搭高鐵北上，還親自將鍋底和豐富菜料送到楊小姐手裡。暖心事蹟登上媒體版面後，感動許多網友，紛紛以5星評論灌爆臉書粉絲團，讓店家評價直逼滿分。,,0
ettoday,癌末弟想吃壽喜燒...她私訊問　老闆親自坐高鐵北上「不收錢」,https://www.ettoday.net/news/20171016/1032204.htm?from=pctaglist,2017-10-16 13:25,由於癌末弟弟住進台大安寧病房，姐姐楊小玫為了完成他的心願，聯絡高雄花葵壽喜燒，希望店家能賣宅配湯頭，讓弟弟吃到想念的味道。讓她意外的是，老闆二話不說答應之外，還親自搭高鐵北上，送來鍋底與豐富菜料；而這滿滿洋蔥的故事也感動許多人。,,0
ettoday,切番茄不流汁、煎豆腐不會碎...　8個最實用的生活絕招！,https://www.ettoday.net/news/20170927/1019285.htm?from=pctaglist,2017-09-27 16:31,在料理的時候，很多人切洋蔥總是會「淚灑廚房」，切辣椒則是覺得手有灼熱感，煎個豆腐一不小心就碎掉，炒馬鈴薯黏鍋，真的超級煩！對此，《健康時報》特地整理了8個最實用的生活絕招，你不妨參考看看！,,0
ettoday,剛吃飽！軍人久沒回家...媽媽堅持「隨便煮一點」　菜色讓人想哭,https://www.ettoday.net/news/20170905/1004805.htm?from=pctaglist,2017-09-05 19:40,日前有網友PO出一張澎湃料理照片，記得阿嬤說的是，「我隨便煮，煮一點點就好，你們隨便吃」，沒想到最後蹦出7盤菜，蝦子、燻雞、絲瓜蛤蜊豐盛到不行。現在有職業軍人分享類似經驗，由於留營多時久沒回家，到家時雖然已經吃飽，媽媽仍堅持「隨便煮一點」，最後上桌的菜餚加了滿滿洋蔥，讓人想哭。,,0
ettoday,結婚週年送「35個500元硬幣」藏洋蔥　網直呼最棒的禮物！,https://www.ettoday.net/news/20170824/996113.htm?from=pctaglist,2017-08-24 20:00,結婚35週年，爸媽送了一個驚喜給女兒！日本《YOMIURI ONLINE》有位女網友分享，當天父母突然拿了沉甸甸的盒子給她，一打開發現裡面裝了35個500元日幣（約台幣139元），雖然金額不高，但蘊藏了父母的心意。,,0
ettoday,計程車後車廂塞16歲少女！路人嚇到報警…背後竟有洋蔥,https://www.ettoday.net/news/20170822/994827.htm?from=pctaglist,2017-08-22 22:22,4名男子22日在基隆市安樂路一段攔搭計程車，不料打開後車廂要放行李時，意外發現裡頭躺了一名少女，當場未搭離去。過程中，後方車輛駕駛以為少女被綁架，立刻記下計程車車號，並報警處理。事後，警方循線找到譚姓女司機後，才發現這背後竟有一段感人的故事。,,0
ettoday,玖壹壹洋蔥喊蔡小虎「爸」　結果生父坐台下...全笑翻！,https://www.ettoday.net/news/20170813/987904.htm?from=pctaglist,2017-08-13 08:27,蔡小虎13日在台中舉行演唱會，找來玖壹壹驚喜站台，唱到《愛人醉落去》時情緒嗨爆，粉絲尖叫聲不斷，蔡小虎跟玖壹壹在台上熱情擁抱，也是虎迷鐵粉的洋蔥爸爸坐在台下，結果洋蔥在舞台上情緒超嗨，當著老爸的面喊蔡小虎一聲「爸」，全場笑翻。,,0
ettoday,多餘水分通通走開！南瓜、洋蔥邊吃邊消水腫,https://www.ettoday.net/news/20170806/981297.htm?from=pctaglist,2017-08-06 23:00,明明吃得很清淡，睡覺前只喝了幾口水，一睡醒之後臉還是腫得不像話，水腫容易被別人誤認為是肥胖，水腫是許多女生逃避不了困擾，除了猛灌黑咖啡，五種食物能夠幫助消水腫，在飲食間也能快速把多餘水分排出去。,,0
ettoday,伊朗洋蔥漲4倍　人民苦笑：做成戒指「一顆永留傳」,https://www.ettoday.net/news/20170803/981027.htm?from=pctaglist,2017-08-03 17:39,伊朗近日爆出「洋蔥危機」，每顆洋蔥的價格由1000至1500托曼（約新台幣8至11元），升至4400托曼（約新台幣39元），大約漲了4倍。洋葱在中東的餐桌上特別受歡迎，價格急升讓不少民眾的生活受到影響。人們紛紛將洋蔥惡搞，比喻成奢侈品，一下做成鑽戒、項鍊，一下又將iPhone上的蘋果標誌換成洋蔥，或把洋蔥做成禮服。,,0
ettoday,「肥小強振翅游泳」員工還在洗洋蔥！台南河粉名店被開單認了,https://www.ettoday.net/news/20170728/976206.htm?from=pctaglist,2017-07-28 00:54,有民眾去台南知名的越南河粉店買河粉，看到男店員在水槽洗洋蔥，水中卻有數隻蟑螂漂浮游泳，不斷要爬出水面，深褐色的翅膀相當顯眼，噁心畫面讓許多網友看了反胃，引發爭議。台南衛生局27日上門稽查，開出勸導單限期改善，業者則出面道歉，認了沒注意到小強入侵水槽，會要求員工加強衛生整潔。,,0
ettoday,6個兒子陪母親留長髮卻遭同學霸凌　堅持背後有洋蔥！,https://www.ettoday.net/news/20170718/968550.htm?from=pctaglist,2017-07-18 15:36,美國紐約有位母親菲比（Phoebe Kannisto）想靠行動來幫助罹癌病童，而6個兒子也決定一起陪媽媽完成夢想，然而，「留長髮」這件事並不符合社會文化所賦予男性的性別角色，因此常被同學們譏笑、甚至霸凌。所幸花了2年時間，咬牙挺過，完成善舉，也讓當初欺負他們的同學主動道歉。,,0
ettoday,有free style嗎？　玖壹壹健志一見「吳亦凡」反應笑噴,https://www.ettoday.net/news/20170703/958165.htm?from=pctaglist,2017-07-03 11:57,藝人吳亦凡受邀擔任《中國有嘻哈》的評審，因為在節目評選參賽者的過程中，常問「有free style嗎」，被許多網友拿來當哏，瞬間成為流行語。玖壹壹的健志跟上這個風潮，2日在Instagram上PO出一則短片，一踏進麥當勞看到吳亦凡的人形立牌，下意識脫口而出「沒準備」，笑壞網友。,,0
ettoday,玖壹壹春風書法字長這樣！　李明依虧「通靈少男」變下咒,https://www.ettoday.net/news/20170629/956004.htm?from=pctaglist,2017-06-29 16:48,玖壹壹為宣傳新專輯上節目，主持人李明依開玩笑說新專輯《周法薷》沒過往2張專輯直接又幽默，春風解釋，因為玖壹壹的聽眾年齡層有下降，所以詞曲創作有收斂一點，健志還神秘地說：「其實還有4支風格直接的MV還沒拍攝完成，更透漏昨晚拍攝《派對俠》MV，會給大家震撼」，粉絲可以期待成品出來。,,0
ettoday,太想念逝世父母…他PO一張照片哭翻網友　釣出滿滿洋蔥,https://www.ettoday.net/news/20170617/946773.htm?from=pctaglist,2017-06-17 00:29,熟悉的氣味就像是連結，總能喚起我們腦中許多獨特的記憶。有一名網友16日就在臉書PO出一張洗髮精和沐浴乳的照片，雖然乍看並無任何特別之處，但當這名網友訴說完背後的故事，立刻讓不少人為之動容，紛紛感性地寫下自己的故事。,,0
ettoday,癌症掰掰惹？　研究證實洋蔥可以讓癌細胞想死,https://www.ettoday.net/news/20170613/944214.htm?from=pctaglist,2017-06-13 18:09,「洋蔥抗癌」的話題經常被提起，加拿大也有相關研究證實，洋蔥的確可以殺死癌細胞，但吃洋蔥就可以抗癌？這件事並未被證實，許多研究人員對於吃洋蔥即可抗癌，都持保留態度。,,0
ettoday,吃到洋蔥氣炸！酒醉奧客餐廳露GG　怒嗆「槍殺老闆」！,https://www.ettoday.net/news/20170609/941284.htm?from=pctaglist,2017-06-09 10:16,美國匹茲堡一名男奧客因為不爽食物裡面有洋蔥，喝酒醉後到餐廳鬧事，先是威脅自己有帶槍要殺了老闆，接著當眾脫褲子暴露生殖器，還一邊胡言亂語。警察到場之後，將這名男子以造成恐怖威脅、在公眾場合喝醉、暴露以及拒捕等罪名收押在監獄中，等候審判。,,0
ettoday,最幸福的新娘！男閨蜜當「伴娘」　原因有洋蔥網友瘋傳,https://www.ettoday.net/news/20170605/935168.htm?from=pctaglist,2017-06-05 15:13,婚禮伴娘誰說一定要是「女生」？巴西有位新娘蕾貝卡（Rebeca Brantes）打破傳統，找來同窗兼閨蜜的5位男性友人擔任伴娘，將一系列「婚前單身趴」照片上傳IG，立刻在社群網站上被瘋傳，引起廣大熱議，而她更被網友封為：「全世界最幸福的新娘」！,,0
ettoday,看到媽媽的陳年日記淚崩！　曾墮胎3次...為了她忍30年寂寞,https://www.ettoday.net/news/20170515/924535.htm?from=pctaglist,2017-05-15 12:49,母親節剛過，到處洋溢著濃濃的親情與愛，但這位女大生卻是心痛。她節日前一天從學校返家，在書房意外看到媽媽的日記，裡面幾乎都是痛徹心扉的自白，讓她忍不住哽咽，「原來妳的堅強妳的韌性，是這樣遍體鱗傷來的...，希望我給妳的愛能彌補妳的傷痛」。,,0
ettoday,洋蔥發芽有毒？　食藥署闢謠：致命的根莖類只有「它」,https://www.ettoday.net/news/20170429/913486.htm?from=pctaglist,2017-04-29 18:29,天氣逐漸回暖，根莖類食材擺放太久也容易發芽，近日網路傳言，發芽的洋蔥有毒不能食用，讓許多民眾好擔心。對此，食藥署表示，洋蔥主要食用的部位是鱗葉，發芽後不會產生任何毒素，但還是建議民眾盡量購買新鮮的食材，並注意保存。,,0
ettoday,玖壹壹洋蔥爆「復合前女友」　巨蛋狂喊55天同框出遊！,https://www.ettoday.net/news/20170425/911130.htm?from=pctaglist,2017-04-25 11:00,「本土天團」玖壹壹2月在高雄巨蛋舉辦《9453》演唱會演唱會時，台上洋蔥唱到《回到我身邊》時，意外連續喊了2遍前女友的名字「黃怡萱」。事隔2個月後，洋蔥在IG上放一張和「黃怡萱」的合照，讓粉絲驚呼連連，經紀人也做出回應。,,0
ettoday,恆春鎮長北上行銷洋蔥　蘇貞昌力挺洋蔥衝衝衝,https://www.ettoday.net/news/20170417/906179.htm?from=pctaglist,2017-04-17 17:53,新北市板橋日前盛大舉辦「屏東縣恆春鎮洋蔥等產業促銷暨節能減碳宣導活動」，藉此提升恆春鎮洋蔥產業國際知名度，並增加農民收益，期望透過產地直銷及農特產品的促銷活動，行銷國境之南的洋蔥特色產業，恆春鎮鎮長盧玉棟親自北上力挺屏東農民，在屏東出生的前行政院長蘇貞昌也現身力挺，共襄盛舉。,,0
ettoday,限定山茶花氣墊粉霜韓妞瘋搶！美麗餅盒裡竟偷放洋蔥？,https://www.ettoday.net/news/20170413/903128.htm?from=pctaglist,2017-04-13 17:28,南韓美妝品牌A’PIEU的WONDER TENSION氣墊粉霜，遮瑕持久的妝感效果，受到許多韓妞喜愛，一推出就造成搶購風潮。在2017年春季，特地與品牌Marymond合作，換上柔和的山茶花新衣，增添不少甜美浪漫的氛圍。,,0
ettoday,玖壹壹春風「母大腸癌過世」　不捨豬哥亮病危曝心痛！,https://www.ettoday.net/news/20170331/895733.htm?from=pctaglist,2017-03-31 11:02,豬哥亮近日傳出大腸癌末病危，現靠著呼吸器維生，曾與他在電影《大顯神威》合作的玖壹壹春風，表示向豬哥亮表示關心，感嘆說：「因為我自己的家人也生過病，可以體會家屬心情。」原來是春風的媽媽當年罹患大腸癌，為此奔走籌每月10萬的醫療費，後來媽媽癌症逝世，他心中也留下不小傷痛。,,0
ettoday,200陸戰兵收洋蔥40天將取消？　農民：沒年輕人，需要支援,https://www.ettoday.net/news/20170323/890583.htm?from=pctaglist,2017-03-23 18:05,屏東三軍聯訓基地每年3至4月，都會派出海陸官兵，協助農民採收洋蔥，一次都是200人協助40天，任務執行至今已經20年，不過卻傳出國防部考量明年全募兵制後，要取消所有的助割任務，農民聽到相當緊張，「現在農地根本就沒有年輕人，需要國軍來支援一下。」對此軍方也澄清，「明年還不會取消。」,,0
ettoday,網嗆玖壹壹「都像黑道更生人」　洋蔥親上火線槓網友！,https://www.ettoday.net/news/20170320/888081.htm?from=pctaglist,2017-03-20 12:02,本土天團玖壹壹一連舉辦三場《9453》巡迴演唱會，攻佔了北高雙巨蛋，人氣持續攀升，更預告今年即將推出新專輯。不過19日卻有張姓網友發文，表示「這公司旗下所有的藝人都像更生人」，引來大批網友關注，洋蔥也親上火線回應。,,0
ettoday,絕美Coser早瀬みる貼「性感照」騙錢？　背後原因有洋蔥,https://www.ettoday.net/news/20170319/887493.htm?from=pctaglist,2017-03-19 12:10,日本coser早瀬みる擁有女神級顏值，加上超犯規身材，把許多宅男迷得不要不要的，人氣可說是相當高，但最近卻傳出她利用自己「性感照」騙錢，詭異的是，被騙的粉絲們還非常開心，不過在得知來龍去脈後，真的會感動想哭，然後大讚她的小巧思。,,0
ettoday,導演酒醉：免錢拍100支MV！玖壹壹發狠「讓他紅到全世界」,https://www.ettoday.net/news/20170317/885846.htm?from=pctaglist,2017-03-17 22:04,玖壹壹第3張專輯將於5月發行，新專輯名稱17日曝光，取名為《周法薷》，原來是去年尾牙上，MV導演好朋友周法薷酒後失言，在尾牙上大開支票，答應玖壹壹要免費拍100支的MV，為了名正言順接受大禮，就決定把他的大名當作新專輯名稱，讓他紅到世界各地，也要讓導演記得承諾。,,0
ettoday,貪嘴貓好可愛？　別餵喵星人這4類食物...魷魚絲也NG！,https://www.ettoday.net/news/20170308/879584.htm?from=pctaglist,2017-03-08 11:03,你家的愛貓很愛吃嗎？許多飼主都覺得家中喵星人貪吃的模樣很可愛，不過你知道家中有很多貓咪不能吃的食物嗎？日本寵物知識網站《PETomorrow》分享4種「貓咪不能吃的4類食物」，對人們很補的螺類、鮑魚，喵星人吃了可是會得皮膚病的！,,0
ettoday,玖壹壹春風、洋蔥「深夜散步談心」　困印尼電梯首回應,https://www.ettoday.net/news/20170302/876494.htm?from=pctaglist,2017-03-02 16:12,本土天團玖壹壹2日他們赴印尼表演，兩人深夜外出，意外被困在電梯裡面，春風Po網求救，所幸在20分鐘內獲救，他們也透過公司回應現場情況。,,0
ettoday,呼叫黃怡萱！洋蔥台上狂喊前女友　6天曝「復合進度」,https://www.ettoday.net/news/20170302/876485.htm?from=pctaglist,2017-03-02 16:05,玖壹壹25日在高雄巨蛋舉辦《9453》演唱會最終場，台上洋蔥唱到《回到我身邊》時，意外喊前女友的名字「黃怡萱」，讓全場驚喜。事隔6天，洋蔥也曝光目前最新進度。,,0
