Source,Title,Link,Date,Summary,Text,Like
ettoday,HowHow、洋蔥已經很搞笑　「他們」靠這2點更紅：笑著笑著就哭了,https://www.ettoday.net/news/20200905/1801775.htm?from=pctaglist,2020-09-05 12:46,YouTuber如雨後春筍般的冒出，題材要符合閱聽者的口味也越來越難， 其中的「HowHow（陳孜昊）」、「洋蔥（Onion Man）」和近期走紅的「反正我很閒」都有不少死忠粉絲，不過一名網友就認為，HowHow和洋蔥出現了「後繼無力」的感覺，評價似乎不如以往；以這3個頻道來說，到底哪一個最好笑？,,0
ettoday,「每周一到五會經歷的痛苦？」　答案讓網友直呼中肯！,https://www.ettoday.net/news/20161013/792428.htm?from=pctaglist,2016-10-13 18:01,「人，為什麼要早起呢？」當每天被鬧鐘驚醒的瞬間，濃濃睡意再度席捲而來，相信這是不少重度賴床患者最大的痛苦，但終究還是要面對殘酷現實。網路插畫家「Onion man洋蔥男」近日在臉書上傳新創作，描述早上爬不起來超痛苦，如果有時光機該有多好，引發網友共鳴！,,0
ettoday,《精靈寶可夢》虐翻單身狗！　洋蔥男新作笑翻上萬網友,https://www.ettoday.net/news/20160807/750373.htm?from=pctaglist,2016-08-07 15:30,萬眾矚目的《精靈寶可夢》Pokémon GO終於在6日登台，全台玩家也陷入一陣抓寶風潮，臉書等社群平台均被寶可夢洗版。知名網路插畫家「Onion man」6日在臉書分享最新創作，將單身與寶可夢做連結，網友看完後留言表示「有種淡淡的哀傷啊！」,,0
ettoday,插畫家們點出5大Pokémon GO中毒現象　全民有感引討論,https://www.ettoday.net/news/20160807/750413.htm?from=pctaglist,2016-08-07 14:25,《Pokémon GO》才剛在台灣上市第二天，全台已立刻陷入神奇寶貝風潮。早先於紐澳美等其他地區上市的《Pokémon GO》，已陸續傳出「Pokémon GO中毒事件」。而台灣插畫家們也觀察到了許多有趣的現象，將它記錄下來，這些全民有感的圖文創作也引起了廣大網友迴響。,,0
ettoday,史上最強COVER神曲！　超狂「海獅系列」笑翻百萬網友,https://www.ettoday.net/news/20160719/737911.htm?from=pctaglist,2016-07-19 12:18,近年來網路紅人經濟崛起，透過口耳相傳快速分享，達到超高人氣，許多網路插畫家也因此爆紅，知名網路插畫家Onion man藉由幽默圖文，獲得大眾喜愛，粉絲人數逼近65萬人，他的「周末小劇場」系列，將插畫變動畫，加入搞笑配音及歌曲，上傳2天就突破百萬觀賞次數。,,0
ettoday,體重、女友全都是「假的」　爆笑惡搞影片吸200萬點閱！,https://www.ettoday.net/news/20160718/737293.htm?from=pctaglist,2016-07-18 10:11,新一代宗教界紅人「海濤法師」近日因「先生外遇，假的？」影片大爆紅，引發網友接連惡搞，不但製作「假的！產生器」、「海濤法師之假的！長輩圖」，甚至還有網友將他和前任宗教界紅人「美江牧師」拿來大PK，網路插畫家Onion man也製作一支搞笑影片，引發網友共鳴，吸引近200萬觀看次數。,,0
ettoday,吃太多了！《美隊3》惡搞版美食內戰　40萬網友笑翻,https://www.ettoday.net/news/20160520/701890.htm?from=pctaglist,2016-05-20 15:14,漫威電影《美國隊長3：英雄內戰》在全球上映近4週，票房進逼10億美元（約新台幣），眾英雄大亂鬥的劇情吸引許多人分析討論，台灣日前有一群網路當紅插畫家攜手合作，以電影預告片為藍本和配音製作成動畫短片，無厘頭又搞笑的內容吸引許多網友關注。,,0
ettoday,洋蔥《3國智》錄影腳滑重摔在地　慘遭張立東狠酸,https://www.ettoday.net/news/20211204/2138507.htm?from=pctaglist,2021-12-04 12:24,玖壹壹日前上台視《綜藝3國智》出外景，節目開播至今迎來第五個年頭，製作單位特別在12月推出系列特別企劃，當天錄影大夥還換上特製周年紀念制服以新面貌闖關，一行人分成紅、黑兩隊PK球技，洋蔥在防守傳球時不慎腳滑，整個人往後倒直接躺在地上。,,0
ettoday,晚餐沒洋蔥抓狂！恐怖爸斧頭屠殺妻和4孩　13歲女兒死前被性侵,https://www.ettoday.net/news/20211203/2138063.htm?from=pctaglist,2021-12-03 17:17,肯亞近來發生一起殘忍屠殺案，35歲男子保羅(Paul Murage Njuki)被控用斧頭殘忍殺死妻子和4名孩子，原因竟然可能與晚餐沒有準備他要吃的洋蔥有關。警方到場時在床上發現5人遺體，頭部都有嚴重的砍傷，並懷疑大女兒死前曾遭到保羅性侵。,,0
ettoday,弟上車指定跟啾啾坐埋頭狂吸嫌臭　吉度開心同步「抬頭嗨笑」,https://www.ettoday.net/news/20211106/2117873.htm?from=pctaglist,2021-11-06 15:20,新北飼主陳焦糖開車接弟弟，弟弟一上車就指定要跟吉娃娃「啾啾」一起坐，接著把臉埋進啾啾的身體狂吸，一邊跟狗狗說話，一邊笑著抱怨「臭臭～」，但他身體非常誠實越吸越起勁，來回2、3次之後一汪一孩同時笑了，畫面非常溫馨。,,0
ettoday,玖壹壹洋蔥Call out粉絲⋯結果超傻眼「求心理陰影面積」,https://www.ettoday.net/news/20211014/2101069.htm?from=pctaglist,2021-10-14 12:24,玖壹壹洋蔥日前錄《蝦皮娛樂線》帶著愛犬「阿弟」一同上節目，沒想到在call out粉絲時，他竟當場被觀眾吐槽：「我還以為是春風。」讓洋蔥聽了都震驚。 最後還有粉絲直接在電話中表示：「玖壹壹我最喜歡健志。」粉絲接連打擊，連網友都心疼地說：「求洋蔥心理陰影面積！」,,0
ettoday,被爆參賽《全明星3》！　玖壹壹春風自爆「是小傑粉絲」,https://www.ettoday.net/news/20211013/2100501.htm?from=pctaglist,2021-10-13 17:57,玖壹壹今（13日）出席記者會，團員春風日前在私人IG曬出與江宏傑合照，引發網友猜測他是否要加入《全明星運動會》第三季，受訪時他表示，自己體能不佳，運動項目只愛玩滑雪、賽車及打乒乓球，對於參賽《全明星》他直言「不會接。」,,0
ettoday,獨／玖壹壹洋蔥滷味店開一年　受疫情影響「無預警宣布收攤」！,https://www.ettoday.net/news/20210826/2065127.htm?from=pctaglist,2021-08-26 14:18,台灣新冠肺炎疫情重創經濟，但隨著疫情趨緩，許多店家也慢慢恢復正常營業，沒想到玖壹壹洋蔥在台中開了一年多的滷味店，昨天突然在社群網站上宣布：「因應疫情蔓延、原物料飆漲，本店入不敷出，預計營業至9月初，詳細日期會再另外通知，謝謝您們一年多來的支持，希望未來仍有機會為各位服務。」讓許多粉絲措手不及，直呼好可惜。,,0
ettoday,玖壹壹健志澎湖酒吧開幕急喊卡！百萬「峇里島風裝潢」訂位全取消,https://www.ettoday.net/news/20210629/2018006.htm?from=pctaglist,2021-06-29 06:49,多方發展副業的玖壹壹，除了去年於台中合夥投資酒吧，健志、洋蔥和春風3人，還各自當起餐酒、滷味與運動服飾老闆。健志在澎湖開設的「SUNLA」酒吧，原訂今年暑假開幕，但因疫情攪局緊急喊卡，他以百萬重金打造的峇里島風店面，只能暫時先擱置吹海風。,,0
ettoday,媽離開5分鐘貪吃汪偷嗑「3條苦瓜」　牠躲角落舔嘴回味,https://www.ettoday.net/news/20210522/1988132.htm?from=pctaglist,2021-05-22 12:53,新北飼主邱美玲飼養的米克斯「曼妮」超級愛吃，貪吃程度讓她非常頭痛。這天邱美玲準備做苦瓜料理，食材處理好後就去客廳關心疫情新聞，回過神來發現曼妮竟將苦瓜全吃光，讓她氣到直呼，「我只是去拿個東西，你就把苦瓜吃光光，還躲！」。,,0
ettoday,健志「邀玖壹壹露營」起床卻被丟包！　急call找人：現實是殘酷的,https://www.ettoday.net/news/20210516/1983323.htm?from=pctaglist,2021-05-16 18:51,台灣饒舌天團玖壹壹成軍12年，3人感情深厚，以直率不做作的台客嘻哈音樂走紅，吸引大批粉絲喜愛。他們在4月剛辦完演唱會，趁著疫情與工作空檔好好放鬆，其中健志在15日於Instagram上發布貼文，表示和團員們一同出去露營時，醒來竟發現被丟包。,,0
ettoday,【廣編】加了洋蔥的水不流淚反而很紓壓？多喝水鹼性竹炭水推出新包裝,https://www.ettoday.net/news/20210507/1980105.htm?from=pctaglist,2021-05-07 15:42,去年度「多喝水鹼性竹炭水」和知名圖文畫家「Onion Man」合作推出的聯名包裝引爆粉絲熱烈回響，在各大社群媒體平台上興起一陣負能量語錄風潮。今年竹炭水針對人生、愛情、學業、事業推出全新8款負能量語錄包裝，語錄更貼近人心，圖畫更風趣幽默，讓人喝水時也能會心一笑。,,0
ettoday,催淚彈！「三色洋蔥」營養價值PK：含鈣量、維生素C最高都是它,https://www.ettoday.net/news/20210406/1951031.htm?from=pctaglist,2021-04-06 21:13,常看到網友留言「有洋蔥」、「偷放好多洋蔥」，代表感人、感動之意，也是因為現實生活切洋蔥時，總是一把鼻涕、一把眼淚的。不過，洋蔥除了讓人流淚、也是相當營養的食物，有抗氧化及免疫調節的能力，營養師就分享，3種不同顏色的洋蔥內含的營養素也不一樣，建議大家平時可多攝取。,,0
ettoday,乾旱農損3.4億！屏東「改良種芒果」最慘...洋蔥、荔枝也遭殃,https://www.ettoday.net/news/20210331/1950910.htm?from=pctaglist,2021-03-31 21:01,受3月高溫乾旱影響，造成農業災情，農糧署今（31日）晚彙整各直轄市、縣市政府查報資料，截至目前為止農業產物估計損失計已高達3億4211萬元，以屏東縣損失最嚴重。,,0
ettoday,玖壹壹主播台初體驗「飄台味」　健志哀喊：比去小巨蛋開唱還緊張,https://www.ettoday.net/news/20210319/1941600.htm?from=pctaglist,2021-03-19 09:36,玖壹壹日前上壹電視《新聞夜PRO》踢館正妹主播沈咏吟，挑戰播報氣象和主播稿，當天錄影3人穿上正式西裝，帶著雨傘、礦泉水道具播報新聞，雖努力「字正腔圓」，但仍飄出台灣國語，頻吃螺絲笑料十足。,,0
ettoday,獨／民眾半夜報案：美術館車站「攔路阿飄」　女警一碗麵線收服,https://www.ettoday.net/news/20210317/1940491.htm?from=pctaglist,2021-03-17 19:07,高雄市一名機車騎士凌晨1多點途經台鐵美術館車站外，竟然被突然伸出的手擋住去路，當場嚇出一身冷汗！他以為自己遇到「歹咪仔」，仔細一看一名老婦人想要搭便車，深夜一名老人卻在街頭徘徊，讓這名騎士越想越不對勁，趕緊打電話通報警方協助，女警許芳慈把這名老婦人帶回派出所，用一碗麵線溫暖老婦人的心。,,0
ettoday,洋蔥癌強襲恆春半島！氣候異常4病齊發　植株腐爛「2／3淪陷」,https://www.ettoday.net/news/20210316/1939141.htm?from=pctaglist,2021-03-16 12:10,恆春半島洋蔥目前正處於結球期，但恆春鎮、車城鄉已有洋蔥產區傳出遭遇炭疽病及黃萎病等病害感染，災損嚴重。,,0
ettoday,美印太司令示警中國恐6年內攻打台灣　邱國正：國軍不會未演先轟動,https://www.ettoday.net/news/20210312/1936551.htm?from=pctaglist,2021-03-12 10:19,美國印太司令部司令戴維森日前提出警訊表示，中國大陸很可能會在6年內入侵台灣，並企圖在亞洲地區取代美國影響力。對此，國防部長邱國正12日表示，國軍有一定的作業程序、不會去否定，但是會按部就班應處，「不會因為有這句話就搞得沸沸揚揚的、未演先轟動，造成全民不安」。,,0
ettoday,恆春洋蔥進入採收期　蘇清泉走訪葱農合作社,https://www.ettoday.net/news/20210223/1924750.htm?from=pctaglist,2021-02-23 15:29,即將進入恆春半島洋蔥採收期，計畫參選2022年屏東縣長的安泰醫院榮譽院長蘇清泉日前到恆春大和蔬果生產合作社，了解今年產銷狀況，以幫助蔥農提高收入。,,0
ettoday,年輕妹被甩！網購「超嗆大禮」送前男友…鄰居阿姨看哭了,https://www.ettoday.net/news/20210210/1887997.htm?from=pctaglist,2021-02-10 17:23,驚天大禮物！山東省淄博市的一位男子日前收到了1噸的洋蔥，竟是自己前女友送的。前女友網購時還備註了「只要放在大門口」，讓前男友自己搬，甚至留下霸氣字條表示，「前任！我哭了3天，這下該你哭了！」對此，男主氣炸，也拒絕領走這1噸洋蔥。,,0
ettoday,偷吃洋蔥炒蛋送醫險沒命！　憨厚汪吐完「櫃台翻肚討摸」媽傻眼,https://www.ettoday.net/news/20210114/1898335.htm?from=pctaglist,2021-01-14 16:06,差點在鬼門關前走一遭！瑞芳米克斯「壯壯」的馬麻這天在家準備了一桌豐盛料理，久違煮了好久沒吃的洋蔥炒蛋，沒想到毛孩當天趁著家人不注意時，就直接衝到廚房偷吃，當馬麻一回神想起「狗不能吃洋蔥」卻為時已晚，壯壯早已吞下好幾口，於是家人立刻送醫催吐，結果少根筋的壯壯卻一心只想著跟路人討摸。,,0
ettoday,搶救洋蔥！全聯推1百公克2.5元免囤貨　家樂福1公斤49元買1送1,https://www.ettoday.net/news/20210111/1896317.htm?from=pctaglist,2021-01-11 17:55,搶救本土洋蔥！近來彰化洋蔥產量過剩造成價崩，全聯與家樂福特地引進幫助農民，接連發起「搶救洋蔥大作戰」，繼家樂福推出1公斤49元「買1送1」後，全聯也推出每100公克2.5元，等於每公斤約25元，好處則是買多少秤多少，不用囤貨。,,0
ettoday,打包好市多洋蔥被酸！他怒下戰帖「汐止店等你」　網卻一面倒嗆爆,https://www.ettoday.net/news/20210104/1891214.htm?from=pctaglist,2021-01-04 17:41,好市多（Costco）熟食區先前傳出不少爭議，曾有人貪小便宜裝一大包洋蔥或飲料回家，導致現在很多民眾看到黑影就開槍！一名男子今天到汐止店採買，由於有買雞腿所以到熟食區裝了一包洋蔥，怎料卻被旁邊的中年男酸言酸語，他事後越想越不是滋味，PO文公開約對方下周一中午1點原地講清楚。,,0
ettoday,黃金獵犬壯麗冰面開心跑　網淚：我家天使汪奔來的樣子,https://www.ettoday.net/news/20201218/1879145.htm?from=pctaglist,2020-12-18 15:54,黃金獵犬跑過冰面，頭也不回地飛快往前奔去，TikTok用戶@nicmonod分享自家愛犬在壯觀景致中奔跑的模樣，而有網友留言「這就是我想像中過世後我家狗狗奔向我的樣子。」，臉書網友Abbie Gerbich將影片與留言轉發，短短6天就有1萬人留言、1.6萬人按讚。,,0
ettoday,洋蔥跟魚蝦一起吃會產生結石？關於洋蔥的4個迷思,https://www.ettoday.net/news/20201216/1874745.htm?from=pctaglist,2020-12-16 19:29,12月是洋蔥的產季，它是常見且好用的蔬菜，富含各種營養素和抗氧化成分，不僅拿來吃，也被當作偏方來改善各種問題，這些洋蔥的運用方式有用嗎？,,0
ettoday,網傳洋蔥配魚蝦易結石　食藥署闢謠但點出「另一項危害」,https://www.ettoday.net/news/20201213/1869217.htm?from=pctaglist,2020-12-13 00:03,糖醋魚、糖醋蝦都需使用洋蔥作為料理食材，但近日網路卻流傳一則訊息，強調洋蔥與魚蝦一起吃會產生結石，讓許老饕心驚驚。對此，食藥署給出回應了。,,0
ettoday,閃電颱風農損1709萬都在屏東　洋蔥最慘被害面積160公頃,https://www.ettoday.net/news/20201109/1850350.htm?from=pctaglist,2020-11-09 12:40,農委會今（9日）指出，11月5日起受閃電颱風影響，造成農業災情，經農糧署彙整各直轄市、縣市政府查報資料，截至今上午11點，農業產物及民間設施估計損失計1709萬元。,,0
ettoday,巴西森林大火...受傷食蟻獸見消防員「張手投降」　原因有洋蔥,https://www.ettoday.net/news/20201023/1838268.htm?from=pctaglist,2020-10-23 16:01,巴西伊普埃拉斯(Sueiras)在10月初發生一起森林大火，消防員接獲通報趕往現場撲火，途中遇見一隻受傷的食蟻獸試圖從燃燒中的叢林逃出，見到消防員驚慌的沿路狂奔，直到跑不動了站在原地「張手投降」，但這個動作背後卻有洋蔥。,,0
ettoday,玖壹壹洋蔥脫口講出「健志電話號碼」　他錄影中大叫：不要亂講,https://www.ettoday.net/news/20201014/1831426.htm?from=pctaglist,2020-10-14 16:38,八大《娛樂百分百》繼實境秀單元「叮咚五堅情」後，再次集結黃偉晉、邱鋒澤、陳零九、賴晏駒及婁峻碩推出「凹嗚5宿舍」，利用情境劇模式呈現五人「偽同居」生活樣貌。首集邀請本土嘻哈天團玖壹壹，無厘頭的他們在過程中頻頻出怪招，其中健志私人電話號碼竟意外被團員公開，聽得健志緊張大叫：「不要亂講！」,,0
ettoday,進入洋蔥育苗期　高雄區農改場籲農友注意病害防治,https://www.ettoday.net/news/20201014/1831105.htm?from=pctaglist,2020-10-14 11:59,高屏地區洋蔥進入育苗適期，但今年從8月份起，因西南氣流及午後熱對流旺盛，南部地區降雨頻繁，產生高溫多濕的環境，有利於黃萎病等病害發生，加上年初曾現蹤的炭疽病，嚴重時導致植株乾枯，對產量及品質影響甚大。為避免病害影響後續栽培，高雄區農業改良場籲請農友育苗時應加強病害預防工作，適時進行防治，而罹病幼苗則不可移至田間，以減少田間初次感染源。,,0
ettoday,把圓的都當胸部！　臉書以「太過性感」將洋蔥廣告刪除,https://www.ettoday.net/news/20201010/1828645.htm?from=pctaglist,2020-10-10 18:12,在社群媒體若發布過於腥羶色的言論，都會被檢舉警告或是刪文。而加拿大一間公司近日上傳一則「洋蔥廣告」，被臉書以含有「性感內容」為理由將其刪文，讓業者非常不解，後來發現原來臉書把洋蔥誤認為是胸部，才會被臉書刪除。,,0
ettoday,影／偷看媽做菜！虎斑貓「淚流不止」轉頭大哭　網笑：這下QQ了,https://www.ettoday.net/news/20201002/1823053.htm?from=pctaglist,2020-10-02 18:41,這份料理是不是加了洋蔥！新北市中和區有隻好奇心極強的貓貓嘎逼，每次看到媽媽在廚房做菜，一定跳到旁邊「監工」。這天嘎逼抓緊機會，又飛到工作臺上偷看食材，沒想到這次「淚流不止」、眼睛一直哭，這下媽媽傻眼表示，「為什麼要在我切洋蔥的時候上來啦！」,,0
ettoday,獨門吃法！好市多沙拉「撒滿雪花」更鮮甜　網暴動：牛肉捲也超搭,https://www.ettoday.net/news/20200916/1809936.htm?from=pctaglist,2020-09-16 12:40,美式賣場好市多（Costco）深受台灣人的喜愛，其中的熟食部也總充滿排隊人潮，還會有人特地前往享用美食。熟食部的「凱薩雞肉沙拉」是許多人的必點，每個人的口味不同，其中就有網友分享了自己的獨門吃法，讓沙拉瞬間更鮮甜；他也強調，如雪花般的洋蔥丁雖然好吃，但是務必不要浪費，「取自己吃得完的量。」,,0
ettoday,HowHow、洋蔥已經很搞笑　「他們」靠這2點更紅：笑著笑著就哭了,https://www.ettoday.net/news/20200905/1801775.htm?from=pctaglist,2020-09-05 12:46,YouTuber如雨後春筍般的冒出，題材要符合閱聽者的口味也越來越難， 其中的「HowHow（陳孜昊）」、「洋蔥（Onion Man）」和近期走紅的「反正我很閒」都有不少死忠粉絲，不過一名網友就認為，HowHow和洋蔥出現了「後繼無力」的感覺，評價似乎不如以往；以這3個頻道來說，到底哪一個最好笑？,,0
ettoday,網球放公園供大家玩！　飼主紀念離世愛犬「藏洋蔥」…網噴淚,https://www.ettoday.net/news/20200813/1783583.htm?from=pctaglist,2020-08-13 19:07,好大一顆洋蔥！推特網友@courttkardashh這天發布了一張她在狗公園拍到的照片，圖中有一個開著的木盒，裡面放了幾顆網球，而蓋子上放了一張紙，上面印著一隻狗狗戴著帽子，手邊放著啤酒罐的逗趣照片，旁邊還寫了紀念「BUFORD」。,,0
ettoday,「漢堡王」推3倍洋蔥漢堡　讓顧客自動保持社交距離,https://www.ettoday.net/news/20200813/1783920.htm?from=pctaglist,2020-08-13 15:38,美國速食巨擘「漢堡王」為降低顧客在點餐時因飛沫傳播感染新冠病毒的風險，推出了 訂製的點餐口罩、以及「社交隔離巨無霸漢堡」等行銷新招。「福斯新聞」報導，新冠肺炎疫情蔓延之際，「漢堡王」推出一項活動，讓顧客用餐廳訂製的口罩點餐。,,0
ettoday,剛切好洋蔥！　一旁三花貓流淚QQ...呆坐萌思考：我怎麼哭了,https://www.ettoday.net/news/20200811/1782388.htm?from=pctaglist,2020-08-11 21:03,國外抖音帳號＠lenastanyeva日前分享一段影片引起網友瘋傳，只見畫面中的三花貓若有所思的樣子坐在桌子旁邊，彷彿有什麼心事一般淚流滿面。原來，牠剛好坐在媽媽剛切好的洋蔥附近，不過牠卻不知道這是怎麼一回事，令人看了好想提醒牠，「換個位子就好了啦～！」,,0
ettoday,能預防骨鬆、降膽固醇！洋蔥好處多　教你4招巧切不流淚,https://www.ettoday.net/news/20200811/1779921.htm?from=pctaglist,2020-08-11 19:34,每次切洋蔥都流淚，但它卻是個「萬靈丹」，可以預防骨鬆、降膽固醇、改善血糖、抗發炎、抗癌......，值得為它多流兩行淚。,,0
ettoday,玖壹壹不畏「報復性旅遊」前進澎湖開唱　千人演唱會圓健志夢想,https://www.ettoday.net/news/20200723/1767933.htm?from=pctaglist,2020-07-23 19:53,2020花蓮夏戀嘉年華演唱會即將在8月25日至29日花蓮登場，玖壹壹五度登「花蓮夏戀嘉年華」開唱，受訪時更爆料演唱會中凸槌最多的是春風，曾在表演中走下臺演唱竟然接錯歌詞，唱成別的歌，最後就當作沒事繼續表演，而健志則是在舞台上唱著唱著竟掉下舞台，好笑的是其他團員竟然還不知道他跌落舞台。」疫情關係玖壹壹坦言上半年收入大受影響，雖然是零收入狀態，但健志也說：「反而因此時間變多也是不錯。」,,0
ettoday,艾文主揪唱歌趴「天團成員驚喜現身」　還有神秘嘉賓「包車衝台中」力挺,https://www.ettoday.net/news/20200711/1757953.htm?from=pctaglist,2020-07-11 14:40,艾文日前舉辦「今晚就要艾」線上KTV同樂趴，邀請5位幸運粉絲一起到包廂相聚歡唱，與粉絲們進行零距離的互動。師兄玖壹壹的洋蔥化身「Onion Eat」，親自外送自己店裡的滷味來探班，讓大夥唱歌時也能享用好料，還做起工商時間打廣告，巧妙置入行銷被誇是聰明老闆。,,0
ettoday,玖壹壹大甲鑽轎拜媽祖　洋蔥自爆結婚進度表「最快明年」,https://www.ettoday.net/news/20200626/1746991.htm?from=pctaglist,2020-06-26 17:41,玖壹壹今（26日）上節目擔任評審，29歲的洋蔥日前女友在他生日時，於IG放閃祝賀他生日快樂，2年前就曾放話說要把女友娶回家的他，被問到時尖點也直言說：「最快明年才結婚。」,,0
ettoday,「含洋蔥」可治療口腔潰瘍？　食藥署打臉：恐致黏膜受損,https://www.ettoday.net/news/20200620/1742320.htm?from=pctaglist,2020-06-20 20:30,許多人在免疫力低下時，容易出現口腔潰爛等症狀，嚴重時一張嘴就痛難以進食。近日網路流傳治療偏方，號稱只要「含洋蔥」就能加速癒合。對此，食藥署出面闢謠了。,,0
ettoday,「玖壹壹」洋蔥生日許願發片順利　女友IG放閃秀甜蜜合照！,https://www.ettoday.net/news/20200609/1734011.htm?from=pctaglist,2020-06-09 20:21,「玖壹壹」成員洋蔥8日生日，他與女友黃怡萱及朋友一起出遊去宜蘭歡慶生日，女友在IG寫下「祝胖子第9個（吧？）生日快樂，這張我看起來還可以，所以特別發一下。」並秀出兩人共進晚餐的甜蜜合照，閃瞎眾人，被問到女友送什麼禮物？洋蔥說：「只要她請我吃飯就很滿足了！」,,0
ettoday,她被甩「寄1噸洋蔥」堵門報復：換你哭　前男友直接轉賣…收錢笑了,https://www.ettoday.net/news/20200524/1721684.htm?from=pctaglist,2020-05-24 20:32,大陸山東淄博一名趙姓女子因為520前夕被提分手，氣得她在網路訂購一卡車（約1噸重）洋蔥，指定快遞520前送到前男友的家門口，希望用整車洋蔥嗆出前男友眼淚，「感情是兩個人的事，不能只有我哭」。不過趙女的前男友事後表示，他沒有哭，而且洋蔥轉手賣了，賺了1000多元（約新台幣4200元）。,,0
ettoday,鹽酥雞加大蒜＝吃心酸的！專家曝「切小塊放著」營養爆表：能降低癌症,https://www.ettoday.net/news/20200523/1719252.htm?from=pctaglist,2020-05-23 22:28,大蒜和洋蔥在台灣的各種美食中都非常常看到它的蹤跡，不論是爆香或配著吃都相當入味，受不少大小朋友的喜愛。而你知道嗎？大蒜和洋蔥其實也是一種非常有利於抗癌的食材之一，今天就來看營養師教大家怎麼吃最能吃出營養！,,0
