ettoday,YouTube公布2021台灣年度排行 療癒系影片最夯《天竺鼠車車》奪冠,https://www.ettoday.net/news/20211214/2145550.htm,2021-12-14 06:58,YouTube 本月初公布台灣 2021 年度影片排行榜，包括「熱門影片」、「熱門音樂影片」、「熱門創作者」、「快速竄升創作者」4項排行，從影片類型可觀察到，疫情期間以療癒舒壓、獲得新知等風格最受民眾歡迎，可愛療癒的《天竺鼠車車》就在「熱門影片」榜單奪冠。(生活 / 2021-12-14 06:58),,0
ettoday,YouTube台灣排行榜「天竺鼠車車」大勝 音樂影片台語歌奪冠,https://www.ettoday.net/news/20211201/2135818.htm,2021-12-01 10:21,YouTube 今 (1) 日公布台灣 2021 年度影片排行榜，包括「熱門影片」、「熱門音樂影片」、「熱門創作者」、「快速竄升創作者」。今年的趨勢為更多的動漫和遊戲電競等 ACG 內容上榜，滿足台灣日益分眾化的娛樂需求，且台灣觀眾在疫情嚴峻期間利用較長時間從 YouTube 獲得新知、療癒和個人啟發。在「熱門影片」榜單，可愛療癒的《天竺鼠車車》勇奪冠軍，成為該榜單首次獲得第一名的動畫影片；在「熱門音樂」榜部分，《愛情你比我想的閣較偉大》成為首次登上「熱門音樂影片」冠軍的台語歌曲(財經 / 2021-12-01 10:21),,0
ettoday,到華山逛「諾亞毛市集」 名人帶老殘病毛孩拍暖心攝影展,https://www.ettoday.net/news/20211024/2108167.htm,2021-10-24 10:16,諾亞方舟動物同樂會是致力於為老、病、殘毛孩發聲的公益團體，公益活動「諾亞毛市集｜方舟攝影展」於10月23日(六)至24日(日)於華山文創園區中4A館熱鬧登場，集結毛孩寵物、星級美食、手作繪畫、塔羅占卜等多元主題，嚴選15個質感品牌一同公益設攤，現場更邀請信義區人氣街頭藝人演出。(寵物動物 / 2021-10-24 10:16),,0
ettoday,呆萌撒摩耶化身「邱比特外送員」 集百人祝福為爸拔求婚成功,https://www.ettoday.net/news/20210930/2090539.htm,2021-09-30 11:43,最稱職邱比特！凱渥男模楊時修近日與愛情長跑7年的女友Karen求婚成功，家裡的薩摩耶「多比」化身成邱比特，跑遍台灣集結百人祝福，和爸拔拜訪100位親友收集「愛心小卡」，用狗狗視角紀錄這有愛的畫面，並於求婚當天在戶外婚禮場地用露天放映場播放，讓Karen感動落淚， (寵物動物 / 2021-09-30 11:43),,0
ettoday,《全明星2》藍隊為張語噥合體 連「知名主持人＋大咖YouTuber」都來了,https://www.ettoday.net/news/20210929/2089874.htm,2021-09-29 13:43,張語噥推出新歌《下單 我的愛》，找來鼓鼓合唱，而MV除了有鄰居張立東、工作上常遇到的YouTuber見習網美小吳，以及鼓鼓特邀請《全明星運動會》藍隊隊友顏佑庭力挺，再加上吳思賢（小樂）客串，還大方出借自家的咖啡廳，讓她感動直呼：「感受到滿滿的友誼，你們真的超棒，片段都很好笑，幫我加很多分啦，我愛大家！」(影劇 / 2021-09-29 13:43),,0
ettoday,台灣茶飲連續四年獲國際大獎肯定 全因茶葉職人堅持做出平凡中的不平凡,https://www.ettoday.net/news/20210913/2068693.htm,2021-09-13 17:00,台灣瓶裝茶飲經典品牌茶裏王，連續四年獲得國際風味評鑑所（ITI）「風味絕佳獎（Superior Taste Award）」的肯定，茶裏王也推出紀錄片，從栽種開始、帶你用不一樣的視角，看見台灣茶葉背後不簡單的故事，並藉此向讓台灣茶飲揚名世界的幕後推手們致上敬意。(消費 / 2021-09-13 17:00),,0
ettoday,小吳整人「集體退好友IG追蹤」！ 網怒指霸凌：無法笑著看完,https://www.ettoday.net/news/20210912/2078035.htm,2021-09-12 23:45,YouTuber「見習網美小吳」憑搞笑親民的風格走紅，團隊成員小吳、卡特、YOYO和聖元感情要好，常在鏡頭前互相吐槽鬥嘴，頻道累積破百萬人訂閱，人氣超高。日前他推出新片，企劃了整人主題，聯合多位好友一起退卡特社群追蹤，怎料卻引來網友罵聲，被指「像霸凌」。(影劇 / 2021-09-12 23:45),,0
ettoday,小吳「自創金牌舞」賀奪金！ 緊身衣＋深蹲笑翻網：明天再跳一次,https://www.ettoday.net/news/20210731/2045008.htm,2021-07-31 23:24,我國羽球男雙組合王齊麟、李洋31日在金牌賽中擊敗中國強敵，拿下台灣奧運史上首面羽球金牌，也是繼「舉重女神」郭婞淳後，代表隊在本屆奧運獲得的第2面金牌。全台陷入狂歡，YouTuber「見習網美小吳」更為此自創了「金牌之舞」，爆笑舞姿逗樂網友。(影劇 / 2021-07-31 23:24),,0
ettoday,小吳被Dcard爆買公關文...他傻眼回應 突哽咽曝2年前陰影,https://www.ettoday.net/news/20210728/2042057.htm,2021-07-28 13:45,百萬YouTuber「見習網美小吳」小吳與卡特、YOYO和聖元在最新影片中分享遇過的走心評論，小吳透露曾因在拍照時粉絲的一句話讓他有陰影，想到當時情況不禁哽咽，一旁的團員紛紛安慰。(影劇 / 2021-07-28 13:45),,0
ettoday,小吳才剛減17kg！ 微解封一量體重「嚇到彈開」：不要阻止我跳海,https://www.ettoday.net/news/20210713/2030035.htm,2021-07-13 20:21,YouTuber「見習網美小吳」先前發憤減肥，從2020年11月開始接受訓練，花費101天時間，從84公斤減到67公斤，被不少粉絲大讚很勵志。不過，他這段時間懈怠下來，好不容易決定面對體重，誰料剛站上體重計就嚇到跳下來，崩潰表示：「不要阻止我跳海！」(影劇 / 2021-07-13 20:21),,0
ettoday,孫協志「很多網紅給我感受不好」 唯一合作小吳...讚他《飢餓》反應,https://www.ettoday.net/news/20210712/2028788.htm,2021-07-12 15:34,孫協志經營的YouTube頻道「Sunday • 威士忌」最新一集找來見習網美小吳小酌談心事。孫協志對小吳上《飢餓遊戲》的印象深，大讚他個性樂觀，也可能是他這個頻道唯一的會找的網紅，「小吳讓我喜歡的點是他很懂得感恩，對於每個人、每件事抱持著尊敬、學習，一起努力的心情，對過去誰幫助過很感謝在心。」(影劇 / 2021-07-12 15:34),,0
ettoday,二伯遭酸變老「黃臉一堆痘痘」 蔡阿嘎高EQ護妻被推爆：亂講！,https://www.ettoday.net/news/20210618/2009949.htm,2021-06-18 14:08,YouTuber蔡阿嘎與二伯結婚後，共育有2個兒子「蔡桃貴」和「蔡波能」，家庭生活幸福甜蜜，夫妻倆也不時會與粉絲分享日常點滴。怎料，他進來看見PTT上有酸民批評妻子「怎變這麼老？」對此，他本人今（18日）高EQ做出回應、力挺太太：「二伯最正啦！」(影劇 / 2021-06-18 14:08),,0
ettoday,郭書瑤被攻擊長相！內心受傷…嗆酸民「想約見面」：看你長怎麼樣,https://www.ettoday.net/news/20210424/1967104.htm,2021-04-24 01:04,女星郭書瑤（瑤瑤）擁有甜美外型，以及魔鬼般的好身材，剛出道時以一句經典台詞「殺很大」而走紅，出道13年如今轉型成實力派演員。她近日到YouTuber「見習網美小吳」的頻道談論關於「粉絲」的主題，表示曾被攻擊關於「長相」的事情，讓她直接在影片中回嗆：「我想看你長什麼樣子。」(影劇 / 2021-04-24 01:04),,0
ettoday,《大熱門》猜歌魔王應戰！Lulu秒答慘電見習網美小吳,https://www.ettoday.net/news/20210413/1959501.htm,2021-04-13 18:02,猜歌魔王無誤！藝人Lulu（黃路梓茵）在綜藝節目《綜藝大熱門》被譽為猜歌魔王，日前與YouTuber見習網美小吳以及其團隊比賽猜歌，只見她不斷聽前奏秒猜，瞬間拉開比分，讓小吳團隊成員傻眼，果然如她所說的「說真的想贏我可沒那麼容易」。(影劇 / 2021-04-13 18:02),,0
ettoday,小吳遭私訊轟炸「太魯閣有捐錢？」 親曝低調善舉：連我媽都不知,https://www.ettoday.net/news/20210406/1954615.htm,2021-04-06 21:24,YouTuber「見習網美小吳」因為逗趣且貼近日常的拍片風格，吸引許多年輕族群喜愛，平時除了拍片也常常在社群網站分享近況，總會吸引許多粉絲迴響，怎料最近他收到不少私訊，質問2日發生的太魯閣號出軌意外，他是否有捐款，6日晚間他也針對此事發文，一番言語獲得許多讚賞。(影劇 / 2021-04-06 21:24),,0
ettoday,王心凌首度唱進高雄 萬張門票全賣完...她悄曝嘉賓：有口袋名單,https://www.ettoday.net/news/20210316/1939494.htm,2021-03-16 16:19,王心凌將在5月29日於高雄巨蛋開唱，舉辦「CYNDILOVES2SING愛‧心凌巡迴演唱會 2021旗艦版高雄場」，門票今（16日）中午開賣，1萬張目前已全數售罄，王心凌感謝大家搶票辛苦了，也表示：「心情非常舒爽！」(影劇 / 2021-03-16 16:19),,0
ettoday,【廣編】桂格30天健康動吃大挑戰！雙網紅熱度引發網友蓋高樓,https://www.ettoday.net/news/20210217/1920632.htm,2021-02-17 12:12,坐擁40支百萬觀看影片，超高人氣的YouTuber團體《欸你這週要幹嘛》，在新的一年，決定為自己的健康身體力行，接受桂格公司的邀請，發起連續30天「桂格健康動吃大挑戰」，更點名了即將步入百萬粉絲大關的另一組YouTuber團體《見習網美小吳》加入挑戰，看誰能在30天後改變最顯著，獲得最終勝利。(消費 / 2021-02-17 12:12),,0
ettoday,五月天除夕夜陪你守歲！ 一一解答「超私密問題」,https://www.ettoday.net/news/20210210/1918560.htm,2021-02-10 14:34,五月天將於明晚（11日）除夕夜晚上10點半，在相信音樂YouTube頻道以及微博直播《五月天陪你守歲2021》特別節目，這也是五月天連續4年陪粉絲守歲迎新年，別出心裁地打造時下最夯的露營野餐風格，在大自然環繞下，帶給大家過個最chill的除夕夜。 (影劇 / 2021-02-10 14:34),,0
ettoday,楊丞琳假MV試鏡整人！ 阿圓、紀卜心跳荒謬「打屁股舞」網笑翻,https://www.ettoday.net/news/20201231/1889101.htm,2020-12-31 18:46,YouTuber「見習網美小吳」日前拍攝了一項整人企劃，找來歌壇小天后楊丞琳，舉辦假MV試鏡，並邀一隻阿圓、這群人、紀卜心等多位YouTuber參加，現場祭出歌唱、舞蹈等各種考題，測驗大家的臨場反應，拍下超多爆笑畫面。(影劇 / 2020-12-31 18:46),,0
ettoday,12夢境場景刷爆IG！全台第一座彩色「口罩牆」 色廊展2.0華山開跑,https://www.ettoday.net/news/20201228/1886262.htm,2020-12-28 15:55,全球累積觀展次數破百萬、曾在IG瘋狂洗版的「色廊展」強勢回歸，「色廊2.0-夢境製造所」即日起至明年4/5在台北華山文創園區開展，以「12個顏色 X 12個夢境」打造繽紛奇幻的創意場景，再搭配心理學家獨家設計的顏色心理測驗，同時打造全台第一座「彩色口罩牆」，預計再掀一波打卡潮！(生活 / 2020-12-28 15:55),,0
ettoday,亂做薑餅屋被罵5天！ 小吳哽咽哭了…「道歉1舉動」被讚爆：模範,https://www.ettoday.net/news/20201226/1884812.htm,2020-12-26 06:26,知名YouTuber「見習網美小吳」日前參加YouTuber們的手作薑餅屋企劃，抽到的對象是「台灣第一位破百萬女YouTuber」魚乾，決定用菜脯餅、蜜餞等台味零食製作，卻遭批太隨便，他事後發文道歉，緊急重新親手做了兩大盒杯子蛋糕補償魚乾並道歉，講一講還哽咽落淚，網友則認為他們非常有誠意，態度180度大轉變讚爆。(影劇 / 2020-12-26 06:26),,0
ettoday,黃氏兄弟「3000片餅乾蓋薑餅屋」 挨轟浪費食物…曝處理過程,https://www.ettoday.net/news/20201222/1881536.htm,2020-12-22 10:32,知名YouTuber「黃氏兄弟」由哲哲（黃雍哲）與弟弟瑋瑋（黃挺瑋）組成，在YouTube擁有162萬粉絲訂閱，近期準備了聖誕特別企劃，聯合了見習網美小吳、白癡公主、魚乾、上班不要看等多組人馬，親手製作薑餅屋，互相送給指定的人，但兩人製作的巨大薑餅屋卻被質疑浪費食物，在網路上引起不少討論。(影劇 / 2020-12-22 10:32),,0
ettoday,薑餅屋塞「菜脯餅+蜜餞」送禮…遭批隨便！ 小吳：只是想當驚喜,https://www.ettoday.net/news/20201219/1880135.htm,2020-12-19 22:40,每年聖誕節，不少人都會和身邊朋友聚會狂歡、交換禮物，製造難忘的佳節回憶。知名YouTuber「黃氏兄弟」就推出特別企劃，聯合「見習網美小吳」、「白癡公主」、「魚乾」、「上班不要看」等多組人馬，親手製作薑餅屋，送給指定的人。(影劇 / 2020-12-19 22:40),,0
ettoday,小吳「iRent違規載狗狗」挨轟！ 刪影片道歉：以為有清理就可以,https://www.ettoday.net/news/20201102/1845311.htm,2020-11-02 19:15,YouTuber「見習網美小吳」今年開始飼養薩摩耶犬「南瓜」，還為她專門開設了一個新頻道，分享人狗相處的生活趣味影片。他日前上傳開iRent車輛載南瓜外出的影片，被網友批評是錯誤示範，1日公開發文道歉：「很抱歉我們不知道iRent不能載狗狗。」並將原影片下架。(影劇 / 2020-11-02 19:15),,0
ettoday,"網美小吳激推中華電信網路門市「呱張夏拼嘉年華」 抽MacBook大獎再領1,000元好買幣",https://www.ettoday.net/news/20200806/1776086.htm,2020-08-06 16:11,網紅團體「見習網美小吳」日前搬新家，按照慣例就是要邀請朋友來家裡「暖房聚人氣」，於是團隊成員中卡特、聖元以及YOYO馬上來到小吳新家好好放肆一下。身為專業的Youtuber，第一件事就趕快到IG打卡，沒想到聖元卻發出警訊說，「你家沒網路」讓在一旁已經拍好美照的YOYO怒吼，「我剛剛已經拍好美照了」(消費 / 2020-08-06 16:11),,0
ettoday,超貼心水果攤阿姨標語又來了！網紅鼻酸直呼：「拯救了我！！」,https://www.ettoday.net/news/20200703/1751149.htm,2020-07-03 10:00,現代人工作忙碌，兼顧健康飲食困難，想透過吃水果來均衡飲食，但到水果攤買、切水果太麻煩，甚至不知如何選，果汁品牌園之味去年便與水果攤合作在店內貼出溫馨標語，提醒大家「有空吃水果，沒空就喝園之味」引起不小迴響，今年有更多水果攤響應，創意標語也引起了網紅們前往朝聖！(消費 / 2020-07-03 10:00),,0
ettoday,網紅路過愛心餅乾曝本性！她撞見「衝擊一幕」秒告白 網淚推：YT界典範,https://www.ettoday.net/news/20200618/1740734.htm,2020-06-18 16:24,許多網紅就算有了名氣，還是不忘本心默默行善。就有一名女網友發文，說她前兩周看到YouTuber「見習網美小吳」在買愛心餅乾，但她之後也沒有看到小吳有發什麼動態或照片，「有些人會曬愛心或是發文討好感，他默默到不行……」原PO也曬出她私訊給小吳被回覆的截圖，忍不住大讚「我愛你小吳，告白！」(生活 / 2020-06-18 16:24),,0
ettoday,網紅「殺豬公」...金額竟高達6位數！  網友狂推：無痛存錢法,https://www.ettoday.net/news/20200601/1727500.htm,2020-06-01 17:47,有些人會使用「小豬撲滿」存錢，究竟存滿後能存下多少錢呢？網紅「見習網美小吳」近期貼出一段影片，分享從大學開始存錢的豬公，6年下來竟累積了6位數金額，讓不少網友又驚又羨慕，直呼「零錢倒出來的瞬間太爽了」。(生活 / 2020-06-01 17:47),,0
ettoday,IG瘋「選擇障礙」挑戰！小編超ㄎㄧㄤ回文引朝聖 網笑瘋：嗑了什麼給我來一點,https://www.ettoday.net/news/20200509/1707302.htm,2020-05-09 09:00,「小孩子才做選擇，我全都要！」這句被選擇障礙者奉為救命解藥的最強金句，完美解決大家「這個也想要、那個也想要」的困境。最近IG出現一個限時開啟的「選擇障礙診療室」，除了幾篇網友投稿的「症狀」得到小編立即的超ㄎㄧㄤ「神回覆」，網友朝聖後更直呼「太鬧了我可以！」(消費 / 2020-05-09 09:00),,0
ettoday,搶救口罩危肌大作戰！見習網美小吳實測揪好物,https://www.ettoday.net/news/20200408/1685269.htm,2020-04-08 12:47,防疫期間「口罩不離口」成為全民運動，但長時間包覆臉部不僅不舒服，潮濕悶熱再加上摩擦，更讓肌膚吃不消，又是泛紅搔癢，又是出面油、狂冒痘，實在令人崩潰！要防疫也要美麗嗎？跟著「見習網美 小吳」一起搶救危肌！(消費 / 2020-04-08 12:47),,0
ettoday,愛莉莎莎嗆一隻阿圓道歉片「看起來像假哭」放大螢幕：眼淚在哪,https://www.ettoday.net/news/20200407/1686071.htm,2020-04-07 20:48,一隻阿圓在今年2月底從南韓返台，未確實做好自主管理出席「走鐘獎」，遭到輿論攻擊，事後阿圓拍影片淚崩道歉。而阿圓近日與愛莉莎莎及見習網美小吳等人在WACKYBOYS 反骨男孩影片「現在不能走心EP2」中PK，影片中所有人都戴好口罩，酷炫拿出清潔液幫大家消毒手部，暗虧阿圓的新聞事件，以「一隻病原」介紹她出場。(影劇 / 2020-04-07 20:48),,0
ettoday,吳宗憲猜歌緊張到結巴...鬆口談周杰倫寫歌往事：我把機會讓給他和方文山,https://www.ettoday.net/news/20200316/1668701.htm,2020-03-16 17:28,今年將邁入第7年的三立都會台《綜藝大熱門》，近日推出全新單元「全民猜歌王」，首集參加者包括唱片歌手陳大天、張芸京、新人王艷薇等，YouTuber那那大師、關韶文、見習網美小吳、欸！你這週要幹嘛等聽歌猜歌名，挑戰獎金高達25萬元。主持人吳宗憲也在節目中道出周杰倫的往事。(影劇 / 2020-03-16 17:28),,0
ettoday,網美小吳DIY「朴敘俊栗子頭」！ 一刀剪掉5cm瀏海...成果網傻眼：河童是你,https://www.ettoday.net/news/20200315/1668036.htm,2020-03-15 13:22,由朴敘俊、金多美主演的韓劇《梨泰院class》受到廣大觀眾喜愛，目前電視劇已經進入尾聲，故事發展頗受劇迷關心。朴敘俊近年來演了不少膾炙人口的作品，每一個角色都讓觀眾印象深刻，這次在《梨泰院》中栗子頭造型再度引領新時尚潮流，YouTuber「見習網美小吳」也難抵魅力親身體驗。(影劇 / 2020-03-15 13:22),,0
ettoday,過年只能「尬聊」？YouTuber教你拉近親戚距離,https://www.ettoday.net/news/20200125/1624645.htm,2020-01-25 10:33,「打算什麼時候結婚？」、「現在薪水多少啊？年終呢？」、「你是不是變胖了？」相信多數人在過年期間最苦惱的就是被親戚長輩追問以上令人「害怕」又「尷尬」的問題；除此之外，過年時總免不了需要和沒那麼熟的遠房親戚碰面「尬聊」，既然逃不掉，不如就主動出擊吧！(3C家電 / 2020-01-25 10:33),,0
ettoday,講幹話也能出名的YouTuber！ 下班後「看一部廢到笑」...網狂讚：看了超紓壓,https://www.ettoday.net/news/20200123/1616015.htm,2020-01-23 13:00,YouTuber一職已漸漸成為新時代的趨勢，他們往往需要具備十八般武藝、口條清晰或講話嗆辣才能脫穎而出，而能在其中凸顯個人特色、走出自己的路更是難上加難。因此各類型的網紅不斷竄起，讓美妝型、知識型的YouTuber不再專美於前，其中「看了影片之後會感到超紓壓」的YouTuber們在近期不斷引起網友們熱烈討論。 (影劇 / 2020-01-23 13:00),,0
ettoday,Dcard公布2019年「年輕人聊什麼？」 阿滴、反送中、同婚討論度最高,https://www.ettoday.net/news/20200121/1630177.htm,2020-01-21 11:11,社群論壇Dcard公布了2019年度回顧，透過數據分析過去一年來在Dcard五大受到年輕人關注的事。其中，討論度最高的YouTuber是利用各種有趣教學分享英文的阿滴；而在社會時事方面，根據數據統計，年青人相當關注反送中、憂鬱症、同志婚姻等議題。(3C家電 / 2020-01-21 11:11),,0
ettoday,YouTuber狠砸50萬買刮刮樂！ 第一張就槓龜「結算金額慘賠」無奈：勿過度投注,https://www.ettoday.net/news/20200116/1626608.htm,2020-01-16 00:44,再不到一個禮拜就要過年，過年當天除了有紅包拿、和親戚團聚，最後大家一起搓麻將、買刮刮樂更是必備行程。YouTuber「黃氏兄弟」每年過年都會集巨資買2000元的刮刮樂，2020年也不例外，影片立刻引起熱議。(影劇 / 2020-01-16 00:44),,0
ettoday,交友軟體糾察隊！ 網紅實測交友App「顏值全爆」還驚見更帥版宥嘉,https://www.ettoday.net/news/20191120/1583049.htm,2019-11-20 12:00,交友軟體不斷推陳出新，網紅見習網美小吳就跟著朋友Yoyo、聖元化身「交友軟體糾察隊」，實測交友App「Omi」各種功能，沒想到不僅找不出破綻，隨便滑顏值都爆表，甚至還驚見「帥版林宥嘉」，讓見習網美小吳宣布，「糾察失敗！這真的是一款超有質感的App。」(生活 / 2019-11-20 12:00),,0
ettoday,水瓶座超怪性格揭秘！適合遠距離戀愛、朋友永遠比自己重要,https://www.ettoday.net/news/20190223/1384812.htm,2019-02-23 12:47,一提到水瓶座，大家的印象就是「怪人」、「外星人」，而且不僅外人覺得怪，連水瓶也引以自豪。「見習網美小吳」就分析，其實高深莫測的水瓶們，還有這些你不知道的特質，超神準點評一起來膜拜。(時尚 / 2019-02-23 12:47),,0
ettoday,momo拼了！線上年貨節搶客源 必殺攻略讓你爽買不手軟,https://www.ettoday.net/news/20190116/1357954.htm,2019-01-16 15:57,隨著農曆年到來，許多家庭陸續開始採買年貨，momo即日起至1月17日止舉辦線上「年貨街」快閃活動，融合娛樂互動、年節刮刮樂與新年許願等元素，甚至推出「Youtuber過年大比拚」活動，邀請許多知名網友來推薦，這次也祭出非常多優惠活動，當然就要有必殺攻略來看怎麼買。(消費 / 2019-01-16 15:57),,0
ettoday,台幣1萬多元買LV！一年僅2次 日本二手名牌特賣會11/9登場,https://www.ettoday.net/news/20181104/1297826.htm,2018-11-04 12:35,想要入手精品名牌嗎？一年僅有2次的「日本二手名牌特賣會」，2018年最後一次將於11月9日至11日在東京登場，僅有3天時間，現場有各大知名精品品牌，更可見LV山，甚至只要1萬多元就有機會入手LV，想要撿便宜可要把握機會！(旅遊 / 2018-11-04 12:35),,0
ettoday,處女座就是難搞！龜毛個性難伺候 其實超沒自信、缺乏安全感,https://www.ettoday.net/news/20180926/1266987.htm,2018-09-26 16:09,大家對於處女座普遍的刻板印象無非是龜毛、難搞、有潔癖，但事實上真是如此嗎？今天就要來解析處女座的優缺點，在他們光鮮亮麗、追求完美的外表下，其實藏著一顆沒自信、易受傷的心，還有追處女必看功略，一同把握五大守則，輕鬆抱得美人歸吧～ (時尚 / 2018-09-26 16:09),,0
ettoday,巨蟹座真的「零負評」？愛上蟹子別玩欲擒故縱 要這樣追才對～,https://www.ettoday.net/news/20180911/1256069.htm,2018-09-11 12:47,在十二星座當中，最獲好評的應該就屬巨蟹座莫屬了，說到這個星座，大家應該都會聯想到愛家、好老公／老婆的代表等，但是今天「見習網美小吳」就要來帶大家一起深入研究巨蟹座的內心，難道他們真的是零負評嗎？(時尚 / 2018-09-11 12:47),,0
ettoday,機車族最討厭6種「超囧狀況」！安全帽消失好悲劇,https://www.ettoday.net/news/20180524/1174766.htm,2018-05-24 08:03,台灣最多的交通工具就是機車，身為機車族，在通勤的過程中難免會遇上一些狀況，網路紅人「見習網美 小吳」就1支影片，點出新手機車族常見的5大難題(ET車雲 / 2018-05-24 08:03),,0
