ettoday,紐時頭條／Stand By Me 領導者們宣示反恐大團結,https://www.ettoday.net/news/20150112/450546.htm,2015-01-12 22:01,數十萬人周日湧上巴黎街頭，參加由法國和世界各國領導人領頭的集會遊行。這是巴黎發生一系列恐怖襲擊之後，法國政府主辦的一次展示團結及反抗的活動。(國際 / 2015-01-12 22:01),,0
ettoday,金球獎／喬治克隆尼夫婦首度齊走紅毯 配件超搶鏡,https://www.ettoday.net/news/20150112/450233.htm,2015-01-12 11:05,2015年第72屆金球獎在台灣時間1月12日於美國洛杉磯盛大舉辦，提名終身成就獎的好萊塢男星喬治克隆尼（George Clooney）也首度攜新婚嬌妻艾默克隆尼（AMAL ALAMUDDIN CLOONEY）步上星光紅毯，不只兩人的親暱互動閃瞎觀眾，就連身上配件也是紅毯大焦點。(消費 / 2015-01-12 11:05),,0
ettoday,響應「我是查理」？ 我們不要廉價的多元文化主義,https://www.ettoday.net/news/20150112/450048.htm,2015-01-12 00:05,這對台灣來說，查理才有意義，我們不要扁平、廉價的多元文化主義。我比較樂觀，網路上有越來越多的文章，都在反省這一些（雖然我不知道台灣社會可以整體地反省的條件在哪，但就我目前看到的網路文章，還算非常有反思性）。(論壇 / 2015-01-12 00:05),,0
ettoday,《查理週刊》遭恐怖份子血洗 法國70萬人遊行悼念,https://www.ettoday.net/news/20150111/449865.htm,2015-01-11 10:20,法國的《查理周刊》（Charlie Hebdo）遭到恐怖份子血洗巴黎總部，包括總編輯在內共有12人死亡。為悼念死者，法國人民10日發起全國為期3天的大遊行，約有70萬人參與。(國際 / 2015-01-11 10:20),,0
ettoday,國際足球／受法國恐怖攻擊 足球隊練習難以集中注意力,https://www.ettoday.net/news/20150110/449696.htm,2015-01-10 14:35,法國最近很不平靜，遭受恐怖攻擊威脅下，法甲豪門巴黎聖日耳曼練習都處在恐怖攻擊的陰影下，總教練白蘭斯(Laurent Blanc)表示，這種情況下練習，難集中注意力。 (體育 / 2015-01-10 14:35),,0
ettoday,NBA／查理周刊血案 法國飛人巴圖「我是查理」T恤聲援,https://www.ettoday.net/news/20150110/449655.htm,2015-01-10 12:43,台灣時間7日法國巴黎發生《查理周刊》(Charlie Hebdo)血案，引發當地民眾用「我是查理」(Je Suis Charlie)的方式表達反恐與挺自由言論的決心，拓荒者隊「法國飛人」巴圖(Nicolas Batum)9日與熱火隊賽前就著「我是查理」T恤熱身，以行動替自己的家鄉聲援。(體育 / 2015-01-10 12:43),,0
ettoday,悼槍擊捍衛言論自由 時尚老佛爺：我是查理！,https://www.ettoday.net/news/20150109/449434.htm,2015-01-09 18:01,法國著名政治諷刺周刊《查理周刊（Charlie Hebdo）》7日發生恐怖槍擊案，包括主編在內共有12人死亡、4人重傷。發生至今，已有眾多網友轉發「我是查理！（JeSuisCharlie）」的標語，弔念死者外也捍衛言論自由，引發「查理效應」。 (消費 / 2015-01-09 18:01),,0
ettoday,我是查理：《查理周刊》跟查理布朗和戴高樂的淵源,https://www.ettoday.net/news/20150108/448802.htm,2015-01-08 20:19,有稜有角、充滿諷刺和爭議色彩的《查理周刊》，名字的淵源竟然是來自「魯蛇幫幫主」查理布朗(Charlie Brown)，讓人頗感意外，然而事實的確是如此。(國際 / 2015-01-08 20:19),,0
ettoday,悼《查理周刊》同業 全球漫畫家PO作品嗆恐怖分子,https://www.ettoday.net/news/20150108/448862.htm,2015-01-08 17:55,法國左派政治諷刺雜誌《查理周刊》（Charlie Hebdo）周三（7日）慘遭大屠殺，造成12人死亡、4人重傷，死者包括多名知名漫畫家，社群網站發起張貼「我是查理」（Je suis Charlie）的圖片運動，聲援言論自由，世界各地許多漫畫家也貼出畫作，哀悼慘死的同業，有的辛辣，有的哀傷。(國際 / 2015-01-08 17:55),,0
ettoday,巴黎槍擊案 11萬網友挺「我是查理」捍衛言論自由,https://www.ettoday.net/news/20150108/448581.htm,2015-01-08 11:23,巴黎查理週刊（Charlie Hebdo）槍擊案造成12人死亡、4人重傷，被視為對言論自由的侵犯；目前，有網友在臉書發起「張貼我是查理（Je suis Charlie）圖片」的運動，藉此表達對媒體及言論自由的支持。(國際 / 2015-01-08 11:23),,0
