Source,Title,Link,Date,Summary,Text,Like
PTT,[問卦] 愛莉莎莎過氣了嗎,https://www.ptt.cc/bbs/Gossiping/M.1639756015.A.DD6.html,2021-12-17 23:46:52,,本木村的高中學姊八卦板的女神愛莉莎莎前陣子的八卦根本就是愛莉莎莎粉絲板好不熱鬧但現在都是OOXX文看了就煩愛莉莎莎過氣了嗎？--,7
PTT,Re: [新聞] 愛莉莎莎「台女拜金、崇洋媚外」惹議！　,https://www.ptt.cc/bbs/Gossiping/M.1633170355.A.0F0.html,2021-10-02 18:25:52,,這次我支持她的言論，根本事實啊媽的，一堆整天喊女權至上，根本女權智障就像有人遇到自己人在辦公室約炮、打炮，結果咧？安靜的跟啥鬼一樣。但一聽到有人太太說話，就馬上跳出來砲轟林北支持兩性憑拳--,
PTT,Re: [新聞] 進化成「AZ莎莎」！愛莉莎莎開心打第二,https://www.ptt.cc/bbs/Gossiping/M.1635951598.A.029.html,2021-11-03 22:59:56,,為什麼很多人都覺得Z跟利是同音阿這個也是，利大於弊時也是念錯就算了，拿來當梗不會很尷尬嗎有把G唸成居，N唸成恩，R唸成阿的掛嗎--,
PTT,Re: [新聞] 愛莉莎莎「台女拜金、崇洋媚外」惹議！,https://www.ptt.cc/bbs/Gossiping/M.1633178071.A.5E1.html,2021-10-02 20:34:29,,我以為同樣都是女生愛麗莎莎講的台女會認同欸結果台女自己都覺得這是貶義那是不是台女自己也覺得自己就是這樣呢事實就是如此反駁不了難怪會77pupu的嘻嘻--,2
PTT,[新聞] 愛莉莎莎當一日女友 評鍾明軒「嘴巴賤Gay,https://www.ptt.cc/bbs/Gossiping/M.1634565374.A.C7C.html,2021-10-18 21:56:12,,愛莉莎莎當一日女友評鍾明軒「嘴巴賤Gay」自由時報2021/10/1807:14〔記者林南谷／台北報導〕網紅鍾明軒日前邀請YouYuber愛莉莎莎擔任他的「一日女友」，他從不避諱承認自己喜歡男生，但愛莉莎莎一點兒也不在意，事後還狂讚鍾明軒。愛莉莎莎透過臉書表示好喜歡鍾明軒，笑稱：「一位個性無法偽裝的直，遇上一個嘴巴對我還賤的Gay，就是舒服，笑爆的一整天。」她感謝鍾明軒的邀約，讓她體驗到不分性別的友誼。鍾明軒日前為了古板家人，決定成為「一日直男」，他希望女方符合皮膚白、說話直接、性格有點ㄎㄧㄤ的形象，因此找上愛莉莎莎，挑戰與女生約會一天。過程中，鍾明軒嘗試做出十指緊扣、摟肩、互相餵飯等親暱舉動，不過都能看出鍾明軒相當不適的表情。愛莉莎莎最後替這場約會打出30分的分數，強調：「如果你的心沒有在對方身上的話，那一切就是0分。」鍾明軒則向鏡頭前的父母喊話，表示自己努力嘗試過了，但他真的沒辦法跟女生在一起，「我本人在台灣就是要交帥哥」，希望家人們都可以死心。--,4
PTT,[新聞] 父親盼延續香火！鍾明軒和愛莉莎莎「在,https://www.ptt.cc/bbs/Gossiping/M.1634876020.A.707.html,2021-10-22 12:13:38,,父親盼延續香火！鍾明軒和愛莉莎莎「在一起」：試最後一次三立黃韻璇新聞內容：YouTuber鍾明軒經常在個人頻道分享生活中大小事，嗆辣敢言、自信做自己的風格，吸引不少粉絲追捧，過去他也透露自己喜歡的是男生，不過16日他卻PO出影片表示，父母仍期盼他「延續鍾家香火」，因此他願意進行最後一次嘗試，和女生約會。鍾明軒表示父親的思想古板，繼母聊天時也經常問「你以後小孩要生男生女生」、「你以後結婚要辦幾桌」，似乎認為他現在喜歡男生只是暫時的，鍾明軒直言「他們的心中還有一絲絲希望出現」，為了要延續鍾家的香火，鍾明軒在影片中嘗試跟女生在一起。影片中鍾明軒找來愛莉莎莎約會，兩人嘗試在一起一天，不過在牽手的環節愛莉莎莎就不太滿意，直說「牽手的時候距離很遠，很想要走掉的感覺」，兩人約會後愛莉莎莎表示「我覺得今天滿自在的，但很明顯感受到對方沒感覺」。▲兩人嘗試壁咚、牽手、摟肩。（圖／翻攝自鍾明軒臉書）過程中愛莉莎莎引導鍾明軒牽手、摟肩，，愛莉莎莎則給鍾明軒打30分，因為兩人從頭到尾沒有情侶感，鍾明軒也坦言「進行了最後一次嘗試，真的沒有辦法跟女生在一起」。鍾明軒最後在臉書PO文中表示「真心希望我是個值得被愛的存在，在未來裡我等待著有一天我真心喜歡的人，可以讓我的人生主詞由『我』變成『我們』，生理女就先算了」。新聞連結：備註：笑死我記得鍾明軒之前說自己是雙性戀還想裝阿==--,
PTT,[問卦] 龍龍/熊熊/愛莉莎莎誰生存力最強八卦?,https://www.ptt.cc/bbs/Gossiping/M.1633278218.A.BED.html,2021-10-04 00:23:35,,如果某日拍實境節目龍龍/熊熊/愛莉莎莎被困在無人島請問誰的生存能力最強?如果參賽者包括你共四人你可以選一個隊友你會選哪一個當隊友以利獲得荒島求生比賽的勝利呢?有沒有這方面的八卦?----,28
PTT,[新聞] 愛莉莎莎當一日女友…信義區索吻放閃！　,https://www.ptt.cc/bbs/Gossiping/M.1634534758.A.B95.html,2021-10-18 13:25:51,,備註請放最後面違者新聞文章刪除1.媒體來源:ETtoday星光雲2.記者署名:記者陳芊秀／綜合報導3.完整新聞標題:愛莉莎莎當一日女友…信義區索吻放閃！打分鍾明軒：嘴巴比我還賤的Gay4.完整新聞內文:網紅鍾明軒為了一圓父母盼望，拍片嘗試「和女生在一起」，對象找來超人氣YouTuber愛莉莎莎，模仿直男跟女生約會。雖然影片中兩人約會狀況百出，愛莉莎莎曬照片發文告白：「好喜歡你。」▲愛莉莎莎點頭當一日女友，和鍾明軒約會。（圖／翻攝自臉書／愛莉莎莎）愛莉莎莎形容兩人約會，「一個個性無法偽裝的直女，遇上一個嘴巴對我還賤的Gay，就是舒服，笑爆的一整天」。她感謝鍾明軒的邀約，體驗到不分性別的友誼，「還有……愛情……？」同時曬出信義區天橋上和鍾明軒貼身挽手、以及摟肩合照，故作獻吻被對方秒撇頭拒絕，互動逗趣，粉絲笑讚「看起來很恩愛喔」、「好登對」、「很直男」、「嫌棄的表情很真實，兩個太可愛了」。▲愛莉莎莎、鍾明軒親密摟肩。（圖／翻攝自臉書／愛莉莎莎）▲愛莉莎莎索吻被嫌棄。（圖／翻攝自臉書／愛莉莎莎）鍾明軒假設自己是個直男，找來愛莉莎莎挑戰約會，並設定表現太Gay就會接受處罰。而他一開始服裝穿搭就不及格，為此重買衣服，接著在女方引導下，嘗試十指交扣走路、摟肩、互相餵食，結果全都適應不良，約會結束前更試圖壁咚愛莉莎莎，還互相輕輕地碰嘴，然而感覺像「姐妹」。愛莉莎莎最後給這場約會體驗打了30分，並說：「做這些親密的事情，如果你的心沒有在對方身上的話，那一切就是0分。」鍾明軒坦言真愛無關性別，實在無法和女生發展，藉此請家中長輩死了這條心。5.完整新聞連結(或短網址):6.備註:--台灣IU《愛莉莎莎》--,
PTT,[新聞] 進化成「AZ莎莎」！愛莉莎莎開心打第二,https://www.ptt.cc/bbs/Gossiping/M.1635950955.A.64B.html,2021-11-03 22:49:08,,備註請放最後面違者新聞文章刪除1.媒體來源:新頭殼2.記者署名:新頭殼newtalk|林冠妤綜合報導3.完整新聞標題:進化成「AZ莎莎」！愛莉莎莎開心打第二劑曝副作用：比較痛4.完整新聞內文:愛莉莎莎宣布去打疫苗打二劑。圖：翻攝自愛莉莎莎IG新冠疫苗正如火如荼的施打中，目前全國第一劑疫苗施打率已經突破7成，第二劑也突破3成，網紅愛莉莎莎也於今(3)日宣布打了AZ第二劑疫苗，她感覺第二劑打進去的時候比較痛，表示第一劑就像喝醉一樣飄飄的，幽默的說她已進化成「AZ莎莎」。第12期公費疫苗開放3種疫苗，分別為BNT第1劑、莫德納第2劑、AZ第2劑，並分成第1、2階段預約登記，施打時程是在10月28日至11月3日。網紅愛莉莎莎今(3)日分享她施打AZ第二劑疫苗，「紀念一下我的完全接種日！進化成AZ莎莎，我覺得第二劑進去比較痛欸！其實我很喜歡第一劑打完很像喝醉飄飄的感覺，真舒服。大家第二劑打完有什麼感覺呀？」網紅芮芮表示：「AZ莎莎好有梗哈哈哈哈哈哈」愛莉莎莎則回：「IZ莎莎進化版」、也有網友分享打完副作用：「第二劑真的很痛目前手依然不舉」愛莉莎莎回應：「我目前手還能舉」，Youtuber草帽悟空也說：「我不舉阿憲也不舉」，很多都表示第二劑手比較痛、麻。【更多的愛莉莎莎--追蹤愛莉莎莎的IG吧！】愛莉莎莎透露疫苗副作用。圖：翻攝自愛莉莎莎IG也有網友分享施打第二劑的副作用就是手很痛。圖：翻攝自愛莉莎莎IG5.完整新聞連結(或短網址):6.備註:--【知恩突抱】注音ㄓㄣㄊㄨˊㄅㄠˋ釋義指愛莉莎莎突然抱住你。例句昨天我夢到知恩突抱，醒來就夢遺了。--,9
PTT,Re: [新聞] 進化成「AZ莎莎」！愛莉莎莎開心打第二,https://www.ptt.cc/bbs/Gossiping/M.1635951663.A.923.html,2021-11-03 23:01:01,,覺得她蠻強的現在一堆網紅都靠政治或爭議來博聲量相較之下她反而是那種是少數的清流低調作影片不去碰那些髒東西--,
PTT,Re: [問卦] 溫妮是新一代愛莉莎莎嗎,https://www.ptt.cc/bbs/Gossiping/M.1636388018.A.ABE.html,2021-11-09 00:13:36,,又親民講話又平易近人像是會跟我們一樣吃麥當勞沒有明星架勢會做出可愛的POSE來拍照讓莎粉們為之瘋狂最近更晉升為”AZ”莎莎防疫好公民最重要的事敢說話讓我們莎粉都覺得她很正義以上圖片取自莎莎哀居--頂多被刪除而已=.=,6
PTT,[問卦] 去年在本版洗愛莉莎莎文的現在在想什麼？,https://www.ptt.cc/bbs/Gossiping/M.1637683548.A.767.html,2021-11-24 00:05:44,,愛莉莎莎是知名網紅，先不論其長相如何。我記得去年年中，大概六、七月開始，在本板看到一堆愛莉莎莎的洗板文。無論是故意捧殺、腦粉真心推薦、還是被我懷疑有商務業配夾雜於其中。現在這個熱潮結束了，當時洗板的八卦肥宅現在應該還在這裡，你們回想當時，現在有何感想？覺得光榮？還是覺得羞恥？有沒有八卦？--現在是事後檢討。回顧過去，思索未來。不要拿我的文跟洗板文相提並論，我發的都是廢文，不敢高攀，哈哈哈,
PTT,[問卦] 愛莉莎莎視頻點閱還是好高呀,https://www.ptt.cc/bbs/Gossiping/M.1637207335.A.40C.html,2021-11-18 11:48:53,,鄉民女神愛莉莎莎經歷各種風波後沉寂一段時間也無參加走鐘獎不過愛莉莎莎的視頻點閱還是一樣高有卦嗎--,
PTT,[新聞] 被質疑「切割愛莉莎莎」！　阿圓正面回,https://www.ptt.cc/bbs/Gossiping/M.1637473937.A.115.html,2021-11-21 13:52:10,,備註請放最後面違者新聞文章刪除1.媒體來源:ETtoday星光雲2.記者署名:記者劉宛欣／綜合報導3.完整新聞標題:被質疑「切割愛莉莎莎」！阿圓正面回擊…親揭兩人真實關係4.完整新聞內文:YouTube頻道上班不要看13日舉辦第3屆走鐘獎頒獎典禮，許多知名YouTuber都前往共襄盛舉，不過有網友發現愛莉莎莎並沒參加這屆的走鐘獎，懷疑她因為今（2021）年發生太多失言爭議，所以遭到切割，對此，她透過IG反駁遭切割的說法，澄清自己只是因為當天有私事不克出席，而被點名與她切割的好友阿圓也出面發聲。▲愛莉莎莎與阿圓是YouTuber眾所周知的好友，近來較少公開合體。（圖／翻攝愛莉莎莎、阿圓Instagram）據悉，有網友在Dcard上發問為何愛莉莎莎沒有參加這屆的走鐘獎，質疑她被排擠，底下還有網友指出她在多次的失言風波後「身邊最好的朋友應該就Penny」，不少YouTuber好友都與她「切割」，對此，先前經常與她合體的阿圓17日便在Instagram發聲反駁切割說法，表示「剛剛才從莎莎家離開，這根本造謠啊」，正面闢謠。▲阿圓反駁切割愛莉莎莎的謠言。（圖／翻攝阿圓Instagram）網友點出愛莉莎莎今年發生的爭議，包含在疫情期間，抱怨住在熱區萬華，每天救護車很吵，還有年初肝膽排石法風波等等，沒有參加很正常，她本人對此則在19日親自回應了，面對各界推測，她解釋：「只事那天有私事，呵呵，別亂腦補。」無奈否認被切割一說。5.完整新聞連結(或短網址):6.備註:--台灣IU《愛莉莎莎》--,2
PTT,[問卦] 有人反串到最後變愛莉莎莎粉嗎？,https://www.ptt.cc/bbs/Gossiping/M.1637210709.A.85E.html,2021-11-18 12:45:07,,小魯本來也不看她的影片啦看著板上反串很有趣後來也跟著反串反串到後來好像真的變莎粉了有人也是這樣的嗎？--,5
PTT,[問卦] 之前一堆愛慕愛莉莎莎文是違反跟騷法吧,https://www.ptt.cc/bbs/Gossiping/M.1637463302.A.F4D.html,2021-11-21 10:54:59,,之前版上有些人每天固定會發愛莉莎莎文裡面文章都是說愛莉莎莎有多好看，可愛，漂亮台灣iu，一些愛慕愛莉莎莎文詞連本人都知道本板一堆人在發她文已經造成對方困擾但本人選擇無視當初版上有人還幫愛莉莎莎申請個版我當時還跑去投同意票如果當時跟騷法已經三讀通過本人如果感到困擾想提告那些id是不是都違反跟騷法--暗號是啥意思1https://i.imgur.com/PTUCuLH.jpg2https://i.imgur.com/iEXvwF7.jpg3https://i.imgur.com/FAbHe0w.jpg4https://i.imgur.com/Y2q2z86.jpg屁股1https://i.imgur.com/1cx36z5.jpg屁股2https://i.imgur.com/SeQ13Fa.jpg--,3
PTT,[問卦] 溫妮是新一代愛莉莎莎嗎,https://www.ptt.cc/bbs/Gossiping/M.1636387424.A.899.html,2021-11-09 00:03:42,,如題上禮拜放鳥事件過沒幾天又被爆抄襲這幾天Dcard每天都有溫妮黑特文溫妮是愛莉莎莎2.0嗎什麼時候被木曜排泄--我會一直推薦愛莉莎莎就是不忍八卦板這幾年世衰道微--,5
PTT,[新聞] 遭疑與好友愛莉莎莎決裂 「一隻阿圓」: ,https://www.ptt.cc/bbs/Gossiping/M.1628868702.A.F04.html,2021-08-13 23:31:40,,遭疑與好友愛莉莎莎決裂「一隻阿圓」:其實她不壞新頭殼陳宜妗Youtuber愛莉莎莎與一隻阿圓皆以韓系風格為拍攝主題聞名，兩人過去時常合體拍片，但近日卻鮮少見兩人同框，網上討論兩人是否交情不再，近日一隻阿圓發出兩人合照，打破決裂謠言。愛莉莎莎曾因多次在影片中失言導致網路上爭議不斷，風波過後有網友發現兩人不像過去經常在網上互動，影片中也不見兩人合體，一隻阿圓也與其他Youtuber林萱、金針菇、蔡哥組成「羽球隊」團體，遭網友質疑是不是與愛莉莎莎切割。一隻阿圓近日發文解釋與愛莉莎莎已認識多年，稱讚對方很會做頻道同時也很調皮，是很多人心目中覺得有趣的角色，但也表示討論度越高，一定也會有不喜歡的人出現，她表示：「畢竟一支影片也就十幾分鐘，你怎麼呈現觀眾就怎麼吸收，完全取決於你想給大家什麼。」，最後她也替愛莉莎莎說話：「很多人會被她的率真吸引，同時又替她的直接捏把冷汗。但其實她不壞，就是比較欠揍而已。」粉絲也開心留言回應：「不一定是搬到檯面上才是友情！喜歡你們！」--,
PTT,[問卦] 愛莉莎莎跟三原是不是假戲真做啊 QQ,https://www.ptt.cc/bbs/Gossiping/M.1629978345.A.F93.html,2021-08-26 19:45:42,,莎莎最新的片跟三原一起兩個一直四目香蕉看對方差點親下去幹崩潰機掰QQ到底是不是假戲真做啊--,
PTT,[問卦] 在愛莉莎莎家樓下可以幹嘛？,https://www.ptt.cc/bbs/Gossiping/M.1630165346.A.778.html,2021-08-28 23:42:16,,大家好，我今天到萬華龍山寺附近逛街，走著走著，眼前突然出現一棟很熟悉的建築物，這不就是傳說中台灣IU愛莉莎莎的香閨台北晶麒嗎？瞬間感覺空氣中充滿了粉紅色泡泡，愛莉莎莎的皂香味撲鼻而來，想請問在這附近可以幹嘛呢？站著一直等可以等到女神出現嗎？有沒有八卦？-----SentfromJPTTonmySamsungSM-G9730.--台灣IU《愛莉莎莎》--,5
PTT,Re: [問卦] 愛莉莎莎跟三原是不是假戲真做啊 QQ,https://www.ptt.cc/bbs/Gossiping/M.1629979464.A.396.html,2021-08-26 20:04:22,,哭哭！莎莎是鄉民女神！希望這一切不是真的！所以之前那個非整人！和三原的戀愛故事還一起去旅行到底是真是假☹我怎麼看不懂我記得我也是因為這部開始不再這麼喜歡愛莉莎莎了！最後送上一張運動風莎莎☺--好喔你開心就好,5
PTT,[問卦] 愛莉莎莎身材真的有這麼好？,https://www.ptt.cc/bbs/Gossiping/M.1630025491.A.99D.html,2021-08-27 08:51:27,,愛莉莎莎我們的台灣IU雖然負面新聞不少大家也很愛酸不過我剛剛好奇google了一下才發現哇靠…她身材有這麼暴力！？想不到她頻道包緊緊的竟然這麼有料@@--SentfrommyMentholatum--,
PTT,[問卦] 為何對愛莉莎莎反感,https://www.ptt.cc/bbs/Gossiping/M.1630424047.A.233.html,2021-08-31 23:34:05,,只要有莎莎鄉民能噓則噓還是有少數人喜歡愛莉莎莎讓大家避之唯恐不及是為什麼有卦嗎--,3
PTT,[問卦] 為什麼愛莉莎莎文變少了?,https://www.ptt.cc/bbs/Gossiping/M.1630392535.A.8DE.html,2021-08-31 14:48:53,,我們的鄉民女神台灣IU台灣廣末涼子最近怎麼沒啥新聞八卦的文章也變好少了為什麼愛莉莎莎文變少了?鄉民不愛她了嗎?大家不想她嗎--為什麼水桶??她不是政治人物阿,1
PTT,[問卦] 一句話證明你愛愛莉莎莎！,https://www.ptt.cc/bbs/Gossiping/M.1630777436.A.F99.html,2021-09-05 01:43:53,,台灣百萬YOUTUBER高學歷高挑正妹人人稱羨也吸引到不少鄉民PO文剛剛搜了一下至少八卦版我從沒看過有個女森可以那麼多文我看其實根本大家超喜歡對吧！一句話怎麼證明卦？☺--何時的事==自己說的不算好爆==還好不是看完歐三百ID才想噓☺,
PTT,Re: [新聞] 多次失言惹爭議仍擁高流量 網曝愛莉莎莎,https://www.ptt.cc/bbs/Gossiping/M.1631958629.A.98E.html,2021-09-18 17:50:27,,阿肥也很好奇這次那個影片拿一萬元消遣朋友為什麼他朋友會這樣給他消遣阿肥=.=如果你跟我說我窮我沒志氣我承認可是拿錢砸在臉上叫你花=.=整個超羞辱人的還拍成影片重點是還只有少少的1萬元花....我如果是她朋友我會翻臉歐這是在消遣阿肥阿=.=你各位肥宅能接受這種消遣嗎--,1
PTT,[新聞] 愛莉莎莎遭酸大餅臉「像大媽」 3年後一,https://www.ptt.cc/bbs/Gossiping/M.1630914083.A.0E2.html,2021-09-06 15:41:21,,1.媒體來源:中時2.記者署名:施品瑜3.完整新聞標題:愛莉莎莎遭酸大餅臉「像大媽」3年後一對比變了4.完整新聞內文:愛莉莎莎曾被酸大餅臉。（圖／翻攝自愛莉莎莎IG）網紅愛莉莎莎在YouTube擁有百萬追蹤，以清新可愛外貌加上自然不做作個性，受到不少喜愛，但初期她也曾被批評外貌，遭網友狠酸是大餅臉，如今過了3年，她臉型有了變化，曬出前後對比真的有差別。愛莉莎莎表示，三年前剛做Youtube的時候，常常被說是大餅臉、包子臉，最近則變得很少人再罵她，甚至常在留言區看到大家誇她臉變小，讓她忍不住坦言：「其實我看了每次都會偷偷暗爽」。同時，愛莉莎莎也曬出臉型前後變化圖，自嘲：「以前沒有下巴，有時側面真像個大媽！」現在則明顯有了側臉線條，整個臉蛋看起來小了一圈。她也透露因為接觸醫美，先後做了電波拉提、音波拉提，效果讓她很滿意，並分享心得，雖然很多人說會痛，可她認為「比我平常去按摩還不痛」，過程中還差點睡著，但也強調疼痛感受因人而異。愛莉莎莎貼文一Po，吸引不少粉絲留言討論「莎莎真的越來越美了」、「整個人升級的感覺」、「其實莎莎一直都很好看，做自己就是最棒最好看的惹」、「越來越可愛了」。愛莉莎莎曬臉蛋的對比照。（圖／翻攝自IG）5.完整新聞連結(或短網址):6.備註:真的好美台灣IU--,
PTT,[新聞] 愛莉莎莎鬆口「現在微單身」！　網揪1點,https://www.ptt.cc/bbs/Gossiping/M.1632106638.A.3A8.html,2021-09-20 10:57:14,,"1.媒體來源:ETTODAY2.記者署名:記者郭采縈／綜合報導3.完整新聞標題:愛莉莎莎鬆口「現在微單身」！網揪1點瘋猜：是因為「他」4.完整新聞內文:YouTuber愛莉莎莎拍攝主題多元，頻道累積超過百萬人數訂閱，在網路上享有高知名度，雖然數次發生失言風波，仍受到大票粉絲追捧。她近日發文分享新購入的小家電，內容提到自己目前是「微單身」的狀態，引起網友熱議，被瘋猜和同為YouTuber的「他」有關！愛莉莎莎近日在Instagram分享新購入的果汁機，透露因為現在是「微單身」，一般果汁機的量太大了，換成小型的相對方便許多，雖然瓶口小需要多注意，但仍相當滿意。貼文曝光後，她的感情狀態立刻掀起討論，曖昧用詞也讓網友不禁聯想到YouTuber三原。由於愛莉莎莎和三原過去合拍過不少影片，雙方互動親密、感情好，更曾扮演一日情侶大方曬恩愛，經常被粉絲「送作堆」，而日前男方才宣布要飛日本老家，她現在就說自己「微單身」，網友紛紛笑說「微單身是因為三原回日本嗎」、「微單身是怎樣」、「噗微單身」、「三原回日本所以微單身」、「微單身是亮點，恭喜妳」。面對底下網友猜測，愛莉莎莎沒有正面說明，只幽默回應「這個詞很好用」，大笑叫網友不要搞錯重點啦。5.完整新聞連結(或短網址):6.備註:可惡!!!!是誰這麽幸福!!!可以得到莎莎的芳心>""<羨慕!!!!--",-3
PTT,Re: [新聞] 愛莉莎莎鬆口「我微單身」！網瘋猜男主角,https://www.ptt.cc/bbs/Gossiping/M.1632227643.A.215.html,2021-09-21 20:34:02,,完全無法接受啊愛莉莎莎一直是我的夢中情人我喜歡她很久了我常常趁洗澡的時候自己一個人練習跟她告白我還沒準備好耶為什麼她可以微單身啊-----SentfromJPTTonmyiPhone--：（也許我該去騙個比我小的嫩草來幹噗噗,
PTT,Re: [問卦] 愛莉莎莎 小馮 福原愛  該怎麼選??,https://www.ptt.cc/bbs/Gossiping/M.1632713077.A.F68.html,2021-09-27 11:24:35,,小妹覺得當然秒選愛莉莎莎啊莎莎人美心也美比起日本人和醫生莎莎更接近一般人莎莎就是鄰家大女孩兒--,
PTT,Re: [問卦] 愛莉莎莎 小馮 福原愛  該怎麼選??,https://www.ptt.cc/bbs/Gossiping/M.1632712480.A.6C2.html,2021-09-27 11:14:38,,我阿肥啦我來表達我的感覺=.=我選福元愛1.小馮感覺很好鬥我不喜歡女生囉嗦強勢2.艾莉莎莎感覺不是很聰明我不喜歡腦袋感覺不好溝通的3.福元愛很大大概是這樣吧嘻嘻--,3
PTT,[問卦] 愛莉莎莎 小馮 福原愛  該怎麼選??,https://www.ptt.cc/bbs/Gossiping/M.1632712089.A.50C.html,2021-09-27 11:08:07,,1號選手福原愛外表可愛，奶最大，人氣球星但會外遇2號選手小馮聰明高智商，奶最小不知道好不好相處(??通常這種都很強勢(??3號選手愛莉莎莎3個裡面最正人氣網紅高IQ高EQ微單身英國斯特拉斯克萊德大學國立清華大學人文社會學系新北市立中和高級中學有台灣IU&台灣太妍的稱號愛莉莎莎小馮福原愛只能挑一個該怎麼選??--因為我最愛莎莎,33
PTT,Re: [問卦] 愛莉莎莎 小馮 福原愛  該怎麼選??,https://www.ptt.cc/bbs/Gossiping/M.1632713093.A.D96.html,2021-09-27 11:24:51,,我選小馮1.高智商的女生，如果有機會一親芳澤真的會爽死，那是一種成就感，很難解鎖的人生任務2.小馮臉蛋跟周子瑜類似，如果不當醫生，去韓團也會大紅大紫目前台灣年輕一代的美女排名1.周子瑜2.小馮3.雞排妹4.豆花妹都很漂亮，每一個都超美，但唯獨小馮是有腦的，高智商台女。讚。讚讚讚。--,
