Source,Title,Link,Date,Summary,Text,Like
PTT,[問卦] 愛莉莎莎484我們一輩子的朋友,https://www.ptt.cc/bbs/Gossiping/M.1611625233.A.583.html,2021-01-26 09:40:18,,愛莉莎莎貴為台灣第一女YTB對陌生粉絲合影來者不拒脫掉口罩不怕染疫這種和藹可親評議進人你有我也有的態度484很適合當我們一輩子的朋友--,
PTT,[問卦] 天冷跟愛莎莉莉泡溫泉是不是很舒服,https://www.ptt.cc/bbs/Gossiping/M.1611619189.A.3CE.html,2021-01-26 07:59:46,,冷冷的天愛莉熱熱的體溫融化你找鄉民女神一起泡溫泉是不是很舒服人生沒有遺憾有沒有卦--,
PTT,[問卦] 早餐跟鄉民女神愛莉莎莎約會要吃什,https://www.ptt.cc/bbs/Gossiping/M.1611626876.A.5CD.html,2021-01-26 10:07:54,,鄉民女神愛莉莎莎早餐如果要跟女神約會吃什麼比較好是永和豆漿還是麥味登有沒有卦阿--,
PTT,Re: [問卦] 鄉民爆料愛莉莎莎：至少有D,https://www.ptt.cc/bbs/Gossiping/M.1611630578.A.C15.html,2021-01-26 11:09:36,,看原文這推文難怪肥宅會沒女友連D都不滿足還是說女神有日本男友由愛生恨台男真的恐怖啊--鄉民女神愛莉莎莎--,
PTT,[問卦] 愛莉莎莎請你去她家吃飯 你會去嗎？,https://www.ptt.cc/bbs/Gossiping/M.1611658951.A.484.html,2021-01-26 19:02:24,,鄉民女神愛莉莎莎一個不小心買太多需要有人幫忙解決如果她請你到她的香閨吃飯你會去嗎？？--,2
PTT,[問卦] 愛莉莎莎的腋下大家可以嗎?,https://www.ptt.cc/bbs/Gossiping/M.1611632813.A.379.html,2021-01-26 11:46:50,,無意中發現愛莉莎莎的腋下非常的性感迷人白皙乾淨甜甜的，根本台女中的極品很難有更好看的吧好奇問問愛莉莎莎的腋下大家可以嗎?--,-1
PTT,[問卦] 愛莉莎莎含吸管放電 鄉民大喊：凍未條,https://www.ptt.cc/bbs/Gossiping/M.1611653035.A.F07.html,2021-01-26 17:23:50,,鄉民女神台灣坂井泉水愛莉莎莎再次秀出她的美貌只見她口含吸管單眼閉合拋出媚眼有鄉民看見這一幕大喊實在凍未條！--鋼鐵莎粉1號G卵2號u卵--,-1
PTT,[問卦] 愛莉莎莎放送電眼 網吶喊：像坂井泉水,https://www.ptt.cc/bbs/Gossiping/M.1611326054.A.651.html,2021-01-22 22:34:08,,愛莉莎莎這張照片真的沒有在跟妳開玩笑放送電眼一眼望去差點跟坂井泉水認錯她們是不是其實是雙胞胎--,
PTT,[問卦] 有沒有中國愛莉莎莎-王梓钰的八卦,https://www.ptt.cc/bbs/Gossiping/M.1611331747.A.E93.html,2021-01-23 00:09:04,,中國愛莉莎莎-王梓钰唱歌很好聽最近越看越像愛莉莎莎愛莉莎莎是不是又多一國的分身了--,
PTT,[問卦] 坂井泉水驚現唐吉訶德 網：是愛莉莎莎,https://www.ptt.cc/bbs/Gossiping/M.1611369204.A.DAE.html,2021-01-23 10:33:14,,昨天有人跟我說他在西門的唐吉訶德看到了坂井泉水我想說怎麼可能後來看到愛莉莎莎的IG才發現他認錯人有人也經常認錯的嗎--第一屆鋼鐵莎粉爭霸賽一號選手：GGrunxxxxxxx二號選手：ubxx--,-7
PTT,[問卦] 睡前噓文 恐夢到愛莉莎莎,https://www.ptt.cc/bbs/Gossiping/M.1611339542.A.360.html,2021-01-23 02:18:55,,我朋友昨天睡前亂噓結果就夢到愛莉莎莎提醒一下各位能不噓就不噓謝謝大家--鋼鐵莎粉4ni?--,
PTT,[問卦] 愛莉莎莎跟日本美女一樣是「耐看型」？,https://www.ptt.cc/bbs/Gossiping/M.1611375190.A.693.html,2021-01-23 12:13:08,,如題日本女生不像韓國一出場就很驚艷但是卻很耐看有自己的風格然而台灣坂井泉水愛莉莎莎好像也是一樣越看越仙難怪日本人那麼哈她有沒有八卦？--,
PTT,[新聞] 愛莉莎莎逛唐吉訶德 上2樓秒滅火買不下去,https://www.ptt.cc/bbs/Gossiping/M.1611449237.A.A35.html,2021-01-24 08:47:14,,愛莉莎莎逛唐吉訶德上2樓秒滅火「買不下去」：不會回訪東森新聞責任編輯陳俊宇日本賣場唐吉訶德日前在台北西門町盛大開幕，吸引大批民眾到場，甚至到凌晨都還有人排隊等待入場，場面十分誇張。對此YouTuber愛莉莎莎也與好友一隻阿圓排隊入場，不過似乎是期待值過高，逛完後愛莉莎莎也在IG分享心得，直呼「近期不會再回訪」。愛莉莎莎在21日時到「唐吉訶德」拍片，她表示排了1個多小時才進去，但是仔細看卻發現所販售商品，大多在屈臣氏、康是美或是Pchome都有，而愛莉莎莎覺得CP值不錯的只有1盒45元的蕨餅，「買了五盒，蠻好吃的，吃不出來是廉價蕨餅！」，此外愛莉莎莎也發現店內有她日本時必買的調製豆乳，但回家一查，發現網購也可以買到。而到二樓後，愛莉莎莎也發現不少特別的東西，「例如超貴熊本草莓，一小盒4、500，我真的買不下去」，她也提到一起去的阿圓反而買了下去，而逛完整間店後，愛莉莎莎完全不懂大家要搶著逛，也指出近期也不會回訪唐吉訶德「可能因為我不煮飯，對零食也沒太大興趣，有點不知道要買什麼.....」。對此不少網友也相當贊同，紛紛留言表示，「其實是逛的感覺，東西也比較集中」、「裡面的東西感覺好貴」、「聽你說我不想去了」、「妳說不懂為什麼那麽多人排隊，可是你不也去了嗎」，對此愛莉莎莎也回應說自己去是為了拍片，另外也有網友詢問她，這樣評論會不會影響到店家，愛莉莎莎就表示「對店家不見得好，但對消費者會有幫助」，不過也有網友表示相當想去唐吉訶德，「人在法國也好想逛，羨慕台灣」、「我超愛逛的！裡面的便當好吃」、「奶茶超棒的」、「我現在在這裡欸」，引發討論。--,-1
PTT,[問卦] 愛莉莎莎484肉身菩薩,https://www.ptt.cc/bbs/Gossiping/M.1611389859.A.C45.html,2021-01-23 16:17:35,,八卦版禁政治文對政治亂象的不滿無處宣洩紛紛湧向愛莎文導致愛莎文紅噓爆增能有這種自我犧牲的精神愛莉莎莎484肉身菩薩--,-1
PTT,[新聞] 唐吉訶德排隊等1小時！ 愛莉莎莎逛到2,https://www.ptt.cc/bbs/Gossiping/M.1611449936.A.C96.html,2021-01-24 08:58:50,,ETtoday新聞雲唐吉訶德排隊等1小時！愛莉莎莎逛到2樓…看價格秒滅火：買不下去記者潘慧中／綜合報導日本賣場唐吉訶德19日於西門町盛大開幕，吸引許多民眾前去朝聖，排隊人潮直到深夜仍不見趨緩。YouTuber愛莉莎莎最近為了拍片，便特地排隊1小時入內，但逛完後心情似乎有點複雜，並在Instagram貼出一篇「偏滅火」的心得，引發不少網友討論。愛莉莎莎表示大部分的商品都能在屈臣氏、康是美買到，調製豆乳雖然蠻好喝的，之前去日本時也會狂喝，但後來發現PChome也買得到，45元蕨餅是她唯一覺得CP值不錯的東西，「買了5盒，蠻好吃的，吃不出來是廉價蕨餅！」逛到2樓時，愛莉莎莎坦言的確是有賣一些特別的商品，例如熊本草莓，但因為實在太貴，「我真的買不下去。」要不是為了拍片，她逛完後真的不懂為何會大排長龍，「我自己近期內不太會想回訪。」▲愛莉莎莎透露草莓真的貴到讓她買不下去。（圖／翻攝自Instagram／goodalicia）然而，愛莉莎莎認為可能是因為自己不下廚的關係，加上對零食無感，才有點不知道要買什麼，被問到如此評論是否會影響民眾的朝聖意願時，她也親自回應了：「對店家不見得好，但對消費者會有幫助。」愛莉莎莎透露草莓真的貴到讓她買不下去真假沒想到莎莎年收這麼高還這麼節儉真的是台灣好媳婦--鋼鐵莎粉4ni?--,
PTT,[問卦] 愛莉莎莎的背後靈是坂井泉水嗎？,https://www.ptt.cc/bbs/Gossiping/M.1611412252.A.C96.html,2021-01-23 22:30:47,,大家好，傳說中每個人都會有一個背後靈去庇護他，那麼我們的台灣IU的背後靈，是不是就是我們的坂井泉水姐姐呢？不然實在無法說明愛莉莎莎的顏值，個性和歌聲怎麼都這麼完美，她的守護靈一定就是坂井泉水姐姐吧！有沒有八卦？-----SentfromJPTTonmySamsungSM-G9730.--→摘自《女神進化史》--,
PTT,[問卦] 誰在噓愛莉莎莎就是和我過不去,https://www.ptt.cc/bbs/Gossiping/M.1611419255.A.47D.html,2021-01-24 00:27:33,,愛莉莎莎身為臺灣YT之首長得可愛影片又好看莎莎也致力於推廣臺韓文化交流讓你們這些臭宅也能了解韓國道地美食和文化你們怎麼可以討厭莎莎誰再噓莎莎就是和我新竹林七賢過不去-----SentfromJPTTonmySamsungSM-A7050.--,-3
PTT,[問卦]愛莉莎莎跟阪井泉水同搭天竺鼠車車看鬼滅!,https://www.ptt.cc/bbs/Gossiping/M.1611450112.A.E81.html,2021-01-24 09:01:50,,愛莉莎莎跟阪井泉水同搭天竺鼠車車看鬼滅!這畫面是不是很美啊?唯一好奇的是鬼滅現在還有在上映嗎?是不是已創下上映最久未下檔的電影啊?中國大陸上映了嗎?有十四億人口加持會不會變成全球最賣座動畫電影?有八卦嗎?--如果我說我希望板主禁愛莉莎莎廢文你信嗎?,
PTT,[問卦] 愛莉莎莎會怎麼介紹唐吉訶德？,https://www.ptt.cc/bbs/Gossiping/M.1611450458.A.50F.html,2021-01-24 09:07:33,,聽說鄉民女神愛莉莎莎已經衝去唐吉訶德拍片了是不是代表近期又有愛莉莎莎新片可以看愛莉莎莎會怎麼介紹唐吉訶德的產品？--,
PTT,[新聞] 唐吉訶德排隊等1小時！ 愛莉莎莎逛到2樓,https://www.ptt.cc/bbs/Gossiping/M.1611454318.A.125.html,2021-01-24 10:11:56,,1.媒體來源:Ettoday2.記者署名:潘慧中3.完整新聞標題:唐吉訶德排隊等1小時！愛莉莎莎逛到2樓…看價格秒滅火：買不下去4.完整新聞內文:▲▼愛莉莎莎。（圖／翻攝自Instagram／goodalicia）日本賣場唐吉訶德19日於西門町盛大開幕，吸引許多民眾前去朝聖，排隊人潮直到深夜仍不見趨緩。YouTuber愛莉莎莎最近為了拍片，便特地排隊1小時入內，但逛完後心情似乎有點複雜，並在Instagram貼出一篇「偏滅火」的心得，引發不少網友討論。愛莉莎莎表示大部分的商品都能在屈臣氏、康是美買到，調製豆乳雖然蠻好喝的，之前去日本時也會狂喝，但後來發現PChome也買得到，45元蕨餅是她唯一覺得CP值不錯的東西，「買了5盒，蠻好吃的，吃不出來是廉價蕨餅！」逛到2樓時，愛莉莎莎坦言的確是有賣一些特別的商品，例如熊本草莓，但因為實在太貴，「我真的買不下去。」要不是為了拍片，她逛完後真的不懂為何會大排長龍，「我自己近期內不太會想回訪。」然而，愛莉莎莎認為可能是因為自己不下廚的關係，加上對零食無感，才有點不知道要買什麼，被問到如此評論是否會影響民眾的朝聖意願時，她也親自回應了：「對店家不見得好，但對消費者會有幫助。」｛5.完整新聞連結(或短網址):6.備註:--,
PTT,Re: [新聞] 唐吉訶德排隊等1小時！ 愛莉莎莎逛到2樓,https://www.ptt.cc/bbs/Gossiping/M.1611455148.A.848.html,2021-01-24 10:25:46,,愛莉莎莎真是心機小人這集不但蹭我們阿圓最後結帳的時候還讓阿圓付錢簡直是沒天理有沒有愛莉莎莎心機很重的八卦--,1
PTT,[問卦] 愛莉莎莎驚爆日本男友 網友：晚上頂太瘋,https://www.ptt.cc/bbs/Gossiping/M.1611465379.A.2DA.html,2021-01-24 13:16:17,,鄉民女神a.k.a台灣IU、坂井泉水驚爆竟然已經跟日本男友交往了想必晚上一定有做一些嘿嘿事完全破滅了完美女性的稱號難過的鄉民請在底下噓文取暖--,
PTT,[問卦] 愛莉莎莎跟劉樂妍，伯仲之間吧？,https://www.ptt.cc/bbs/Gossiping/M.1611457728.A.69E.html,2021-01-24 11:08:46,,如題愛莉莎莎知名油土伯八卦版女神vs劉樂妍F奶女神，知名女藝人八卦版享有極高聲量小弟想了一下這兩個實在難分難捨是不是在伯仲之間？莎粉好像也跟樂妍粉頗有重疊是不是可以說劉樂妍=電視版愛莉莎莎？有無相關八卦--,4
PTT,[問卦] 愛莉莎莎是不是與江祖平黃金交叉了?,https://www.ptt.cc/bbs/Gossiping/M.1611466053.A.B03.html,2021-01-24 13:27:31,,江祖平（1978年1月30日－），台灣女演員，國光藝校戲劇科畢業42歲，明顯已有老態皺紋皮膚下垂等現象愛莉莎莎年輕貌美，甜美可愛，皮膚緊緻飽滿高學歷靠自己台北市買房愛莉莎莎是不是與江祖平黃金交叉了?--,-1
PTT,[問卦] 愛莉莎莎是不是假掰女？,https://www.ptt.cc/bbs/Gossiping/M.1611469917.A.B92.html,2021-01-24 14:31:55,,愛莉莎莎去唐吉自己花了一小時排隊買完叫大家不要去還說不懂大家幹嘛去不值得那妳花那一小時是自打嘴巴嗎？愛莉莎莎這種行為是gay掰台女嗎？-----SentfromJPTTonmyiPhone--,2
PTT,[問卦] 愛莉莎莎要起飛了嗎,https://www.ptt.cc/bbs/Gossiping/M.1611467249.A.780.html,2021-01-24 13:47:27,,墊飛是狼人殺名詞即狼人牌故意發言爆炸站邊真預言家導致真預言家不被好人信任從而被投票出局所以墊飛不只是反串而是反串招黑版上這麼都愛莎文墊飛愛莉莎莎要起飛了嗎--,
PTT,[問卦] 愛莉莎莎自爆：幾乎每天摔一次手機,https://www.ptt.cc/bbs/Gossiping/M.1611475925.A.AB8.html,2021-01-24 16:12:03,,被稱作台灣坂井泉水的鄉民女神愛莉莎莎自爆說她幾乎每天都會摔一次手機因為手很滑之前新聞也報導過莎莎丟了五副airpod耳機愛莉莎莎是不是有著精明外表的迷糊俏女孩--鋼鐵莎粉1號G卵2號u卵--,
PTT,[問卦] 其實愛莉莎莎身材超好的吧..？,https://www.ptt.cc/bbs/Gossiping/M.1611057652.A.274.html,2021-01-19 20:00:50,,剛剛看到獨家外流的不囉唆先上圖整天看網路上在吵愛Z莎莎雖然我沒關注她，不過看起來身材超好的吧？皮膚白又大估計腿也不會太差這樣你們真的不可以嗎？--,
PTT,[問卦] 2020是不是愛莉莎莎的時代,https://www.ptt.cc/bbs/Gossiping/M.1611078366.A.875.html,2021-01-20 01:46:04,,有人說90年代有坂井泉水80年代有台灣第一名模林志玲那2020是不是愛莉莎莎的時代有沒有卦--,
PTT,[問卦] 慟！粉絲放棄愛莉莎莎了嗎？,https://www.ptt.cc/bbs/Gossiping/M.1611076749.A.F0D.html,2021-01-20 01:19:07,,好久沒去看莎粉在做啥了，剛搜了一下資深莎粉廢文，19號居然沒有愛莉莎莎！！而且一篇扣打都沒有留給她！！將近6個月的連載就這樣斷了！到底是發生了什麼事？難道莎莎文已經無聊到粉絲都放棄了嗎？還是已經問到沒梗了呢？有沒有卦？--,2
PTT,[問卦]有沒有yt五姬之首-愛莉莎莎的8卦?,https://www.ptt.cc/bbs/Gossiping/M.1611079644.A.4AA.html,2021-01-20 02:07:17,,台大以前有5姬最正寶寶覺得是吳依潔現在有yt五姬泱泱千千癡癡滴妹跟愛莉莎莎愛莉莎莎只是不跟台男交往就被黑沒像泱泱整型沒像癡癡整型不整胸沒像千千養不起沒像滴妹只喝南部超甜飲料賣貴貴騙宅宅錢愛莉莎莎莎粉莎起來有沒有yt五姬之收-愛莉莎莎的8卦?-----SentfromJPTTonmyLGELG-H930.----,
PTT,Re: [問卦] 慟！粉絲放棄愛莉莎莎了嗎？,https://www.ptt.cc/bbs/Gossiping/M.1611106991.A.C12.html,2021-01-20 09:43:07,,這不就是在說哥我本人嗎沒想到發愛莎文也可以圈粉正所謂堅持做正確的事情，一定會帶來影響。自從發了[問卦]愛莉莎莎有毒(發錢)文章網址:目前逐步戒毒中另外莎粉對偶像要有信心愛莉莎莎是萬用梗取之不盡用之不竭--,
PTT,[問卦] 愛莉莎莎穿純潔白絲襪？,https://www.ptt.cc/bbs/Gossiping/M.1611111216.A.42E.html,2021-01-20 10:53:30,,剛剛看到以為愛莉莎莎穿了白絲襪鼻血差點噴出來結果看到按讚人數只有39000覺得莎莎白絲不可能這麼少唉果然看錯了有人跟我一樣期待台灣坂井泉水穿白絲嗎--鋼鐵莎粉4ni?--,
PTT,[問卦] 對愛莉莎莎的愛意已經滿溢……,https://www.ptt.cc/bbs/Gossiping/M.1611114154.A.E5F.html,2021-01-20 11:42:32,,最近對莎莎的愛意有如春天的嫩芽漸漸浮現……你早已成我靈魂的一部我的影子裡有你的影片我的耳機裡有你的聲音我的心裡有你的心魚不能沒有水人不能沒有氧氣我不能沒有愛莉莎莎……--,
PTT,[問卦] 愛莉莎莎粉絲484該停止追偶像,https://www.ptt.cc/bbs/Gossiping/M.1611122537.A.A6C.html,2021-01-20 14:02:14,,愛莉莎莎的粉絲很熱情發生不戴口罩和偶像合影的事萬一害莎神染疫就不好了莎神染疫不足惜畢竟讓粉絲傳染也很甜蜜但是假設愛莉莎莎成為傳染源百萬粉絲再追星就危險了想想真是可怕--,
PTT,[問卦] 八卦舉辦無愛莉莎莎週會怎樣？,https://www.ptt.cc/bbs/Gossiping/M.1611125449.A.610.html,2021-01-20 14:50:47,,既然舉辦無政治新聞週，那麼下次舉辦無愛莉莎莎週有搞頭嗎？雖然愛莉莎莎粉絲會很傷心，但愛莉莎莎問卦已經壓過政治文了舉辦無愛莉莎莎週有搞頭嗎？----,7
PTT,[問卦] iPhone是手機界的愛莉莎莎嗎,https://www.ptt.cc/bbs/Gossiping/M.1611128049.A.303.html,2021-01-20 15:34:05,,愛莉莎莎的美無遠弗屆就像iPhone銷售到全球一樣iPhone可以算是手機界的愛莉莎莎嗎那這樣手機拿iphone的人就好像擁有了愛莉莎莎一樣是不是很棒很興奮！！--鋼鐵莎粉4ni?--,
PTT,[問卦] 台積電是台股界的愛莉莎莎嗎？,https://www.ptt.cc/bbs/Gossiping/M.1611126204.A.ADA.html,2021-01-20 15:03:20,,大家好，今天大盤小跌71點，台積卻大漲20塊，如果不看台積的話，大盤實質上是崩盤兩百多點的，感覺很像YouTuber的行情一樣，什麼蔡阿嘎，聖潔石，小玉，理科太太，雖然以前都曾經紅過，不過現在也都沒什麼討論熱度了，不像我們的台灣IU&台灣坂泉井水&台灣新垣結衣&台灣本田翼&台灣智秀&台灣秀智&台灣奧黛麗赫本&台灣安海瑟薇&台灣艾瑪華森&台灣吳卓源，不但人氣一點都沒有消去，反而還有越來越旺的趨勢，所謂的拉積盤其實就跟拉莎盤一樣，都是一家獨大帶了幾十個拖油瓶吧，有沒有台積電是台股界的愛莉莎莎的八卦？-----SentfromJPTTonmySamsungSM-G9730.--→摘自《女神進化史》--,-1
PTT,[問卦] 八卦版是論壇界的愛莉莎莎嗎？,https://www.ptt.cc/bbs/Gossiping/M.1611129893.A.099.html,2021-01-20 16:04:51,,臺灣論壇這麼的多，知名論壇就那幾個，但是有個大家愛看又愛嫌，集一切爭議之根源的地方，就是我們腳底下的八卦版。它就如莎莎般的美麗，吸引大眾的目光。擁有莎莎的爭議特質，讓大家議論不休。八卦版算是完美復刻了莎莎的個人特色。這樣的八卦版算是論壇界的愛莉莎莎嗎？--,
PTT,[問卦] 愛莉莎莎如何能成為永恆,https://www.ptt.cc/bbs/Gossiping/M.1611205569.A.49C.html,2021-01-21 13:06:04,,秦始皇一統七國後尋求長生不老人到了巔峰總希望能成為永恆愛莉莎莎已是YTB的王者在莎粉心中是一種信仰要如何成為永恆呢--,
PTT,[問卦] 天竺鼠車車是動漫界的愛莉莎莎嗎,https://www.ptt.cc/bbs/Gossiping/M.1611164256.A.2FA.html,2021-01-21 01:37:34,,愛莉莎莎AKA鄉民女神AKA全民老婆AKAYOUTUBER顏值擔當AKA我老婆突然爆紅萌萌惹人愛可愛爆表關注度極高影片一片一片看停不下來無限重播和天竺鼠車車有著異曲同工之妙請問天竺鼠車車是動漫界的愛莉莎莎嗎--搞清楚是車車在蹭我老婆（愛莉莎莎）,
PTT,[問卦] 愛莉莎莎還是處女嗎？,https://www.ptt.cc/bbs/Gossiping/M.1611186371.A.410.html,2021-01-21 07:46:09,,愛莉莎莎A.K.A.臺灣IU顏值高、身材好、學歷頂尖、多才多藝，更是鄉民們的夢中情人這樣完美的女孩兒，一定堅守婚前不破處對吧？咱們的愛莉莎莎還是處女對吧？有八卦？----,
PTT,[爆卦] 愛麗莎莎在影片承認做過H,https://www.ptt.cc/bbs/Gossiping/M.1611188222.A.02E.html,2021-01-21 08:17:00,,愛莉莎莎在玩國王遊戲的時候大方承認11月做過H鄉民不是都說愛莉莎莎處女嗎怎麼會直接H不是說沒男朋友嗎--,--
PTT,Re: [問卦]愛莉莎莎這麼努力做影片，還有人不分享的?,https://www.ptt.cc/bbs/Gossiping/M.1611301380.A.13A.html,2021-01-22 15:42:58,,為了點閱率在這邊下細下井可謂人不要臉天下無敵號稱百萬訂閱百萬流量只不過是善於製造話題真正喜歡她的，我不覺得有很多搞不好討厭她的更多看看前幾篇的噓文就知道事業成功但做人應該蠻失敗的--,
PTT,[問卦] 愛莉莎莎算是耐看的美女嗎?,https://www.ptt.cc/bbs/Gossiping/M.1611302331.A.E0A.html,2021-01-22 15:58:49,,很多美女第一眼看覺得驚艷但看久了就沒啥感覺反觀愛莉莎莎看愈久愈覺得討喜、漂亮附照真的看久了很舒服很漂亮又會念書又會拍影片又很有時尚感愛莉莎莎算是耐看的美女嗎--,-1
PTT,[問卦] 愛莉莎莎30歲沒結婚就嫁給你 你ok嗎,https://www.ptt.cc/bbs/Gossiping/M.1611312661.A.59A.html,2021-01-22 18:50:55,,很多女孩都愛約定30歲還沒結婚就怎樣愛莉莎莎好像還沒30吧那如果愛莉莎莎30歲沒結婚就嫁給你你ok嗎--第一屆鋼鐵莎粉爭霸賽一號選手：GGrunxxxxxxx二號選手：ubxx--,3
PTT,[新聞] 被罵一直跳來跳去！愛莉莎莎無奈：不跳,https://www.ptt.cc/bbs/Gossiping/M.1610764265.A.F9D.html,2021-01-16 10:31:02,,1.媒體來源:東森2.記者署名:3.完整新聞標題:被罵一直跳來跳去！愛莉莎莎無奈：不跳我就不對勁算命後秒懂了4.完整新聞內文:YouTuber愛莉莎莎擁有119萬訂閱者，以大剌剌的作風吸引許多粉絲，雖然走紅的同時也招來大量攻擊，但始終開心大方地做自己。她透露，以往發表新的影片，幾乎都會被罵「為什麼要一直跳來跳去」，自己也覺得疑惑，沒想到最近算命後得到了答案！▲愛莉莎莎被罵一直跳來跳去。（圖／翻攝自Instagram／愛莉莎莎Alisasa）▲愛莉莎莎被罵一直跳來跳去。（圖／翻攝自Instagram／愛莉莎莎Alisasa）▲愛莉莎莎發影片常被罵一直跳來跳去。（圖／翻攝自Instagram／愛莉莎莎Alisasa）愛莉莎莎坦言，其實看到網友這些批評留言，也覺得自己一直跳來跳去很奇怪，「但是不跳我就渾身不對勁！」她13日去算命，未料竟然從算命師口中得知「上輩子是兔子」，頓時恍然大悟，理解自己為什麼老是想要蹦蹦跳跳，但也還是笑說：「我比較喜歡無尾熊。」▲愛莉莎莎被罵一直跳來跳去。（圖／翻攝自Instagram／愛莉莎莎Alisasa）▲愛莉莎莎被算命師告知「上輩子是兔子」。（圖／翻攝自Instagram／愛莉莎莎Alisasa）粉絲留言鼓勵「跳跳跳才活潑可愛啊！那才是妳」、「兔子莎莎和無尾熊莎莎都很可愛」、「很愛看莎莎跳來跳去」、「支持繼續跳跳」；也有許多人cue最近跟她拍「交往7天」企劃的三原，熱烈回應「那三原肯定是紅蘿蔔」、「沒關係三原喜歡就好」。▲愛莉莎莎被罵一直跳來跳去。（圖／翻攝自Instagram／愛莉莎莎Alisasa）5.完整新聞連結(或短網址):6.備註:算命+莎莎會被噓爆ㄇ？--,-1
PTT,[問卦] 香港熱爆話題 台灣爆紅情侶-愛莉莎莎,https://www.ptt.cc/bbs/Gossiping/M.1610778621.A.530.html,2021-01-16 14:30:19,,香港熱爆話題台灣爆紅情侶-愛莉莎莎跟三原唇交！沒想到愛莉莎莎已經紅到香港去了？！--,
PTT,Re: [問卦] 高鐵乘客激似坂井泉水 網：那是愛莉莎莎,https://www.ptt.cc/bbs/Gossiping/M.1610722221.A.FAF.html,2021-01-15 22:50:19,,你是有多愛她啊！平均一天至少在八卦板PO一篇以上的文章。讓我都懷疑你是不是本人了？--410X21/05norvasc□[問卦]愛莉莎莎參加露營一晚僅15900元411X11/05norvasc□[問卦]幹IU這張有像愛莉莎莎耶！4121/06norvasc□[問卦]愛莉莎莎甜美放送牛排竟無人要吃？！413X11/07norvasc□[新聞]愛莉莎莎聲稱「喝橄欖油排膽結石」！4141/07norvasc□[問卦]愛莉莎莎是不是靠長得美為所欲為？41531/07norvasc□[問卦]愛莉莎莎為何一直不鳥PTT41611/08norvasc□[問卦]正妹+乖乖女網友：愛莉莎莎417131/08norvasc□[問卦]Hebe37歲素顏曝光網：堪比愛莉莎莎4181/09norvasc□[問卦]愛莉莎莎是靠美貌拿百萬訂閱嗎？4191/09norvasc□[問卦]幹愛莉莎莎談戀愛了網友：崩潰中4201/10norvasc□[問卦]台男嫉妒了！三原跟愛莉莎莎一起七天4211/10norvasc□[問卦]愛莉莎莎昨天上影片今天就快百萬點閱4221/10norvasc□[新聞]愛莉莎莎激吻三原被攝！畫面全洩羞認42311/11norvasc□[問卦]愛莉莎莎輸了！新影片只有發燒第二名42461/12norvasc□[問卦]愛莉莎莎：我跟三原有夫妻臉嗎？？4251/12norvasc□[問卦]愛莉莎莎會不會挺醫護同仁？！4261/14norvasc□[新聞]真在一起？愛莉莎莎激吻三原後出浴4271/14norvasc□[問卦]愛莉莎莎絕世美照：我可能是隻兔子428101/15norvasc□[問卦]試辦無「愛莉莎莎」週你ok嗎？4291/15norvasc□[問卦]高鐵乘客激似坂井泉水網：那是愛莉莎莎--,1
