Source,Title,Link,Date,Summary,Text,Like
PTT,[問卦] 愛莉莎莎大戰蒼藍鴿用一張圖表示？,https://www.ptt.cc/bbs/Gossiping/M.1613273235.A.023.html,2021-02-14 11:27:13,,吶吶本肥看網路上有人分享j張圖應該三幻鳥之一的冰鳥直接把素利伯虐爆雖然素利伯以前蠻好用的啦都會去11號道路抓一張素利普來養有人在問這件事的話484傳這張圖就好？--,6
PTT,Re: [問卦]  有沒有愛莉莎莎在clubhouse發言的八卦,https://www.ptt.cc/bbs/Gossiping/M.1613274070.A.14A.html,2021-02-14 11:41:08,,不懂耶，我以為台灣要看醫生是一件非常容易的事，健保卡拿著去掛號不就什麼答案都有了還在那邊在網路上呼籲人家跟她聯絡？清大腦子都這樣？裝的吧？就算不想用健保，直接去醫學院跟phd約時間不行？要在網路上呼籲大家跟她拍片？這的是智障，喔，不對！製造話題高手--,
PTT,[問卦] 愛莉莎莎：希望有態度好的醫師來討論,https://www.ptt.cc/bbs/Gossiping/M.1613274241.A.58D.html,2021-02-14 11:43:59,,愛莉莎莎在clubhouse提出想跟一個態度好、願意討論的醫生聊聊私訊她什麼的我終於知道大鴿輸在哪了大鴿的態度不夠好身段不夠軟這樣不好--,2
PTT,[問卦] 誰會成為愛莉莎莎第一個告的對象??,https://www.ptt.cc/bbs/Gossiping/M.1613273767.A.EE6.html,2021-02-14 11:36:04,,愛莉莎莎決定不忍的話誰會成為艾莉莎莎告的對象?2-14號祝艾莉莎莎情人節快樂..等下去泡湯--,6
PTT,Re: [問卦]  有沒有愛莉莎莎在clubhouse發言的八卦,https://www.ptt.cc/bbs/Gossiping/M.1613274270.A.8F9.html,2021-02-14 11:44:28,,講到這個不是每個人都住萬華知道是哪間這時候應該不是要有人要找出是哪一間然後google一下這間醫生的來歷背景看到有沒有可能燒到他出來解釋他到底是支持還是不支持驗證莎莎有沒有說謊說不定根本沒有這個醫生或是醫生沒有一百個案例或是醫生沒有支持如果醫生支持大家繼續鬥他有沒有萬華人趕快出來爆料一下--,1
PTT,[問卦] 愛莉莎莎把事件上升到女權就穩贏了嗎？,https://www.ptt.cc/bbs/Gossiping/M.1613274273.A.EDD.html,2021-02-14 11:44:31,,如題愛莉莎莎最近被罵爆黑到歪頭不過原本隱藏倒讚和留言突然又重開果不其然一堆人進去開嘲諷愛莉莎莎是不是在下很大的一盤棋事件延燒一開始不給抒發出口等能量累積再給抒發管道畢竟言多必失人多必有白癡然後先把自己的角色從誤導者塑造成被霸凌者挑幾則偏激的侮辱性的留言出來說要保留法律追訴權半夜哭哭啼啼素顏精神不好拍個敞開心胸的影片內容不外乎什麼拍這個影片的原意只為了驗證這個療法並以自身實踐和大家分享而已沒有要攻擊誰或業配結果被罵QQ接著開始上升到女權「這個世界對女生很不公平女生想獲取知識的管道很少還會被視為異類專業知識的話語權和詮釋者都是男生女生講錯就被嘲諷、圍攻、獵巫甚至被羞辱、辱罵這就是父權社會畢竟女子無才便是德」緊接著再說沒有特別指誰只是想抒發一下最後講一段#虛心接受所有建議#身為女生很抱歉#之後不會再拍這麼有爭議性的東西了#夜深了#我累了#謝謝大家#希望台灣未來會更好請問愛莉莎莎把事件上升到女權就穩贏了嗎？愛莉莎莎準備來一波極限反殺有沒有八卦？-------對主打莎文公豬主義那麼我看接下來蒼藍鴿頭是會真的痛身為男性就是原罪一開始沒想那麼多結果被罵後來才會從長計議準備搞一波大的無聊我要看到血流成河.jpg說理組恃才傲物只尊重自己的專業文組的專業都不被重視QQ對男性在社會、專業、知識的社會紅利太多女生想靠自己卻發現社會很不友善QQ不一定要身為女權不過蒼藍鴿就是父權社會縮影無關個人為了性別平等蒼藍鴿挺帥的不知雞排妹會不會認證他可以摸屁股我不許你這樣說台灣IU他只是有求知慾卻被書本誤導也不小心誤導觀眾愛莉莎莎幹嘛要為了女性的求知慾而道歉這樣先入為主的莎豬思想不可取整排女油土伯留言聲援接著眾多女性政治人物跳進來#范雲如果能被參考三生有幸感激涕零不知所云可以講女性醫師整體比例少男生很多#父權社會遺毒有聲量大家都愛蹭女性政治人士又噱一波小心發言等等被法律追訴拳打很多油土伯公關危機不是都這套劇本嗎？不用聘請連學店生如我都想得到這套對蒼藍鴿引用影片曲解原意感到被冒犯是的女生也擁有談論專業知識的權益吧蒼藍大哥不會被認証人醜性騷擾吧QQ2018年執業西醫師人數46474人女西醫師為9025人佔19.4%#父權社會#莎或贏大鴿沒有輸只是性騷擾蒼藍鴿要被迫改名成粉紅割了清大的欸腦子應該冷靜下來就很有料不對喔你這樣就是漠視台灣社會無所不在的男性紅利素利柏不知道哭聲是怎樣開個記者會標題聳動就沒有人會去管原本誤導別人的事實你怎麼可以這樣嘴台灣IU主管覺得被冒犯我也是很期待自然排石法大師後續表現莎可以鴿不行4觀念正確主觀認定這世界什麼事情都可以扯女權哪裡哪裡比不上志其77講公關危機的影片一定會有啦女權怎麼輸？我就問你4這樣的話愛莉莎莎比你我想像的都還有料#油土伯道歉模板,42
PTT,[新聞] 愛莉莎莎深夜發聲！邀醫拍片：幾分幾秒,https://www.ptt.cc/bbs/Gossiping/M.1613274736.A.A97.html,2021-02-14 11:52:13,,1.媒體來源:ETtoday新聞雲2.記者署名:劉宜庭3.完整新聞標題:愛莉莎莎深夜發聲！邀醫拍片：幾分幾秒讓你們覺得我Google找的？4.完整新聞內文:YouTuber愛莉莎莎先前挑戰「喝橄欖油排膽結石」的民俗療法，被台大兒科醫師「蒼藍鴿」批評是誤導觀眾，12日拍攝影片質疑對方言論，卻又遭到許多醫療人員嚴厲批評，面對外界罵聲，她事後發文道歉，並於14日凌晨透過社群平台「Clubhouse」與許多醫師交流，還提議想邀請醫生合作拍片，被指態度似乎放軟許多。據多名參與聊天室網友說法，愛莉莎莎14日凌晨在Clubhouse與多名醫生一起討論近日的爭議，想徵求在場醫師上她的頻道拍片討論。她坦言，起初會想拍攝影片，是因為做了斷食後感到有幫助，偏頭痛也有改善，身心靈都有獨特的感受，但也認為「這種爭議性題材好像以後不要拍比較好」。期間，醫師姜冠宇表示，因愛莉莎莎本身並非醫療專業出身，找資料可能會有困難，並舉例許多阿公阿嬤自己上網Google可能也會有問題。這時，愛莉莎莎反問，「請問影片幾分幾秒讓你們覺得我是google找的？」同在聊天室中的前主播陳海茵則提問，是否有諮詢專業人士？愛莉莎莎則說，主要資訊來源就是自己手邊的書籍，從註釋中去連到相關資料，以及蒼藍鴿影片中提到的Lancet論文。愛莉莎莎坦言，因為此事受到很大的輿論壓力，「互相攻擊的狀態不是我們想看見的。」她因為聽聞聊天室中的討論偏向溫和，才會加入聊天，但不希望內容被記錄，因為自己正在風頭上，所有言論都會被放大檢視。面對有許多醫生主動表示願意上節目幫忙，她除了感謝眾人提供意見，也表示經紀公司會幫忙篩選出在場的3至4名醫生上頻道，再另外製作一集影片討論，並強調希望有相關科別的醫生在，「希望是肝膽腸胃科的醫生，不然又會被嘴。」在愛莉莎莎下線之後，曾是護理師出身、如今與愛莉莎莎隸屬同個經紀公司的網紅「千千進食中」也加入聊天，她建議類似影片應要找醫生參與，事前須給詳細訪綱，上片前也要給醫生看過剪片成果。她也提到醫護人員與網紅合作的難處，在相關法規規範下，醫師不能隨便背書。事後，姜冠宇醫師也在臉書上發文，除了針對相關醫療議題進行分析，他也分享暢聊完之後的心得，「Clubhouse比傳統文字社群，有更強大的力量，或許我們在雙方社群公關危機的當下，可以減少負面的評論與爭執，甚至可以協助雙方各退一步海闊天空，這才能提升事件的價值，檢視我們真正缺乏的要素，去解決我們真實需要解決問題～。」在愛莉莎莎參與討論結束後，在PTT掀起不小討論度，認為女方「態度放軟」，同時也有不少網友留言批評「態度真的要加油」、「還篩選勒…以為別人想上」、「剛剛聽了一陣，對愛莉莎莎印象超差，對醫師們的回應真的失禮」、「怎麼講得好像還是覺得自己很無辜」、「打死不認錯就對了…」，意外引發熱議。5.完整新聞連結(或短網址):6.備註:----,-1
PTT,Re: [新聞] 愛莉莎莎深夜發聲！邀醫拍片：幾分幾秒,https://www.ptt.cc/bbs/Gossiping/M.1613275613.A.771.html,2021-02-14 12:06:51,,我想知道有什麼醫師被欽點去救駕？看看救駕錯誤的觀念會不會黑掉我再重覆一次很多人不知道自己有膽結石貿然喝油100cc可能會誘發成急性膽囊炎會害到人的錯誤觀念就認錯別再凹了引述《HTC92(中国台湾人的驕傲-92共識)》之銘言：鴿外還?的?食像舉幾人蒼」在謝影」千給隨之機?事」?剛自--,1
PTT,Re: [問卦] 愛莉莎莎把事件上升到女權就穩贏了嗎？,https://www.ptt.cc/bbs/Gossiping/M.1613276335.A.47D.html,2021-02-14 12:18:52,,很可惜的事情是這件事情並不是單純的父權女權之爭議而是恰恰體現了深植於台灣人民之中的對於威權的崇拜蒼藍鴿為何會氣急敗壞的拍一隻影片反擊一個網紅美其名是因為看不下自己專業被踐踏不如說是自己的權威被冒犯事實上是同樣的一件事情不同的醫生也會有不同的見解並不是你蒼藍鴿是醫生而其他人就不是醫生歷史上告訴我們威權的對立面從來就是另一個威權愛莉莎莎後來也拿出了所謂重量級大佬的推薦序還反擊這連串的事件撇除事件的本質就是兩個人在面對威權表現了不同的姿態而這種奴化是在骨子裡產生的在所有儒家子民的血液中留著這與歐美那種重視自我實踐性反抗精英的實踐主義是不一樣的光是美國憲法保留人民持有槍枝的權利即可看出大政府下美國政府仍然留給平民反抗自己的武器這是對威權的賤斥也是對自我實踐的謳歌然後台灣人民身為長期儒弱化的信仰者早已失去反抗威權的能力歷史上一次一次威權的倒台民間反應是急於尋找另一種威權因此這次事件不如說蒼藍哥在後現代儒化社會為威權主義打響了一槍同時賤斥了以自我實踐為基礎的愛莉莎莎對於威權的質疑想到這裡筆者真的感到不寒而慄啊台灣人民何時才能有自由的心靈呢?--,
PTT,[問卦] 愛莉莎莎這一局有贏面嗎？,https://www.ptt.cc/bbs/Gossiping/M.1613276396.A.84B.html,2021-02-14 12:19:54,,女口是頁愛莉莎莎之前發了一篇肝膽排石法的影片被臺大醫科的youtuber打臉結果不但沒有反省還拍了第二隻影片直接跟蒼藍鴿槓上現在還要邀請醫師來討論肥宅真的不懂愛莉莎莎有必要這樣硬幹到底嗎這療法要是真的這麼神會沒有藥廠跟生技公司介入開放產品嗎排石是多大的商機不合理嘛愛莉莎莎這局還有贏面嗎？有沒有卦-----SentfromJPTTonmyiPhone--,7
PTT,[問卦] 如果愛莉莎莎爸爸姓柯會怎麼發展,https://www.ptt.cc/bbs/Gossiping/M.1613274954.A.C8D.html,2021-02-14 11:55:52,,最近愛莉莎莎的事鬧得沸沸揚揚，看起來我們的鄉民女神很難反殺但如果愛莉莎莎的爸爸姓柯，喬幾下就完事了吧？有沒有劇情會怎麼發展的卦？--,9
PTT,[問卦] 愛莉莎莎或成最大贏家？,https://www.ptt.cc/bbs/Gossiping/M.1613274776.A.AB8.html,2021-02-14 11:52:54,,這幾天炎上的事件相信大家都知道的昨天看他的訂閱數117萬今年已經來到118萬照這個進度下去相信很快就能超車李子柒了吧你各位說說看她是不是一個優秀的流量操盤手不服來辯--好好說話那也是指日可待也是一個方向請你拿出證據,2
PTT,[問卦] 愛莉莎莎說的那本書很多推薦？,https://www.ptt.cc/bbs/Gossiping/M.1613275560.A.A98.html,2021-02-14 12:05:58,,欸欸愛莉莎莎死不認錯還舉證一本書神奇的肝膽排石法說裡面的推薦序很多名人醫生生意人推薦如下圖：這樣這些名人不相挺一下嗎？總不能只靠一個洗溫泉的日本仔在支援吧？--生意人不支持愛莉莎莎嗎？好險我不是文組女權左膠仔13位裡面只有一位是醫生這邊「書還可信嗎？,11
PTT,Re: [問卦] 愛莉莎莎要怎麼樣才能安全下莊？,https://www.ptt.cc/bbs/Gossiping/M.1613265971.A.A88.html,2021-02-14 09:26:09,,不用這麼麻煩啦現在開始裝死不談這件事就好依大部分台灣人的個性沒幾天就忘了哪需要抱歉丟了面子事小讓腦粉被看不起才事大該拍片的拍片該裝死的裝死不要害到粉絲自然能繼續混一口飯吃上面沒聲音腦粉看風向不對自然會安靜如果不相信我就問你還剩多少人在注意飛機妹?等過幾天風平浪靜了各大板又會開始刷莎莎了你信不信?--,2
PTT,[問卦] 有沒有醫界人士才是最無知又噁心的一群,https://www.ptt.cc/bbs/Gossiping/M.1613266880.A.19B.html,2021-02-14 09:41:18,,對啦我就是衝著愛莉莎莎引起的爭議來的啦大家都在指責愛莉莎沙的反駁不對叫大家好好地審視跟檢視愛莉莎莎的言論我反過來說「請大家好好審視跟檢視那群象牙塔裡醫界人士的言論」愛莉莎莎的言論為什麼是錯的「拜託我腎臟科醫師耶」「拜託我醫學院念了七年耶」「拜託人家是台大名醫耶」「拜託你只是一個小小網紅」「拜託你那只是一個商業書耶」「拜託人家那個是權威專業期刊論文耶」拜託你們這群噁心又自閉的醫護群組你們到底知不知道什麼叫做「打臉」阿人家愛莉莎莎求的是一個「真劍勝負」！為什麼愛莉莎莎至今還不認錯！！！！！因為愛莉莎莎還沒輸阿！！！為什麼愛莉莎莎還沒輸？？？？我可以公開的這樣講因為愛莉莎莎的反駁影片就是一個比武擂台了！！！要想打敗愛莉莎莎就「請上擂台」「請上擂台」「請上擂台」而不是在台下一直講「拜託我廣東五省武術冠軍耶」「拜託我可是人稱鐵拳無敵孫中山耶」「拜託兵器榜上根本沒看過你這個沒沒無聞的小東西」我真的看不出來愛莉莎莎哪一點被你們這群驕傲又自閉的醫護人員打臉了你們到底說了哪一點打臉了愛莉莎莎如果愛莉莎莎在擂台上真的比你們比下去了這絕對是輸得心服口服！你們就只會在擂台下叫囂要人家道歉、認錯只會在那指責「愛莉莎莎你到現在還不知道哪裡錯了」我也想反問那群封閉又噁心又驕傲的醫護人士「你們想要愛莉莎莎認錯的方法你們到現在還不知道哪裡錯了！！！！！！」那種只因為他是腎臟科醫師或者他是醫界大老的這種頭銜就相信他們說的一切醫界權威也不過就是你們眼中的另一種形式的愛莉莎莎而你們這群醫護人跟你們最鄙視的愛莉莎莎粉絲到底有什麼區別阿？就只是因為你們是醫護就自覺高人一等你說我用噁心來形容你們是不是不過分想要愛莉莎莎道歉認錯就請上擂台！！！真劍勝負！！！愛莉莎莎現在還沒輸！！！我現在還沒看到愛莉莎莎哪裡被你們醫界人士打臉了我只看到你們在「擂台下」叫囂叫得很厲害把自己的名聲喊得漫天價響說不定上擂台之後全台醫護還輸給一個無法在醫界入流的小網紅！！！--我不是挺愛莉莎莎我只是覺得打臉不是這樣的真相跟事實不會因為你名聲大、人數多就會被扭曲！！！我就是故意寫給那一群擁有愛莉莎莎粉絲本質的醫界人士看的--^^^^^^^^^^既然是不實影片那打臉愛莉莎莎應該是很容易要打臉就請提出證據阿證據勒證據勒而不是在那邊喊自己的名聲或者在那邊口口聲聲說人家的是不實影片你他媽的你說那是不實影片我就要信喔!!!我如果自稱我醫界大老我說你腦袋孔固力你是不是也要信我你是不是也要信我啦你看那些噓的到底是我的邏輯沒問題還是這社會有問題....也沒有任何一個證據可以證明愛莉莎莎說的是不實為什麼你會這麼輕易地相信別人的言論如果專家說吃大便有營養你是不是也會去吃你說人家「不實影片」我就要相信你嗎你有沒有證據？你拿出證據打臉愛莉莎莎我就相信你說的那是不實影片人家愛莉莎莎影片有說了阿你沒看喔愛莉莎莎是有拿出他自以為的證據反駁倉懶哥的喔你們這些反駁愛莉莎莎的有沒有證據沒有啊只有我是腎臟科醫師我念醫學院的這種說法而已沒了笑掉大牙他後面有說因為那個XXX療法她身體變好你甚麼都沒去看你是上來放什麼屁阿就給我罵得而已沒看到你在用阿你在說幹話嗎專家說對你就信說得好像你有用一樣你敢跟我提現代醫學？那你知道未來醫學嗎？未來醫學都是推翻現代醫學來的你知道嗎不然怎麼成為未來好啦上面那個邏輯你可能不懂我就提你最驕傲的現代醫學你知道現代醫學怎麼來的嗎？就是推翻傳統醫學來的你知道嗎就是因為證實了很多傳統醫學的錯誤而奠立了現代醫學的可信度你知道時代是怎麼進步的嗎就是推翻過去創造未來！！！未來要進步就是讓現在的更好如何讓現在的更好就是因為現在的不夠好才會被推翻你敢跟我提現代醫學？你又知道只有他一個人了你真的沒去看影片在這邊說屁話你沒看影片就一直上來想嘴你還敢勸人家要用腦袋...?,-8
PTT,[問卦] 愛莉莎莎重開影片留言但刪醫生留言不見？,https://www.ptt.cc/bbs/Gossiping/M.1613266985.A.0A7.html,2021-02-14 09:43:03,,愛莉莎莎終於又開了影片留言但仔細一看原來按讚爆多的醫師藥師留言不知道是YouTube重開留言後的機制還是被刪除突然都不在留言的前幾位讓現在新留言的網友整個炎上指責她疑似刪留言原先這些醫藥師的功能還有在下方等於有警語的作用大家怎麼看？若沒刪應該要澄清不然留言區都炎上了--,17
PTT,[問卦] 台灣IU愛莉莎莎是不是文組之光,https://www.ptt.cc/bbs/Gossiping/M.1613267078.A.40C.html,2021-02-14 09:44:35,,文組被理組壓迫久了組隊也打不贏理組，遲遲找不到反擊的契機愛莉莎莎一戰成名，讓醫師群吃鱉還賺到知名度，賺點閱率還賺錢利用過年大家最有空的時候殺遍四方，還直接進去醫師clubhouse群組大放厥詞莎莎根本吃了無敵星星至於那個蒼藍鴿過年還要值班，根本被打假的仗著醫師執照仍被打趴愛莉莎莎是不是文組之光呢有迷有八卦R?----,
PTT,Re: [問卦] 三原在愛莉莎莎的道歉文下約去溫泉幹嘛,https://www.ptt.cc/bbs/Gossiping/M.1613267366.A.293.html,2021-02-14 09:49:15,,請問懶叫可以震碎結石是真的嗎？我google過了，查不太到相關資訊可以提供source嗎？謝謝-----SentfromJPTTonmyiPhone--廢文產生器廢文創作，筆耕不輟；《廢文賞析》不定期更新。--,2
PTT,[新聞] 可能害死別人!愛莉莎莎再遭打臉「在科學,https://www.ptt.cc/bbs/Gossiping/M.1613267096.A.752.html,2021-02-14 09:44:50,,可能害死別人！愛莉莎莎再遭打臉「在科學上不堪一擊」2021/02/1321:40:00三立新聞網娛樂中心／陳又瑞報導人氣百萬YouTuber「愛莉莎莎」去年曾實測7日蔬果斷食法，同時又進行了傳說中的「肝膽排石法」，讓同是YouTuber的台大兒科醫師「蒼藍鴿」狠狠打臉「完全沒有科學根據」，不過愛莉莎莎12日再度反擊，強調自己事前有買書來看，書上有許多醫界、養生界大老推薦。但醫護組成的臉書粉專「MedPartner美的好朋友」再度打臉愛莉莎莎，直言該書跟推薦人的說法「在科學上是不堪一擊的」愛莉莎莎發表影片「正式回應蒼藍鴿對我的各種指責」，澄清自己在進行肝膽排石法以前有做功課，還特地買了《神奇的肝膽排石法》來看，該書獲得許多醫界、養生界大老推薦；愛莉莎莎反批，蒼藍鴿用來反駁她的依據只是醫學期刊《刺胳針》上的一篇「讀者投書」公信力非常低，懷疑蒼藍鴿沒有好好看過自己引用的數據，也沒有好好看過《神奇的肝膽排石法》。不過美的好朋友指出，蒼藍鴿真的沒有亂講話，直言愛莉莎莎引用的書和推薦人的觀點「在科學上是不堪一擊的」，愛莉莎莎認為「讀者投書」沒公信力，但那並非阿貓阿狗就可以去投的，「不然這麼厲害你可以去投看看」；美的好朋友坦言，所謂的「肝膽排石法」絕對沒辦法排出膽結石，「無數的臨床醫師都可以告訴你」，否則醫學上就不用發展相關手術、科技夾石頭，而是喝果汁、喝油就好了。美的好朋友表示，雖然該書有許多大老推薦，但更重要的是「是否能在科學上被檢視」，強調「醫療人員不願民眾被偏方所誤，善意的提醒，希望網紅不要覺得這是被攻擊還是怎樣，修正自己的說法就好。」同時也建議愛莉莎莎可以和真正的專家對談。新聞連結:備註:愛莉刪刪的該則爭議影片下方的眾多醫師、藥師、護理師專業留言，很多都已經被刪除--,
PTT,[問卦] 愛莉莎莎一開始就道歉不就沒事了？,https://www.ptt.cc/bbs/Gossiping/M.1613267520.A.F43.html,2021-02-14 09:51:56,,最近愛莉莎莎和蒼藍鴿的事件被大家炮得體無完膚而且一開始還堅持不道歉，認為自己是對的但現在事情燒成這樣，再道歉是不是有點晚了？如果一開始就放低姿態，說個「自己不夠謹慎，以後會再做足功課，且會尊重專業領域」之然後直接道歉是不是就沒事了？--已更正,84
PTT,[問卦] 愛莉莎莎情人節在幹嗎??,https://www.ptt.cc/bbs/Gossiping/M.1613267206.A.AC4.html,2021-02-14 09:46:44,,愛莉莎莎今年情人節寂寞嗎?聽說今天很適合泡溫泉有沒有愛莉莎莎今天情人節的行程的八卦???--,4
PTT,[問卦] 恭喜蒼藍鴿哥 但也不用太擔心愛莉莎莎,https://www.ptt.cc/bbs/Gossiping/M.1613267798.A.254.html,2021-02-14 09:56:36,,hiall恭喜蒼藍鴿哥大獲全勝但是風度如蒼藍鴿哥得理饒人想必也不會趕盡殺絕愛莉莎莎加上愛莉莎莎可愛銳氣的能量一定可以挺過這次的公關危機的--,6
PTT,Re: [問卦] 愛莉莎莎一開始就道歉不就沒事了？,https://www.ptt.cc/bbs/Gossiping/M.1613268521.A.094.html,2021-02-14 10:08:38,,道歉有用還需要警察啊？當年不砍七天假，轉彎後砍光當年拒絕萊劑，轉彎進口來豬有道歉嗎？沒有呀總統都沒道歉了現在憑什麼要一個小女生道歉欺負小女生你們敢有種去總統府立法院抗議啊你各位就是欺善怕惡難道你要投國民黨？這沒得選只好吞下去投民進黨難道你沒別的yt可以看嗎？不是沒得選吧！不要看不要聽不就好了要一個小女生道歉情何以堪錯就錯了總統都沒在道歉的人民至少也要向總統看齊吧不要雙重標準支持愛莉莎莎永不道歉大家給我挺起來--,3
PTT,[問卦] 愛莉莎莎 支持成立清大學士後醫學系？,https://www.ptt.cc/bbs/Gossiping/M.1613268562.A.C3F.html,2021-02-14 10:09:20,,清華大學傑出校友愛莉莎莎，是否會支持清大成立學士後醫學系，假使成立的話，憑著愛莉莎莎的絕世容顏與聰明才智，要考上清大學後醫應該十分容易，順利的話，還能藉此成為台灣肝膽腸胃科權威，除了可以在自己的youtube頻道分享醫學衛教，還能參加胡瓜的醫師好辣，讓更多人認識集聰明美貌醫學專業於一身的愛莉莎莎！愛莉莎莎考學後醫，輕鬆沒問題吧？--目光短淺，還好愛莉莎莎與您不同,2
PTT,[問卦] 愛莉莎莎影片點閱數1天內翻倍?怎麼辦到的,https://www.ptt.cc/bbs/Gossiping/M.1613268189.A.35F.html,2021-02-14 10:03:04,,阿no內我昨天看愛莉莎莎的影片才51萬而已今天早上就破120萬次點閱到底怎麼辦到的？莫非背後有高人指點抑或是有莎粉肝膽香皂？--老婆1老婆2老婆3老婆4老婆5老婆6老婆7老婆8老婆9老婆10老婆11老婆12--,1
PTT,Re: [問卦] 愛莉莎莎一開始就道歉不就沒事了？,https://www.ptt.cc/bbs/Gossiping/M.1613268761.A.40B.html,2021-02-14 10:12:39,,你如果有跟到昨天晚上的ClubHouse就知道了她根本不覺得她有錯啊她的論點：1.蒼蘭鴿盜用她影片，他有錯在先2.有書本佐證，如果真的有錯，為什麼可以發行？3.她有做功課，先Google過，還有潘懷宗的節目當背書4.蒼蘭鴿先態度不好，她才又做影片反擊5.要舉手發言可以，態度要好，而且她有想學，房間內醫生請線上看診--,83
