Source,Title,Link,Date,Summary,Text,Like
PTT,Re: [問卦] 對於愛莉莎莎事件，鄉民們會自責嗎？,https://www.ptt.cc/bbs/Gossiping/M.1615087258.A.5F9.html,2021-03-07 11:20:55,,真的一代女神就此殞落但下一個PTT女神己經準備好了那就是臉正奶大的正妹罔腰愛莉莎莎真的可惜了台男就是不愛台女-----,
PTT,[問卦] 孟達死前沒找愛莉莎莎合作是不是終生遺憾,https://www.ptt.cc/bbs/Gossiping/M.1615092155.A.07D.html,2021-03-07 12:42:31,,孟達年紀大了沒人氣沒人關心又病了這時候如果找台灣女神愛莉莎莎合作拍片是不是能讓孟達東山在起再度發光發熱孟達沒找小愛チャン合作是不是終生遺憾-----可惜你沒2按,-1
PTT,[問卦] 愛莉莎莎再不發影片 我就要發飆了,https://www.ptt.cc/bbs/Gossiping/M.1615090901.A.49F.html,2021-03-07 12:21:36,,大家看看大家看看台灣坂井泉水鄉民女神愛莉莎莎被逼到什麼樣子了多久沒發影片了？完全置八卦莎粉於不顧嘛我在這裡慎重警告愛莉莎莎再不發影片我恐怕就要發飆了...--鋼鐵莎粉1號G卵2號u卵--,
PTT,[問卦] 愛莉莎莎不拍片，沒錢付房貸怎麼辦？,https://www.ptt.cc/bbs/Gossiping/M.1615100275.A.A0A.html,2021-03-07 14:57:50,,大家好，我們的台灣IU&台灣新垣結衣&台灣坂井泉水&台灣潤娥&台灣雪炫&台灣本田翼&台灣蓋兒加朵&台灣安海瑟薇&台灣艾瑪華森&台灣黑嘉嘉，已經要一個月沒上片了，YouTube收入來源都是點閱率和業配，沒有拍片就沒有業配，也就沒有收入了，我記得愛莉莎莎的晶麒不是一次付清的，還有一千萬的房貸要還，如今沒收入了怎麼辦啊？要不要在八卦板集資幫愛莉莎莎募集房貸基金？有沒有八卦？-----SentfromJPTTonmySamsungSM-G9730.--【知恩突抱】注音ㄓㄣㄊㄨˊㄅㄠˋ釋義指愛莉莎莎突然抱住你。例句昨天我夢到知恩突抱，醒來就夢遺了。--,
PTT,[問卦] 愛莉莎莎不拍片，公司營運怎麼辦？,https://www.ptt.cc/bbs/Gossiping/M.1615101337.A.622.html,2021-03-07 15:15:34,,公司名稱愛莉莎莎有限公司公司英文名稱AlisasaInc.愛莉莎莎不拍片那公司營運怎麼辦如果愛莉莎莎的公司倒了台灣又少了一間本土企業愛莉莎莎也不會搬到中國賺中國錢因為愛莉莎莎曾說她最喜歡的是台灣台灣人不能給陳小愛チャン力量嗎--【】注音ㄍㄢㄉㄢˇㄒㄧㄤㄓㄠˋ釋義當愛莉莎莎願意為你同時喝下檸濛汁和橄欖油來製造肥皂，代表她是真愛。例句網紅真愛粉，檸濛橄欖油，大便皂化石，真是肝膽香皂。--拍什?台灣之女陳小愛的本名啊難不成用你的名字?不跟你說耶什麼果?奇異果?,
PTT,[問卦] 愛莉莎莎最近在幹嘛？,https://www.ptt.cc/bbs/Gossiping/M.1615113530.A.F51.html,2021-03-07 18:38:48,,我們台灣新垣結衣台灣iu好久沒發文了不知道最近她在幹嘛？還是她打算去帛琉旅行替台灣代言--,
PTT,[問卦] 夢到愛莉莎莎被亂噓 驚醒嚇哭 還好是夢,https://www.ptt.cc/bbs/Gossiping/M.1615145654.A.34F.html,2021-03-08 03:34:09,,今天白天還在想愛莉莎莎好久沒發片了可能日有所思夜有所夢剛剛夢到愛莉莎莎被八卦暴民亂噓到XX半夜直接驚醒嚇哭還好醒來只是夢破涕為笑--鋼鐵莎粉1號G卵2號u卵--,-1
PTT,[問卦] 日本人:愛莉莎莎會想加入AKB48嗎,https://www.ptt.cc/bbs/Gossiping/M.1615171264.A.085.html,2021-03-08 10:41:00,,AKB48是日本超人氣女團但因為近幾年缺了一個中心所以AKB48人氣有點下降如果愛莉莎莎能加入AKB48一定能再造奇蹟愛莉莎莎是不是該加入日本AKB48放棄台灣市場了-----小愛莎莎チャン哭啊~所以不能道歉?道歉完還想怎樣?先姦後殺嗎?噁心台男,
PTT,[問卦]愛莉莎莎是怎麼走上神壇的？,https://www.ptt.cc/bbs/Gossiping/M.1615172370.A.2C0.html,2021-03-08 10:59:28,,阿諾內肥宅我剛好想到台灣的愛莉莎莎氣質很像奧黛麗赫本可愛有如新垣結衣而且他的地位跟英國女皇非常相似老公還是金城武請問愛莉莎莎是怎麼走上神壇的有卦否-----SentfromJPTTonmySamsungSM-N960F.--,
PTT,[問卦] 失蹤網紅？愛莉莎莎月餘未發片，台股創,https://www.ptt.cc/bbs/Gossiping/M.1615192242.A.F83.html,2021-03-08 16:30:40,,國民女兒愛莉莎莎由於肝膽排石法的風波，鬧得沸沸揚揚。已經神隱一個多月。不僅IG停止更新。就連YouTube迄今也一個月沒發片。恰好台股今天創金牛年開紅盤以來新低。大家說這是巧合嗎？我不覺得。為了台灣的政經穩定。大家一人一推，把這篇推爆。讓愛莉莎莎看見我們。知道台灣跟世界還是很需要她的。大家說好噗好？--,
PTT,[問卦] 愛莉莎莎引退?,https://www.ptt.cc/bbs/Gossiping/M.1615200556.A.091.html,2021-03-08 18:49:13,,自從80事件後愛莉莎莎長休一般長休原因是出國玩(疫情中不成立)有人說是去整容很多實例是秘密生子但有可能是要引退嗎引退不是要拍告別作還要辦引退見面會莎粉引頸期盼都變長頸鹿了--,
PTT,[問卦] 愛莉莎莎 vs 艾瑞絲，女朋友選誰？,https://www.ptt.cc/bbs/Gossiping/M.1615199054.A.507.html,2021-03-08 18:24:10,,這是艾瑞絲，這是愛莉莎莎，學歷：愛莉莎莎勝顏值：愛莉莎莎勝身材：愛莉莎莎勝人氣：愛莉莎莎勝客觀條件來看愛莉莎莎全勝，不過愛莉莎莎有個致命的缺點，就是太完美，聖女光環太強了，看到她無法產生性慾，艾瑞絲就沒這個問題，所以要選一個當女朋友的話，誰比較好呢？有沒有八卦？-----SentfromJPTTonmySamsungSM-G9730.--→摘自《女神進化史》--,
PTT,[問卦] 被鄉民霸凌 愛莉莎莎受創(己失蹤,https://www.ptt.cc/bbs/Gossiping/M.1615177422.A.884.html,2021-03-08 12:23:39,,"愛莉莎莎久被霸凌近一個月己經失蹤未發影片不知道愛莉莎莎是否還活著只盼不要再發生網路霸凌事件愛莉莎莎是最後受害者-----中央政府也應該建立類似通報法律不讓悲劇再度發生小燈泡案後霸凌持續進行殺警等精神病、校園安全問題尚未解決一起努力讓社會更和諧莎莎己經一個月未發文了不然你還想怎樣,等出事了才在那假仁假義嗎?莎莎是善良的,請不要再霸凌她好嗎還有人性嗎一點點的良知都沒有了嗎?你還是人嗎?莎莎是善良的女神才不會跟鄉民一樣壞希望莎莎趕快發視頻讓大家安心",-1
PTT,Re: [問卦] 愛莉莎莎引退?,https://www.ptt.cc/bbs/Gossiping/M.1615201576.A.740.html,2021-03-08 19:06:14,,我勸大家不要在B她了喔IZSASA畢竟只是一個女森雖然房間不用擠三人但是她之前也說過有點後悔不要讓傷心的事情再度發生好嗎？--買辣果房子,5
PTT,[問卦] 愛莉莎莎真的很重情義為朋友著想對吧,https://www.ptt.cc/bbs/Gossiping/M.1615482865.A.713.html,2021-03-12 01:14:20,,"常常看到莎莎,阿圓,林萱,金針菇,蔡哥一起拍片前幾天天他們又一起去吃韓國烤肉之前愛莉莎莎影片底下都會出現他們的留言最近都沒有了，可能是愛莉莎莎怕連累他們真的很有情有義的女神，大家還能不喜歡嗎----真的,他們現在都私下打氣對啊~所以我如果想弄你,法官也會保謢我",1
PTT,[問卦] 愛莉莎莎怎麼那麼殘忍？,https://www.ptt.cc/bbs/Gossiping/M.1615560915.A.E66.html,2021-03-12 22:55:03,,大家好，我們的台灣IU&台灣新垣結衣&台灣本田翼&台灣坂泉井水&台灣安海瑟薇&台灣蓋兒加朵&台灣雪炫&台灣多賢&台灣艾瑪華森&台灣周子瑜&台灣黑嘉嘉，已經要一個月沒有任何更新了，全台灣數百萬嗷嗷待哺的莎粉，這一個月來少了精神糧食，就如同心裡被開了個洞，每天行屍走肉，彷彿失去了活著的目標，愛莉莎莎何以忍心丟下我們呢？有沒有愛莉莎莎怎麼那麼殘忍的八卦？-----SentfromJPTTonmySamsungSM-G9730.--→摘自《女神進化史》--,
PTT,[問卦] 日本人:小愛可以換愛莉莎莎嗎?,https://www.ptt.cc/bbs/Gossiping/M.1614769417.A.2ED.html,2021-03-03 19:03:34,,有一個日本朋友跟老娘聊到小愛真的是丟了日本人的臉相比起來台灣女神真的日本女人該學習的典範可以回日本小愛留台灣就好嗎有沒有卦?-----,
PTT,[問卦] 八卦有些ID很詭異，言必推愛莉莎莎,https://www.ptt.cc/bbs/Gossiping/M.1614746915.A.30E.html,2021-03-03 12:48:30,,愛莉莎莎有百萬粉絲這大家都知道但每天都有必推莎莎文到底是金莎還是黑莎有沒有卦-----,5
PTT,[問卦] 沒有愛莉莎莎要看什麼頻道墊檔？,https://www.ptt.cc/bbs/Gossiping/M.1614696323.A.EA0.html,2021-03-02 22:45:16,,大家好，我們的台灣IU&台灣坂井泉水&台灣新垣結衣&台灣艾瑪華森&台灣雪炫&台灣太妍&台灣潤娥&台灣多賢&台灣周子瑜&台灣黑嘉嘉，已經有超過兩個禮拜沒更新IG和Youtube了，以前我都只看愛莉莎莎當精神糧食的，可是現在不得不看一些其他的頻道來填補愛莉莎莎留下的空間了，有沒有什麼內容品質不輸愛莉莎莎的優質頻道啊？我打算在沒有莎莎的日子先看它們墊墊檔，要推薦非常優質的頻道哦，一般的庸脂俗粉不可能是台灣IU的對手，有沒有啊？--→摘自《女神進化史》--,1
PTT,[問卦] 二伯跟愛莉莎莎誰才是第一美女？,https://www.ptt.cc/bbs/Gossiping/M.1614701726.A.F3F.html,2021-03-03 00:15:24,,愛莉莎莎素來以美貌聞名有台灣IU之稱二伯最近瘦下來也變成一個美人還有點母性美想問問看大家覺得是愛莉莎莎還是二伯才是第一美女呢？有沒有八卦？--,
PTT,[問卦] 愛莉莎莎 福園愛 都幾??,https://www.ptt.cc/bbs/Gossiping/M.1614773804.A.18F.html,2021-03-03 20:16:41,,福園愛日本國民女兒，桌球國手，精通中文的日女愛麗莎莎人稱台版IU，國立清華大學人文社會學系畢業，目前是當紅Youtuber各位鄉民會選誰??--,3
PTT,[問卦] 該把小愛和愛醬這頭銜還給愛莉莎莎了吧,https://www.ptt.cc/bbs/Gossiping/M.1614771706.A.B89.html,2021-03-03 19:41:40,,如題，小愛或愛醬聽起來就是很純真的樣子，福原愛已經87%確定外遇了，根本不夠格再擁有這麼親切的頭銜，反觀我們的台灣IU&台灣新垣結衣&台灣坂井泉水，在世大運時被高大帥氣的男運動員當面約炮也不為所動，潔身自愛的形象和福原愛形成強烈對比，愛莉莎莎才是真正的小愛和愛ちゃん吧！有沒有應該把小愛和愛醬的頭銜還給愛莉莎莎的八卦？-----SentfromJPTTonmySamsungSM-G9730.--【知恩突抱】注音ㄓㄣㄊㄨˊㄅㄠˋ釋義指愛莉莎莎突然抱住你。例句昨天我夢到知恩突抱，醒來就夢遺了。--,
PTT,[問卦]愛莉莎莎是日本的福原愛吧？,https://www.ptt.cc/bbs/Gossiping/M.1614788862.A.59D.html,2021-03-04 00:27:40,,剛好想到福原愛他的桌球實力地位還有代言許多產品猶如台灣的愛莉莎莎一樣如出一轍且非常相似難道愛莉莎莎是台灣的福原愛嗎如何？-----SentfromJPTTonmySamsungSM-N960F.--,
PTT,[問卦] 福原愛有比愛莉莎莎美貌嗎?,https://www.ptt.cc/bbs/Gossiping/M.1614788026.A.732.html,2021-03-04 00:13:44,,愛莉莎莎-台灣IU-第一美女最近話題炒很大的日本國民球星福原愛兩個誰比較美貌呢?有沒有八卦?--,
PTT,[問卦] 名字有愛的最正的是誰? 網友:愛莉莎莎,https://www.ptt.cc/bbs/Gossiping/M.1614791551.A.C53.html,2021-03-04 01:12:27,,名字有愛的女神很多尤其以愛莉莎莎為首其次是福原愛最可惜的是早死早超生的飯島愛有愛的女神最正的是不是愛莉莎莎有沒有卦-----你別忘了南京大屠殺,
PTT,[問卦] 愛莉莎莎也劈腿不就扯平了？,https://www.ptt.cc/bbs/Gossiping/M.1614804968.A.11F.html,2021-03-04 04:56:06,,日本愛愛子跑回去跟朋友過夜還住旅館剛好我們也有一個愛愛子愛莉莎莎愛莉莎莎與三原愛莉莎莎只要劈腿的話相信日本人一定很痛苦重點來了愛莉莎莎究竟要跟誰曖昧呢？嘻嘻--,5
PTT,[問卦] 江宏傑改找愛莉莎莎有搞頭嗎,https://www.ptt.cc/bbs/Gossiping/M.1614834984.A.2C4.html,2021-03-04 13:16:22,,各位八卦鄉民午安今天江的頭頂根台股一樣綠光罩頂不如就趁機換照台版小愛的愛莉莎莎這樣有搞頭班？--,6
PTT,[問卦] 愛莉莎莎去打桌球會紅嗎？,https://www.ptt.cc/bbs/Gossiping/M.1614853853.A.32E.html,2021-03-04 18:30:51,,餓死抬頭八卦板yt女神愛莉莎莎無所不能還會身體製造手工皂如果愛莉莎莎跨足體育界能在桌球界殺出重圍享譽國際嗎？--,
PTT,[問卦] 「捧げよ」の愛莉莎莎是奉獻型台女嗎,https://www.ptt.cc/bbs/Gossiping/M.1614844919.A.BA1.html,2021-03-04 16:01:55,,"中文:莎莎給油日文:「捧げよ！」在日文指的是""奉獻吧""的意思而台灣莎莎粉絲給愛莉莎莎又稱莎莎給油是不是代表愛莉莎莎是個奉獻型台女有沒有卦-----",
PTT,[問卦] 是不是證明愛莉莎莎比福原愛好太多了,https://www.ptt.cc/bbs/Gossiping/M.1614850946.A.FF3.html,2021-03-04 17:42:24,,1外表福原愛普妹大餅臉禢鼻愛莉莎莎甜美性感清純可愛有智慧2感情專一愛莉莎莎看就是個專一的人不會像福原愛外遇劈腿，噁心3學歷莎莎愛莉莎莎本身是清華大學人文社會學士，還曾到英國斯特拉斯克萊德大學（Strathclyde）讀行銷碩士，在去英國留學之前，她就已經開始在台灣當家教，多益成績是金色證書、有900多分，雅思成績則是7.5福原愛畢業於日本青森山田高校，曾就讀於早稻田大學體育科但輟學。以上種種是不是證明愛莉莎莎比福原愛好太多了--,
PTT,[問卦] 交大Joeman vs 清大愛莉莎莎 梅竹賽誰贏?,https://www.ptt.cc/bbs/Gossiping/M.1614918332.A.192.html,2021-03-05 12:25:29,,安安又到了梅竹賽的季節清大vs交大如果搬到youtuber那交大代表是Joeman清大代表是愛莉莎莎如果梅竹賽youtuber算一點那交大贏還是清大贏?--,9
PTT,[問卦] 台灣IU愛莉莎莎去做疫苗開箱，會想看嗎?,https://www.ptt.cc/bbs/Gossiping/M.1614926888.A.8A3.html,2021-03-05 14:48:06,,安安大家豪我城武喇愛莉莎莎可以說是台灣IU最近因為生技問題蠻紅的如果他現在也來順便做一下台灣買的疫苗開箱打過之後來說感想大家會想看嗎有沒有八卦--,
PTT,[問卦] 進擊的巨人是愛莉莎莎粉嗎?,https://www.ptt.cc/bbs/Gossiping/M.1614930264.A.D71.html,2021-03-05 15:44:20,,歌曲:心臓を捧げよ！歌手:LinkedHorizon動畫:進擊的巨人第二季莎莎給油莎莎給油耳熟能響的曲風跟詞愛莉莎莎是不是紅到日本了有沒有進擊的巨人是莎粉的卦-----,
PTT,[問卦] 一人一推，喚愛莉莎莎早點回來,https://www.ptt.cc/bbs/Gossiping/M.1614932290.A.607.html,2021-03-05 16:18:06,,愛莉莎莎啊，妳已經快一個月沒有新片了，我們等到花兒都謝了，請妳快回來好嗎？沒有了妳，我們天天茶不思，飯不想，曾經好吃的大麥克也索然無味，不知道妳在螢幕的另一端過得好嗎？莎兒，回來吧，我們不會再黑妳是素利柏了，你永遠是我們的IU，我們的坂井泉水，我們的艾瑪華森，期望妳再次出現在YouTube上，帶給我們歡樂。以下開放一人一推真情喊話，喚愛莉莎莎回來-----SentfromJPTTonmySamsungSM-G9730.--→摘自《女神進化史》--,
PTT,Re: [新聞] 【獨家/網紅大戰】愛莉莎莎粉的反擊 台大,https://www.ptt.cc/bbs/Gossiping/M.1614571798.A.BCE.html,2021-03-01 12:09:53,,就算鄉民女神愛莉莎莎再善良莎粉們也受不了女神被種種的無情對待如今莎莎心痛不發片了莎粉也要爆動了這樣百萬大軍將直取烏巢休矣-----超正莎莎,1
PTT,Re: [新聞] 戰愛莉莎莎慘爆 台大醫蒼藍鴿遭檢舉營利,https://www.ptt.cc/bbs/Gossiping/M.1614575944.A.953.html,2021-03-01 13:19:02,,之前大鴿上過館長節目相信政府不敢對他怎樣啦況且大鴿也不是做啥傷天害理的事如果醫師出來衛教要被綁手綁腳那民眾被網紅神棍騙根本是剛好而已換言之萬一真的懲處反而會促長莎莎們的孳生光這民怨政府就不敢承擔再者之前就說過萬一大鴿真的被台大醫院搞悲劇英雄形象粉絲至少再漲10萬莎莎只會繼續掉粉那就真的可能小玉化了粉絲害主子的案例又不是沒有去年才一個市長被罷掉一個自帶流量的醫師根本各大私立醫院搶著收畢竟業績很重要(講業績怪怪?)就算大鴿還只是住院醫師無法獨立門診但有人氣總是好的從住院醫師時期就累積粉絲以後升上主治就門庭若市啊這叫超前部屬這兩個人的組合還蠻鮮的兩個都是學生時代父母口中[別人家的小孩]只是一個要效法一個要遠離根本不同世界最後竟然湊一起----法條是一回事執法機關要怎麼解讀法條那是另一回事不然我打這篇幹嘛XD,1
PTT,[新聞] 戰愛莉莎莎慘爆 台大醫蒼藍鴿遭檢舉營利 ,https://www.ptt.cc/bbs/Gossiping/M.1614573460.A.9AD.html,2021-03-01 12:37:38,,1.媒體來源:中時2.記者署名:11:172021/03/01中時新聞網莊楚雯3.完整新聞標題:戰愛莉莎莎慘爆台大醫蒼藍鴿遭檢舉營利院方回應了4.完整新聞內文:愛莉莎莎被醫界砲轟引用資訊不當後，出面道歉並將影片下架，然而粉絲仍為他抱不平，寫信向台大醫院檢舉蒼藍鴿，身為公務員還營利。(翻攝自蒼藍鴿IG)百萬YouTuber愛莉莎莎去年底拍攝「肝膽排石法」影片，被台大醫師蒼藍鴿打臉排出的只是皂化石、不是結石，之後兩人隔空交火，愛莉莎莎並因此遭醫護圍剿，之後不僅公開道歉並將影片下架，但日前Dcard突然出現指控蒼藍鴿身為公務員還藉由YouTube開啟廣告分潤、經營商業頻道，並附上台大醫院接獲檢舉後的回文，台大醫院今證實，全案已進入調查。愛莉莎莎遭醫護圍剿道歉後，有粉絲想幫她反擊，向台大醫院檢舉台大住院醫師蒼藍鴿身為公務員還開設YouTube頻道營利。（圖／取材自愛莉莎莎Instagram）蒼藍鴿吳其穎以台大住院醫生的身分開設YouTube頻道、臉書粉專「蒼藍鴿的醫學天地」，發佈超過260部有關於醫學知識的影片，YouTube訂閱人數更在愛莉莎莎事件後暴衝到49.1萬人，除經營YouTube有分潤外，蒼藍鴿也接業配，推薦健康好物，並為保健品牌打廣告，輸入專屬折扣碼就會有9折優惠。在和愛莉莎莎交火後，蒼藍鴿疑似被愛莉莎莎粉絲盯上，2月26日在Dcard上出現「蒼藍鴿(台大住院醫生吳其穎)恐怕會被撤職」的PO文，指蒼藍鴿違反公務員規定，長期在YouTube經營商業頻道營利，已向台大醫院檢舉。並舉前台大感染科醫師林氏璧為例子，指其就是因為經營日本旅遊部落格營利，依違反《公務員服務法》遭到記過。台大醫院今天表示，確實有收到民眾檢舉吳其穎涉嫌利用YouTube營利，目前已展開調查，但院方強調，台大醫師有些是公務員有些不是，因公務員名額有限，住院醫院都不是公務員，即使升上主治醫師，有些也沒有公務員身分，吳其穎目前還是住院醫師，因此沒有公務員不得兼職或從事商業行為的問題，目前初步認定未違法。但不具名台大醫師表示，不論是否具公務員身分，台大醫師都是廣義的公務員，根據行政院人事行政局96年4月13日所做的第0960008394號書函，即使是約聘僱人員也適用《公務員服務法》，業外不得有商業或營利行為，前台大感染科醫師林氏璧就是因為經營旅遊社群網站接受業配、分潤，遭到懲戒，後來離開台大，蒼藍鴿（吳其穎）其實也是類似情形。《中時新聞網》已透過臉書私訊蒼藍鴿，目前尚未獲得回應。圖為蒼藍鴿的簡介欄中以推薦好物，輸入折扣碼有優惠的方式放置廣告。(翻攝自ApplePodcasts)文章來源：dcard#愛莉莎莎#蒼藍鴿#台大醫院#公務員#營利5.完整新聞連結(或短網址):6.備註:--,80
PTT,Re: [新聞] 【獨家/網紅大戰】愛莉莎莎粉的反擊 台大,https://www.ptt.cc/bbs/Gossiping/M.1614569970.A.44F.html,2021-03-01 11:39:28,,:目前公務員兼職的規定都傾向放寬只要兼職的內容不要跟自己所負責的公務內容有實質關聯影響力有跟單位主官報備，通常都會是例外允許例如公職醫生的話不要自己私下去別的醫院兼職開刀看診上電視或是出書分享自己的醫學知識我認為這不至於違反公務員兼職的規定公務員兼職的規定是擔心公務員利用職務之便操控控制某特定行業的營運狀況而讓自己獲利例如公務員承辦土木工程的驗收結果跑去某公司擔任顧問兼職當門神雖然沒有刻意去操縱得標但該公務員擔任顧問一職總是對該公司對於招標驗收有利這就絕對禁止公務員兼職的項目之一了蒼蘭鴿被熱心民眾檢舉最後應該是沒有太大的問題頂多補個報備程序院方同意即可--,1
PTT,Re: [新聞] 戰愛莉莎莎慘爆 台大醫蒼藍鴿遭檢舉營利,https://www.ptt.cc/bbs/Gossiping/M.1614577644.A.68F.html,2021-03-01 13:47:19,,銓敘部：公立住院醫師是「公務員」不適用勞基法部落客「林氏璧」證實為台大公職醫師！經營部落格被記過台灣標準情、理、法社會之前林氏璧經營部落格就被被記過所以除非有修法不然蒼藍鴿很明顯知法犯法這種不該等人去檢舉而是台大醫院要主動處理跟那個鬼排石法政府醫界早就該處理不是等到一個文組網紅嗆醫界才出手--別以為素利伯有騎士團蒼藍鴿沒有,6
PTT,[問卦] 震驚！！PTT要開設  愛莉莎莎板了？,https://www.ptt.cc/bbs/Gossiping/M.1614590871.A.924.html,2021-03-01 17:27:48,,剛剛發現有人在聯署新板文章代碼(AID):[ptt.cc][申請新板]izsasa││文章網址:沒想到我們最俏皮可愛的愛莉莎莎也要有專屬自己的看板了以後可以到專板討論izsasa了！只不過我看票數還差了那麼一些些八友們能夠幫忙投個贊成票嗎？讓我們這些十年izsasa粉能夠有專板可以討論！有沒有ptt要開izsasa板的八卦？----可以友善點嗎？我很贊同你說的不管喜不喜歡讓我們這些十年鯊粉有個討論板不是很好嗎？雖然是事實但是還是謙虛點好打在板標即可艾莉傻傻只有一個哪來同性質看板,1
PTT,[問卦] 明明就是愛莉莎莎過太爽吧,https://www.ptt.cc/bbs/Gossiping/M.1614591409.A.5BF.html,2021-03-01 17:36:47,,是誰允許這些人每天不務正業拍些生活影片就可以爽在台北買房就是你們這些莎粉他拍些沒營養的，然後信一些旁門左道最後再跟日本人搞CCR莎粉們都是你們貢獻的一人一信請愛莉莎莎停止對醫生搞小動作--,
PTT,Re: [問卦] 震驚！！PTT要開設  愛莉莎莎板了？,https://www.ptt.cc/bbs/Gossiping/M.1614593926.A.BB1.html,2021-03-01 18:18:39,,"來爆個卦至從鋼鐵莎粉G軟被水桶後版主們為了G軟決定要幫身為莎粉的G軟成立專版大家可以看一下莎粉支持者很多都是版主----------支持----------1.ubcs活動發起人且希望有專板供板友們討論2.a741085我們都是其中的一份子3.girl55665566支持申請理由唯一支持izsasa4.OGCOGCOGCOGC支持申請理由我喜歡愛莉莎莎5.bruce511239台灣IUa.k.a坂井泉水怎麼可以沒專版!6.KDGC希望有個能專心看愛莉莎莎文的地方7.HsiangMing台灣IU愛莉莎莎要有專板8.GhostFather支持9.redDest我愛愛莉莎莎10.zhtw十年愛裡傻傻粉支持建立偶像專板11.BlueBird5566台灣iu當然支持成立專版後，新聞記者也會開始進駐到時莎莎會有更多的新聞可報八卦版莎莎的新聞也會變多而且就算問卦有專版的問題莎黑真的以為這樣就完全不能問卦嗎如果問卦的主角不是愛莉莎莎那也不能視為專版處理例如阪井泉水像台灣愛莉莎莎嗎?主體詞問卦的是阪井泉水並不是在問愛莉莎莎例如問卦只打莎莎根本沒法判是哪個莎莎（食尚玩家）成立專版只對莎莎有幫助但百萬莎粉如果生氣起來到時不只看到更多莎莎文還可能會有一連串的莎莎出征例如簽名檔都放莎莎的照片莎莎只會越來越紅而己而上面那些莎粉支持者名單就是最佳助力這些莎粉真的努力的暗地裡幫莎莎-----你真傻B耶~版主們是在幫莎莎紅,你真以為有專版就會滾出八卦?問卦只要不打愛莉莎莎全名,用沙或莎莎問卦都無法立足叫人滾,只會被莎粉投訴你以為版主有這麼多時間處理投訴嗎XD事情只會越鬧越大,得利的是誰?你想想吧用哪一條劣退?版主都莎粉怎劣退法?而且就算真的強硬劣退,莎粉會怎麼投書記者變新聞就不知了謝謝你為愛莉莎莎盡一份力量XD老娘看戲的,看台灣能多亂,就是要血流成河留島不留人莎粉黑莎兩派繼續內鬥吧XD哈哈~台灣人就是要這樣才有意思~給力點啊我們早買通了很多PTT帳號,就是要PTT自己內鬥",4
PTT,Re: [新聞] 戰愛莉莎莎慘爆 台大醫蒼藍鴿遭檢舉營利 ,https://www.ptt.cc/bbs/Gossiping/M.1614596462.A.590.html,2021-03-01 19:01:00,,調查又不會被怎樣..這些人真的很無聊醫師好辣的葉配更多好嗎?有些人還有繼續動刀的外科醫師咧人加人家艾莉莎莎都認錯了，伯粉真的吃飽沒事做--◤◣◢--,2
