Source,Title,Link,Date,Summary,Text,Like
PTT,[問卦] 木曜4超玩怎麼拍一日發言人？,https://www.ptt.cc/bbs/Gossiping/M.1605491966.A.10E.html,2020-11-16 09:59:24,,安安大家早木曜4超玩的一日系列到現在也上山下海各行各業都拍得差不多了從市長幕僚、檢察官、憲兵都很精彩一個單位的發言人也是非常重要的職務身為公關守門人事情一定很多很有趣如果今天阿公邰智源跟百祥要拍「一日發言人」大家覺得腳本要怎麼寫比較好？有什麼必要的橋段或工作內容？--,39
PTT,[新聞] 木曜4超玩有望上架電視頻道 麥卡貝綜合台,https://www.ptt.cc/bbs/Gossiping/M.1630113731.A.345.html,2021-08-28 09:22:07,,1.媒體來源:中央社2.記者署名:蘇思云3.完整新聞標題:木曜4超玩有望上架電視頻道麥卡貝綜合台獲申設4.完整新聞內文:（中央社記者蘇思云台北25日電）麥卡貝網路電視今天通過NCC許可，成功申設「麥卡貝綜合台」頻道，從網路擴大戰場到有線電視。NCC表示，希望頻道為廣電內容產製帶來良性競爭，增加民眾收視選擇的多樣性。三立電視轉投資的隨身遊戲，旗下麥卡貝網路電視在2013年開始播出節目，節目類型包括電玩、綜藝類型，知名節目包含藝人邰智源等人主持的「木曜4超玩」，主要在各大社群平台與YouTube播出節目。NCC表示，今天審議許可隨身遊戲申設「麥卡貝綜合台」頻道，頻道以年輕族群為目標受眾，以自製的實境綜藝、電玩、音樂等類型節目為頻道特色。也就是說，麥卡貝綜合台取得衛廣執照後，可以在有線電視系統與中華電信MOD上播出。NCC指出，麥卡貝網路電視近年來網際網路平台政策調整，希望透過申設頻道，把創作能量帶到傳統電視平台，把作品帶給電視觀眾，並承諾會透過剪輯符合相關法規，承諾新播比率會超過40%、外購比率低於10%等。NCC表示，考量網路內容與廣電內容在目標受眾、呈現節奏及適用法規方面均有不同，審查過程中也提醒公司要落實節目分級規定、指定時段製播節目並符合「衛星頻道節目供應事業播送本國節目管理辦法」規定暨落實廣告置入、贊助、冠名贊助等自律規範。5.完整新聞連結(或短網址):6.備註:每天24小時輪播節目單元要變多品質還撐得住嗎?--,7
PTT,[問卦] 木曜4超玩拍一日全聯？,https://www.ptt.cc/bbs/Gossiping/M.1616676108.A.2D5.html,2021-03-25 20:41:46,,木曜4超玩的一日系列讓人看到社會各職業的辛勞與奉獻如果木曜今天拍一日全聯店員請問會怎樣？--,6
PTT,[新聞] 賠錢也要辦《木曜4超玩》圓夢砸千萬開唱,https://www.ptt.cc/bbs/Gossiping/M.1608470806.A.5F9.html,2020-12-20 21:26:37,,1.東森202012192.記者蕭雅玲／台北報導3.賠錢也要辦《木曜4超玩》圓夢砸千萬開唱3000門票銷售一空4.邰智源領軍主持的網路節目，今晚（19日）在台大體育館舉辦「木曜跨界演唱會」，3000張門票早已銷售一空。包含邰智源、KID（林柏昇）、坤達、主持群輪番開唱，更邀請美秀集團、大淵、呂士軒、陳芳語、Julia（吳卓源）等歌手共襄盛舉立刻炒熱氣氛，嗨爆全場。演唱會一開始主持群們一身白色系太空裝，從舞台中央高台現身，與主題曲的創作人阿達一起高唱同名主題曲《木曜四超玩》，立刻引來全場近3000木曜粉的尖叫聲；而後陳芳語接力登場，與邰智源、KID、坤達一起演唱共同創作的新歌《蛤歌》，又唱又跳的funk曲風加上Rap，立刻帶動全場的氣氛，大夥還在台上直笑說沒想到閒聊的「蛤」都可以寫成一首歌，多虧了陳芳語和製作人Jinbo的巧思，贏得滿堂喝采。演唱會的重頭戲莫過於是邰智源與美秀集團的合作，當邰智源一身黃金色調的和服高坐在舞台中央，手中撥打著日本傳統樂器輕津三味線現身，立刻掀起演唱會的高潮，結合日本演歌民謠與美秀集團的民謠搖滾，再從情色文學的靈感創作出的《哥哥呀哥哥》，讓現場的木曜粉絲直呼很可以啊。KID與阿部瑪利亞則是與頑童的大淵合作，把兩人的特色融入歌詞中的《山山》一出場同樣熱力不退，輕鬆搖擺的曲風迅速虜獲現場粉絲的心，而阿部瑪利亞隨後更是首唱自己前一天才發行的全新單曲《ShineShineTheNight》，黑色勁裝搭配粉紅中空、及膝亮靴，熱力四射的她同樣讓粉絲無法停止的一起熱舞。而演唱會的尾聲由坤達和吳卓源合作登場，他們一同創作了《Ireallywannaseeunow》，久違舞台的坤達依舊魅力十足，不過最意外的高潮莫過於是，當音樂聲一下全場瘋狂，坤達與音樂製作人Chrisflow熱力四射，經典舞蹈動作讓全場陷入回憶殺，坤達笑說這還真得謝謝吳卓源的製作人Chrisflow，因為他是ENERGY的頭號粉絲，更是坤達的鐵粉，在幾次討論中讓重現《放手》的可能性慢慢浮現，加上當年原曲的編舞老師剛好從日本回來，就順水推舟的讓坤達點頭在演唱會上重唱這首歌，果真成為今晚的最大爆點之一。《木曜4超玩》大手筆砸千萬在台大體育館開演唱會，，另還有服裝等製作費用，，卻也圓了主持群們開演唱會的夢想。5.6.備註。--,10
PTT,[問卦] 木曜4超玩vs 綜藝玩很大  都幾,https://www.ptt.cc/bbs/Gossiping/M.1613200961.A.18D.html,2021-02-13 15:22:39,,木耀：邰照明溫妮泱泱阿部瑪麗亞陳百祥坤達玩很大：憲哥其他藝人KID兩邊都有一邊主打玩遊戲一邊主打一日系列大家比較喜歡看哪一個--,11
