Source,Title,Link,Date,Summary,Text,Like
PTT,Re: [問卦] cheap是歷史最頂的嗎？,https://www.ptt.cc/bbs/Gossiping/M.1633089688.A.D2F.html,2021-10-01 20:01:16,,cheap是講得生動，他是有用心找專屬美術設計人員幫忙做影片，所以可接受度蠻高的，自己也讀過很多書，但是畢竟非本科出身，內容偏向敘述性，比較缺少分析類作品。要說歷史的話，我還可以推薦幾個不亞於cheap的作者，算是各擅勝場，cheap找設計師作圖這個用心其他人比較少。第一個是史大郎，他使用影視截圖，地圖跟光榮插畫來做畫面設計，但他似乎是歷史學系出身，會看很多資料交叉驗證說明，然後會有很多主觀分析觀點，但是又能旁徵博引各種參考資料，不是隨便亂扯。講述範圍主要以中國歷史為主，日本歷史為輔。(這樣才有光榮插圖可用？)第二個是信息素，信息素是結合地理地圖來分析歷史事件，尤其是著重於戰爭歷史，其考據之仔細與用心，無人能出其右，尤其是是二戰歷史，根本就像是玩鋼鐵雄獅，歐陸風雲這種等級遊戲一樣。主要歐洲與中國的戰爭歷史為主。另外，元滅宋之戰，蒙古帝國遠征，宋遼之戰，元滅金之戰，元末起義的戰史都非常非常精彩第三個是歷史面面觀，這個缺點是美術設計比較差一點，主要重複影視作品的內容，另外早期還用電腦合成聲音，不過優點是可以當成podcast來聽，主要都在說中國歷史。第四個瑞森老哥，其實嚴格來說他是比較像是綜合說書型的頻道，歷史只是他提的其中一個主題而已，但是他的歷史故事都是說一些很有趣的典故並且五花八門，主要以西方歷史為主，美術設計生動活潑原創，不亞於cheap。第五個是史圖館，這個是以地圖出發介紹歷史地圖的演變，而且不僅僅是中國，而是世界任何歷史都會介紹，對於地圖歷史的考究沒有頻道可以超過-----SentfromJPTTonmyRealmeRMX2144.--,90
PTT,[問卦] Cheap其實可以算圖文網紅了吧,https://www.ptt.cc/bbs/Gossiping/M.1637922234.A.C39.html,2021-11-26 18:23:52,,歷史系YoutuberCheap幾乎算是台灣講歷史最頂的Youtuber雖然在八卦板有點小黑因為他偏綠但每部影片的質感還是都很高業配也完全不反感不過除了內容之外他每次影片的圖我都覺得超可愛的不是那種從圖庫跟網路上抓的都是跟內容相互配合的而且一部影片的圖片真的超多我沒印象他有沒有提過這些圖都是誰畫的是他自己畫的嗎？這個圖文水平幾乎屌打一堆圖文網紅了吧有沒有Cheap的圖的八卦？--原來有說過插畫來源喔不過也是因為他影片產量真的太高了一直翻舊影片看都還沒看完所以沒注意到有解釋過,55
PTT,[問卦] Cheap講話的語調是不是很特別?,https://www.ptt.cc/bbs/Gossiping/M.1631635582.A.D58.html,2021-09-15 00:06:20,,我拿Cheap的影片給我大陸朋友看都說這個人講話的語調非常特別注意不是腔調，是語調幾乎都是一句話從頭開始起音比較高，然後越講越低直到下一句話才又起個高音，然後越講越低，不斷loop有人也那麼覺得的嗎?--,1
PTT,Re: [問卦] cheap是歷史講古最頂的嗎？,https://www.ptt.cc/bbs/Gossiping/M.1633088491.A.E3A.html,2021-10-01 19:41:29,,他有一集主題是中國跟美國誰在國際舞台上比較霸道下的結論是中國比較霸道原因是因為美國有國會監督，中國沒有人監督我不知道原來美國國會還會替其他國家著想真的很有深度--,10
PTT,Re: [問卦] cheap是歷史最頂的嗎？,https://www.ptt.cc/bbs/Gossiping/M.1633087362.A.C4C.html,2021-10-01 19:22:40,,原來寫的是歷史系後來修改成歷史學者越改越不對勁==我寫個分級給你參考1.歷史盲：對歷史概念全無2.國高中歷史課有稍微聽一下：大概知道從前發生過哪些大事，但是不是很清楚，也不想搞清楚；多數人的屬於這個層級3.歷史宅：對特定類型的歷史事實感興趣並深入研究，比如三國史宅、軍事史宅等，對該領域以外的歷史基本上沒有概念4.歷史普及愛好者：對歷史甚至歷史學感興趣，也讀過不少歷史書，會自己查資料，不過沒有受過更專業的訓練；多數歷史相關ytr屬於這邊，當然不排除他們是為了觀眾方便沒有講更深的東西5.認真的歷史系學生：在大學接受較多的歷史學訓練，對各種理論有一定的了解，但尚未擁有獨立進行和完成歷史學研究的能力；從這層級開始進入歷史學的範圍，尚未畢業的歷史所碩士生多數也屬於這裡6.歷史學研究者：在碩班乃至博班接受完整的歷史學訓練，能在自己擅長的領域獨立完成學術研究，但尚未取得重大的學術成果；這層開始可以稱為學者，簡單的說就是踏入學界了7.大佬：對學術界有重大貢獻，反正就是這行的頂尖人士以上純屬個人分類方式其實若要細分還可以分個地方文史工作者出來但是很麻煩而且可能會戰起來還是算了==--,2
PTT,Re: [問卦] cheap是歷史講古最頂的嗎？,https://www.ptt.cc/bbs/Gossiping/M.1633088113.A.A24.html,2021-10-01 19:35:11,,"歷史頻道當然要推李天豪阿有深度有內容還不用看葉配連最近的""時事討論""單元都能以古喻今不帶立場要不然也可以看產量很少的""信息素""圖片講解標註得清清楚楚以前看二戰史書地理觀念薄弱都不太懂地理位置現在人家都幫你找出圖對照的好好的我是覺得看這些頻道最開心無葉配有內容何必看一些工商又帶立場的歷史頻道呢?--李天豪有日俄戰爭系列信息素的西線閃擊戰系列我都喜歡cheap你有推薦的嗎?我也是之前也會看痾....",6
PTT,Re: [問卦] cheap是歷史講古最頂的嗎？,https://www.ptt.cc/bbs/Gossiping/M.1633090451.A.F13.html,2021-10-01 20:14:09,,在歷史講解影片的話，歐美的Youbute影片質感還是好非常多。TheGreatWar主要是講一戰，不過現在也包含戰間期跟二戰了。KingsandGeneralsBazBattles專注在講戰役的歷史影片，裡面的動畫真的非常細緻。Invicta另一個我也很喜歡的歷史頻道。如果英聽能力好的又對歷史有興趣，很推薦上面幾個頻道。也是希望台灣講歷史的可以像上面那些頻道一樣，講得又好影片又精緻。--哎唷，沒被推播過。收藏起來感謝。,1
PTT,[問卦] cheap是歷史最頂的嗎？,https://www.ptt.cc/bbs/Gossiping/M.1633085244.A.1E3.html,2021-10-01 18:47:22,,最近常上網看cheap說書發現懂歷史根本超方便業配的任何人、事、物，都有它的故事背景，透過適度的編撰，歷史影片最後搭配相關產品業配，無違和感。而且可以做的單元範圍超廣，永遠不怕沒題材。能把歷史講得淋漓盡致，cheap算是之光了吧？--沒錯連立可白都能業配我服了有時候片尾的業配有驚喜感搭配一些ptt梗就是好吸收哪需要藏什麼我只是一時不知道該怎麼稱呼而已不是歷史系，那就歷史說書人吧別想太多,38
PTT,Re: [問卦] cheap是歷史講古最頂的嗎？,https://www.ptt.cc/bbs/Gossiping/M.1633091144.A.3B7.html,2021-10-01 20:25:42,,如果是日本戰國粉的話可以看權兵衛這個頻道訂閱數還很少，但作者非常用心不管是敘事的口條或是內容的考據都很仔細，故事也都搭配圖片或地圖來呈現毛利系列/尼子系列/井伊系列都非常精彩是長篇小說式的，介紹一個家族的興亡再來是日本的youtuberYUKIMURACHANNEL因為我聽不懂日文，所以只能用圖像來猜測故事同樣是大量的歷史圖片+地圖+強大的BGM主要重點放在解說日本戰國時期各重大戰役一集通常都40~60分鐘，甚至還有90分鐘的如果是日本戰國粉，那千萬不要錯過這兩個頻道--,1
PTT,Re: [問卦] cheap是歷史講古最頂的嗎？,https://www.ptt.cc/bbs/Gossiping/M.1633093044.A.F2F.html,2021-10-01 20:57:20,,如果真的要比較的話最頂肯定不是的cheap頻道有很多優點比如說廢話很少講重點循序漸進脈絡清楚這可能跟他的語文背景有關但說到底還是個自媒體不過抨擊自媒體不中立這件事其實滿好笑的自媒體就是挾帶私貨來賺你的流量的你想上課或覺得不對你的味那就關掉不要看阿認真一點你也能夠找到很多立場完全相反的互相比較阿從我個人觀點來說cheap的內容產出幾個小小小小的問題是1.沒有很好的做到田野調查雖然說這就是個給小白看的歷史科普但對於稍微有深入了解一點的觀眾就會看的出來這其實只是一家之言尤其是扯到近代史的時候2.對於史實的評價未能區分個人觀點與事實很多他講的歷史事件發生是發生了也沒有講錯但最後的結語和評價卻會直接偷偷塞入整個故事內讓cheap個人的主觀意見變相的客觀輸出就如我上述所說的挾帶私貨販售本身沒什麼問題但問題是會有很多的不動腦觀眾進而輕易的被拉進他的史觀世界像這個問題最嚴重的就是台灣吧其他什麼影像品質方面的沒什麼好講的就不提了總而言之是個優秀的科普頻道但真的想學到點什麼東西的話肯定是不夠且容易走歪的--大哥你是有什麼閱讀障礙我沒說有問題啊,5
PTT,Re: [問卦] cheap是歷史最頂的嗎？,https://www.ptt.cc/bbs/Gossiping/M.1633094387.A.F40.html,2021-10-01 21:19:43,,cheap不到最頂啦我這裡不說優點只說缺點有些文案寫得太粗略口條感覺也不太好不過這些也是很多知識類台灣YouTuber的硬傷看過中國頻道的都知道比如講波蘭跟哈布斯堡那幾集看完後印象真的不深而且不知道是圖片轉場的關係還甚麼的感覺講話節奏慢慢的同樣是台灣講歷史的YouTuber應該是李天豪的文案比較有噴吧只是沒有包裝然後政治立場會讓鄉民有點受不了ㄅ而且歷史頻道要看哪些方面最頂吧硬核類最頂：史圖館益達諾夫斯基信息素娛樂類最頂：萌蛋人（中國板oversimplified口條類最頂：袁騰飛-----SentfromJPTTonmyAsusASUS_I01WD.--吃雞教父|史塔克姊妹守護者|屠山者|真正的騎士桑鐸‧Fucking‧狗幹--價值不夠而已沒偏台灣價值不夠你去看看蔣介石沒來台那集真的最頂啊他能沒看稿在一堆人面前講歷史,9
PTT,Re: [問卦] cheap是歷史講古最頂的嗎？,https://www.ptt.cc/bbs/Gossiping/M.1633096358.A.3D7.html,2021-10-01 21:52:35,,一開始覺得不錯後來就還好而且我發現這個人怪怪的常爆氣對他影片有意見他就狂噴不然還會貼到自己FB噴給大家看上次看他跟大奶但不紅的網紅嘴砲吵訂閱數就覺得這人有點自大記得還看到他說自己是知識型YT==老實講他講的都淺淺的就加強版說書人YT還不到知識型YT等級--,6
PTT,Re: [問卦] cheap是歷史講古最頂的嗎？,https://www.ptt.cc/bbs/Gossiping/M.1633094763.A.8DE.html,2021-10-01 21:26:00,,cheap的好處是講的東西有所本就是K完書再拿出來講有時候還會翻案但我最近不爽看他的地方是影片真正的內容只有前半段後半段是工商+賣書我不排斥工商但內容佔一半明顯就有灌水的嫌疑說的二戰歷史我就蠻喜歡Matt撇開64炎上但他一二戰資料真的有夠全完整到連國外書籍都在K一些超冷門歷史都有介紹而且塞了些迷音挺有趣的有興趣的朋友可以去追他的頻道話說他的防毒面具第二集還在嗎？-----SentfromJPTTonmyGooglePixel4a.--五月雨は露か涙か不如帰我が名をあげよ雲の上まで(五月細雨露還淚且寄吾名杜鵑翼翩然上雲霄)---劍豪將軍足利義輝（天文5年3月10日-永祿8年5月19日）--,2
PTT,[問卦] Cheap講塔綠班如何崛起是不是很無奈,https://www.ptt.cc/bbs/Gossiping/M.1634546468.A.0A3.html,2021-10-18 16:41:06,,Cheap是用世紀帝國講解歷史的Youtuber他看到一堆留言要求他講解塔綠班是如何崛起的我發現這部影片他的語氣越講越無奈不過想想他以前做的台灣歷史影片好像情有可原--,57
PTT,Re: [問卦] Cheap講塔綠班如何崛起是不是很無奈,https://www.ptt.cc/bbs/Gossiping/M.1634552498.A.3F6.html,2021-10-18 18:21:36,,因為按照歷史來看他一定會洞見民進黨遲早腐敗爛掉的命運國民黨再十年就沒了這時候可以說是擁有了絕對的權力不能台獨、也不想統一RCEP跟CPTPP搞得起來嗎台灣的經濟越來越靠大陸大家一定會開始浮躁但擁有了絕對的權力就可以為所欲為民意與我何干反正中國都會打過來趁我還是執政黨為何不及時行樂？--,3
PTT,[問卦] 瑞森老哥是不是屌打cheap,https://www.ptt.cc/bbs/Gossiping/M.1637552476.A.E53.html,2021-11-22 11:41:14,,有人聽過這個YouTube嗎？剛剛發現，這人主題有趣且不會參雜個人立場台派最愛的歷史YouTuber是不是敗陣了？絕對不是引戰，因為我不會回--Cheap講話音調陰陽怪氣頓點也怪我也聽不下，台灣youtube我推大雅工作室宇智波騙你畢竟台灣是嘲弄不得的,4
PTT,[問卦] cheap是不是鬼才,https://www.ptt.cc/bbs/Gossiping/M.1637234279.A.18E.html,2021-11-18 19:17:57,,最新影片業配一個蘇格蘭威士忌，直接把大不列顛的歷史簡單講了一遍，不像國高中歷史課本一樣死板，又講得清清楚楚而且影片還有很多小插圖，畫得都很契合主題，這可能是背後團隊的功勞Cheap這樣算鬼才嗎--,13
PTT,[問卦] 請問現在有cheap，會讓學測歷史科？,https://www.ptt.cc/bbs/Gossiping/M.1637415187.A.5BD.html,2021-11-20 21:33:05,,想到就很幹當初國文社會特別爛的二類，社會只有9級，總級分65就是可惡的歷史拖累，國文廢是我的錯，歷史爛是因為我的歷史老師很醜，想問，現在有cheap提升大家歷史的興趣！學測社會科能提升多少呢？？--SentfromnPTTonmyiPhone12--,10
PTT,[問卦] 有cheap跟高雄歷史哥網站的八卦嗎？,https://www.ptt.cc/bbs/Gossiping/M.1637428194.A.08C.html,2021-11-21 01:09:51,,如題一開始好像是高雄歷史哥發文，下面留言有人問說覺得cheap怎麼樣高雄歷史哥說他學術性不夠然後cheap開噴，嗆他政治網紅之類之後兩人有私聊雙方好像釋出善意結果現在高雄歷史哥直接在直播說cheap向他道歉然後cheap就在他FB嗆歷史哥斷章取義有沒有兩人PK的八卦？--,7
PTT,[問卦] cheap很厲害嗎,https://www.ptt.cc/bbs/Gossiping/M.1634734238.A.90F.html,2021-10-20 20:50:36,,大家女子女口是頁YouTube常常發歷史相關影片想問真的是很厲害嗎？大家都有在追嗎--,17
PTT,Re: [問卦] Cheap 做那些社會議題的影片怎麼沒了,https://www.ptt.cc/bbs/Gossiping/M.1605127428.A.3BB.html,2020-11-12 04:43:46,,現在人家忙著接業配發大財阿沒看到每個影片後面都會接上業配然後點閱率就平均10幾萬左右如果沒業配點擊率就高一些到50萬不過錢就少了一點最近沒在追就是後面放業配讓觀眾有被騙的感覺跟那個最近爆紅的我很閒一樣為了接業配品質都不管了這樣很不好-----SentfromJPTTonmySamsungSM-N9750.--,4
PTT,[問卦] cheap 是中產中的勝利組嗎,https://www.ptt.cc/bbs/Gossiping/M.1605184780.A.E53.html,2020-11-12 20:39:38,,小康世家一生不愁吃穿異性緣屌打理科魔法回收士任任水準以上肩負覺青撥亂反正的氣魄又是名利雙收的YT堪稱台灣知男雖然不能跟三代自耕農相比算是中產中的勝利組嗎？--,8
PTT,[問卦] 欸 cheap ，看到說用世紀帝國解說我才看,https://www.ptt.cc/bbs/Gossiping/M.1609247647.A.8F1.html,2020-12-29 21:14:05,,"標題明著說要用世紀帝國解說中國打的下台灣嗎？結果世紀帝國解說就幾個炮塔。然後把你的論點再說ㄧ遍。看之前我還以為世紀帝國什麼時候有空軍了。結果還是用19世紀的登陸方法。還好後面回到了業配書籍。那本書到底好不好看,有沒有卦？--",8
PTT,[問卦] cheap出席台北市跨年晚會?,https://www.ptt.cc/bbs/Gossiping/M.1609435123.A.C13.html,2021-01-01 01:18:41,,如題今天很冷在家看電視轉播台北市跨年活動發現鏡頭有拍到cheap哥出現就是在水管用世紀帝國講歷史的優吐伯附上照片--水管講歷史的cheap阿cheap的前女友是趙岱新,4
PTT,[問卦] cheap打世紀帝國會缺電嗎,https://www.ptt.cc/bbs/Gossiping/M.1621578234.A.17A.html,2021-05-21 14:23:52,,如標題專業歷史遊戲ytubercheap在油管有很多用世紀帝國做的歷史片不過他的臉書，大部分都在講政治發覺這一週他狂罵華航機師不守規矩可是感覺停電都沒有影響到他cheap家裡是不是A組有八卦嗎？--做了禮拜，漲紅的臉色漸漸復了原，旁人便又問道，“，你當真會魔法嗎？”看著問她的人，顯出不屑置辯的神氣。他們便接著說道，“你怎的連半個Master也撈不到呢？”立刻顯出頹唐不安模樣，臉上籠上了一層灰色，嘴裡說些話；這回可是全是“討厭戰爭”“為了”之類，一些不懂了。在這時候，眾人也都哄笑起來：教堂內外充滿了快活的空氣。--沒有喔，人家是日文系的另外蔡煌瑯好像是經濟系的,7
PTT,[問卦] cheap世紀算強嗎,https://www.ptt.cc/bbs/Gossiping/M.1616985558.A.791.html,2021-03-29 10:39:16,,在看cheap打世紀還是幾年前的影片手速還滿快的偷豬偷羊圍墻現在根本沒人在實況直播打世紀吧經典的遊戲不過好像要出四代----SentfromonmyASUS_Z01RD--,3
PTT,[問卦] 怎麼到處都看的到cheap頻道的塗鴉呀?,https://www.ptt.cc/bbs/Gossiping/M.1612436987.A.B4C.html,2021-02-04 19:09:45,,cheap的頻道大家都知道嘛說故事內容會搭配他們的塗鴉怎麼一段時間別人的頻道(像是LOL實況主猴哥)甚至其他廣告都看的到chea裡的塗鴉呀那是他自己畫的嗎?--,2
PTT,[問卦] Cheap是不是又要被台派出征了?,https://www.ptt.cc/bbs/Gossiping/M.1622443186.A.7E4.html,2021-05-31 14:39:44,,Cheap剛剛發了一篇文大致上就是在質疑當今聖上的疫苗政策附上一張圖然後下面正反兩面的留言就跑出來了想想上次Cheap稱讚侯和廷就被各路側翼粉專出征等等Cheap是不是要被側翼二度圍攻了?ofpurity(?)要不要發表一下看法--,100
PTT,Re: [問卦] Cheap是不是又要被台派出征了?,https://www.ptt.cc/bbs/Gossiping/M.1622458717.A.1C5.html,2021-05-31 18:58:34,,"cheap加油雖然不影響你文章的意思，但還是提醒一下疫苗是vaccine,解藥是cure你想說的應該是疫苗是解答，用字還是要小心一下，免得被無事生非從世紀帝國時代就開始看你頻道了，加油～-----SentfromJPTTonmyGooglePixel3.--",1
PTT,Re: [問卦] 有沒有大奶網紅嗆cheap的八卦,https://www.ptt.cc/bbs/Gossiping/M.1624114854.A.CB4.html,2021-06-19 23:00:52,,嗆cheap的大奶網紅是誰？！臉書：新聞寫到：PTT表特板有名身材火辣的.....Q塔略懂琴棋書畫，並淺談詩書禮樂，過去，目前專注於品牌行銷，她曾接受《三立新聞》訪問，透露畢業後便對領導與教育有獨到的想法，一開始就遇到好老闆，同時也是一位好老師，二話不說就投身教職工作，身為的她興趣廣泛，喜歡彈琴、看書、畫畫，也喜歡打電動，因為她「」。無聊翻翻她的臉書舍我盃？！我只知道是世新創辦人名字再查查歷屆大學榜單蝦米！？如果是應屆的話猜她是再用世新關鍵字研究恩美麥天蠍座11/13...那生日應該是1989/11/13？！至於國文老師部分...從國一帶著你們到國三？！...原來先前是國中補習班的國文老師話說世新廣電畢業教國文算是跨領域囉？！--------------補充內容剛剛又在Queenta乃維ig查到一些資料桃園的大園國小、大園國中都是第一名獎狀好好棒棒據了解是桃園市立陽明高中然後世新大學廣電系可以說是小時了了大未必佳乃維與她媽line對話老媽臉書老爸臉書結論：Q塔乃維出奶打球（大家都好奇妳為何可打AZ)--,12
PTT,Re: [問卦] 有沒有大奶網紅嗆cheap的八卦,https://www.ptt.cc/bbs/Gossiping/M.1624110051.A.259.html,2021-06-19 21:40:49,,這位大奶網紅我是在2020年注意到的，她有以下特徵：一、外貌漂亮、身材姣好、家裡有錢二、小聰明、伶牙俐齒，但卻沒有深層思考三、家裡很寵，吃好穿好用好四、因為外在條件，有許多的「奶粉」簇擁五、從小到大過得極為順遂，導致不知天高地厚六、自詡戰神，但其實戰力很差，筆戰被打爆就耍賴或封鎖你七、毫無同理心，認為自己比他人高等，無法感受他人痛苦列完以上特徵，忽然驚覺她跟神鵰俠侶的郭芙超像的啊！郭芙也是外貌漂亮、身材姣好（練武的應該不胖吧）家裡除了有錢以外，老爸是北俠，老媽是丐幫幫主，外公是東邪＆桃花島主，她也是從小又寵又有大武小武兩個舔狗整天吹捧她，過得極為順遂沒人治得了她，婚後闖蕩江湖因為出言不遜被其他高手教訓。所以我跟朋友都戲稱她為郭芙，平常偶爾看看她臉書又講了什麼奇耙的言論，一個聰明人被綠營謊言騙得團團轉不自知，還用似是而非理論高談闊論，下面還有一群「大武小武」留言：「對對對，精闢精闢。」現在是文明時代而不是武力時代，用拳頭說話的時代你只要把對手打倒，勝負很容易能看出來，而筆戰則是將對手言論跟邏輯戳破，基本上勝負就分出來了，而郭芙厲害的是，根本不知道自己已經輸了，或是知道自己輸了就耍賴不認直接封鎖你。要怎麼樣才能自稱自己筆戰無敵，打遍天下無敵手？很簡單，只要把打贏自己的通通封鎖讓他不能講話就行了。有這種邏輯，難怪跟綠營的價值觀這麼天衣無縫......本來想找去年臉書打爆她的紀錄，結果已經被刪除了囧，只好附上IG私訊她糾正錯誤訊息的照片，最後一張後她就沒回我，而且把我封鎖了。講不贏就人身攻擊，像不像綠蟑螂講道理講不贏你，就罵你4%韓粉、華腦、中共同路人？最後再附上幾篇最近的奇葩言論，每次看都懷疑台灣真的有平行時空，怎麼感覺她跟我活在不同世界？--閒著也是閒著，臉書IG滑一滑看到有人發謠言，我習慣私訊或留言直接糾正。就叫她郭芙吧，好聽好叫又好記對不起，我錯惹……對吧，是不是像我說的，打不贏就「校正回歸」，這樣永遠天下無敵！去她粉專跟她聊政治啊，她超愛聊沒辦法，在陪民進黨坐牢不用上班啊,52
PTT,Re: [問卦] 有沒有大奶網紅嗆cheap的八卦,https://www.ptt.cc/bbs/Gossiping/M.1624128464.A.8C9.html,2021-06-20 02:47:42,,歷史不斷重複文革的時候紅衛兵把看不順眼的掃除後就開始內鬥了綠衛兵也只是在搶誰更有台灣價值而已這種時候看奶就好…--,4
PTT,Re: [問卦] 有沒有大奶網紅嗆cheap的八卦,https://www.ptt.cc/bbs/Gossiping/M.1624122408.A.B0A.html,2021-06-20 01:06:44,,應該有些人都有追蹤這位小姐的臉書或IG啦，是因為他的言論嗎？當然不是，因為有容乃大啊...她的臉書或IG發文，只要沒有奶的按讚數會掉很多，就算同一篇文章，裡面的照片也有這樣的差異。我是不知道CHEAP幹嘛跟她戰這個，兩個人的等級跟水準是不一樣的，CHEAP這樣去戰這個其實蠻不符合他的身價的。可能太閒沒事幹吧（太閒影片不會多做一點唷）不過原文下面的一些推文，可能要注意一下。因為以這位小姐的個性，如果去告起來，或許之後可能會看到很多人在PTT發道歉文了。各位周末好剛看到Cheap(知識型youtuber歷史大師世紀帝國實況主)的臉書PO出被大奶網紅嗆不紅其實我看Cheap也沒說甚麼不明白這網紅被打臉就要這麼生氣還嗆人品什麼的話說剛去看了這位的IG除了露奶好像也沒甚麼特別不過她IG要追蹤者才能留言有沒有八卦??------------------------------------------------------------補充:剛有鄉民私訊我說網紅很兇有錢真好啊....可以理直氣壯不是得理不饒人而是她爽就好QQ--可以教一下嗎QQ我手機看得到耶好像可以了?--,4
PTT,Re: [問卦] Cheap是不是又要被台派出征了?,https://www.ptt.cc/bbs/Gossiping/M.1622445629.A.BC8.html,2021-05-31 15:20:25,,如果十年後，你們在萬華龍山寺前看到一個落魄的遊民長得很像我，記得在碗裡丟個十塊錢.......回到正題..網紅欸有點社會責任好不好講真的疫情乾我屁事我的工作性質我早就自我隔離一年了我大可在家裡吃爆米花反正我錢照賺根本不受影響啊不是啊每天都有人死亡每天幾百個人確診國外答案都給你抄了疫苗才是解藥上海復星BNT這支全世界他媽最強的疫苗美帝領導人都打這支結果變成共匪分裝的垃圾疫苗你可以討厭阿共但不要不相信科學我多討厭阿共不用證明吧現在我只看到一群義和團自以為刀槍blue我能做什麼?用一點微薄小到不行的影響力希望政府回頭是岸我其實是一個感性的人看到每天這麼多同胞確診死去你不難過?記得十年後在龍山寺前看到一個很像我的遊民...請伸出援手...----,100
