Source,Title,Link,Date,Summary,Text,Like
PTT,[問卦] Cheap 做那些社會議題的影片怎麼沒了,https://www.ptt.cc/bbs/Gossiping/M.1605119493.A.AD2.html,2020-11-12 02:31:31,,應該已經有一年了這個炒房的人等於吸取大家辛苦創造出的實際價值的說法我覺得很好但看他後來的影片都是一些歷史的，不是社會與經濟了怎麽了，有卦嗎？不過話說回來，就算很多人知道，好像除了靠選舉也不能幹什麼因為［政府］——＞《法律》—＞［人民］--,8
PTT,[問卦] 嗆cheap的網紅vs獅子會大奶妹,https://www.ptt.cc/bbs/Gossiping/M.1624129800.A.682.html,2021-06-20 03:09:53,,"前陣子很紅的獅子會大奶妹vs世新廣電畢業挺過九妹,嗆cheap就刪留言,鎖文鄉民選誰???有八卦嗎?我覺得論EQ我覺得獅子贏--我婆予晞--",27
PTT,Re: [問卦] 有沒有大奶網紅嗆cheap的八卦,https://www.ptt.cc/bbs/Gossiping/M.1624127437.A.527.html,2021-06-20 02:30:35,,嗯吶乃維奶唯都提示那麼明顯惹還硬要跟她吵？你們也是很奇怪==安安靜靜看奶好爆？--蘿莉銘身不在高，米四就行，胸不在大，有型則靈，斯是蘿莉，為吾是侵。洋裝貓耳朵，小嘴大眼睛。短髮很俏麗，長髮也飄逸。可以給糖果，玩親親。無八卦之亂耳，無血拼之勞行。學校游泳室，公園小涼亭。吾自云：能萌就行--,2
PTT,[問卦] Cheap是歷史系賺最多的嗎？,https://www.ptt.cc/bbs/Gossiping/M.1629990000.A.2D9.html,2021-08-26 22:59:58,,歷史系畢業並沒有直接對應的工作，出了社會也只能找不相干的工作，因為文組沒有特別的專長，所以薪水相對較低Cheap應該是歷史類youtuber最紅的，收入絕對屌打一般員工，更何況Cheap的業配一大堆要說Cheap是歷史系畢業收入最多的應該不為過吧有沒有Cheap是不是歷史系畢業賺最多的八卦？--為什麼Hook賺比較多？我只記得之前她邀請莫采曦和亞當上節目，當時在談某位美國總統為什麼在美國的地位很高，結果Hook只說他帥不帥，實在有夠蠢,28
PTT,[問卦] 有沒有大奶網紅嗆cheap的八卦,https://www.ptt.cc/bbs/Gossiping/M.1624100698.A.26F.html,2021-06-19 19:04:53,,各位周末好剛看到Cheap(知識型youtuber歷史大師世紀帝國實況主)的臉書PO出被大奶網紅嗆不紅其實我看Cheap也沒說甚麼不明白這網紅被打臉就要這麼生氣還嗆人品什麼的話說剛去看了這位的IG除了露奶好像也沒甚麼特別不過她IG要追蹤者才能留言有沒有八卦??------------------------------------------------------------補充:剛有鄉民私訊我說網紅很兇有錢真好啊....可以理直氣壯不是得理不饒人而是她爽就好QQ--可以教一下嗎QQ我手機看得到耶好像可以了?,90
PTT,[問卦] 有沒有大奶網紅還想要蹭第二輪的八卦,https://www.ptt.cc/bbs/Gossiping/M.1624154120.A.71B.html,2021-06-20 09:55:18,,女口是頁目戶斤描述白勺阿宅的朋友剛剛傳給我一張圖這個網紅是不是發現Cheap的流量超級大於是繼續搞戰？有八卦嗎？前情提要--標題Re:[求助]女友想要被盛大的求婚現在女生不少本來就有嚴重的公主病噓au355:會說現在女生都公主病的人，先去看看眼科吧有人說都嗎?--,
PTT,[爆卦] 酸Cheap 最兇國文老師：我是天生焦點,https://www.ptt.cc/bbs/Gossiping/M.1624181866.A.FD4.html,2021-06-20 17:37:43,,昨日與歷史專家Youtuber筆戰後稍早在ig發表圖文內容：我是一個的人不主動引戰也不想要熱度的人不過我大概是我真的很困擾再重申一次啊有很少數沒禮貌的新朋友私訊我：「」我都不好意思說世新大學廣播電視電影系畢業最兇正妹有話題、點閱率流量高不僅新聞記者愛抄賺點閱率Q塔也憑著自己廣電專業跨領域教及以下新聞請看中國時報：最辣前國文老師穿這樣打AZ老司機一看照片全暴動鏡週刊：前「最凶國文老師」曬接種AZ照超辣穿搭網暴動：穿這樣去？ETtoday:最辣前國文老師曬「接種疫苗卡」網看照狂歪樓：穿這樣去！？三立新聞：台灣正妹演「史上最巨胸黃蓉」！老司機噴血讚：又大又正東森新聞：「最兇國文老師」打疫苗小背心包不住網全歪樓：穿這樣去？Nownews:「最兇國文老師」低胸打疫苗：全身發熱整排老司機歪樓自由時報：「最兇國文老師」曝施打AZ疫苗！畫面羞爆…網全歪樓：穿這樣嗎果然是世新廣電畢業的國文老師新聞界人脈好大家爭相報導至於粉絲跟酸民都關心醫療院所之非醫事人員(含集中檢疫所之非醫事人員)不過媒體記者有平衡報導Q塔說法（記者抄就好？）相對歷史專家Youtuber--,3
