Title,Link,Date,Summary
蕾菈走鐘獎突問「胸垂要隆乳嗎」挨轟！　呱吉：理解大家不喜歡的原因,https://www.ettoday.net/news/20211117/2126196.htm?from=pctaglist,2021-11-17 21:48,YouTuber蕾菈日前在第3屆走鐘獎上，突然脫口問全場創作者：「我到底要不要去隆乳？我覺得我的胸部太垂了。」此話一出，收看直播的網友狂刷一排問號，甚至被質疑「蕾菈頒獎是不是走鐘獎最大敗筆？」，對此，身為走鐘獎主辦人的網紅兼台北市議員呱吉（邱威傑）17日在臉書發聲，直言「能理解大家不喜歡這段發言的原因」。
一隻阿圓「走鐘獎發防疫品」2　呱吉砸700萬打造典禮：去年有小瑕疵,https://www.ettoday.net/news/20211113/2123204.htm?from=pctaglist,2021-11-13 18:39,YouTube頻道上班不要看今（13日）舉辦第3屆走鐘獎頒獎典禮，負責人呱吉（邱威傑）表示今年作品比以往多，角逐的作品有1500件，在評選花了非常多時間，最後選出34個獎項，透露這屆規模較往年盛大，花了700萬元打造典禮，「跟以前規模有差10倍左右，上一屆3、400萬左右，第一屆約3、40萬。」
罷昶二階錯假率達三成　呱吉嗆爆鍾小平：不過是政治圈三姓家奴,https://www.ettoday.net/news/20211112/2122754.htm?from=pctaglist,2021-11-12 21:12,罷免林昶佐二階段連署提交3.1萬份連署書，中選會今（12）日公布審查結果，不合格份數有9431分將近三成，引發綠營抨擊「作弊」。對此，無黨籍台北市議員「呱吉」邱威傑諷刺投入「罷昶」的台北市議員鍾小平，不過是政治圈的三姓家奴，要討的公到除了自己的政治路外有啥正當性。
20場公投意見發表會時程曝　連勝文談萊豬、呱吉VS黃士修辯核四,https://www.ettoday.net/news/20211105/2117049.htm?from=pctaglist,2021-11-05 09:16,4大公投12月18日登場，為此中選會自11月13日起至12月11日間各辦理5場意見發表會，總計20場，分別由華視、民視、中視、台視、公視等5家無線電視台進行轉播，並同步於中選會網站直播。
柯文哲「無視」監視器畫面曝光　網看完嗆爆呱吉：雙標打臉自己,https://www.ettoday.net/news/20211103/2115825.htm?from=pctaglist,2021-11-03 17:13,台北市長柯文哲為拚熊好券預算過關，上周赴議員辦公室爭取支持，但卻指控議員都躲起來了，此話一出另台北市議員「呱吉」、邱威傑勃然大怒，反嗆是柯文哲視而不見，揚言要調出監視器畫面還原。不過，網友看到畫面後猛酸呱吉，明明是電梯出口的「擦肩而過」，「這到底是有甚麼好吵的」。
柯文哲突襲議員辦公室　呱吉動怒捶桌：企圖製造「不願見面假象」,https://www.ettoday.net/news/20211028/2111273.htm?from=pctaglist,2021-10-28 12:25,台北市政府推出的「熊好券」因違背預算審查程序，5億預算墊付案被台北市議會暫擱，台北市長柯文哲27日中午拜會台北市議會新黨黨團，臨時決定結束後要拜訪其他台北市議員，但該筆預算最終仍因朝野議員無共識暫割。台北市議員「呱吉」邱威傑28日於議會動怒拍桌，直批市府沒有事先知會，而柯文哲也當場道歉「我們錯了。」
餐被打翻卻要付錢！呱吉超氣「太爛了吧」　下秒愧疚了：真是笑話,https://www.ettoday.net/news/20211023/2107775.htm?from=pctaglist,2021-10-23 14:35,邱威傑（呱吉）昨晚在臉書上發文，提到外送員因為打翻食物而自行取消訂單，然而他向平台申訴時，業者卻要他自行負擔餐點費用，「太爛了吧！」不過，他稍早又發文透露，今早一起床就得知朋友與外送平台公關均嘗試聯繫他，內心也不禁愧疚，其實他並不在意退款問題，只希望平台能將系統性的問題解決。
熊好券預算未審先抽　呱吉開炮柯文哲：情緒勒索算什麼卵蛋正義？,https://www.ettoday.net/news/20211013/2100510.htm?from=pctaglist,2021-10-13 17:25,台北市「熊好券」預算卡關，因此被迫延期至15日抽籤。對此，台北市議員呱吉邱威傑在臉書怒嗆，「X你豬排蛋堡，預算要經過正常民主審查程序，想要跳過程序，在媒體上跟市民和議會情緒勒索，算什麼卵蛋正義？再囉哩八唆三小？！搞到一堆政治白痴來靠杯。」
快訊／呱吉不再參選！她繼承衣缽　投入民進黨2022港湖區議員初選,https://www.ettoday.net/news/20211012/2099707.htm?from=pctaglist,2021-10-12 18:04,各政黨逐步布局2022大選。過去曾以社民黨籍參選2018台北市第五選區（中正、萬華）的無黨籍台北市議員邱威傑（呱吉）辦公室主任許菡芸，傳出投入民進黨港湖區議員的初選。對此，邱威傑12日在臉書證實此事，並表示自己一直說不會繼續參選，但一走了之好像沒給選民交代，有一個辦公室主任願意繼承衣缽，等於扛下他的這棒責任，讓他如釋重負，許菡芸一定可以做得比他更好。
喜劇圈回收龍龍！東區德聲援 …呱吉心疼：就算是Bitch，也是我們的,https://www.ettoday.net/news/20211008/2097236.htm?from=pctaglist,2021-10-08 16:47,龍龍（林千聿）日前控訴遭薩泰爾娛樂班底老K霸凌，沒想到，鄭家純（雞排妹）7日開直播爆氣表示對方後來聲稱「記錯了」，老K當初在炎上現場根本沒提到「前男友」3個字，氣得公司馬上跟她解約，而這一場將近6萬人收看的直播，也讓不少喜劇圈人發聲，語氣中透露「心疼龍龍」的氛圍，引起熱議。
才開嗆呱吉！龍龍遭爆「炎上找4寫手」：沒聲稱我的本是自己寫的,https://www.ettoday.net/news/20211003/2093134.htm?from=pctaglist,2021-10-03 17:04,脫口秀演員「龍龍」控訴被薩泰爾班底「老K」出言霸凌，之後又被呱吉（邱威傑）開直播暗指不好相處，風波延燒至今戰火依然猛烈。而她之前表示從正式登台至今，單口喜劇的稿子都是自己寫的，3日卻在回應中提到「沒聲稱我的本是自己寫的」，遭質疑雙重標準。
呱吉道歉龍龍了！「挖出1年前PO文」　點名老K霸凌：應該道歉,https://www.ettoday.net/news/20211001/2091737.htm?from=pctaglist,2021-10-01 15:24,脫口秀演員「龍龍」控訴被薩泰爾班底「老K」出言霸凌，也不滿被呱吉開直播貼上難相處的標籤，1日在臉書發文反擊，對此，呱吉留言道歉，PO出2020年她在《吐槽大會》後的發文，表示這些指控是經過觀察及她過去的發言，但強調認同老K發言不當，應該道歉，引起外界熱議。
龍龍暴怒開戰呱吉：噁不噁心！　「400字火力滿點」親揭被誣衊真相,https://www.ettoday.net/news/20211001/2091700.htm?from=pctaglist,2021-10-01 15:04,脫口秀演員「龍龍」控訴被薩泰爾班底「老K」出言霸凌，連薩泰爾老闆曾博恩也坦言管不動，呱吉（邱威傑）卻開直播提及她因為講話沒人理，憤而退出《吐槽大會》活動，對此，龍龍發文打臉，怒嗆呱吉直播內容令人反胃、刻意帶風向，「到底噁不噁心、扭不扭曲啊？」
驚爆「龍龍爆氣退群組」內幕！　呱吉酒後直播：我不知怎跟她相處,https://www.ettoday.net/news/20211001/2091301.htm?from=pctaglist,2021-10-01 09:12,無黨籍台北市議員呱吉（邱威傑）是網紅出身，昨（9月30日）深夜酒後直播時，針對龍龍指控遭到老K霸凌一事，發表個人看法，還爆料女方原本是《吐槽大會》的成員之一，最後卻因不滿群組無人理會她的留言而退出，他坦言：「我不知道怎麼跟她相處，這就是我真實的感受。」言論掀起熱議，也引來不少粉絲留言狂勸「別再說了」。
陳柏惟台語問政掀論戰　呱吉「一句話力挺」！網怒嗆：這叫硬拗,https://www.ettoday.net/news/20210928/2089329.htm?from=pctaglist,2021-09-28 18:41,台灣基進黨立委陳柏惟昨（27）日於立院，要求全程以台語質詢國防部長邱國正，但雙方因認知不同引發爭執。對此，台北市議員邱威傑、呱吉表示，如果你認為這是尊重社會多元文化的一部分，那你就不需要質疑為什麼有人在國會殿堂上堅持講台語。但有網友卻認為這叫這叫硬拗。
呱吉稱不需太在意被譏「塔綠班」：民進黨以前就是這樣贏國民黨的,https://www.ettoday.net/news/20210921/2084200.htm?from=pctaglist,2021-09-21 16:49,上月底美軍撤退阿富汗成國際焦點時，有PTT網友以「塔綠班」諷刺民進黨及其支持者，成時下網路哏；名嘴朱學恒近日改編綠油精廣告曲，創作出「塔綠班之歌」，歌詞中除直白寫著「綠畜」外，還找了民眾黨立委高虹安、媒體人黃暐瀚獻唱，惹怒綠營。對此，台北市議員「呱吉」邱威傑21日下午在臉書表示，自己雖不贊同塔綠班這種稱呼，但也覺得不需太過在意。
收到鄭家純送的飛機杯！　呱吉看「蔡哥尺寸」一比傻眼：真的生氣了,https://www.ettoday.net/news/20210913/2078723.htm?from=pctaglist,2021-09-13 21:33,藝人鄭家純（雞排妹）經營自創情趣用品品牌，前陣子大力宣傳的飛機杯「純愛杯」，也送了不少給身邊的網紅試用，台北市議員兼YouTube頻道「上班不要看」的老闆呱吉（邱威傑）也收到了公關品，不料卻因為身旁頻道成員蔡哥拿到的尺寸比他大，讓他傻眼「這下子我真的生氣了」，笑翻網友。
疫情衝擊、市場需求　呱吉提議「開放網路賣酒」逾5000人連署,https://www.ettoday.net/news/20210907/2074094.htm?from=pctaglist,2021-09-07 18:22,網路何時才能開放賣酒，爭議已久，台北市議員邱威傑（呱吉）透過公共政策網路參與平台，提議修正《菸酒管理法》第三十條，發起「開放網路賣酒」連署，逾5000人附議達標，主管機關財政部須於10月3日前具體回應說明。網路購物商機大，再加上疫情改變購物習慣，時空環境背景不同以往，對於外界擔心未成年身分造假在網路買酒或酒駕加遽，邱威傑認為，以現在的科技手段來說，其實可以解決網路身分驗證或實名制等問題，建議參考各國作法予以開放。
好萊塢巨星「打工辛酸畫面」流出　瞿友寧、呱吉笑瘋被療癒,https://www.ettoday.net/news/20210826/2064660.htm?from=pctaglist,2021-08-26 07:14,集結三大金獎影帝勞勃狄尼洛、摩根費里曼、湯米李瓊斯爆笑主演的年度爆笑喜劇片《詐製片家》，片中三位影帝為了詐領保險金，竟把歪腦筋動到電影上，以製片身份惡搞拍片現場，超爆笑題材讓許多台灣影人看得心有戚戚焉。
樂透獎金「越疊加越多人買」！議員一句分析超神　網笑噴：準爆,https://www.ettoday.net/news/20210821/2061381.htm?from=pctaglist,2021-08-21 17:04,無黨籍台北市議員「呱吉」邱威傑是網紅出身，經常在臉書分享對時事的看法，或是分享日常。今（21）日下午他就貼文，像是用了讀心術般的一句話，讓許多人直呼根本就是自己的心聲，連網紅四叉貓也現身「同行勿擾，我跟你之間最後只有一個人笑的（得）出來！」
陳時中成為「虛擬貨幣大師」網瘋傳！　內行揭手法：之前是郭董,https://www.ettoday.net/news/20210630/2019601.htm?from=pctaglist,2021-06-30 17:49,假消息要慎防！指揮中心指揮官陳時中日前才被假消息瘋傳，本名是「南雲忠一」，因為做了人體實驗的關係，從二戰一路活到現在，今年已經129歲了。台北市議員「呱吉」邱威傑今指出，最近點開一則新聞頁面，內容竟然是「陳時中教大家買虛擬貨幣」。貼文一出，引發網友熱議。
林珍羽161秒內講了7次「珍羽」　呱吉譏「原始人」：發言超沒邏輯,https://www.ettoday.net/news/20210626/2016542.htm?from=pctaglist,2021-06-26 20:13,針對好心肝調查報告限北市議員看30分鐘爭議，北市府副發言人林珍羽26日在北市防疫記者會「不實訊息澄清專區」時段，點名北市議員邱威傑（呱吉），盼他如果覺得時間不足，可以向市府「協商」，而非用「拗」；但由於在整段短短2分41秒中，林珍羽說了7次「珍羽」，讓邱威傑在臉書嘲諷，「我一直以為會用自己的名字來當作主詞的只有原始人和宋楚瑜」。
呱吉看好心肝調查報告！釣出高嘉瑜「崩潰臉」自損：有看到我嗎,https://www.ettoday.net/news/20210625/2015437.htm?from=pctaglist,2021-06-25 12:00,台北中正區好心肝診所特權施打疫苗爆出爭議，北市政風處對此提出約百頁的完整報告書，不過要看報告有所限制，遭到議員質疑。北市議員邱威傑（呱吉）就在臉書發文，市府僅提供5頁「精簡版」給議員，詳細版只能去「小房間」看30分鐘，還不能拍照、抄筆記，「不給看是合理的嗎？」貼文則釣出高嘉瑜開自己玩笑「有看到我嗎？」讓眾人笑翻。
好心肝百頁調查報告「議員限看30分鐘」　林穎孟：柯文哲信用破產,https://www.ettoday.net/news/20210624/2015108.htm?from=pctaglist,2021-06-24 19:47,針對台北中正區好心肝診所特權施打疫苗爭議，北市政風處提出約百頁的完整報告書，但北市議員林穎孟24日指出，市府僅提供5頁「精簡版」給議員，詳細版只能去「小房間」看30分鐘，且還不能拍照、抄筆記，直批「柯市長自豪的公開透明完全信用破產」；另位北市議員邱威傑（呱吉）則困惑，不給看是合理的嗎？
呱吉評論林瑋豐「看不出跟民進黨的關係」　起碼是個立場一致的人,https://www.ettoday.net/news/20210525/1990964.htm?from=pctaglist,2021-05-25 20:36,親綠寫手林瑋豐遭質疑自導自演炒作「認知作戰」話題，在PTT引發「反串之亂」。對此同樣熟知網路生態的台北市議員「呱吉」邱威傑就發文評論指出，看不出來林瑋豐跟民進黨的關係，從過往的認識起碼林瑋豐是個立場一致的人。
口譯哥返台投入北市選戰　呱吉神分析最有可能選「這一區」,https://www.ettoday.net/news/20210424/1967335.htm?from=pctaglist,2021-04-24 14:01,駐美代表處政治組長「口譯哥」趙怡翔上周傳出將請辭返台，準備投入2022年地方議員選舉，預計鎖定台北市。對此，無黨籍台北市議員「呱吉」邱威傑分析，趙怡翔可能會選擇松山信義區的選戰。
影／奇摩知識+「9大不可思議知識問答」！ADSL經典炸：鄉民還是愛,https://www.ettoday.net/news/20210415/1961036.htm?from=pctaglist,2021-04-15 16:31,本站6日曾報導《16年Yahoo奇摩知識+宣布關閉！用戶收通知淚　「手槍伯」傳奇掰了》，擁有16年歷史的「Yahoo奇摩知識+」將於5月4日關閉，從4月20日起用戶就不能再發布新問題或提供解答，而所有資料將在6月30日起刪除。台北市議員邱威傑（呱吉）就在YouTube發影片，討論10大不可思議知識問答，讓網友笑噴。
呱吉怒揭無良粉專以「罹難者名義」騙捐款　家屬說話了...,https://www.ettoday.net/news/20210408/1956118.htm?from=pctaglist,2021-04-08 16:58,今天是台鐵太魯閣號翻覆事件頭七，意外一共造成50人罹難，其中一位罹難者為消防特考班學員黃法喆。有臉書粉專「Kuso宅卡啦」貼出黃法喆的故事，並附上捐款連結，企圖打著罹難者的名義騙捐款，甚至刪掉黃法喆妹妹在該貼文底下的澄清留言，讓台北市議員邱威傑（呱吉）氣憤轉分享。
顏若芳沉潛王定宇沒事　呱吉曾預言：她和蝴蝶姐姐一樣銷聲匿跡,https://www.ettoday.net/news/20210315/1938916.htm?from=pctaglist,2021-03-15 22:00,對於被媒體拍到和民進黨立委王定宇同居，顏若芳15日表示，記取經驗，房子不再外租，同時為了個人私事影響公務道歉，並自請處分取消對外發言的工作。台北市議員「呱吉」邱威傑就曾預言，顏若芳會和蝴蝶姐姐一樣銷聲匿跡，還有網友留言「預測成功」。
一日北高關注度輸呱吉　柯文哲：很正常啊！畢竟騎過了,https://www.ettoday.net/news/20210302/1929377.htm?from=pctaglist,2021-03-02 16:55,台北市長柯文哲2月28日凌晨0時進行「一日北高」挑戰，總預算高達72萬元，其中20萬元為直播經費，然而卻爆出畫面與聲音有問題等狀況，且觀看人數還不如台北市議員「呱吉」邱威傑日前挑戰的「一日雙塔」。對此，柯文哲2日受訪時表示，關注度不高「很正常啊！」畢竟都已經騎過了。
歡樂無法黨「解散原因曝光」　呱吉沉重宣告：早預訂好廢黨,https://www.ettoday.net/news/20210220/1923075.htm?from=pctaglist,2021-02-20 20:53,台北市議員「呱吉」邱威傑與知名網紅「志祺」、「視網膜」於2019年11月成立「歡樂無法黨」，因為未依法完成法人登記，遭內政部於2月19日廢止政黨備案。對此，呱吉透過粉專「歡樂無法黨」說明，黨內沒有在2022或2024推出候選人的打算，因此最佳的解散時機就是不完成法人登記。
歡樂無法黨遭廢黨　呱吉：階段性任務完成,https://www.ettoday.net/news/20210220/1922983.htm?from=pctaglist,2021-02-20 17:10,台北市議員、知名YouTuber「呱吉」邱威傑，2019年11月5日宣布與志祺七七、視網膜、眼球中央等網紅聯手籌組「歡樂無法黨」，同月在14日舉辦歡樂無法黨成立大會。但內政部19日公告，歡樂無法黨因為在備案後1年內未成法人登記，宣布廢止該黨的政黨備案。
呱吉組「歡樂無法黨」2年就掰了　未完成法人登記遭內政部廢黨,https://www.ettoday.net/news/20210220/1922969.htm?from=pctaglist,2021-02-20 17:08,台北市議員「呱吉」邱威傑與知名網紅「志祺」、「視網膜」於2019年11月成立「歡樂無法黨」，但該黨成立兩年多的時間卻因為沒有完成法人登記，內政部於2月19日依法廢止政黨備案。
呱吉酸趙少康選總統「蠻弱的」　大概跟沈富雄差不多而已,https://www.ettoday.net/news/20210210/1918374.htm?from=pctaglist,2021-02-10 09:39,資深媒體人趙少康重返國民黨，日前更表態要參選2024掀起政壇一股震撼。不過，台北市議員「呱吉」邱威傑則認為，覺得趙少康「蠻弱的，大概跟沈富雄差不多而已」。
才挺雞排妹！呱吉被挖出脫口秀喊「把高雄人X到脫肛」　網怒轟雙標,https://www.ettoday.net/news/20210206/1915660.htm?from=pctaglist,2021-02-06 10:29,雞排妹（鄭家純）日前控訴翁立友在尾牙場上性騷擾，但卻被網友翻出她曾在直播節目上，透露被一名醫師拍屁股其實蠻爽的，進而遭質疑是「雙重標準」。對此，台北市議員呱吉（邱威傑）舉例力挺雞排妹，表明「所有的話都是看人看地點講的」。原本這席話被網友讚爆，但後來就有人挖出呱吉之前的脫口秀影片，發現內容超不妥當，根本就是公然「性騷擾」。
罷免陳柏惟「很困難」？　呱吉分析「不make sense」傻瓜才做,https://www.ettoday.net/news/20210203/1913629.htm?from=pctaglist,2021-02-03 16:28,前桃園市議員王浩宇遭罷免後，高雄市無黨籍議員黃捷的罷免案也將於本周六舉行；此外，先前有台中里長出面表態罷免台灣基進黨立委陳柏惟，連署已於2月1日啟動。對此，台北市議員「呱吉」邱威傑分析，這個罷免門檻很難，如果當地里長推動罷免案「傻瓜才會做，這件事很不make sense（不合理）」。
《天竺鼠車車》塞車是「呱吉的錯」　萬人朝聖關鍵1幕：抓到你了,https://www.ettoday.net/news/20210121/1903716.htm?from=pctaglist,2021-01-21 10:11,日本定格動畫《PUI PUI 天竺鼠車車》在台灣引發熱議，其內容以日常生活為主，再透過天竺鼠的角度呈現，雖然原本是設定給孩童觀看，但卻意外吸引大人們的關注。《PUI PUI 天竺鼠車車》的第1話「塞車了是誰的錯」在YouTube公開後，就有網友笑稱，裡頭害後方大塞車的罪魁禍首超像台北市議員「呱吉」；對此，呱吉也在臉書上幽默回應。
「現場所有叫囂都是表演而已」　呱吉曝未參與零檢出釋憲案表決理由,https://www.ettoday.net/news/20210107/1893775.htm?from=pctaglist,2021-01-07 17:21,針對行政院日前宣布地方政府以自治條例規定萊濟零檢出，抵觸中央法規無效，北市議會6日在國民黨團人數優勢下，表決通過釋憲案。對此，無黨籍北市議員邱威傑（呱吉）7日透露未參與表決的理由，並批評「現場的所有叫囂都是表演而已」。
防數位身分證洩個資　唐鳳傳授貼「不透明膠帶」輕鬆搞定,https://www.ettoday.net/news/20201218/1879324.htm?from=pctaglist,2020-12-18 15:52,內政部預告明年1月起先在新竹市小規模試辦「數位身分證」，結束後並於6、7月檢討資安防護、個資防護，確認是否須調整。針對民眾的資安疑慮，行政院數位政委唐鳳鼓勵民眾可善用不透明膠帶保護個人隱私，只要把條碼跟機讀碼這2欄位貼掉，證件資料就不會被感應到而遭讀取。
呱吉爆「雞排妹上廁所」驚人之舉：做到真的屌！她高調曝光閨房照,https://www.ettoday.net/news/20201125/1861965.htm?from=pctaglist,2020-11-25 00:46,台北市議員邱威捷「呱吉」6日在網路廣播Podcast節目上談到，自己曾因跟空服員親切打招呼，而被讚賞，但他其實看過更了不起的名人，就是「雞排妹」鄭家純，「能做這件事真的很屌」，機組人員發現，每次雞排妹上完廁所，就會像剛剛打掃完，全部都擦得乾乾淨淨。雞排妹24日也發文分享自己整潔8大秘招。
鄭人碩失傳「金手指」大嘆：遺憾！　呱吉自嘲「這點」像酒店小姐,https://www.ettoday.net/news/20201120/1858387.htm?from=pctaglist,2020-11-20 11:30,同學注意！納豆X鄭人碩兩位自帶綜藝感的金馬準男配來廝殺！還有上班不要看首領呱吉aka台北市議員邱威傑大解密雙重身份甘苦談，本週立喆也要來尬全台第一台MINI GP，偷天換日不是夢！
小S質疑新課綱刪三國「有什麼好抽掉？」　呱吉：讀書的事問她幹嘛,https://www.ettoday.net/news/20200912/1807253.htm?from=pctaglist,2020-09-12 09:50,教育部推出的新課綱隨著近日開學受到關注，有國中歷史老師發現新版教課書中，三國、劉邦等內容被刪減，因而引發討論是否略古詳今，對此小S表示：「三國志有什麼好抽掉的啊？讓小朋多讀一些歷史不是很好嗎？」沒想到她的這番話遭多位公眾人物批評。
「歡迎核廢放我家」359字電翻呱吉　黃士修曝原因！網友瘋搶報名,https://www.ettoday.net/news/20200903/1799842.htm?from=pctaglist,2020-09-03 06:06,台北市議員呱吉（邱威傑）2日在臉書PO文表示，目前人在蘭嶼，剛好看到核廢存放區，覺得應該叫核能流言終結者的人都來認領一公斤回家。沒想到文章才PO出半小時，以核養綠公投發起人黃士修不僅在個人臉書PO文反酸，甚至還在呱吉的文章底下留言，「可怕的是，核終真的會抵達，呵呵」、「沒問題，我向來大方主張核廢料放我家」。
林書豪拿中華民國護照！　呱吉揭「一魚雙吃」內幕：常出差的就懂,https://www.ettoday.net/news/20200820/1789622.htm?from=pctaglist,2020-08-20 18:36,球星林書豪入籍台灣，證實已於7月30日拿到中華民國護照，引發各界關注。對此，身為台北市議員的網紅呱吉（邱威傑）就分享自身看法，他更認為林書豪這招就是「一魚雙吃」。
臉書PO「松山邱威傑」酒駕判決！呱吉急撇：不是我…網：原來70年代菜市場名,https://www.ettoday.net/news/20200714/1760353.htm?from=pctaglist,2020-07-14 18:08,台北市議員邱威傑（呱吉）14日在個人臉書上貼出一張「酒駕法院判決書」，由於判決書上被告與他同名同姓，案發地剛好也在他居住地松山區，助理無意間看到後非常緊張，趕緊問他是不是本人，呱吉連忙回應「當然不是」。網友們看完後紛紛開玩笑表示，「原來威傑是 1970 年代的菜市場名啊」。
蔡英文、韓國瑜付錢上《博恩夜夜秀》　呱吉：「未揭露利益」是道德瑕疵,https://www.ettoday.net/news/20200711/1757874.htm?from=pctaglist,2020-07-11 11:00,監察院10日公開第15任總統、副總統選舉政治獻金收支結算表，只見當時角逐總統大位的國民黨候選人、前高雄市長韓國瑜支付2筆共31.5萬元費用給網路節目《博恩夜夜秀》，總統蔡英文卻只支付13萬1040元，雙方價碼差了2倍左右。對此，台北市議員「呱吉」邱威傑認為，博恩在節目中做業配，如果沒有揭露利益，「就是道德瑕疵。」
