ettoday,中職千人入場、山屋開放登記 八大行業何時開？陳時中：再等等,https://www.ettoday.net/news/20200506/1707900.htm,2020-05-06 14:27,新冠肺炎疫情衝擊台灣，不少產業因此紛紛倒閉，酒店等八大行業也因為有一例酒店女公關確診，被下令無限期停業，由於現在疫情趨緩，外界也相當關心什麼時候可恢復營業？對此，指揮官陳時中指出，如果可以做到近日實名制登記，維持相關防疫措施，就可以開放，做不到就再等等。(生活 / 2020-05-06 14:27),,0
ettoday,影／國家公園山屋開放！ 疫情趨緩明起開放線上登記恢復原住宿人數,https://www.ettoday.net/news/20200506/1707943.htm,2020-05-06 14:19,因應新冠肺炎疫情狀況，中央流行疫情指揮中心日前宣布，國家公園山屋部分之室內住宿人數降載50%。但因國內疫情已逐漸趨緩，指揮中心今（6日）再宣布，明天開始開放線上登記，提供登山者住宿。(生活 / 2020-05-06 14:19),,0
ettoday,牛小排＋炙燒牛五花堆成山！台中超狂丼飯 還有邪惡炸牛排,https://www.ettoday.net/news/20200503/1701045.htm,2020-05-03 15:00,在台中小有名氣的「嵐山熟成牛かつ專売」，除了大里、西屯，最近也來到北屯設點啦！加上澎湖的分店，短短三年，他們已經擴點到第四間分店，我上周首度來踩點，點了他們家招牌的炸牛排跟男子漢份量的丼飯，真心認為對於他們家的份量之多，留下非常大的印象。(旅遊 / 2020-05-03 15:00),,0
ettoday,指揮中心公布五一連假全台旅館訂房率 高山區飯店幾乎滿房,https://www.ettoday.net/news/20200427/1701176.htm,2020-04-27 14:57,五一連假即將到來，中央流行疫情指揮中心今天公布觀光局統治截至上週五為止全台訂房狀況，中央流行疫情指揮中心副指揮官陳宗彥表示，目前像是太魯閣國家公園內的飯店，或是少數高山山區的飯店訂房較滿，其他訂房比例仍在正常範圍內。(生活 / 2020-04-27 14:57),,0
ettoday,雲林山區汛期將至 古坑華山社區行防災演練保家園,https://www.ettoday.net/news/20200423/1698573.htm,2020-04-23 15:55,雲林縣古坑鄉華山社區為因應汛期即將到來，預防突發性豪大雨所造成的土石流危害，農委會水土保持局南投分局日前邀集古坑鄉公所、逢甲大學防災研究中心等單位於古坑鄉華山村辦理自主防災疏散撤離演練，演練結束後亦邀集華山地區各產業代表共同討論地方未來發展走向與產業創新議題。 (地方 / 2020-04-23 15:55),,0
ettoday,古坑華山螢火蟲暴增 大量群聚吸引遊客上山賞螢,https://www.ettoday.net/news/20200421/1696743.htm,2020-04-21 17:58,雲林縣古坑華山山區螢火蟲群聚棲地超過20處，除山豬湖、桂林、山峰國小等地，從約300到800公尺低海拔山區，沿路都有機會看見螢火蟲，每年3至5月為螢火蟲活躍的季節，防疫期間不出國，上山賞螢遊客劇增，桂林一家檜木屋民宿庭園，今年螢火蟲數大爆量，因重視保育只對住宿客開放，使螢火蟲數逐年上升。(地方 / 2020-04-21 17:58),,0
ettoday,苗栗火炎山意外頻傳 1日4人救護「警消忙翻天」,https://www.ettoday.net/news/20200419/1694978.htm,2020-04-19 10:46,日前新北1名林姓員警，在攀爬苗栗知名景點火炎山時，因拍照未注意腳下土石鬆動，而墜谷死亡事件；不料18日又有4名登山客因腳扭傷及呼吸困難等，請求協助；也讓警、義、消疲於奔命，也呼籲民眾請山友攀爬火炎山時，務必要小心，注意安全及自身身體狀況。(社會 / 2020-04-19 10:46),,0
ettoday,違反禁足令！觀光客在印度小鎮悠哉散步 被逮「罰寫500遍對不起」,https://www.ettoday.net/news/20200413/1690596.htm,2020-04-13 18:00,印度官員今天表示，有10名外國觀光客因在小鎮瑞詩凱詩（Rishikesh）散步，違反防疫管制令，被罰寫500遍「對不起」以示悔悟。(國際 / 2020-04-13 18:00),,0
ettoday,資深製毒師轉行搞「擄鴿集團」 強索鴿主3萬元...獲利上百萬,https://www.ettoday.net/news/20200411/1689003.htm,2020-04-11 11:06,北市刑大日前接獲報案，有民眾在山區架設捕鴿網抓賽鴿，最後要求被害人匯款後把鴿子放飛，每隻鴿子平均要價1萬至3萬元，而主嫌還曾是1名製毒師，因遭逮捕不敢再做，但卻欠下百萬賭債，而轉行當起擄鴿主嫌。(社會 / 2020-04-11 11:06),,0
ettoday,玉山再降雪！北峰積雪14.5公分 合歡山武嶺凌晨也短暫降雪,https://www.ettoday.net/news/20200407/1685325.htm,2020-04-07 10:06,玉山接連2天降下四月雪。中央氣象局通報，玉山地區4月6日早上7時10分開始降雪，至4月7日早上6時40分積雪14.5公分。排雲山莊也受到這波東北季風增加華南雲雨區東移雙重影響，凌晨開始降雪，積雪1公分。此外，合歡山凌晨也降下皚皚白雪，可惜天亮回溫雪逐漸溶化，地面僅留些許殘雪。(生活 / 2020-04-07 10:06),,0
ettoday,可愛貓頭鷹到南投五育高中旁聽 不屑「鳥巢箱」領角鶚自己蓋,https://www.ettoday.net/news/20200331/1680703.htm,2020-03-31 11:52,南投市五育高中校園，最近來了4隻貓頭鷹家族棲息。位處八卦山山脈尾端，占地10公頃五育高中，附近林木茂密、自然生態維護良好，已連續數年有領角鶚家族，飛到校區做客，有次幼雛還停在教室窗簾上聽課。校方在牠們常棲息的印度黑檀、松樹架鳥巢木箱供築巢，但附近可躲藏的隱密林木很多，牠們根本不領情。(寵物動物 / 2020-03-31 11:52),,0
ettoday,防疫無漏洞治安零死角！ 白河警強力清山掃蕩治安,https://www.ettoday.net/news/20200325/1675922.htm,2020-03-25 10:04,隨著「新冠肺炎」疫情升溫，為了避免市民遭感染風險，白河警分局為貫徹「治安零死角」之決心，針對轄內易衍生治安死角之偏遠山區、空屋等地採取強勢作為，於3月24日下午2至6時動員優勢警力實施「清山專案」。(地方 / 2020-03-25 10:04),,0
ettoday,南投市公所賞鷹及賞桐花活動 因新冠肺炎宣布停辦,https://www.ettoday.net/news/20200324/1675534.htm,2020-03-24 17:25,每年4月南投、彰化交界八卦山山區，大冠鷲、鳳頭蒼鷹、松雀鷹、赤腹鷹等猛禽，常盤旋天際際遨翔，南投市公所每年都會舉辦賞鷹季活動。新冠肺炎疫情防疫優先考量，南投市公所宣布今年「鷹緣聚會」與「遊賞桐花」活動均停辦。(旅遊 / 2020-03-24 17:25),,0
ettoday,宜蘭必去8條綠色步道懶人包 世界最美小路、打卡仙境抹茶山都在這,https://www.ettoday.net/news/20200322/1673705.htm,2020-03-22 14:00,宜蘭是北部民眾最愛去的渡假休閒縣市，境內擁有多條絕美的綠色山林步道，《ETtoday新聞雲》整理出宜蘭8條必去綠色步道懶人包，在無法出國的此時，不妨走進山林間，感受芬多精的洗禮，與大自然來場親密接觸吧。(旅遊 / 2020-03-22 14:00),,0
ettoday,Tiffany色療癒湖水環繞！盤點全台10大夢幻湖泊 煙雨濛濛宛如仙境,https://www.ettoday.net/news/20200320/1668885.htm,2020-03-20 11:18,厭倦了城市的喧囂煩擾，偶爾也該到戶外走走踏青，台灣各地都擁有得天獨厚的自然美景，ReadyGo為您精心盤點全台10大夢幻湖泊，白天欣賞山水美景，夜晚觀賞星空月色，推薦給平日總是坐在電腦桌前奮鬥的你，從今天開始為自己安排個短暫的假期，與身邊親愛的人們偕手，走進大自然，享受悠閒靜謐的時光吧！(旅遊 / 2020-03-20 11:18),,0
ettoday,綠光點點大爆發！宜蘭隱藏版賞螢秘境 還打造超夢幻「燈海隧道」,https://www.ettoday.net/news/20200319/1671579.htm,2020-03-19 15:27,這裡根本就是魔幻森林！宜蘭山谷中藏了一座賞螢秘境，目前已經進入螢火蟲季，預估4月初就會大爆量，直到5月中收尾，園區中滿是點點綠光超級夢幻。另外，園區還特別融合森林地景打造最新「爍影隧道」，抬頭就是一閃一閃的燈光，讓宜蘭的夜晚變得更加浪漫。(旅遊 / 2020-03-19 15:27),,0
ettoday,瘋電影／安雅的回家路 法國老婦解救多名猶太兒童,https://www.ettoday.net/news/20200319/1670457.htm,2020-03-19 08:19,住在法國庇里牛斯山山區的13歲牧童裘（諾亞施納普 飾），在一次牧羊過程中，猶太人班傑明幫他從野熊手中救回牧羊犬，他得知班傑明在山區躲避蓋世太保追捕，等待依親的女兒安雅回家，他決定幫他藏村裡的寡婦艾莉絲（安潔莉卡休士頓 飾）的家裡，而艾莉絲和班傑明陸續救了一些猶太小孩，他們計畫偷偷帶小孩們到安全的西班牙邊境，熟悉山路的裘也決定出手相助，但德軍佔領了山村，讓他們的運送工作更加困難及危機重重....(名家 / 2020-03-19 08:19),,0
ettoday,西藏大學生每天爬4500米高山上網課 網友歪樓「小哥挺帥的」,https://www.ettoday.net/news/20200317/1669541.htm,2020-03-17 14:04,在新冠肺炎疫情籠罩下，中國改透過「網課」模式授課，線上教學看似方便，卻苦了居住在偏遠地區的學生。老家住在西藏林周的一名大二男學生，因為家裡沒訊號，只能每天騎摩托車到海拔4500公尺的山頂上網課，他的求學之路讓許多網友大感佩服，但也有人默默發現「小哥挺帥的」，留言瞬間歪樓。(大陸 / 2020-03-17 14:04),,0
ettoday,人間仙境裡賞景修行！「台版金閣寺」在嘉義 龍王金殿超浮誇,https://www.ettoday.net/news/20200313/1666643.htm,2020-03-13 11:39,龍王金殿位在群山峻嶺的森林之中，金碧輝煌的唐宋建築，好似京都金閣寺，四周環山，還有一整片壯麗的茶田風光，參觀龍王金殿漫遊賞景，也格外舒心愜意，龍王金殿旁的巧雲小棧提供精緻的餐點和茶點，假期來嘉義梅山，也很值得來一趟龍王金殿唷！(旅遊 / 2020-03-13 11:39),,0
ettoday,LIFE・經典／日本狹長型3口之家 有小孩也能走極簡風,https://www.ettoday.net/news/20200307/1658084.htm,2020-03-07 12:05,其實世界各地都有狹長型建築，但日本絕對是狹長型建築設計的佼佼者，近期擅長極簡風格的 FORM／Kouichi Kimura Architects事務所，在滋賀縣的新作品，引起了廣泛的討論，在一塊狹長型的土地上，以極簡風格規劃了3口之家，成員中還有一個小女孩，透過光影與簡單的內部設計，完成了令人印象深刻的作品。(時尚 / 2020-03-07 12:05),,0
ettoday,「神攝手」就是你！到桃園機場觀景台拍下航機美照 得意之作有機會高掛國門,https://www.ettoday.net/news/20200304/1654776.htm,2020-03-04 18:25,"趁著近日北部晴空朗朗的天氣，前往被全國航空攝影迷譽為「最讚取景地」的桃園機場南北側觀景台踩點拍照，並參加「觀景神攝手–照片徵集」活動，得意作品不僅有機會高掛在第二航廈，還有最高新臺幣5,000元不等的禮券讓優勝者帶回家。(生活 / 2020-03-04 18:25)",,0
ettoday,美翻！穿浴衣漫步粉紅仙境 台中福壽山農場千櫻園盛放中,https://www.ettoday.net/news/20200303/1658876.htm,2020-03-03 20:34,今年春天無法到日韓賞櫻就上山去吧！台中高山農場櫻花正美，3月最新的千櫻園花況滿開中，花期預計可以維持到3月下旬，園內還能換上浴衣浪漫拍美照。 (旅遊 / 2020-03-03 20:34),,0
ettoday,環台賽／桃園站高難度登山賽 角板山強風、地獄坡環伺,https://www.ettoday.net/news/20200301/1657320.htm,2020-03-01 18:26,2020年自由車環台賽，2日將拉拔到桃園市開戰，車手在經歷北市激烈的城市繞圈賽後，馬上要遇上嚴苛的登山賽，若遇下雨難度還會加倍。 (體育 / 2020-03-01 18:26),,0
ettoday,新冠肺炎疫情擴大 京都東山花燈路停辦,https://www.ettoday.net/news/20200301/1657150.htm,2020-03-01 13:39,京都東山為京都觀光的中心地區，每年三月皆會舉辦冬季花燈路活動，夜晚裡的神社寺廟及小路巷弄中將有溫暖的燈光點綴，不過受到新冠肺炎疫情影響，28日主辦單位宣布原訂3月6日開始的「京都・東山花燈路」停辦。(旅遊 / 2020-03-01 13:39),,0
ettoday,漸層神秘海岸！特搜228連假必去景點 走進翡翠湖步道超浪漫,https://www.ettoday.net/news/20200228/1654793.htm,2020-02-28 12:13,過年連假結束後每天上班上課都覺得好痛苦嗎？這次的228連假共有3天假期，足夠你來趟三天兩夜的春天小旅行，今天先帶著大家瞧瞧北部地區包括新北、台北、桃園及新竹地區好拍又好玩的景點，除了以下景點推薦之外，也很建議大家趁著春暖花開的季節，到各地欣賞燦爛花季！ (旅遊 / 2020-02-28 12:13),,0
ettoday,窗外整片蘭陽美景！宜蘭日式小清新飯店 無邊際泳池眺望太平洋,https://www.ettoday.net/news/20200225/1648997.htm,2020-02-25 10:19,去宜蘭玩住哪才好？這間日式文青風飯店或許是個不錯的選項，除了絕佳的視野和地點吸引不少旅客前來入住之外，超美無邊際泳池更是飯店招牌之一，頂樓還有絕美的玻璃空中咖啡廳，超Chill的日式大洋房超級放鬆，還有專門為孩童設計的親子館、攀岩區等，對於親子旅遊來說非常方便。 (旅遊 / 2020-02-25 10:19),,0
ettoday,免出國！2020精選寶島賞櫻秘境 絕美粉色海瞬間少女心爆炸,https://www.ettoday.net/news/20200221/1646374.htm,2020-02-21 10:00,年假剛結束，228連續假期就要來臨，這意味著走春的時候要來臨。每年最令人期待就是2月中到3月初的「櫻花季」，這幾年隨著走春的氣息日漸濃厚，全台各地也都種起的許多櫻花供民眾遊憩，不管是三色櫻、八重櫻以及吉野櫻等等，不用出國就能欣賞到櫻花四處綻放的絕色美景，就讓ETtoday介紹給你2020必去賞櫻秘境，一起帶著家人以及野餐用具，來一場賞櫻之旅吧。(旅遊 / 2020-02-21 10:00),,0
ettoday,賞花控快筆記！「全台8大花海人氣景點」由8.3億評論選出,https://www.ettoday.net/news/20200219/1649261.htm,2020-02-19 15:57,新冠肺炎（COVID-19）疫情讓大家不敢往密閉的場所去，此時不妨前往空曠郊外賞花、呼吸新鮮空氣！Tripadvisor® 從8.3億則用戶評論中，挑選出全台各地賞花人氣熱點以及最佳花期，可利用新推出的「旅程」功能，將喜愛的賞花景點標記在旅遊必訪名單，還可建立自訂賞花行程，即時掌握最美花景的圖文資訊和花期實況。(旅遊 / 2020-02-19 15:57),,0
ettoday,宜蘭太平山氣溫零下2度！霧淞覆蓋山毛櫸步道 變身銀白世界,https://www.ettoday.net/news/20200218/1648107.htm,2020-02-18 11:44,寒流發威，宜蘭太平山國家森林遊樂區內的山毛櫸步道，從17日晚出現霧淞美景，將整條步道染成一片銀白，吸引許多民眾上山欣賞。(旅遊 / 2020-02-18 11:44),,0
ettoday,山巔巨岩秘境！特搜台南9個自然系美景 竹林＋惡地彷彿畫中世界,https://www.ettoday.net/news/20200214/1643972.htm,2020-02-14 12:47,之前和大家介紹過台南熱門景點四天三夜，相信大家對台南打卡景點已經很熟悉了，但其實台南還有許多可以玩呢！那麼這次一起跟著ReadyGo稍微走遠一點，遠離市區，看看台南有哪些美麗的大自然景點吧！(旅遊 / 2020-02-14 12:47),,0
ettoday,惡魔的足跡？ 35萬年前人類的腳印「向著火山走」,https://www.ettoday.net/news/20200210/1642225.htm,2020-02-10 15:32,義大利坎帕尼亞區（Campania）北部羅卡蒙菲納（Roccamonfina）火山附近，有著一排被稱為「惡魔的足跡（Ciampate del Diavolo）」的足跡化石，分析後發現，火山爆發後，足跡的所有者不是逃下山，而是往噴火的火山山頂走去。(國際 / 2020-02-10 15:32),,0
ettoday,2020台灣櫻花野餐企劃！武陵農場櫻花野餐x阿里山茶席野餐,https://www.ettoday.net/news/20200206/1621332.htm,2020-02-06 16:12,說到賞櫻花，你會想到什麼玩法呢？是漫步在櫻花林中，還是喝杯櫻花季節限定特調飲料呢？今年有不少台灣櫻花景點都推出了超夢幻的「櫻花野餐企劃」，讓你可以坐在櫻花樹下，一邊欣賞浪漫櫻花，一邊吃著櫻花便當，是不是很浪漫呢？趕快一起來看看台灣櫻花季，有什麼好玩的吧！(旅遊 / 2020-02-06 16:12),,0
ettoday,影／實名制口罩上路上班族等不及 嘉義藥局貼心推「預約制」,https://www.ettoday.net/news/20200206/1639122.htm,2020-02-06 11:31,中央流行疫情指揮中心3日宣布最新政策，4日起四大超商停售口罩，6日「口罩實名制」9點正式上線，不少上班民眾一早7、8點就拿著健保卡至鄰近藥局等著排隊買口罩，嘉義市不少藥局推出貼心預約制，並未出現擔心的排隊人潮及系統當機。(生活 / 2020-02-06 11:31),,0
ettoday,風．LUXURY／貝殼雕的老鼠錶盤好生動 寶璣發揚古老工藝、專接特殊訂製,https://www.ettoday.net/news/20200128/1625151.htm,2020-01-28 22:06,瑞士各鐘錶品牌發布的鼠年生肖錶中，唯一的女錶是寶璣（Breguet）Reine de Naples 8955 Cammea那不勒斯王后系列鼠年錶，細看面盤上活靈活現的老鼠，原來運用貝殼浮雕藝術賦予生命力，雕刻亦展現貝殼由銅棕色至棕黑色的細緻漸變色彩，為全球限量8只的專賣店限定款，由於每個天然貝殼不盡相同，因此每只貝雕錶堪稱獨一無二。(時尚 / 2020-01-28 22:06),,0
ettoday,該拒絕時就拒絕！別把生活過成一部「大型妥協劇」,https://www.ettoday.net/news/20200126/1622422.htm,2020-01-26 11:00,生活中，有很多人希望你妥協，希望你滿足他們的期待，實際上，這只是他們自私的表現。在僵化的思維模式下，我們選擇了用妥協來讓對方感到快樂。可是，如果你的一次次妥協，換來的是別人對你的無視，甚至侵占你的時間，阻止你去做自己要做的事，那麼，這時的你不必做到事事「善解人意」。(生活 / 2020-01-26 11:00),,0
ettoday,381條嚴選出35條遊程！「2020脊梁山脈年」經典遊程出爐,https://www.ettoday.net/news/20200120/1629792.htm,2020-01-20 17:56,歷經一個多月的選拔，「2020脊梁山脈旅遊年」經典遊程徵選結果今（20日）出爐！從381條參賽行程中嚴選出35條經典遊程，其中以皇朝國際旅行社一舉拿下7大獎項為最多。親山與經典遊程涵蓋了中央、雪山、玉山、阿里山、海岸山脈等，範圍包含北海岸及觀音山、參山、日月潭、阿里山、茂林等國家風景區。(旅遊 / 2020-01-20 17:56),,0
ettoday,風勢助長...梨山火警又延燒！陸空聯手難滅火 3公頃林地燒光光,https://www.ettoday.net/news/20200120/1629516.htm,2020-01-20 12:59,位於台八線69公里處，也就是和平區梨山舊佳陽地區的大甲溪事業區第五林班地，19日傳出山林火警，消防隊與東勢林區管理處、空勤總隊進行陸空搶救，經開闢防火巷阻隔火勢。南方火勢雖順利阻隔，但北方卻因風勢助長下，持續延燒。(社會 / 2020-01-20 12:59),,0
ettoday,最強戰友汪星人！陪12歲男童上山「轉大人」 保護羊群＋躲花豹,https://www.ettoday.net/news/20200114/1625344.htm,2020-01-14 18:33,「動物星球頻道」推出一系列，人類與汪汪如何互相合作、互相陪伴的節目，分享超多暖暖的故事。其中在非洲南部的龍山山區有個傳統習俗，就是12歲小朋友要學會在山上獨自過液，並看好家裡的羊群、避免花豹攻擊，而2年前在村裡出現的小黃狗「寶貝」陪他參與「轉大人」的過程。(寵物動物 / 2020-01-14 18:33),,0
ettoday,山勢險峻登山人必挑戰！台灣五嶽三尖一奇你爬過了嗎？,https://www.ettoday.net/news/20200113/1616577.htm,2020-01-13 13:22,台灣百岳是標高超過3000公尺以上，且山勢起伏明顯、具挑戰性的100座台灣山峰，而在台灣百岳中，更有「台灣五嶽三尖一奇」的說法，講得正是集合「奇、險、峻、偉」的高山，當然，也就是登山人一生必挑戰的台灣百岳囉！現在一起來看看「台灣五嶽三尖一奇」有哪幾座山！(旅遊 / 2020-01-13 13:22),,0
ettoday,驚悚！2018台灣爆4件分屍案 迄今6人慘遭殺害...警嘆：真不平靜,https://www.ettoday.net/news/20200112/1624012.htm,2020-01-12 18:51,台灣近年重大殺人分屍案眾多、其中光2018年就陸續發生4件，包含新北市健身教練分屍前女友案、桃園陳姓老翁協議離婚殺害老婆分屍案、台北市射箭教練陳伯謙酒後性侵殺害學弓道女學生性侵分屍命案、新北市永和區加拿大籍男子Ryan因販毒糾紛遭外籍藥頭分屍命案，讓警員私下驚嘆，2018是台灣治安史上的「分屍年」。(社會 / 2020-01-12 18:51),,0
ettoday,台東縣關山鎮及長濱鄉獲選台灣經典山城小鎮 各奪600萬獎金,https://www.ettoday.net/news/20200110/1622532.htm,2020-01-10 17:24,台東關山鎮與長濱鄉參加2020台灣經典／山城小鎮，經觀光局透過神秘客現勘與委員評選從全台30個經典小鎮中脫穎而出，兩鄉鎮雙雙獲選，也是繼去年成功鎮、池上鄉獲獎後，再度獲得此殊榮，兩鄉鎮各奪600萬宣傳行銷及設施整備獎金。(地方 / 2020-01-10 17:24),,0
ettoday,台東利稻小熊「越獄」落跑仍未找到 研判逃往大雪山,https://www.ettoday.net/news/20200110/1622331.htm,2020-01-10 14:40,台東林管處照養在特有生物保育研究中心低海拔試驗站的利稻小熊(Litu)在1月2日健康檢查前意外逃出籠舍，經投入大量人力、物力、科技器材進行搜尋及誘捕，迄今仍未發現，也未接獲附近居民發現及通報。因該區屬獨立封閉山谷地形與鄰近村落尚有段距離，且均有溪流阻隔，最有可能往該區唯一連接森林的大雪山山區移動。(寵物動物 / 2020-01-10 14:40),,0
ettoday,《白頭山》活火山有活躍跡象！北韓東北部恐毀滅、南韓失去陽光,https://www.ettoday.net/news/20200106/1618280.htm,2020-01-06 21:12,電影《白頭山：半島浩劫（백두산，港譯為白頭山：火山浩劫）》講述「白頭山」忽然爆發，其實不全然是沒有可能發生的。在現實環境上，中國與南北韓三國間的地質學家與火山研究學者，近十年也一直就此問題作深入研究。發現這個被稱為正在「休眠」的活火山，雖然不能斷言馬上爆發，但極有可能在未來的一段日子，隨時再次發生大規模的爆發﹗(影劇 / 2020-01-06 21:12),,0
ettoday,軍人泰山崩於前色不變！曹進平走進急診室 還向記者彎腰道謝,https://www.ettoday.net/news/20200103/1617101.htm,2020-01-03 20:36,國軍黑鷹直升機昨（2日）墜毀烘爐地山山區，機上8人不幸罹難，傷者則陸續被送到宜蘭陽大醫院救治，其中中將次長曹進平不僅在失事現場鎮定指揮和回報情況，還自己走進急診室，並向現場媒體彎腰道謝。 (政治 / 2020-01-03 20:36),,0
ettoday,悼黑鷹慘劇扯年改...挨轟消費罹難者 王惠美：像楊蕙如一樣的網軍,https://www.ettoday.net/news/20200103/1616545.htm,2020-01-03 14:10,空軍黑鷹直升機2日迫降墜毀於新北市烏來區、宜蘭交界處，釀成8死5傷，彰化縣長王惠美獲知消息後，於臉書表示哀悼，並提到公務人員年金改革，遭網友質疑是在消費亡者；3日上午王惠美被媒體問及此事，她回應，那些留言都不是彰化縣的鄉親，比較像是楊蕙如一般的網軍，現在最重要的是國家應該如何讓軍警消得到最好的照顧。(政治 / 2020-01-03 14:10),,0
ettoday,軍方去宜蘭「為何偏要搭直升機」 老學長曝需求：時間成本不同,https://www.ettoday.net/news/20200103/1616376.htm,2020-01-03 09:31,空軍UH-60M黑鷹直升機2日上午墜毀福山山區，導致參謀總長在內8死5傷，因飛鷹直升機失事非第一次，一名網友好奇，明明有其他種陸地交通工具，為何軍方人員去到宜蘭要搭直升機？PO文吸引許多留言回覆，「你有他們專業嗎」、「那改開坦克過去你說好不好」？(網搜 / 2020-01-03 09:31),,0
ettoday,王惠美臉書悼黑鷹墜機事件 下秒提「更令人遺憾的是年改」留言區戰翻,https://www.ettoday.net/news/20200103/1616334.htm,2020-01-03 06:36,空軍黑鷹直升機2日墜毀烏來山區，造成參謀總長沈一鳴等高階將官在內，8死5傷的慘劇。對此，彰化縣長王惠美也在臉書表達悼念之意，但隨即話鋒一轉，將失事事件和年金改革議題搭在一起，引起許多網友不滿，被痛批根本就是在消費亡者。(政治 / 2020-01-03 06:36),,0
ettoday,黑鷹墜毀「前後折斷」夾沈一鳴！300人濃霧開路 還原空難8死現場,https://www.ettoday.net/news/20200103/1616313.htm,2020-01-03 01:18,空軍黑鷹直升機2日上午墜毀烏來、宜蘭交界處，釀成8死5傷，其中包括參謀總長沈一鳴、情次室助理次長洪鴻鈞、政戰局副局長于親文等高階將官均不幸罹難。搜救隊第一時間抵達現場，發現直升機前後折斷，機體嚴重扭曲，令人不忍卒睹。(社會 / 2020-01-03 01:18),,0
