ettoday,排成壯觀火龍！ 文化傳承「瑞芳火把節」感動了原鄉人,https://www.ettoday.net/news/20160218/649469.htm,2016-02-18 16:16,農曆正月15日元宵節又稱為小過年，全台各地舉辦相關活動。新北市瑞芳曾經有個景象，每到元宵大家會拿著火把逛街，有一個說法是這項傳承與1940年「瑞芳事件」有關，而現在瑞芳老街文化觀光推展協會為讓更多人重拾往昔兒時回憶，舉辦了「瑞芳火把節」活動。(地方 / 2016-02-18 16:16),,0
ettoday,「火環帶」的無奈宿命 全球8成地震發生在這裡,https://www.ettoday.net/news/20160216/648099.htm,2016-02-16 22:29,小年夜發生的台南26大地震造成116人死亡、超過500人輕重傷。據悉，多數地震發生在三大地震帶（環太平洋地震帶、歐亞地震帶以及中洋脊地震帶），其中以環太平洋地震帶的地震最多，全世界有80%的地震跟60%的活火山就在環太平洋地震帶上。(國際 / 2016-02-16 22:29),,0
ettoday,平日不可能！無敵好天氣 中台肉眼望玉山能見「殘雪」,https://www.ettoday.net/news/20160213/647007.htm,2016-02-13 21:25,年假尾聲，13日初六全台放晴，大雨後天氣回穩，視野極佳，午後從南彰化員林一直到嘉義地區，都可遠眺玉山山脈，肉眼清晰看到玉山山頭皚皚白雪，讓嘉義不少網友驚呼連連，「睽違好幾年的嘉義市玉山殘雪再現！」當地70多歲的老人家也直呼難得！因為他上一次看到這麼清楚的玉山可是在小時候。(地方 / 2016-02-13 21:25),,0
ettoday,台南也有高檔和牛燒肉店 粉嫩油花密布的幸福滋味,https://www.ettoday.net/news/20160208/643137.htm,2016-02-08 12:12,想不到以往小吃才是王道的台南，這一年也開始出現好多這樣的高檔燒肉餐廳，這篇要介紹的就是台南老字號牛排歐納開的新燒肉品牌餐廳→【歐納碳火燒肉】想不到以往只有在中北部才有的高檔和牛燒肉店，現在連台南也能吃得到了啊！(旅遊 / 2016-02-08 12:12),,0
ettoday,隱身台北信義區山上 廢棄已久的「德興煤礦」整修好了,https://www.ettoday.net/news/20160207/640600.htm,2016-02-07 20:39,台北市信義區山上有2處廢棄舊煤礦坑，日據時代被稱為「德興煤礦」、「和興炭坑」，近年來經過台北市政府工務局大地工程處進行整體環境改善，重現於大家眼前，成為信義區新特色景點，來到這裡彷彿到了著名景點金瓜石一般。(地方 / 2016-02-07 20:39),,0
ettoday,新北走春六行程輕鬆玩 四大財神廟祈福兼賞櫻,https://www.ettoday.net/news/20160205/643952.htm,2016-02-05 14:01,農曆新年將近！過年期間除了大快朵頤一番，就是要全家人團聚出遊！新北市政府觀光旅遊局推薦的6大新春「猴」塞雷輕旅行路線，無論是想要放慢繁忙生活步調，或想要感受繽紛的佳節氣氛，在連假期間走訪新北秘境，快樂過好年。(旅遊 / 2016-02-05 14:01),,0
ettoday,《大航海時代V》推「Road TO Far East」全新大型改版,https://www.ettoday.net/news/20160203/638745.htm,2016-02-03 10:00,紅心辣椒旗下最受歡迎的跨平台策略經營遊戲《大航海時代V》，日前火熱推出「Road TO Far East」改版，特別開放兩大海圖「印度洋」、「中亞」，同步全新推出主線劇情任務及大型寶物挖掘活動「秘寶大爭奪」。邀請所有玩家一起展開海上航海霸業，挑戰最強大的敵人並發掘豐富的財寶。(遊戲 / 2016-02-03 10:00),,0
ettoday,內湖鯉魚山驚見野生總統府 竟是有人「走火入魔」造的,https://www.ettoday.net/news/20160202/642168.htm,2016-02-02 11:32,北市內湖山上驚見「野生總統府」！有網友在「爆料公社」PO出一張照片，指出鯉魚山山頂涼亭旁，竟然有一座「縮小版」的總統府，引起熱烈討論，甚至有人覺得「毛毛的」。不過，在這100公尺的鯉魚山步道兩側，一座座縮小版石雕，其實是出自山友劉洋正之手，且已有20多年的歷史，當時他還被形容走火入魔。(生活 / 2016-02-02 11:32),,0
ettoday,你去過了沒？網友討論度爆高的台灣十大絕美吊橋,https://www.ettoday.net/news/20160129/639899.htm,2016-01-29 14:30,全台各地興起一股吊橋熱！走上吊橋感覺微風拂過、步步驚心的刺激感，總讓人念念不忘。而到底哪座吊橋最美則引發網友熱烈討論，DailyView網路溫度計調查網路聲量公布十大絕美吊橋，所有吊橋都各具特色，假期將至，不妨考慮排進行程中喔！(旅遊 / 2016-01-29 14:30),,0
ettoday,日本小知識／新三大夜景在這裡 「札幌」遊樂指南,https://www.ettoday.net/news/20160126/627623.htm,2016-01-26 12:00,大家好，我是北海道地區負責公關宣傳工作的吉村。我居住的札幌以經進入嚴冬，雖然氣溫一天比一天低，但空氣對流減少也令夜空變的更加清澈，此時札幌的夜景更是令人嚮往，前不久還被認定為「日本新三大夜景」呢！(旅遊 / 2016-01-26 12:00),,0
ettoday,新竹五指山下瑞雪 民眾開心堆雪人、打雪仗,https://www.ettoday.net/news/20160124/636700.htm,2016-01-24 16:06,10年來最強的「帝王級寒流」來襲，全台都成凍番薯，今（24）日清晨最低溫只有4度，全台多處氣溫再下修，接著許多地方都飄下白雪。位於新竹縣竹東鎮、北埔鄉和五峰鄉交界處的五指山，清晨開始白雪朵朵飄下，難得的景象讓民眾開心堆起雪人。(生活 / 2016-01-24 16:06),,0
ettoday,「行政院設玉山頂」 他建議五院分遷東南西北中 網讚爆,https://www.ettoday.net/news/20160119/633924.htm,2016-01-19 21:20,2016總統暨立委選舉落幕，民進黨在濁水溪以南打出「紅不讓」成績，也讓南北發展失衡問題再次受到關注。台南市長賴清德18日提議，將總統府遷往台南，行政院、立法院遷到中部，以解決區域平衡問題。對此，有網友認為「太浪費錢了！4年後換國民黨執政，難道又要移往台北嗎？」(政治 / 2016-01-19 21:20),,0
ettoday,不一樣的上海宿旅 藝術殿堂-月湖會館,https://www.ettoday.net/news/20160115/628214.htm,2016-01-15 22:10,有別於上海繁華都市區的連鎖飯店，月湖會館坐落在寧靜的上海余山國家旅遊度假區內畔湖而立，安靜的蕩漾在余山山腳下，從窗看出去盡是湖光山色，高聳的雕刻作品就像是守護者們圍繞著湖比鄰著會館。(旅遊 / 2016-01-15 22:10),,0
ettoday,雙腿截肢女孩挑戰3886米雪山 雲科學生助她《破峰》,https://www.ettoday.net/news/20160114/630556.htm,2016-01-14 13:35,由雲科數媒系大學生發表的畢製作品《破峰》(Break the Break)，全程記錄一位因遭受灼傷而截去三肢的女孩莊雅菁勇敢登上台灣第二高峰「雪山主峰」，在四天三夜的時間裡完成3886公尺的極限挑戰！(生活 / 2016-01-14 13:35),,0
ettoday,天山賽里木湖的冬季美到窒息 倒掛冰凌像是「捲珠簾」,https://www.ettoday.net/news/20160113/629819.htm,2016-01-13 11:20,這裡是距新疆烏魯木齊520公里的賽里木湖，就像顆藍寶石靜靜鑲嵌在天山腳下；倒掛的冰凌點綴在雪與水之間，彷彿傳說中的「捲珠簾」，顯得聖潔而壯美，乍看之下還以為來到仙境了呢！(大陸 / 2016-01-13 11:20),,0
ettoday,離神戶最近的摩耶山纜車 700米高空賞日本新三大夜景,https://www.ettoday.net/news/20160113/628945.htm,2016-01-13 09:01,神戶在2015年與札幌、長崎並列、獲選為日本新三大夜景城市，讓更多旅客趨之若鶩。如果想俯瞰這道擁有「千萬美元價值夜景」美稱的景色，除了六甲山外，還可選擇搭乘摩耶山纜車前往摩耶山山頂，從700米高空，可同時遠眺神戶、大阪，甚至是關西機場夜景，是想要收集日本三大美景旅客不可錯過的必訪之地。(旅遊 / 2016-01-13 09:01),,0
ettoday,星座大勢唐立淇 2016星座運勢完整解析（上）,https://www.ettoday.net/news/20160105/624898.htm,2016-01-05 13:01,2016唐立淇老師的12星座完整解析都在這裡！(影劇 / 2016-01-05 13:01),,0
ettoday,【週三專欄】黃光芹／國民黨還在奢望把廢鐵煉成鋼,https://www.ettoday.net/news/20151230/621764.htm,2015-12-30 10:21,國民黨的選情已吃緊到連過去的鐵票區都不再靠譜的地步。為了挽救低迷的選情，國民黨黃復興黨部一連下了好幾張動員令，其中中和地區，更以分區唱名的方式動員。另外，設在國民黨中央黨部頂樓的催票中心，也積極催票，但令人喪氣的是，往往電話才拿起來，就被掛斷；連文傳會副主委李明賢因為幫王如玄辯護，走出家門倒垃圾時都被老兵嗆聲。(論壇 / 2015-12-30 10:21),,0
ettoday,日本飯店促銷新招！這次看不到富士山、下次讓你免費住,https://www.ettoday.net/news/20151227/620355.htm,2015-12-27 18:13,名列世界遺產的富士山是日本代表名景，許多旅客總想從各種角度捕捉其美麗風采，能清楚眺望富士山與山中湖的日本山梨縣富士山飯店，近日就推出促銷新招，只要在1月12日至24日為止，從入住起到退房期間超過1分鐘以上看不到富士山，就贈送旅客免費住宿券，可於下次入住時使用。(旅遊 / 2015-12-27 18:13),,0
ettoday,12酷島迎曙光、摸麻將！快來東森海洋溫泉酒店開跨年趴,https://www.ettoday.net/news/20151225/613804.htm,2015-12-25 17:00,跨年夜是今年寒冬的重頭戲，除了信義區煙火秀及阿里山觀日的景點外，不妨安排一趟東北角海岸「龜山朝日」之旅，朝聖蘭陽平原的壯闊美景，擁抱新年的第一道曙光。東森海洋溫泉酒店，將舉辦2016年跨年派對，結合懷舊老歌演唱、麻將競賽、趣味遊戲，及煙火秀等，讓旅客在大自然中迎接嶄新的一年。(旅遊 / 2015-12-25 17:00),,0
ettoday,全台首見！6.6公尺超萌愛神現身七股鹽山山頭,https://www.ettoday.net/news/20151222/617551.htm,2015-12-22 18:05,全台最大愛神現身七股鹽山！為迎接聖誕、跨年和情人節，七股鹽山在主山頭打造愛神巨型裝置藝術，並斥資超過300萬元舖上白鹽讓鹽山煥然一新，搭配一系列愛神主題活動和優惠，打造幸福景點！(旅遊 / 2015-12-22 18:05),,0
ettoday,跨年兼渡假 泡美人湯畫下2015完美句點,https://www.ettoday.net/news/20151222/617017.htm,2015-12-22 15:19,2015年剩下最後一週，若不想人擠人，不如到輕鬆愜意的泡湯飯店獨享暖湯迎接2016年吧！本篇整理東森山林渡假酒店、東森海洋溫泉旅館、福隆海洋溫泉四季度假飯店和台中清新溫泉飯店共4間溫泉飯店，提供溫泉水滑洗凝脂般的暖湯，泡湯後睡個好覺就以最美的姿態跨年吧！(旅遊 / 2015-12-22 15:19),,0
ettoday,冬季登山去！帽子山步道新亮點 中空透明遮陽觀景亭,https://www.ettoday.net/news/20151217/614860.htm,2015-12-17 16:01,相信很多人還不知道，在屏東縣內居然有座海拔650公尺的山峰可以遠眺東部外海太平洋？就是位於雙流國家森林遊樂區內的帽子山！於104年10月剛整修完畢的帽子山步道及山頂上的新型帽子遮陽觀景亭，特殊的中空透明屋頂設計，也讓此處成為了觀光新亮點。(旅遊 / 2015-12-17 16:01),,0
ettoday,登山健行好方便！屏東縣府精選「拾美步道」,https://www.ettoday.net/news/20151212/609407.htm,2015-12-12 16:01,登山健行已經成為民眾休閒旅遊的熱門活動，為提供民眾更多登山資訊，屏東縣政府特別整合縣內森林秘境，印製登山導覽摺頁，從屏北的尾寮山到國境之南的墾丁國家森林樂區，列舉10條「拾美步道」，不僅詳細簡介景點特色、最佳登山季節，更區分攀登難易度。(旅遊 / 2015-12-12 16:01),,0
ettoday,14萬台灣人都去了！日本祕境「立山黑部」交通全攻略,https://www.ettoday.net/news/20151210/610771.htm,2015-12-10 09:02,每年僅在4月至11月間開山的日本「立山黑部」，近20米的巨大雪壁走廊、秋季時滿山如烈火般的紅葉美景，或可近看冠雪的日本阿爾卑斯山頭，多樣化的自然景觀讓台灣旅客為其折腰。以下詳解立山黑部交通攻略，同時介紹沿途有何不可錯過風景，來年開山時，不妨親自走一遭吧！(旅遊 / 2015-12-10 09:02),,0
ettoday,【廣編】跨年迎晨曦住東北角溫泉飯店 訂房天天抽機票,https://www.ettoday.net/news/20151204/608074.htm,2015-12-04 14:41,「龜山朝日」有著蘭陽八景之首的美譽，位於東北角海岸線上的東森海洋溫泉酒店，面臨太平洋、背朝雪山山脈，海景客房正對有著受國外旅遊媒體所讚揚「世界12酷島」之稱的龜山島，旅人在晨光中甦醒時，便能在寧靜的龜山島絕美海景的陪伴之下迎接嶄新的一年！(旅遊 / 2015-12-04 14:41),,0
ettoday,邱毅列新黨不分區第二名 蔡正元贈「情詩」祝福,https://www.ettoday.net/news/20151126/603446.htm,2015-11-26 15:07,新黨26日公布2016立委不分區名單，第1名為警察大學前教授葉毓蘭、第2名則為前立委邱毅；而國民黨立委蔡正元25日在臉書上贈詩祝福邱毅，「心頭影事幻重重，化作佳人絕代容，恰似東山山上月，輕輕走出最高峰。」(政治 / 2015-11-26 15:07),,0
ettoday,"【廣編】團購網限定1,999 海底溫泉湯屋+一品海鮮鍋物",https://www.ettoday.net/news/20151125/602711.htm,2015-11-25 11:30,"東森海洋溫泉酒店與團購網業者，攜手合作推出限量特惠，每張 NT$ 1,999 的「雙人海底溫泉湯屋+藏海一品海鮮鍋物」票劵，不僅欣賞東北角海岸線的海潮奇景，更以海底溫泉，讓消費者感受海底溫泉流動的溫暖，以美食滋養身心，享受溫暖舒適的旅行！(旅遊 / 2015-11-25 11:30)",,0
ettoday,12貫握壽司590元！台南高CP值日式料理店,https://www.ettoday.net/news/20151123/600833.htm,2015-11-23 15:00,台南的新光三越旁邊，連著晶英酒店隔壁有兩間好吃的餐廳，一間是專賣頂級燒肉的老乾杯，而另一間則是提供日本料理的【藏也和食】，而今天就是衝著好吃的握壽司而來，整盤12貫只要590元，很超值呢~(旅遊 / 2015-11-23 15:00),,0
ettoday,比清水寺厲害！京都青龍殿「玻璃茶室」 透明限期展出,https://www.ettoday.net/news/20151116/597646.htm,2015-11-16 21:07,日本京都的清水寺，是賞京都市景及秋季楓葉景觀的熱門景點，然而除了清水寺，京都還有一處較少人知道「青蓮院門跡‧將軍塚青龍殿」的景觀舞台，不亞於清水寺，景觀更甚。2015年開始，限期展出的「玻璃茶室」，細密的景觀跟著周遭自然變化，展現出透亮靜美的平靜感。(旅遊 / 2015-11-16 21:07),,0
ettoday,日「堅強鴨鴨」被吹箭貫頭還能游泳 救援5小時才抓到,https://www.ettoday.net/news/20151106/592684.htm,2015-11-06 23:00,頭部幾乎是所有動物的要害，一般來說頭部受到重創是很難存活的，但日本有隻「堅強鴨鴨」，牠被發現時頭部被吹箭「貫穿」。但這隻鴨子不僅存活下來，還能游泳，為了幫牠治療，保育人員花了5個小時才將其抓到。 (新奇 / 2015-11-06 23:00),,0
ettoday,玉山箭竹死亡上遷 陳玉峰：在10年內恐全部滅絕,https://www.ettoday.net/news/20151028/587025.htm,2015-10-28 13:17,被視為台灣中、高海拔山林地面防線的玉山箭竹驚傳快死光？阿里山森林遊樂園的玉山箭竹在今年出現大面積開花死亡的現象，寫下近半世紀新紀錄。綠黨社會民主黨聯盟不分區立委候選人李根政日前召開記者會，呼籲政府應注意警訊，通盤檢討國土計畫，否則玉山箭竹最快在10年內恐全部滅絕。(地方 / 2015-10-28 13:17),,0
ettoday,團購網線上旅展先開跑 優惠2.3折起、買就抽福袋,https://www.ettoday.net/news/20151020/582678.htm,2015-10-20 11:15,搶在國際旅展舉辦之前，團購網GOMAJI線上旅展於即日起先登場，結合飯店、民宿住宿券、Motel休息券、觀光工廠DIY及遊樂園門票等，下殺2.3折起吸引消費者，業者表示，今年旅遊業務較去年成長約30%，因此在進入10月旅遊旺季後，除了祭出150檔優惠商品，同時再推出星級飯店、高檔民宿業者福袋抽獎活動。(消費 / 2015-10-20 11:15),,0
ettoday,太平山山毛櫸換秋衣！綠葉轉金黃 美得像一首詩,https://www.ettoday.net/news/20151019/582139.htm,2015-10-19 16:01,台灣每個時節都擁有不同的花季，每年的十月過後，生長於太平山國家森林遊樂區的台灣山毛櫸是全年最美的時節，園內擁有約1100公頃大面積的山毛櫸原始林，是台灣最大片的山毛櫸所在地。而山毛櫸屬冰河時期孑遺植物，分布海拔於1600-1800公尺。(旅遊 / 2015-10-19 16:01),,0
ettoday,迪士尼9個恐怖的瞬間嚇壞小孩 大家有因此做惡夢嗎？,https://www.ettoday.net/news/20151012/578355.htm,2015-10-12 19:00,說到迪士尼動畫，我們聯想到的，幾乎都是幸福快樂、行俠仗義、充滿正面能量這樣的印象。不過，其實細細回想後，會發現其實在很多片段都暗藏著世界上的黑暗面，恐怖驚奇的畫面更勝驚悚片！像小編我對於《小飛象》裡的粉紅大象遊行那一段，到現在都還是覺得很可怕呢！(遊戲 / 2015-10-12 19:00),,0
ettoday,杜鵑重創千歲神木 國寶紅檜「王昭君」、「韓愈」倒亡,https://www.ettoday.net/news/20151006/575487.htm,2015-10-06 15:27,宜蘭棲蘭神木園區有許多國寶神木，但在杜鵑颱風過後「2死1傷」。依照歷史人物命名的 1247歲的紅檜「韓愈」倒臥在步道，2069歲的「王昭君」也不敵強風，倒塌死亡，讓人好心疼；另外已經1243歲的「白居易」樹幹被吹裂，所幸還能存活。(地方 / 2015-10-06 15:27),,0
ettoday,5隻水鹿成群覓食還泡天然泥浴！ 牠們住在鹿林山,https://www.ettoday.net/news/20150921/567813.htm,2015-09-21 15:56,林務局嘉義林區管理處積極保育鹿林山珍貴自然生態，為了瞭解保育成效，特別委託團隊進行野生動物資源調查，透過影像更捕捉到許多珍貴畫面，包含成群水鹿覓食、鬥角、泡泥浴，母黑熊帶著2隻小熊穿過森林，還有台灣山羊親子一同出現。(地方 / 2015-09-21 15:56),,0
ettoday,快訊／75歲比丘尼被擄走 遺體今上午新竹山區尋獲,https://www.ettoday.net/news/20150913/563820.htm,2015-09-13 11:52,苗栗縣造橋一名75歲的陳姓比丘尼8月遭人擄走，湯姓嫌犯落網後，仍不願吐實棄屍地點，警方昨天對他進行測謊，他才說出將屍體丟棄在新竹縣五指山山區，警方今天上午11時許在竹37-1線4.6公里的路旁草叢處尋獲遺體。警方表示，湯男還利用樹枝樹葉遮掩，目前全案偵辦中。(社會 / 2015-09-13 11:52),,0
ettoday,勇闖川西秘境天堂 揭開康定的神秘面紗,https://www.ettoday.net/news/20150831/557740.htm,2015-08-31 15:45,川西，這片位處滇川藏交界、成都平原與橫斷高原地形過渡帶的土地，由於極端地貌與極高海拔，保留了大片人跡罕至的原始景色，宛如天堂一般的絕世美景，獲日本登山界傳奇人物中村保稱為「最後的秘境」。(旅遊 / 2015-08-31 15:45),,0
ettoday,七星山主峰告示牌遭狠削一大片 網怒：要揪出兇手！,https://www.ettoday.net/news/20150828/556699.htm,2015-08-28 17:11,新北市議員李坤城28日在「爆料公社」分享一張照片，提到自己的朋友去爬七星山主峰，沒想到卻看到主峰的告示牌，被狠刮到面目全非，整個破壞了，「到底是誰這麼沒有公德心啦！爛人！」網友看完也很生氣，「破壞的人意圖到底是甚麼啊！」「一定要揪出兇手！」還有人猜，「會不會是熊破壞的啊？」(生活 / 2015-08-28 17:11),,0
ettoday,魔神仔帶去荒山？嬤失蹤3天睡墓園被找到「有人送三餐」,https://www.ettoday.net/news/20150821/553521.htm,2015-08-21 22:22,高雄市燕巢警方18日晚間獲報，78歲的柯姓阿嬤到田裡工作後失蹤，警消動員200多人上山搜索，3天後終於在田寮山區墓園找到平安無事的阿嬤，大家好奇她這幾天怎麼過的？阿嬤有些虛弱地回，有人帶她到那「睡了兩暝」，三餐「有人準備」，適逢鬼門開聽得大家心裡發毛，有搜救人員私下猜可能是遇到了魔神仔。(社會 / 2015-08-21 22:22),,0
ettoday,柬埔寨6大必做事項與6大禁忌 搞懂才能精彩玩吳哥窟,https://www.ettoday.net/news/20150814/549506.htm,2015-08-14 11:01,擁有眾多精緻石雕、豐富人文歷史的吳哥古蹟，不僅是許多人心中「死前必去的景點」，同時也是TripAdvisor用戶最愛打卡的旅遊景點，證明吳哥窟的超高人氣。但是，正由於吳哥窟神秘又莊嚴的宗教氣息，因此旅客前往吳哥古蹟時，更需要謹言慎行，才不會犯了當地旅遊的大忌，成為失格的旅人。(旅遊 / 2015-08-14 11:01),,0
ettoday,《山豬王》回部落 平等國小上阿里山演原住民風布袋戲,https://www.ettoday.net/news/20150729/542248.htm,2015-07-29 18:22,創立28年的台北市士林平等國小「巧宛然」掌中劇團，今年將首度表演阿里山鄒族傳說故事《山豬王傳奇》，7月31日台北首演後，8月1日到8月3日將前往阿里山上的鄒族部落表演，期望部落朋友們能欣賞到這齣特別有原住民風格的台灣布袋戲。(生活 / 2015-07-29 18:22),,0
ettoday,外國客最愛隱藏版日本住宿處 700隻兔子大久野島奪冠,https://www.ettoday.net/news/20150723/539573.htm,2015-07-23 19:18,最受外國遊客歡迎的「隱藏版」日本人氣住宿地點在哪裡？國外網站發布統計訊息，日本寶川溫泉汪泉閣、直島故鄉、以及休暇村大久野島等皆迅速竄紅，是連日本當地人都不知道的「巷子內」景點。(旅遊 / 2015-07-23 19:18),,0
ettoday,雙北、基桃發布豪雨特報 吳聖宇：北台午後雷雨開炸！,https://www.ettoday.net/news/20150723/539407.htm,2015-07-23 15:37,雙北23日午後下起暴雨，三重、蘆洲等地都傳出淹水，中央氣象局在下午1點20分，針對基隆市、新北市、台北市、桃園市發布豪雨特報，宜蘭縣、新竹縣、台中市、南投縣、金門縣發布大雨特報，「要注意瞬間大雨、雷擊、強陣風及溪水暴漲。」天氣風險公司吳聖宇就在臉書PO文提到，「北台灣午後雷雨開炸了！」(生活 / 2015-07-23 15:37),,0
ettoday,近距離捕捉！墨國民眾屋頂驚見外星人 全身赤裸粉紅肌,https://www.ettoday.net/news/20150721/538387.htm,2015-07-21 18:23,又有外星人的影像！墨西哥一名民眾日前在住家屋上驚見一名人形生物，由於特徵及身形與外星人極為相似，讓許多人相信這個不知名的生物就是外星人，而影片也在網路上廣為流傳。(新奇 / 2015-07-21 18:23),,0
ettoday,瘋電影／道士下山 復仇的正當性,https://www.ettoday.net/news/20150720/536327.htm,2015-07-20 08:37,一門之隔，兩個世界！不諳世事的小道士，因為鬧糧荒離開道觀下了山，一腳踏入了光怪陸離的萬丈紅塵之中，他以一顆赤子之心面對一切，才發現這個世界與他的想像有多麼不同，他終於明白了臨下山前師傅說過的一句話：「不擇手段是豪傑，不改初衷真英雄」。(名家 / 2015-07-20 08:37),,0
ettoday,太愛大自然！台大教授深山蓋民宿 外型是「一隻蜻蜓」,https://www.ettoday.net/news/20150709/530850.htm,2015-07-09 11:01,宜蘭頭城鎮深山裡有一處外型像蜻蜓的民宿，從平地開車必須行經約莫20分鐘蜿蜒的山路才能抵達，但憑藉著與大自然融合的獨特氛圍，還能遠眺絕美雪山山脈出海口、夜景景緻，幾乎每到假日就客滿，而美妙的住宿環境來自於一個愛好大自然的大學教授及細心的女主人。(旅遊 / 2015-07-09 11:01),,0
ettoday,爆紅「東方夏威夷」！越南峴港5大必遊景點,https://www.ettoday.net/news/20150708/531621.htm,2015-07-08 20:49,位於越南中部、緊鄰南中國海邊的越南第四大城─峴港，擁有綿延30公里的潔白沙灘，湛藍的海水、無汙染的海岸線，使這裡被盛讚為「東方夏威夷」。除了在美麗的海景中享受悠閒的海島度假氛圍外，峴港還有許多值得一遊的景點，可以讓人從早玩到晚，完全不無聊！(旅遊 / 2015-07-08 20:49),,0
ettoday,日本「富士山」開放進入 開山期間限定WiFi免費連,https://www.ettoday.net/news/20150701/528777.htm,2015-07-01 19:08,7月到來，富士山又將進入一年一度的開山期，山梨縣側登山口已於7月1日開放登山，靜岡縣側的3處登山步道則將於10日開放，針對前來登山的國外山友，今年富士山在開山期間更提供免費WiFi服務。(旅遊 / 2015-07-01 19:08),,0
ettoday,一覽大片玻璃窗外美景！大湖公園捷運站設「歇腳椅」,https://www.ettoday.net/news/20150620/523403.htm,2015-06-20 16:01,位於台北市內湖區的捷運大湖公園站，在依山傍水的大湖公園旁，二樓擁有大片落地窗，在站內就可看見窗外大湖公園的景色，吸引許多附近居民和旅客駐足窗前欣賞風景，台北捷運公司更特別在落地窗前設置6張「歇腳椅」，讓路過的旅人能舒服的欣賞綠地、湖泊美景。(旅遊 / 2015-06-20 16:01),,0
